,title,subhed,url,byline
0, Trump does not rule out sending US troops into Iran  ,"US President Donald Trump said on Monday that the country could sustain the assault on Iran beyond the month-long timeframe he has publicly spoken about. 'The big wave hasn't even happened,' he said.",https://www.lemonde.fr/en/international/article/2026/03/02/trump-does-not-rule-out-sending-us-troops-to-iran_6751016_4.html,Le Monde with AFP
1,"Middle East turmoil constrains China, a crucial backer of Iran and major buyer of its oil","China, which purchased 80% of the oil exported by Tehran, issued a verbal protest against the attack but did not take any further action.",https://www.lemonde.fr/en/international/article/2026/03/02/middle-east-turmoil-constrains-china-a-crucial-backer-of-iran-and-major-buyer-of-its-oil_6751021_4.html,  By Harold Thibault (Beijing (China) correspondent) 
2,Rubio says Israel's strike plan triggered US attack on Iran,"'There absolutely was an imminent threat and the imminent threat was that we knew that if Iran was attacked – and we believed they would be attacked – that they would immediately come after us,' Secretary of State Marco Rubio told reporters on Monday.",https://www.lemonde.fr/en/international/article/2026/03/02/rubio-says-israel-s-strike-plan-triggered-us-attack-on-iran_6751024_4.html,Le Monde with AFP
3,What does international law say about the Israeli-American attack on Iran and Tehran's retaliation?,"Aggression, self-defense, preemptive strikes: The United States, Israel and Iran each justified their military actions, but legal experts question their legality.",https://www.lemonde.fr/en/international/article/2026/03/03/what-does-international-law-say-about-the-israeli-american-attack-on-iran-and-tehran-s-retaliation_6751025_4.html,  By Stéphanie Maupas (The Hague (Netherlands) correspondent) 
4,Iranian regime scrambles to survive after Khamenei's death,"Amid scenes of celebration and mourning, the formation of an interim government and ongoing bombings, Iran has entered a period of profound uncertainty, where the Islamic Republic's very survival and the reshaping of its internal balance of power are at stake.",https://www.lemonde.fr/en/international/article/2026/03/02/iran-s-regime-scrambles-to-survive-after-ali-khamenei-s-death_6751012_4.html,  By Ghazal Golshiri 
5,A gas shock: The other risk of war in the Middle East,,https://www.lemonde.fr/en/economy/article/2026/03/03/a-gas-shock-the-other-risk-of-war-in-the-middle-east_6751026_19.html,  By Marie de Vergès 
6,"In the United Kingdom, fear of being drawn into a war with Iran",,https://www.lemonde.fr/en/international/article/2026/03/03/in-the-united-kingdom-fear-of-being-drawn-into-a-war-with-iran_6751027_4.html,"  By Cécile Ducourtieux (London, correspondent) and Philippe Jacqué (Brussels, Europe bureau) "
7,House panel releases videos of Bill and Hillary Clinton answering questions about Epstein,,https://www.lemonde.fr/en/international/article/2026/03/02/house-panel-releases-videos-of-bill-and-hillary-clinton-answering-questions-about-epstein_6751022_4.html,Le Monde with AP
8,"In Guadalajara, fears of violence linked to the death of 'El Mencho' raise concerns over World Cup: 'If we ourselves are afraid, imagine the tourists!'",,https://www.lemonde.fr/en/sports/article/2026/03/03/in-guadalajara-fears-of-violence-linked-to-the-death-of-el-mencho-raise-concerns-over-world-cup-if-we-ourselves-are-afraid-imagine-the-tourists_6751028_9.html,  By Anne Vigna (Mexico City (Mexico) correspondent) (with Reuters)  
9,"From the UAE to Qatar, Gulf countries condemn 'Iranian aggression'",,https://www.lemonde.fr/en/international/article/2026/03/02/from-the-uae-to-qatar-gulf-countries-condemn-iranian-aggression_6751020_4.html,  By Hélène Sallon (Beirut (Lebanon) correspondent) 
10,Melania Trump presides at UN Security Council meeting on children in conflict as US attacks Iran,,https://www.lemonde.fr/en/international/article/2026/03/02/melania-trump-presides-at-un-security-council-meeting-on-children-in-conflict-as-us-attacks-iran_6751023_4.html,Le Monde with AP
11,Israel unites against the 'existential threat' of Iran: 'We need to get rid of this regime that hates us',,https://www.lemonde.fr/en/international/article/2026/03/02/israel-unites-against-the-existential-threat-of-iran-we-need-to-get-rid-of-this-regime-that-hates-us_6751000_4.html,
12,Netanyahu's 30-year obsession with Iran,,https://www.lemonde.fr/en/international/article/2026/03/02/netanyahu-s-30-year-obsession-with-iran_6751018_4.html,"  By Luc Bronner (Jerusalem, correspondent) "
13,Macron says France to increase nuclear warheads,,https://www.lemonde.fr/en/france/article/2026/03/02/france-to-increase-nuclear-warheads_6751015_7.html,Le Monde with AFP
14,Lebanon bans Hezbollah's armed wing after rocket fire,,https://www.lemonde.fr/en/international/article/2026/03/02/lebanon-bans-hezbollah-s-armed-wing-after-rocket-fire_6751019_4.html,Le Monde with AFP
15,European stock markets tumble and defense stocks soar amid Middle East conflict,,https://www.lemonde.fr/en/economy/article/2026/03/02/european-stock-markets-tumble-and-defense-stocks-soar-amid-middle-east-conflict_6751011_19.html,  By Eric Albert 
16,"American press voices concerns over Trump's operation in Iran: 'A reckless, imperial error'",,https://www.lemonde.fr/en/international/article/2026/03/02/american-press-voices-concerns-over-trump-s-operation-in-iran-a-reckless-imperial-error_6751014_4.html,  By Oscar Korbosli 
17,"Attacks on Iran: US and Israel are committing 'a crime of aggression,' says Bernie Sanders' former adviser","An influential voice in the progressive camp and former advisor to Senator Bernie Sanders, Matthew Duss harshly criticizes Donald Trump's actions following Saturday's strikes, stating that 'this war is unfortunately the culmination of decades of a militarist foreign policy.'",https://www.lemonde.fr/en/international/article/2026/03/01/attacks-on-iran-us-and-israel-are-committing-a-crime-of-aggression-says-bernie-sanders-former-adviser_6750976_4.html,  Interview by Piotr Smolar (Washington (United States) correspondent) 
18,Photographer Robert Frank's love letter to Paris,"During a stay in Paris in the autumn of 1949, Swiss photographer Robert Frank created an album of the French capital for his fiancée, Mary, who had remained in the United States. In around 80 freely arranged prints, he captured the city's streets, inhabitants and everyday objects. This notebook has now been published, revealing the emergence of a style that would later explode in 'The Americans,' the photographer's seminal work.",https://www.lemonde.fr/en/m-le-mag/article/2026/03/02/photographer-robert-frank-s-love-letter-to-paris_6750992_117.html,
19,"Ali Khamenei, Iran's supreme leader and symbol of a repressive regime, has died","The successor to Ayatollah Khomeini in 1989, Ali Khamenei embodied the Islamic Republic, setting its political course both domestically and abroad. Over the course of his rule, and faced with the country's isolation, he chose to harden the regime and brutally repress any dissent. He died on Saturday, February 28, at the age of 86.",https://www.lemonde.fr/en/obituaries/article/2026/03/01/ali-khamenei-iran-s-supreme-leader-and-representative-of-the-regime-s-hard-line-faction-has-died_6750973_15.html,  By Ghazal Golshiri 
20,Trump's war of choice in Iran,,https://www.lemonde.fr/en/opinion/article/2026/03/01/trump-s-war-of-choice-in-iran_6750980_23.html,
21,"'US Supreme Court slows, but does not lessen, the dangers of Donald Trump's trade war'",,https://www.lemonde.fr/en/opinion/article/2026/03/01/us-supreme-court-slows-but-does-not-lessen-the-dangers-of-donald-trump-s-trade-war_6750970_23.html,
22,'The Louvre director's resignation raises an old question: Why do cultural execs go mad?',,https://www.lemonde.fr/en/opinion/article/2026/02/27/the-louvre-director-s-resignation-raises-an-old-question-why-do-cultural-execs-go-mad_6750939_23.html,
