,title,url,byline,subhed
0,"Tony Blair, former British prime minister, is prepared to lead Gaza",https://www.lemonde.fr/en/international/article/2025/09/29/tony-blair-former-british-prime-minister-is-prepared-to-lead-gaza_6745894_4.html,"  By Cécile Ducourtieux (London, correspondent) ",
1,Moldova's pro-European ruling party wins absolute majority in Parliament,https://www.lemonde.fr/en/international/article/2025/09/29/moldova-s-pro-european-ruling-party-wins-absolute-majority-in-parliament_6745890_4.html,"  By Marine Leduc (Chisinau, Moldova, special correspondent) ",
2,"Eric Adams withdraws from New York City mayoral race, paving way for anti-Mamdani front",https://www.lemonde.fr/en/international/article/2025/09/29/eric-adams-withdraws-from-new-york-city-mayoral-race-paving-way-for-anti-mamdani-front_6745888_4.html,Le Monde,
3,The Liangma River: Beijing's urban greening success story,https://www.lemonde.fr/en/international/article/2025/09/29/the-liangma-river-beijing-s-urban-greening-success-story_6745879_4.html,  By Harold Thibault (Beijing (China) correspondent) ,
4,Sanctions against Russia spark rift between US and Europe over China,https://www.lemonde.fr/en/international/article/2025/09/15/sanctions-against-russia-spark-rift-between-us-and-europe-over-china_6745411_4.html,"  By Philippe Jacqué (Brussels, Europe bureau), Philippe Ricard and Harold Thibault (Beijing (China) correspondent) ",
5,France's political instability puts Franco-German alliance to the test,https://www.lemonde.fr/en/opinion/article/2025/08/30/france-s-political-instability-puts-franco-german-alliance-to-the-test_6744873_23.html,,
6,France faces prospect of paying higher borrowing costs than Italy,https://www.lemonde.fr/en/economy/article/2025/08/19/france-faces-prospect-of-paying-higher-borrowing-costs-than-italy_6744519_19.html,  By Denis Cosnard and Allan Kaval (Rome (Italy) correspondent) ,
7,French man arrested in Slovenia for crimes committed in Croatia during 1991 war,https://www.lemonde.fr/en/international/article/2025/08/06/french-man-arrested-in-slovenia-for-crimes-committed-in-croatia-during-1991-war_6744113_4.html,  By Stéphanie Maupas (The Hague (Netherlands) correspondent) and Richard Schittly (Lyon (France) correspondent) ,
8,Macron condemns threats against judges in Sarkozy case,https://www.lemonde.fr/en/france/article/2025/09/28/macron-condemns-threats-against-judges-in-sarkozy-case_6745875_7.html,Le Monde with AFP,
9,'Get up or I'll smash you': French police violence mars September 10 and 18 protests,https://www.lemonde.fr/en/france/article/2025/09/29/get-up-or-i-ll-smash-you-french-police-violence-mars-september-10-and-18-protests_6745889_7.html,  By Antoine Albertini and Arthur Carpentier ,
10,French artists and feminists call to honor women who died of illegal abortions,https://www.lemonde.fr/en/france/article/2025/09/28/french-artists-and-feminists-push-to-honor-women-who-died-of-illegal-abortions_6745868_7.html,  By Solène Cordier ,
11,French investigators believe Russia involved in dumping of pig heads at mosques,https://www.lemonde.fr/en/france/article/2025/09/27/french-investigators-believe-russia-involved-in-dumping-of-pig-heads-at-mosques_6745830_7.html,  By Jacques Follorou ,
12,Watch: Hundreds of thousands march in France against budget cuts,https://www.lemonde.fr/en/videos/video/2025/09/19/french-strikes-watch-what-happened-as-hundreds-of-thousands-marched-against-budget-cuts_6745548_108.html,  By Le Monde's video desk   ,
13,Emmys 2025: 'Adolescence' star Owen Cooper becomes youngest winner for best supporting actor,https://www.lemonde.fr/en/videos/video/2025/09/15/emmys-2025-adolescence-star-owen-cooper-becomes-youngest-winner-for-best-supporting-actor_6745427_108.html,  By Le Monde's video desk   ,
14,"From 'influence peddling' to 'corruption,' what is French Culture Minister Rachida Dati accused of?",https://www.lemonde.fr/en/videos/video/2025/09/06/from-influence-peddling-to-corruption-what-is-french-culture-minister-rachida-dati-accused-of_6745094_108.html,"  By Alexis Tromas, Arthur Navet (Motion design) and Sinead McCausland ",
15,Watch: Tsunami warnings sound in Japan after 8.8 magnitude quake off Russian coast,https://www.lemonde.fr/en/videos/video/2025/07/30/watch-tsunami-warnings-sound-in-japan-after-8-8-magnitude-quake-off-russian-coast_6743900_108.html,,
16,NATO's necessary response to drone incursions,https://www.lemonde.fr/en/opinion/article/2025/09/29/nato-s-necessary-response-to-drone-incursions_6745892_23.html,,
17,"'After colonizing the adult world, AI enters the world of children'",https://www.lemonde.fr/en/opinion/article/2025/09/28/after-colonizing-the-adult-world-ai-enters-the-world-of-children_6745857_23.html,,
18,The troubling direction of American justice,https://www.lemonde.fr/en/opinion/article/2025/09/27/the-troubling-direction-of-american-justice_6745818_23.html,,
19,'To frame Kirk's death as escalation misses the truth. The real threat is normalization',https://www.lemonde.fr/en/opinion/article/2025/09/26/to-frame-kirk-s-death-as-escalation-misses-the-truth-the-real-threat-is-normalization_6745775_23.html,,
20,"Vivian Jenna Wilson, Elon Musk's transgender daughter, has become a New York Fashion Week sensation",https://www.lemonde.fr/en/m-le-mag/article/2025/09/24/vivian-jenna-wilson-elon-musk-s-transgender-daughter-has-become-a-new-york-fashion-week-sensation_6745690_117.html,  By Ève Minault ,
21,Historian Tal Bruttmann's sharp eye on the Holocaust,https://www.lemonde.fr/en/m-le-mag/article/2025/09/21/historian-tal-bruttmann-s-sharp-eye-on-the-holocaust_6745597_117.html,,
22,The silent and destructive spread of laughing gas: 'That shit took my whole life',https://www.lemonde.fr/en/m-le-mag/article/2025/09/20/the-silent-and-destructive-spread-of-laughing-gas-that-shit-took-my-whole-life_6745588_117.html,,
23,"For the 250th anniversary of Jane Austen's birth, take a trip into the world of her superfans",https://www.lemonde.fr/en/m-le-mag/article/2025/09/20/on-the-250th-anniversary-of-jane-austen-s-birth-take-a-trip-into-the-world-of-the-english-novelist-s-superfans_6745580_117.html,,
24,Tradition done right: Five Paris restaurants reimagining the classics,https://www.lemonde.fr/en/lifestyle/article/2025/09/08/tradition-done-right-five-paris-restaurants-reimagining-the-classics_6745133_37.html,,
25,Paris Design Week: A 15th edition marked by abundance,https://www.lemonde.fr/en/lifestyle/article/2025/09/05/paris-design-week-a-15th-edition-marked-by-abundance_6745060_37.html,  By Véronique Lorelle ,
26,It's pain suisse time! Five places in and around Paris to find this treat,https://www.lemonde.fr/en/lifestyle/article/2025/09/04/it-s-pain-suisse-time-five-places-in-the-paris-region-to-find-this-treat_6745022_37.html,  By Zazie Tavitian ,
27,"At Musée d'Orsay, a Courbet painting gets a new life before visitors' eyes",https://www.lemonde.fr/en/culture/article/2025/07/26/at-musee-d-orsay-a-courbet-painting-gets-a-new-life-before-visitors-eyes_6743744_30.html,  By Max Blanc ,
28, 'Get up or I'll smash you': French police violence mars September 10 and 18 protests  ,https://www.lemonde.fr/en/france/article/2025/09/29/get-up-or-i-ll-smash-you-french-police-violence-mars-september-10-and-18-protests_6745889_7.html,  By Antoine Albertini and Arthur Carpentier ,Testimonies reveal the violence committed during the protests organized by the 'Block Everything' movement and a coalition of unions. Lawyers criticize 'extremely incomplete files' for the arrests conducted and denounce 'preventive police custody.'
29,Moldova's pro-European ruling party wins absolute majority in Parliament,https://www.lemonde.fr/en/international/article/2025/09/29/moldova-s-pro-european-ruling-party-wins-absolute-majority-in-parliament_6745890_4.html,"  By Marine Leduc (Chisinau, Moldova, special correspondent) ",
30,"Tony Blair, former British prime minister, is prepared to lead Gaza",https://www.lemonde.fr/en/international/article/2025/09/29/tony-blair-former-british-prime-minister-is-prepared-to-lead-gaza_6745894_4.html,"  By Cécile Ducourtieux (London, correspondent) ",
31,Italy's Meloni hardens rhetoric after killing of Charlie Kirk,https://www.lemonde.fr/en/international/article/2025/09/28/italy-s-meloni-hardens-rhetoric-after-killing-of-charlie-kirk_6745861_4.html,  By Allan Kaval (Rome (Italy) correspondent) ,"Since the assassination of Trump ally Chalie Kirk, the Italian prime miniser has embraced darker, more polarized themes, invoking conspiracies and casting herself as a target of political violence."
32,Financial prosecutor says he feels no 'hatred' toward Nicolas Sarkozy and condemns threats on judge,https://www.lemonde.fr/en/france/article/2025/09/29/sarkozy-conviction-financial-prosecutor-says-he-feels-no-hatred-condemns-threats-on-judge_6745891_7.html,Le Monde with AFP,"Since his conviction for letting his aides seek Libyan funding for his 2007 election campaign, ex-president Nicolas Sarkozy has consistently attacked the ruling, which he believes was motivated by the judges' 'hatred.'"
33,"Eric Adams withdraws from New York City mayoral race, paving way for anti-Mamdani front",https://www.lemonde.fr/en/international/article/2025/09/29/eric-adams-withdraws-from-new-york-city-mayoral-race-paving-way-for-anti-mamdani-front_6745888_4.html,Le Monde,"The outgoing mayor announced on Sunday that he would not seek re-election. He gave no clear endorsement ahead of the November 4 election, where the remaining candidates are the democratic socialist Zohran Mamdani, Republican Curtis Sliwa and former New York State Governor Andrew Cuomo."
34,'Zucman tax': The great fear of France's ultra-rich,https://www.lemonde.fr/en/politics/article/2025/09/29/zucman-tax-the-great-fear-of-france-s-ultra-rich_6745885_5.html,  By Denis Cosnard ,"Amid budget negotiations, the idea of a tax on the wealth of the ultra-rich is provoking an outcry from those affected, even though it is widely supported by the left and backed by public opinion."
35,EU confirms it has reinstated sanctions against Iran over nuclear program,https://www.lemonde.fr/en/international/article/2025/09/29/iranian-nuclear-program-eu-confirms-that-it-has-reinstated-sanctions-against-iran_6745893_4.html,Le Monde with AFP,
36,Boys' clubs at work are still a thing,https://www.lemonde.fr/en/economy/article/2025/09/29/boys-clubs-at-work-are-still-a-thing_6745883_19.html,  By Thomas Lestavel ,
37,The Liangma River: Beijing's urban greening success story,https://www.lemonde.fr/en/international/article/2025/09/29/the-liangma-river-beijing-s-urban-greening-success-story_6745879_4.html,  By Harold Thibault (Beijing (China) correspondent) ,
38,Emma Reyes' still lifes finds new life in two Paris exhibitions,https://www.lemonde.fr/en/culture/article/2025/09/28/emma-reyes-still-lifes-finds-new-life-in-two-paris-exhibitions_6745877_30.html,  By Emmanuelle Jardonnet ,
39,Hamas urges Israel to halt strikes as it searches for two hostages,https://www.lemonde.fr/en/international/article/2025/09/28/hamas-urges-israel-to-halt-strikes-as-it-searches-for-two-hostages_6745876_4.html,Le Monde with AFP,
40,Europe's emotional Ryder Cup triumph after fighting off the US,https://www.lemonde.fr/en/sports/article/2025/09/29/europe-s-emotional-ryder-cup-triumph-after-fighting-off-the-us_6745880_9.html,Le Monde with AFP,
41,Picasso Museum in Paris to expand with new wing and garden redesign,https://www.lemonde.fr/en/culture/article/2025/09/28/picasso-museum-in-paris-to-expand-with-new-wing-and-garden-redesign_6745873_30.html,  By Roxana Azimi   ,
42,"Svalbard, the fastest-warming place on Earth",https://www.lemonde.fr/en/environment/article/2025/09/28/svalbard-the-fastest-warming-place-on-earth_6745872_114.html,,
43,"Gunman opens fire at Michigan church and sets it ablaze, killing at least 4 and wounding 8",https://www.lemonde.fr/en/international/article/2025/09/29/at-least-4-people-dead-and-8-wounded-in-a-shooting-and-fire-at-a-michigan-church-police-say_6745882_4.html,Le Monde with AP,
44,Gaza: Diplomats press Trump to push Israel toward ending war,https://www.lemonde.fr/en/international/article/2025/09/27/gaza-diplomats-press-trump-to-push-israel-toward-ending-war_6745820_4.html,"  By Claire Gatinois, Philippe Ricard and Hélène Sallon (Beirut (Lebanon) correspondent) ",
45,Spain's Valencia region on red alert for heavy rains,https://www.lemonde.fr/en/international/article/2025/09/29/spain-s-valencia-region-on-red-alert-for-heavy-rains_6745884_4.html,Le Monde with AFP,
46,Madagascar's president returns amid unrest,https://www.lemonde.fr/en/le-monde-africa/article/2025/09/28/madagascar-s-president-returns-amid-unrest_6745863_124.html,"  By Laurence Caramel and Guilhem Fabry (Antananarivo (Madagascar), correspondent) ",
47,French artists and feminists call to honor women who died of illegal abortions,https://www.lemonde.fr/en/france/article/2025/09/28/french-artists-and-feminists-push-to-honor-women-who-died-of-illegal-abortions_6745868_7.html,  By Solène Cordier ,Activists are calling to build a monument in Paris to honor the women who died from unsafe abortions before abortion was legalized in France in 1975.
48,How can Europe withstand pressure from Russia and the US? Two experts debate,https://www.lemonde.fr/en/books/article/2025/09/28/how-can-europe-withstand-pressure-from-russia-and-us-two-experts-debate_6745858_33.html,  Interview by Florent Georgesco ,Tensions with Russia to the East and the United States to the West are testing Europe's model. Sylvain Kahn and Guillaume Lagane examine this shifting landscape and the possible responses.
49,Relationship sex: Why many women still feel pressure to say yes,https://www.lemonde.fr/en/intimacy/article/2025/09/24/relationship-sex-why-many-women-still-feel-pressure-to-say-yes_6745687_310.html,  By Tiphaine Thuillier ,"Many women have sex with their partners even when they do not want to, out of reluctance to say no, uncertainty about desire, or fear of offending. Together, these reasons sketch the contours of a gray zone of consent."
50,NATO's necessary response to drone incursions,https://www.lemonde.fr/en/opinion/article/2025/09/29/nato-s-necessary-response-to-drone-incursions_6745892_23.html,,
51,"'After colonizing the adult world, AI enters the world of children'",https://www.lemonde.fr/en/opinion/article/2025/09/28/after-colonizing-the-adult-world-ai-enters-the-world-of-children_6745857_23.html,,
52,"'On the Zucman tax, France is mired in a hysterical debate'",https://www.lemonde.fr/en/opinion/article/2025/09/23/on-the-zucman-tax-france-is-mired-in-a-hysterical-debate_6745678_23.html,,
