,title,subhed,url,byline
0," In Greenland, a European military mission of uncertain contours seeks to counter Trump  ","Denmark, which organized the operation, has so far not disclosed any figures regarding the number of soldiers who have arrived in Nuuk, the island's capital, on a 'reconnaissance mission.'",https://www.lemonde.fr/en/international/article/2026/01/16/in-greenland-a-european-military-mission-of-uncertain-contours-seeks-to-counter-trump_6749492_4.html,"  By Elsa Conesa (Berlin (Germany) correspondent), Philippe Jacqué (Brussels, Europe bureau), Virginie Malingre (Brussels, Europe bureau), Isabelle Mandraud (Nuuk (Greenland), special correspondent) and Elise Vincent "
1,"Behind Iran regime's brutal crackdown, rulers are playing for survival",,https://www.lemonde.fr/en/international/article/2026/01/16/behind-iran-regime-s-brutal-crackdown-rulers-are-playing-for-survival_6749496_4.html,  By Ghazal Golshiri and Madjid Zerrouky 
2,French government halts budget talks to consider options,,https://www.lemonde.fr/en/politics/article/2026/01/16/french-government-halts-budget-talks-to-consider-options_6749493_5.html,Le Monde with AFP
3,Istanbul's ultra-violent gangs tighten their grip on the city,"In Turkey's major cities, criminal gangs made up of teenagers and young adults have grown rapidly in recent years, fueled by a boom in synthetic drug trafficking.",https://www.lemonde.fr/en/international/article/2026/01/16/istanbul-s-ultra-violent-youth-gangs-tighten-their-grip-on-the-city_6749485_4.html,
4,"Benedictine nuns of Montmartre spent 40 years 'under duress,' report finds","An independent investigation, commissioned by the congregation of the iconic Paris neighborhood, reported that former prioress general Mother Marie-Agnès ruled through an atmosphere of 'terror and suspicion' up to her death in 2016. The control of food and body weight of the congregation's members was central to the superior's domination.",https://www.lemonde.fr/en/france/article/2026/01/16/benedictine-nuns-of-montmartre-under-duress-for-40-years-report-finds_6749480_7.html,  By Sarah Belouezzane 
5,"'Heated Rivalry,' the show that's shaking up hockey culture in Canada","The series by Canadian director Jacob Tierney, which centers on a romance between two gay athletes, challenges the hyper-masculine foundations of hockey, a sport of which no National Hockey League (NHL) player has yet dared to come out. The show is currently streaming on HBO Max in the United States.",https://www.lemonde.fr/en/culture/article/2026/01/16/heated-rivalry-the-show-that-s-shaking-up-hockey-culture-in-canada_6749484_30.html,"  By Eliott Dumoulin (Montreal, Canada, correspondent) "
6,'The budget and the Mercosur deal: Two symptoms of France's political powerlessness',"The crisis engulfing the government at the start of 2026 is a result of the failed snap elections of 2024. Yet it is also symptomatic of an exhausted system, in which posturing has surpassed long-term political efforts, observes Le Monde's Solenn de Royer in her column.",https://www.lemonde.fr/en/opinion/article/2026/01/16/the-budget-and-the-mercosur-deal-two-symptoms-of-france-s-political-powerlessness_6749495_23.html,
7,Macron issues stern warning to French defense industry,,https://www.lemonde.fr/en/economy/article/2026/01/16/emmanuel-macron-issues-stern-warning-to-french-defense-industry_6749479_19.html,  By Olivier Pinaud 
8,Trump announces Gaza 'board of peace' as phase two of US-backed plan begins,,https://www.lemonde.fr/en/international/article/2026/01/16/trump-announces-gaza-board-of-peace-as-phase-two-of-us-backed-plan-begins_6749481_4.html,Le Monde with AFP
9,Gaza's universities strive to welcome students back amid ruins,,https://www.lemonde.fr/en/international/article/2026/01/16/gaza-s-universities-strive-to-welcome-students-back-amid-ruins_6749487_4.html,  By Marie Jo Sader 
10,Venezuelan opponent says she presented her Nobel Peace Prize to Trump during meeting,,https://www.lemonde.fr/en/international/article/2026/01/15/venezuela-s-machado-says-she-presented-her-nobel-peace-prize-to-trump-during-their-meeting_6749478_4.html,Le Monde with AP
11,Germany questions future of the European project,,https://www.lemonde.fr/en/international/article/2026/01/16/germany-is-questioning-the-future-of-the-european-project_6749482_4.html,  By Elsa Conesa (Berlin (Germany) correspondent) 
12,"Vladimir Putin has stayed silent and powerless on Iran, despite their 'strategic partnership'",,https://www.lemonde.fr/en/international/article/2026/01/15/vladimir-putin-has-stayed-silent-and-powerless-on-iran-despite-their-strategic-partnership_6749477_4.html,  By Benjamin Quénelle 
13,Canada's Carney hails 'strategic partnership' in talks with China's Xi,,https://www.lemonde.fr/en/international/article/2026/01/16/canada-s-carney-hails-strategic-partnership-in-talks-with-xi_6749488_4.html,Le Monde with AFP
14,French figure skating champion Papadakis claims she was under her partner's 'control',,https://www.lemonde.fr/en/sports/article/2026/01/16/french-figure-skating-champion-papadakis-claims-she-was-under-her-partner-s-control_6749491_9.html,Le Monde with AFP
15,US and Taiwan reach trade deal on superconductor chips and reduced tariffs,,https://www.lemonde.fr/en/economy/article/2026/01/16/us-and-taiwan-reach-trade-deal-on-superconductor-chips-and-reduced-tariffs_6749490_19.html,Le Monde with AFP
16,"Macron's party endorses Sarkozy's son in Riviera election, dividing members",,https://www.lemonde.fr/en/france/article/2026/01/15/macron-s-party-endorses-sarkozy-s-son-in-riviera-election-dividing-members_6749468_7.html,  By Marie Pouzadoux 
17,"Behind France's declining birthrate, the complex question of wanting children",,https://www.lemonde.fr/en/france/article/2026/01/15/behind-france-s-declining-birthrate-the-complex-question-of-wanting-children_6749448_7.html,  By Solène Cordier 
18,Low-dose hormonal IUD linked to increased risk of ectopic pregnancy,,https://www.lemonde.fr/en/science/article/2026/01/16/low-dose-hormonal-iud-linked-to-increased-risk-of-ectopic-pregnancy_6749486_10.html,  By Florence Rosier 
19,"'India and Europe are discovering new geostrategic affinities, an example of realignment amid global chaos'","The warming of relations between Europe and the world's most populous country reflects a counter-strategy to the hostility of the Trump administration, writes Le Monde's columnist Sylvie Kauffmann.",https://www.lemonde.fr/en/opinion/article/2026/01/15/india-and-europe-are-discovering-new-geostrategic-affinities-an-example-of-realignment-amid-global-chaos_6749476_23.html,
20,"Long before coveting Greenland, the US expanded by opening its checkbook","From the early 19th century on, the United States expanded by acquiring territory through purchase or force. By expressing interest in Greenland, Donald Trump has revived that tradition.",https://www.lemonde.fr/en/international/article/2026/01/13/long-before-sizing-up-greenland-the-us-expanded-by-opening-its-checkbook_6749390_4.html,  By Arnaud Leparmentier (San Francisco (United States) correspondent) 
21,"After celebrating Maduro ouster, Venezuelan migrants in US fear what lies ahead","After celebrating the abduction of Nicolas Maduro, Venezuelan asylum seekers in the US have begun to have doubts. In Denver, Colorado, where they number in the tens of thousands, many now fear having to go back to their country with the Chavistas still in power.",https://www.lemonde.fr/en/international/article/2026/01/14/after-celebrating-maduro-ouster-venezuelan-migrants-in-us-fear-what-lies-ahead_6749433_4.html,
22,"President Trump, Greenland does not want to become American",,https://www.lemonde.fr/en/opinion/article/2026/01/15/president-trump-greenland-does-not-want-to-become-american_6749460_23.html,
23,"By crushing its own people, the Iranian regime paves the way for its own downfall",,https://www.lemonde.fr/en/opinion/article/2026/01/11/by-crushing-its-own-people-the-iranian-regime-paves-the-way-for-its-own-downfall_6749299_23.html,
24,'The raw and brutal display of American power in the Trump II era is finally opening the eyes of Washington's allies',,https://www.lemonde.fr/en/opinion/article/2026/01/08/the-raw-and-brutal-display-of-american-power-in-the-trump-ii-era-is-finally-opening-the-eyes-of-washington-s-allies_6749203_23.html,
