,title,subhed,url,byline
0, Trump's unchecked imperialism raises growing concerns  ,"While the Trump administration's handling of the Venezuelan situation has revealed numerous contradictions, its intentions regarding Greenland have sparked anxiety and opposition among members of Congress, including Republicans.",https://www.lemonde.fr/en/international/article/2026/01/07/in-the-us-trump-s-unchecked-imperialism-raises-growing-concerns_6749166_4.html,  By Nicolas Chapuis (New York (United States) correspondent) 
1,"In Paris, Ukraine's allies express hopes and fears over US security guarantees","The coalition of the willing, a group of Kyiv's allies who met in Paris on Tuesday, said they were ready to send troops to Ukraine for a ceasefire if they were guaranteed that the US would deter any new Russian attack.",https://www.lemonde.fr/en/international/article/2026/01/07/in-paris-ukraine-s-allies-express-hopes-and-fears-over-us-security-guarantees_6749169_4.html,  By Claire Gatinois and Philippe Ricard 
2,"Trump weighs 'range of options' for acquiring Greenland, including military ones","Donald Trump is looking at ideas for acquiring the Danish territory and using the US military is 'always an option,' the White House said on Tuesday. Earlier, Greenland and Denmark called for a meeting with US Secretary of State Marco Rubio after Trump's renewed claims.",https://www.lemonde.fr/en/international/article/2026/01/06/trump-discussing-range-of-options-for-greenland-including-military_6749153_4.html,Le Monde with AP and AFP
3,"Roberto Saviano, writer: 'Venezuela is not a narco-state, but a state that uses drugs as an instrument for the survival of those in power'","Western democracies have allowed the regime to survive, enabling it to strengthen itself by becoming increasingly criminalized. Today, Venezuela acts as a hub state, exhibiting advanced forms of narco-structuring, writes the author of 'Gomorrah.'",https://www.lemonde.fr/en/opinion/article/2026/01/07/roberto-saviano-writer-venezuela-is-not-a-narco-state-but-a-state-that-uses-drugs-as-an-instrument-for-the-survival-of-those-in-power_6749160_23.html,
4,"Venezuela, under state of emergency, stages illusory transition","A decree granting emergency powers to the head of state has left Venezuelans on the ground anxious, as the US moves to capture oil and political influence.",https://www.lemonde.fr/en/international/article/2026/01/07/venezuela-under-state-of-emergency-stages-illusory-transition_6749171_4.html,  By Elisabeth Miranda and Angeline Montoya 
5,Brigitte Bardot to be buried in Saint-Tropez as cause of death revealed,,https://www.lemonde.fr/en/france/article/2026/01/07/brigitte-bardot-to-be-buried-in-saint-tropez-as-cause-of-death-revealed_6749165_7.html,Le Monde with AFP
6,UN accuses Israel of 'apartheid' in the West Bank,,https://www.lemonde.fr/en/international/article/2026/01/07/west-bank-un-accuses-israel-of-apartheid_6749170_4.html,Le Monde with AFP
7,Paris snow forces 140 flight cancellations,,https://www.lemonde.fr/en/france/article/2026/01/07/paris-snow-forces-140-flight-cancellations_6749167_7.html,Le Monde with AFP
8,Saudi-led coalition strikes Yemen as separatist leader flees,,https://www.lemonde.fr/en/international/article/2026/01/07/saudi-led-coalition-strikes-yemen-as-separatist-leader-flees_6749161_4.html,Le Monde with AFP
9,Iran risks losing a key economic and military ally in Venezuela,,https://www.lemonde.fr/en/international/article/2026/01/07/venezuela-iran-risks-losing-a-key-economic-and-military-ally_6749155_4.html,  By Ghazal Golshiri and Madjid Zerrouky 
10,"After tragedy at Swiss resort bar, residents express 'anger' and 'shame'",,https://www.lemonde.fr/en/international/article/2026/01/07/after-the-crans-montana-tragedy-residents-express-anger-and-shame_6749158_4.html,"  By Eric Collier, Rémi Dupré and Serge Enderlin (Geneva (Switzerland) correspondent) "
11,"AFCON 2025: Algeria reaches quarterfinals, Côte d'Ivoire also advances",,https://www.lemonde.fr/en/sports/article/2026/01/07/afcon-2025-algeria-reaches-quarterfinals-ivory-coast-also-advances_6749154_9.html,Le Monde with AP and AFP
12,Cold snap hits Paris's homeless population hard,,https://www.lemonde.fr/en/france/article/2026/01/06/cold-snap-hits-paris-s-homeless-population-hard_6749142_7.html,  By Quentin Baraja 
13,Ukraine's Western allies agree on key security guarantees in Paris,,https://www.lemonde.fr/en/international/article/2026/01/06/ukraine-western-allies-agree-on-key-security-guarantees-in-paris_6749151_4.html,Le Monde with AFP
14,France's political parties divided over US operation in Venezuela,,https://www.lemonde.fr/en/politics/article/2026/01/06/france-s-political-parties-divided-over-us-operation-in-venezuela_6749148_5.html,"  By Sandrine Cassini, Mariama Darame, Corentin Lesueur and Alexandre Pedro "
15,"Deep freeze grips Europe, killing six and disrupting travel",,https://www.lemonde.fr/en/international/article/2026/01/06/deep-freeze-grips-europe-killing-six-and-disrupting-travel_6749145_4.html,Le Monde with AFP
16,Reviving Venezuela's oil industry comes at a steep cost,,https://www.lemonde.fr/en/economy/article/2026/01/06/reviving-venezuela-s-oil-industry-comes-at-a-steep-cost_6749143_19.html,
17,EU offers extra funds to quell farmer anger over Mercosur trade deal,,https://www.lemonde.fr/en/international/article/2026/01/06/eu-offers-extra-funds-to-quell-farmer-anger-over-mercosur-trade-deal_6749146_4.html,Le Monde with AFP
18,"With the Venezuela operation, Marco Rubio is at the heart of reshaping the 'Western Hemisphere'",,https://www.lemonde.fr/en/international/article/2026/01/06/with-the-venezuela-operation-marco-rubio-is-at-the-heart-of-reshaping-the-western-hemisphere_6749128_4.html,  By Piotr Smolar (Washington (United States) correspondent) 
19,"'If tomorrow, the US decides to seize Greenland, neither Denmark nor the EU has the means to stop it'","Donald Trump's military operation in Venezuela should show Europeans that the US is a predator for Europe, just like Russia and China, argues former United Nations under-secretary-general Jean-Marie Guéhenno.",https://www.lemonde.fr/en/opinion/article/2026/01/06/if-tomorrow-the-us-decides-to-seize-greenland-neither-denmark-nor-the-eu-has-the-means-to-stop-it_6749149_23.html,
20,"Maduro, the failed heir to Hugo Chavez's Bolivarian Revolution","The Venezuelan president, recently abducted by the US, was chosen by Hugo Chavez as his successor and narrowly elected in 2013. Over 13 years in power, he has eliminated political opposition, tightened control over state institutions and overseen a 70% collapse in GDP as a quarter of Venezuelans fled the country.",https://www.lemonde.fr/en/international/article/2026/01/06/maduro-the-failed-heir-to-hugo-chavez-s-bolivarian-revolution_6749137_4.html,"  By Marie Delcas (Bogota (Colombia), correspondent) "
21,'Trump is torn between the UAE and Saudi Arabia',"US President Donald Trump faces pressure from Mohammed bin Salman to oppose the separatist strategy pursued by the United Arab Emirates in Sudan, and even more so in Yemen, writes columnist Jean-Pierre Filiu, a professor at Sciences Po Paris.",https://www.lemonde.fr/en/international/article/2026/01/05/trump-is-torn-between-the-uae-and-saudi-arabia_6749076_4.html,
22,EU-Mercosur deal: France's diplomatic gamble falls short,,https://www.lemonde.fr/en/opinion/article/2026/01/07/eu-mercosur-deal-france-s-diplomatic-gamble-falls-short_6749172_23.html,
23,Greenland is and must remain European,,https://www.lemonde.fr/en/international/article/2026/01/06/greenland-is-and-must-remain-european_6749141_4.html,
24,The return of the US's predatory imperialism,,https://www.lemonde.fr/en/opinion/article/2026/01/04/the-return-of-the-us-s-predatory-imperialism_6749061_23.html,
