,title,url,byline,subhed
0,China raises prices of condoms and birth control pills in attempt to boost birth rate,https://www.lemonde.fr/en/international/article/2025/12/31/china-raises-prices-of-condoms-and-birth-control-pills-in-attempt-to-boost-birth-rate_6748954_4.html,"  By Jordan Pouille (Beijing (China), correspondence) ",
1,Israeli drones make life miserable for residents of southern Lebanon,https://www.lemonde.fr/en/international/article/2025/12/30/israeli-drones-make-life-miserable-for-residents-of-southern-lebanon_6748939_4.html,  By Laure Stephan (Abbasiyeh (Lebanon) special correspondent) ,
2,"Trump puts differences with Netanyahu aside, sends warnings to Hamas and Iran",https://www.lemonde.fr/en/international/article/2025/12/30/trump-puts-differences-with-netanyahu-aside-sends-warnings-to-hamas-and-iran_6748935_4.html,"  By Nicolas Chapuis (New York (United States) correspondent) and Samuel Forey (Jerusalem, special correspondent) ",
3,Berlin's dangerous fascination with homemade firecrackers and fireworks,https://www.lemonde.fr/en/international/article/2025/12/30/berlin-s-dangerous-fascination-with-homemade-firecrackers-and-fireworks_6748934_4.html,  By Elsa Conesa (Berlin (Germany) correspondent) ,
4,'Trump's ideological challenge to Europe is more dangerous than the security one',https://www.lemonde.fr/en/opinion/article/2025/12/11/trump-s-ideological-challenge-to-europe-is-more-dangerous-than-the-security-one_6748393_23.html,,
5,"Attacked by Trump, Europe wavers between denial and fear of reprisals",https://www.lemonde.fr/en/international/article/2025/12/11/attacked-by-trump-europe-wavers-between-denial-and-fear-of-reprisals_6748382_4.html,"  By Philippe Jacqué (Brussels, Europe bureau) and Virginie Malingre (Brussels, Europe bureau) ",
6,Bosnia and Herzegovina's Serb entity elects ally of  former leader Dodik,https://www.lemonde.fr/en/international/article/2025/11/24/bosnia-and-herzegovina-s-serb-entity-elects-ally-of-former-leader-dodik_6747765_4.html,  By Rémy Ourdan (Banja Luka (Bosnia and Herzegovina) special correspondent) ,
7,"In France's Somme, bagpipers keep the memory of the Great War alive",https://www.lemonde.fr/en/history/article/2025/11/11/in-france-s-somme-bagpipers-keep-the-memory-of-the-great-war-alive_6747347_157.html,,
8,"French ban on 'forever chemicals' in cosmetics, clothing to enter force",https://www.lemonde.fr/en/france/article/2025/12/30/french-ban-on-forever-chemicals-in-cosmetics-clothing-to-enter-force_6748944_7.html,Le Monde with AFP,
9,'We have to know a lot of things that the French don't': Migrants face new residence permit tests,https://www.lemonde.fr/en/france/article/2025/12/27/we-have-to-know-a-lot-of-things-that-the-french-don-t-migrants-face-new-residence-permit-tests_6748863_7.html,  By Julia Pascual ,
10,Why more young people are turning to religion,https://www.lemonde.fr/en/france/article/2025/12/25/why-more-young-people-are-turning-to-religion_6748827_7.html,  By Sarah Belouezzane ,
11,French biathlon team races ahead on the unpredictable road to the Olympics,https://www.lemonde.fr/en/sports/article/2025/12/25/french-biathlon-team-races-ahead-on-the-unpredictable-road-to-the-olympics_6748823_9.html,"  By Thomas Saintourens (Le Grand-Bornand (France), special correspondent) ",
12,The French studio behind a viral Christmas ad,https://www.lemonde.fr/en/videos/video/2025/12/12/the-french-studio-behind-a-viral-christmas-ad_6748436_108.html,"  By Le Monde's video desk, Antoine Apelbaum   and Sinead McCausland (Le Monde in English) ",
13,"Israel's D9 bulldozer, a tool of destruction in Gaza",https://www.lemonde.fr/en/videos/video/2025/11/27/israel-s-d9-bulldozer-a-tool-of-destruction-in-gaza_6747870_108.html,"  By Liselotte Mas, Elsa Longueville (motion design) and Sinead McCausland ",
14,"Ukraine's Pokrovsk faces fierce fighting, footage analyzed by Le Monde reveals",https://www.lemonde.fr/en/videos/video/2025/11/21/ukraine-s-pokrovsk-faces-fierce-fighting-footage-analyzed-by-le-monde-reveals_6747708_108.html,"  By Alexandre Horn, Gabriel Lecointre (edit), Elisa Bellanger (motion design) and Sinead McCausland ",
15,Afghanistan: Relentless repression continues over four years into Taliban's rule,https://www.lemonde.fr/en/videos/video/2025/10/04/afghanistan-relentless-repression-continues-over-four-years-into-taliban-s-rule_6746092_108.html,"  By Chloé Denis, Félix Pommier (Motion design) and Sinead McCausland ",
16,"The 2026 FIFA World Cup is shaping up to be 'America first' and, above all, 'business first'",https://www.lemonde.fr/en/opinion/article/2025/12/30/the-2026-fifa-world-cup-is-shaping-up-to-be-america-first-and-above-all-business-first_6748925_23.html,,
17,Trump's failing bet against wind power,https://www.lemonde.fr/en/opinion/article/2025/12/30/trump-s-failing-bet-against-wind-power_6748940_23.html,,
18,"The death of Brigitte Bardot: One icon, many faces",https://www.lemonde.fr/en/opinion/article/2025/12/29/the-death-of-brigitte-bardot-one-icon-many-faces_6748914_23.html,,
19,South Asia is both a contributor and victim of the climate crisis,https://www.lemonde.fr/en/opinion/article/2025/12/28/south-asia-is-both-a-contributor-and-victim-of-the-climate-crisis_6748903_23.html,,
20,Dining at the Centre Pompidou-Metz,https://www.lemonde.fr/en/m-le-mag/article/2025/12/30/dining-at-the-centre-pompidou-metz_6748951_117.html,  By Julien Amat ,
21,"Fight, the innovative agency behind Zohran Mamdani's New York victory",https://www.lemonde.fr/en/m-le-mag/article/2025/12/30/fight-the-innovative-agency-behind-zohran-mamdani-s-new-york-victory_6748931_117.html,,
22,The flights of fancy of the French entrepreneur who brought Shein to Paris,https://www.lemonde.fr/en/m-le-mag/article/2025/12/28/the-flights-of-fancy-of-the-french-entrepreneur-who-brought-shein-to-paris_6748883_117.html,,
23,"At Marseille's MuCEM, an exhibition explores the sunken island of Ferdinandea",https://www.lemonde.fr/en/m-le-mag/article/2025/12/27/at-marseille-s-mucem-an-exhibition-explores-the-sunken-island-of-ferdinandea_6748860_117.html,,
24,Five creative craft workshops to enjoy doing in Paris with your child,https://www.lemonde.fr/en/intimacy/article/2025/12/13/in-paris-five-creative-craft-workshops-to-enjoy-doing-with-your-child_6748451_310.html,  By Tiphaine Thuillier ,
25,Jewels of power go on display in Paris,https://www.lemonde.fr/en/culture/article/2025/12/11/the-power-gems-on-display-in-paris_6748374_30.html,  By Valentin Pérez   ,
26,Five spots in Paris to enjoy a (great) plant-based sandwich,https://www.lemonde.fr/en/lifestyle/article/2025/12/04/in-paris-five-spots-to-enjoy-a-great-plant-based-sandwich_6748131_37.html,  By Lucas Scaltritti ,
27,"Bayonne's 'Little Louvre,' the Bonnat-Helleu Museum, reopens after 14 years",https://www.lemonde.fr/en/culture/article/2025/11/28/bayonne-s-little-louvre-the-bonnat-helleu-museum-reopens-after-14-years_6747913_30.html,  By Roxana Azimi (Bayonne (France) special correspondent) ,
28," Sudan: Inside besieged El-Obeid, the war's new frontline  ",https://www.lemonde.fr/en/le-monde-africa/article/2025/12/30/sudan-inside-besieged-el-obeid-the-war-s-new-frontline_6748949_124.html,,"War in Sudan: A Trapped Nation (1/6). For nearly three years, Sudan has been torn apart by a conflict between the national army and the militias of the Rapid Support Forces, leaving some 200,000 people dead. For the first time, Le Monde traveled to El-Obeid, a city threatened by paramilitary forces and now crucial for controlling the country's center."
29,French municipal elections: How environmental issues became central to voters' daily lives,https://www.lemonde.fr/en/politics/article/2025/12/30/french-municipal-elections-how-environmental-issues-became-central-to-voters-daily-lives_6748942_5.html,  By Matthieu Goar ,
30,"Trump puts differences with Netanyahu aside, sends warnings to Hamas and Iran",https://www.lemonde.fr/en/international/article/2025/12/30/trump-puts-differences-with-netanyahu-aside-sends-warnings-to-hamas-and-iran_6748935_4.html,"  By Nicolas Chapuis (New York (United States) correspondent) and Samuel Forey (Jerusalem, special correspondent) ",
31,Eurostar resumes service across Europe after power problem,https://www.lemonde.fr/en/economy/article/2025/12/30/eurostar-urges-passengers-not-to-travel-due-to-disruption-in-channel-tunnel_6748941_19.html,Le Monde with AFP,"A power glitch in the Channel Tunnel caused major disruptions to train services between London, Paris and Amsterdam, prompting the train company to urge passengers to delay travel. Getlink, the tunnel's operator, later said traffic was expected to return to normal overnight."
32,Israel warns it will suspend aid organizations operating in Gaza,https://www.lemonde.fr/en/international/article/2025/12/31/israel-warns-it-will-suspend-aid-organizations-operating-in-gaza_6748953_4.html,Le Monde with AFP,The Ministry of Diaspora Affairs and Combating Antisemitism also accused two Doctors Without Borders employees of links to militant groups and that the latest move is part of Israel's decision to 'strengthen and update' regulations that govern international NGOs in Palestinian territory.
33,"UK moves to ban boiling lobsters, shrimp, crabs and langoustines alive, recognizing their capacity for pain",https://www.lemonde.fr/en/environment/article/2025/12/31/uk-moves-to-ban-boiling-lobsters-shrimp-crabs-and-langoustines-alive-recognizing-their-capacity-for-pain_6748952_114.html,  By Emma Nicolas ,"The measure, to be implemented by 2030, would also apply to crustaceans and cephalopod mollusks, including octopuses, all of which are recognized as sentient beings under British law."
34,Dining at the Centre Pompidou-Metz,https://www.lemonde.fr/en/m-le-mag/article/2025/12/30/dining-at-the-centre-pompidou-metz_6748951_117.html,  By Julien Amat ,"'A Meal at the Museum' (4/6). Charles Coulombeau, the chef of the brasserie Umé, reinvents French classics with a Japanese twist. His cuisine is as inventive as the museum's art."
35,China raises prices of condoms and birth control pills in attempt to boost birth rate,https://www.lemonde.fr/en/international/article/2025/12/31/china-raises-prices-of-condoms-and-birth-control-pills-in-attempt-to-boost-birth-rate_6748954_4.html,"  By Jordan Pouille (Beijing (China), correspondence) ",
36,Artists cancel shows at Washington's premier performing arts center after name changed to Trump-Kennedy Center,https://www.lemonde.fr/en/international/article/2025/12/31/artists-cancel-shows-at-washington-s-premier-performing-arts-center-after-name-changed-to-trump-kennedy-center_6748955_4.html,Le Monde with AFP,
37,Israeli drones make life miserable for residents of southern Lebanon,https://www.lemonde.fr/en/international/article/2025/12/30/israeli-drones-make-life-miserable-for-residents-of-southern-lebanon_6748939_4.html,  By Laure Stephan (Abbasiyeh (Lebanon) special correspondent) ,
38,Berlin's dangerous fascination with homemade firecrackers and fireworks,https://www.lemonde.fr/en/international/article/2025/12/30/berlin-s-dangerous-fascination-with-homemade-firecrackers-and-fireworks_6748934_4.html,  By Elsa Conesa (Berlin (Germany) correspondent) ,
39,"French ban on 'forever chemicals' in cosmetics, clothing to enter force",https://www.lemonde.fr/en/france/article/2025/12/30/french-ban-on-forever-chemicals-in-cosmetics-clothing-to-enter-force_6748944_7.html,Le Monde with AFP,
40,Fine champagnes at affordable prices: Le Monde's selection of the best bubbles for the holiday season,https://www.lemonde.fr/en/lifestyle/article/2025/12/30/fine-champagnes-at-affordable-prices-le-monde-s-selection-of-the-best-bubbles-for-the-holiday-season_6748929_37.html,,
41,US sanctions Iran-Venezuela drone network amid Maduro pressure,https://www.lemonde.fr/en/international/article/2025/12/30/us-sanctions-iran-venezuela-drone-network-amid-maduro-pressure_6748950_4.html,Le Monde with AFP,
42,Banana growers in the French Antilles try to move past legacy of chlordecone,https://www.lemonde.fr/en/economy/article/2025/12/30/banana-growers-in-the-french-antilles-try-to-move-past-legacy-of-chlordecone_6748938_19.html,"  By Jean-Michel Hauteville (Capesterre-Belle-Eau (Guadeloupe), special correspondent) ",
43,China conducts second day of military drills around Taiwan with port blockade simulation,https://www.lemonde.fr/en/international/article/2025/12/30/china-conducts-second-day-of-military-drills-around-taiwan-with-port-blockade-simulation_6748928_4.html,Le Monde with AP and AFP,
44,"Russia declines to provide proof of alleged drone attack on Putin's home, says will 'toughen' negotiating stance",https://www.lemonde.fr/en/international/article/2025/12/29/zelensky-denies-ukraine-attacked-putin-s-residence-accuses-russia-of-lies_6748919_4.html,Le Monde with AFP,
45,"Fight, the innovative agency behind Zohran Mamdani's New York victory",https://www.lemonde.fr/en/m-le-mag/article/2025/12/30/fight-the-innovative-agency-behind-zohran-mamdani-s-new-york-victory_6748931_117.html,,
46,UAE to withdraw remaining forces from Yemen amid separatist offensive,https://www.lemonde.fr/en/international/article/2025/12/30/saudi-arabia-bombs-yemen-port-over-weapons-shipment-from-uae-warns-abu-dhabi_6748936_4.html,Le Monde with AP,
47,Israel: The MAGA world's new obsession,https://www.lemonde.fr/en/international/article/2025/12/29/israel-the-maga-world-s-new-obsession_6748918_4.html,  By Piotr Smolar (Washington (United States) correspondent) ,"As Israeli Prime Minister Benjamin Netanyahu is expected to meet with US President Donald Trump in Miami on Monday, December 29, Israel has become a source of contention and fantasy within the Trump movement."
48,Sex: Should you really 'enjoy yourself before settling down' and entering a relationship?,https://www.lemonde.fr/en/intimacy/article/2025/12/28/sex-should-you-really-enjoy-yourself-before-settling-down-and-entering-a-relationship_6748904_310.html,,Le Monde columnist Maïa Mazaurette challenges arguments that urge young people to expand their range of sexual experiences and partners – especially maxims that undermine the value of relationships.
49,How dining etiquette reveals social divides among young people,https://www.lemonde.fr/en/campus/article/2025/12/27/how-dining-etiquette-reveals-social-divides-among-young-people_6748873_11.html,  By Audrey Parmentier ,"Choosing a natural wine, slicing comté cheese the 'right' way, opening an oyster: For young people lacking the right social codes, embarrassment at the table is often inevitable."
50,Trump's failing bet against wind power,https://www.lemonde.fr/en/opinion/article/2025/12/30/trump-s-failing-bet-against-wind-power_6748940_23.html,,
51,"The death of Brigitte Bardot: One icon, many faces",https://www.lemonde.fr/en/opinion/article/2025/12/29/the-death-of-brigitte-bardot-one-icon-many-faces_6748914_23.html,,
52,2025: The year Europe weakened Ukraine by abandoning the Gaza Strip,https://www.lemonde.fr/en/international/article/2025/12/29/2025-the-year-europe-weakened-ukraine-by-abandoning-the-gaza-strip_6748909_4.html,,
