,title,subhed,url
0, Vance's stark warning to Israeli leaders: 'Donald J. Trump is the only head of state in the entire world who is sympathetic to the nation of Israel'  ,"By sharply criticizing Israel, accusing it of blocking the agreement signed between Washington and Tehran on June 17, the US vice president exposed a lasting rift between the two countries.",https://www.lemonde.fr/en/international/article/2026/06/19/vance-delivers-stark-warning-to-israel-donald-j-trump-is-the-only-head-of-state-in-the-entire-world-who-is-sympathetic-to-the-nation-of-israel_6754664_4.html
1,"'In France, 50% of buildings are not adapted to heatwaves'",,https://www.lemonde.fr/en/france/article/2026/06/19/in-france-50-of-buildings-are-not-adapted-to-heatwaves_6754654_7.html
2,"After death of 11-year-old Lyhanna, French public invited to courthouse voice anger at justice system",,https://www.lemonde.fr/en/france/article/2026/06/19/after-death-of-11-year-old-lyhanna-french-public-invited-to-courthouse-voice-anger-at-justice-system_6754653_7.html
3,Ukrainian defense manufacturers seek their footing as headliners at Eurosatory arms fair in Paris,Promoted for their 'battle-tested' weapons – a coveted label in the defense industry – Ukrainian arms manufacturers are encountering a European market that remains hesitant amid regulations that are ill-suited to their urgent needs.,https://www.lemonde.fr/en/international/article/2026/06/19/ukrainian-defense-manufacturers-seek-their-footing-as-headliners-at-eurosatory-arms-fair-in-paris_6754659_4.html
4,"Labour's Andy Burnham, Keir Starmer's rival, wins by-election and secures Parliament seat",The mayor of Greater Manchester won by a wide margin over the far-right Reform UK candidate in the Makerfield constituency. He now aims to become the leader of the Labour Party and unseat the prime minister.,https://www.lemonde.fr/en/international/article/2026/06/19/labour-s-andy-burnham-keir-starmer-s-rival-wins-by-election-and-secures-parliament-seat_6754656_4.html
5,"Wealthy taxpayers clean out their holdings, keeping their homes, sports cars and gold bars safe","The new 20% tax on 'luxury' assets held in personal holdings is prompting owners to quickly remove them. As a result, the measure risks bringing in almost nothing.",https://www.lemonde.fr/en/politics/article/2026/06/19/wealthy-taxpayers-clean-out-their-holdings-keeping-their-homes-sports-cars-and-gold-bars-safe_6754650_5.html
6,'The French are reading less and the consequence is that many bookshops now face extinction',"In 2025, for the first time, more bookshops closed in France than opened. These businesses, which receive less public support than broadcasting, cinema, the press or the music industry, need greater backing, writes culture columnist Michel Guerrin.",https://www.lemonde.fr/en/opinion/article/2026/06/19/the-french-are-reading-less-and-the-consequence-is-that-many-bookshops-now-face-extinction_6754665_23.html
7,"EU hails turning tide for Ukraine, yet membership path remains uncertain",,https://www.lemonde.fr/en/international/article/2026/06/19/eu-hails-turning-tide-for-ukraine-yet-membership-path-remains-uncertain_6754657_4.html
8,Ukrainian drone assault on Moscow undermines Putin's promises of victory,,https://www.lemonde.fr/en/international/article/2026/06/18/ukrainian-drone-assault-on-moscow-undermines-putin-s-promises-of-victory_6754645_4.html
9,Bruno Mars brings funk and romance to Paris,,https://www.lemonde.fr/en/culture/article/2026/06/19/bruno-mars-brings-funk-and-romance-to-paris_6754662_30.html
10,Mont-Saint-Michel will no longer be managed by France's National Monuments Center,,https://www.lemonde.fr/en/culture/article/2026/06/19/mont-saint-michel-will-no-longer-be-managed-by-france-s-national-monuments-center_6754648_30.html
11,France detains man suspected of spying on drone factory for Russia,,https://www.lemonde.fr/en/international/article/2026/06/19/france-detains-man-suspected-of-spying-on-drone-factory-for-russia_6754663_4.html
12,Judicial investigation opened against former French PM Edouard Philippe,,https://www.lemonde.fr/en/france/article/2026/06/18/judicial-investigation-opened-against-former-french-pm-edouard-philippe_6754639_7.html
13,US says goodbye to Air Force One as Qatari jet awaits,,https://www.lemonde.fr/en/international/article/2026/06/19/last-ride-us-says-goodbye-to-air-force-one-as-qatari-jet-awaits_6754651_4.html
14,UN aid chief demands 'dignity' for Gaza population,,https://www.lemonde.fr/en/international/article/2026/06/19/un-aid-chief-demands-dignity-for-gaza-population_6754647_4.html
15,"Paris blocks concert organized by the hard-left, fueling political backlash",,https://www.lemonde.fr/en/politics/article/2026/06/18/paris-blocks-concert-organized-by-the-hard-left-fueling-political-backlash_6754638_5.html
16,"'Incidents multiply in the Baltic Sea, where the Russian navy 'now operates in a completely overt manner'",,https://www.lemonde.fr/en/international/article/2026/06/18/incidents-multiply-in-the-baltic-sea-where-the-russian-navy-now-operates-in-a-completely-overt-manner_6754643_4.html
17,"Online betting ads are everywhere during the World Cup, but a law could soon ban them during matches",,https://www.lemonde.fr/en/sports/article/2026/06/19/online-betting-ads-are-everywhere-during-the-world-cup-a-law-could-soon-ban-them-during-matches_6754649_9.html
18,Knicks fans flood New York City streets for championship parade,,https://www.lemonde.fr/en/sports/article/2026/06/18/knicks-fans-flood-new-york-streets-for-championship-parade_6754641_9.html
19,"In Trump's polarized America, empathy faces unanimous opposition","Once valued in American public life, empathy now faces criticism from the far right, which sees it as a sign of weakness. The left, too, is questioning its relevance: In a world where brutality prevails, can we still afford to show understanding?",https://www.lemonde.fr/en/opinion/article/2026/06/18/in-trump-s-polarized-america-empathy-faces-unanimous-opposition_6754642_23.html
20,"French security replaces Palantir with domestic firm ChapsVision, a complicated choice","Used since the 2015 terrorist attacks, the controversial American company's data analysis software is set to be gradually replaced by that of a French provider. The long-awaited decision presents a significant technological challenge.",https://www.lemonde.fr/en/france/article/2026/06/17/french-security-replaces-palantir-with-domestic-firm-chapsvision-a-complicated-choice_6754592_7.html
21,Ending the war with Iran comes at the cost of major US concessions,"The memorandum of understanding, signed on the evening of June 17 by the presidents of both countries is intended to end hostilities and allow for the reopening of the Strait of Hormuz. Nuclear negotiations will begin immediately afterward.",https://www.lemonde.fr/en/international/article/2026/06/18/ending-the-war-with-iran-comes-at-the-cost-of-major-us-concessions_6754629_4.html
22,Ukraine turns the tide of war in its favor,,https://www.lemonde.fr/en/opinion/article/2026/06/19/ukraine-turns-the-tide-of-war-in-its-favor_6754666_23.html
23,"'In Iran, none of the causes that sparked the relentless and admirable anti-regime uprisings has disappeared'",,https://www.lemonde.fr/en/opinion/article/2026/06/19/in-iran-none-of-the-causes-that-sparked-the-relentless-and-admirable-anti-regime-uprisings-has-disappeared_6754655_23.html
24,French government urged to reveal hidden assets of the rich,,https://www.lemonde.fr/en/politics/article/2026/06/17/france-no-longer-knows-who-its-wealthiest-citizens-are-government-urged-to-reopen-black-box-on-the-assets-of-the-richest_6754601_5.html
