,title,url,byline,subhed
0,Russia aims to cripple Ukraine's power grid to weaken Kyiv,https://www.lemonde.fr/en/international/article/2025/11/03/russia-aims-to-cripple-ukraine-s-power-grid-to-weaken-kyiv_6747041_4.html,"  By Emmanuel Grynszpan (Kyiv, Odesa (Ukraine), special correspondent) ",
1,Iran: Rape allegations against famous actor spark rare debate in deeply patriarchal society,https://www.lemonde.fr/en/international/article/2025/11/03/iran-rape-allegations-against-famous-actor-spark-rare-debate-in-deeply-patriarchal-society_6747040_4.html,  By Ghazal Golshiri ,
2,"China uses subsidies, coercion and propaganda to boost falling birth rates",https://www.lemonde.fr/en/international/article/2025/11/02/china-uses-subsidies-coercion-and-propaganda-to-boost-falling-birth-rates_6747027_4.html,,
3,JD Vance positions himself as heir of the MAGA movement,https://www.lemonde.fr/en/international/article/2025/11/02/jd-vance-positions-himself-as-heir-of-the-maga-movement_6747025_4.html,"  By Piotr Smolar (Oxford (Mississippi, United States) special correspondent) ",
4,"After Charlie Kirk's murder, Europe's far right swears allegiance to Trump's politics",https://www.lemonde.fr/en/les-decodeurs/article/2025/10/20/the-murder-of-charlie-kirk-how-europe-s-far-right-swore-allegiance-to-trump-s-politics_6746586_8.html,,
5,Sanctions against Russia spark rift between US and Europe over China,https://www.lemonde.fr/en/international/article/2025/09/15/sanctions-against-russia-spark-rift-between-us-and-europe-over-china_6745411_4.html,"  By Philippe Jacqué (Brussels, Europe bureau), Philippe Ricard and Harold Thibault (Beijing (China) correspondent) ",
6,France's political instability puts Franco-German alliance to the test,https://www.lemonde.fr/en/opinion/article/2025/08/30/france-s-political-instability-puts-franco-german-alliance-to-the-test_6744873_23.html,,
7,France faces prospect of paying higher borrowing costs than Italy,https://www.lemonde.fr/en/economy/article/2025/08/19/france-faces-prospect-of-paying-higher-borrowing-costs-than-italy_6744519_19.html,  By Denis Cosnard and Allan Kaval (Rome (Italy) correspondent) ,
8,"Louvre heist suspects believed to be small-time criminals, says Paris prosecutor",https://www.lemonde.fr/en/france/article/2025/11/02/louvre-heist-two-suspects-a-couple-with-children-believed-to-be-small-time-criminals-says-prosecutor_6747026_7.html,Le Monde with AFP,
9,"Louvre heist: Man and woman charged, but jewels still missing",https://www.lemonde.fr/en/france/article/2025/11/02/louvre-heist-man-and-woman-charged-but-jewels-still-missing_6747016_7.html,  By Thomas Saintourens ,
10,All-you-can-eat buffets attract gourmet and value-conscious diners in France's city centers,https://www.lemonde.fr/en/france/article/2025/11/01/all-you-can-eat-buffets-attract-gourmet-yet-value-conscious-diners-in-france-s-city-centers_6747005_7.html,  By Jessica Gourdon and Léo Pajon ,
11,Sentences over red hand graffiti on Paris Shoah Memorial handed down in 'unprecedented' trial,https://www.lemonde.fr/en/france/article/2025/11/01/sentences-over-red-hand-graffiti-on-paris-shoah-memorial-handed-down-in-unprecedented-trial_6746993_7.html,  By Benoît Vitkine ,
12,Afghanistan: Relentless repression continues over four years into Taliban's rule,https://www.lemonde.fr/en/videos/video/2025/10/04/afghanistan-relentless-repression-continues-over-four-years-into-taliban-s-rule_6746092_108.html,"  By Chloé Denis, Félix Pommier (Motion design) and Sinead McCausland ",
13,Watch: Hundreds of thousands march in France against budget cuts,https://www.lemonde.fr/en/videos/video/2025/09/19/french-strikes-watch-what-happened-as-hundreds-of-thousands-marched-against-budget-cuts_6745548_108.html,  By Le Monde's video desk   ,
14,Emmys 2025: 'Adolescence' star Owen Cooper becomes youngest winner for best supporting actor,https://www.lemonde.fr/en/videos/video/2025/09/15/emmys-2025-adolescence-star-owen-cooper-becomes-youngest-winner-for-best-supporting-actor_6745427_108.html,  By Le Monde's video desk   ,
15,"From 'influence peddling' to 'corruption,' what is French Culture Minister Rachida Dati accused of?",https://www.lemonde.fr/en/videos/video/2025/09/06/from-influence-peddling-to-corruption-what-is-french-culture-minister-rachida-dati-accused-of_6745094_108.html,"  By Alexis Tromas, Arthur Navet  and Sinead McCausland ",
16,Why peace in the Middle East depends on the release of Marwan Barghouti,https://www.lemonde.fr/en/opinion/article/2025/11/02/why-peace-in-the-middle-east-depends-on-the-release-of-marwan-barghouti_6747022_23.html,,
17,US-China trade truce shows Beijing has upper hand,https://www.lemonde.fr/en/opinion/article/2025/11/03/us-china-trade-truce-shows-beijing-has-upper-hand_6747045_23.html,,
18,"In Poland, Donald Tusk's anti-populist 'revolution' fails",https://www.lemonde.fr/en/opinion/article/2025/11/03/in-poland-donald-tusk-s-anti-populist-revolution-fails_6747039_23.html,,
19,"'The Louvre theft marks a turning point between a hampered public cultural scene and wealthy, private players'",https://www.lemonde.fr/en/opinion/article/2025/11/01/the-louvre-theft-marks-a-turning-point-between-an-underfunded-worn-out-public-cultural-scene-and-wealthy-agile-private-players_6746987_23.html,,
20,French lesbian literature steps into the spotlight with new prize,https://www.lemonde.fr/en/m-le-mag/article/2025/11/02/french-lesbian-literature-steps-into-the-spotlight-with-new-prize_6747015_117.html,  By Clémentine Goldszal ,
21,A dizzying dive into Bob Wilson's Long Island theater of objects,https://www.lemonde.fr/en/m-le-mag/article/2025/11/01/a-dizzying-dive-into-bob-wilson-s-long-island-theater-of-objects_6746988_117.html,,
22,Brigitte Macron's never-ending fake news nightmare,https://www.lemonde.fr/en/m-le-mag/article/2025/10/25/brigitte-macron-s-never-ending-fake-news-nightmare_6746763_117.html,,
23,A new Israeli-Palestinian restaurant promotes peace through food in Paris,https://www.lemonde.fr/en/m-le-mag/article/2025/10/22/a-new-israeli-palestinian-restaurant-promotes-peace-through-food-in-paris_6746662_117.html,  By Gaspard Dhellemmes ,
24,The Orient Express pulls up in Paris: An opulent journey into the 1920s,https://www.lemonde.fr/en/lifestyle/article/2025/11/02/the-orient-express-pulls-up-in-paris-an-opulent-journey-into-the-1920s_6747014_37.html,,
25,Twelve artistic happenings to catch outside Art Basel Paris,https://www.lemonde.fr/en/culture/article/2025/10/24/twelve-artistic-happenings-to-catch-outside-art-basel-paris_6746743_30.html,"  By Roxana Azimi, Philippe Dagen, Claire Guillot, Emmanuelle Jardonnet, Sylvie Kerviel and Emmanuelle Lequeux ",
26,A new Israeli-Palestinian restaurant promotes peace through food in Paris,https://www.lemonde.fr/en/m-le-mag/article/2025/10/22/a-new-israeli-palestinian-restaurant-promotes-peace-through-food-in-paris_6746662_117.html,  By Gaspard Dhellemmes ,
27,"'The spirit of the new Fondation Cartier is not that of a cathedral where one must always do more, always bigger'",https://www.lemonde.fr/en/culture/article/2025/10/21/the-spirit-of-the-new-fondation-cartier-is-not-that-of-a-cathedral-where-one-must-always-do-more-always-bigger_6746624_30.html,  Interview by Roxana Azimi   ,
28, Russia aims to cripple Ukraine's power grid to weaken Kyiv  ,https://www.lemonde.fr/en/international/article/2025/11/03/russia-aims-to-cripple-ukraine-s-power-grid-to-weaken-kyiv_6747041_4.html,"  By Emmanuel Grynszpan (Kyiv, Odesa (Ukraine), special correspondent) ",Moscow's drone strikes seek to plunge the east of the country into darkness and cold. But Ukraine's energy sector strives for greater resiliency by investing into renewable energy.
29,"From the US to Qatar, the frantic race for liquefied natural gas",https://www.lemonde.fr/en/economy/article/2025/11/03/from-the-us-to-qatar-the-frantic-race-for-liquefied-natural-gas_6747034_19.html,  By Marie de Vergès ,
30,"In Poland, Donald Tusk's anti-populist 'revolution' fails",https://www.lemonde.fr/en/opinion/article/2025/11/03/in-poland-donald-tusk-s-anti-populist-revolution-fails_6747039_23.html,,
31,Regional leader in Spain steps down one year after deadly floods,https://www.lemonde.fr/en/international/article/2025/11/03/regional-leader-in-spain-steps-down-one-year-after-deadly-floods_6747043_4.html,Le Monde with AFP,Valencia region President Carlos Mazon faced criticism for his handling of the disaster and was subjected to repeated insults during the memorial ceremony for the victims on Wednesday.
32,Iran: Rape allegations against famous actor spark rare debate in deeply patriarchal society,https://www.lemonde.fr/en/international/article/2025/11/03/iran-rape-allegations-against-famous-actor-spark-rare-debate-in-deeply-patriarchal-society_6747040_4.html,  By Ghazal Golshiri ,"The actor Pejman Jamshidi, briefly arrested and then released, left the country for Canada after a young woman accused him of sexual assault."
33,"At the Musée Picasso, Philip Guston and the irony of history",https://www.lemonde.fr/en/culture/article/2025/11/03/at-the-musee-picasso-philip-guston-and-the-irony-of-history_6747032_30.html,  By Philippe Dagen ,"The American painter, a major figure of the second half of the 20th century who moved from figurative art to abstract expressionism, blended biting irony with a critique of American society."
34,Sudan: The UAE's shady role and Western nations' 'culpable indifference',https://www.lemonde.fr/en/le-monde-africa/article/2025/11/03/the-uae-s-shady-role-in-sudan-and-western-nations-culpable-indifference_6747044_124.html,  By Eliott Brachet (Cairo (Egypt) correspondent) ,"Allied with General Hemedti's Rapid Support Forces, the UAE has provided crucial logistical support to the paramilitary fighters who conducted the deadly assault on el-Fasher."
35,Earthquake in northern Afghanistan kills more than 20 and injures hundreds,https://www.lemonde.fr/en/international/article/2025/11/03/earthquake-in-northern-afghanistan-kills-more-than-20-and-injures-hundreds_6747036_4.html,Le Monde with AFP,
36,Wembanyama held to nine points in Spurs first loss of the season to Pheonix,https://www.lemonde.fr/en/sports/article/2025/11/03/wembanyama-held-to-nine-points-in-spurs-first-loss-of-the-season-to-pheonix_6747037_9.html,Le Monde with AP and AFP,
37,Israel receives the remains of three hostages from Gaza as fragile ceasefire holds,https://www.lemonde.fr/en/international/article/2025/11/02/israel-receives-the-remains-of-three-hostages-from-gaza-as-fragile-ceasefire-holds_6747028_4.html,Le Monde with AP,
38,Riot police separate opponents and loyalists of Serbia's president as tensions soar,https://www.lemonde.fr/en/international/article/2025/11/03/riot-police-separate-opponents-and-loyalists-of-serbia-s-president-as-tensions-soar-amid-protests_6747031_4.html,Le Monde with AP,
39,UK police release one of two men arrested over train stabbings and laud a 'heroic' rail worker,https://www.lemonde.fr/en/international/article/2025/11/02/uk-police-arrest-two-suspects-after-multiple-people-stabbed-on-train_6747011_4.html,Le Monde with AP and AFP,
40,"'I never eat alone anymore': La Cop1ne, a Parisian community canteen offering a cure for loneliness",https://www.lemonde.fr/en/campus/article/2025/11/03/i-never-eat-alone-anymore-la-cop1ne-a-parisian-community-canteen-offering-a-cure-for-loneliness_6747030_11.html,  By Swann Deseine ,
41,Mexican mayor assassinated during Day of the Dead celebrations,https://www.lemonde.fr/en/international/article/2025/11/03/mexican-mayor-assassinated-during-day-of-the-dead-celebrations_6747033_4.html,Le Monde with AP,
42,Artificial intelligence is sparking a sexual revolution,https://www.lemonde.fr/en/intimacy/article/2025/11/02/artificial-intelligence-is-sparking-a-sexual-revolution_6747029_310.html,  By Maïa Mazaurette ,
43,JD Vance positions himself as heir of the MAGA movement,https://www.lemonde.fr/en/international/article/2025/11/02/jd-vance-positions-himself-as-heir-of-the-maga-movement_6747025_4.html,"  By Piotr Smolar (Oxford (Mississippi, United States) special correspondent) ",
44,"Louvre heist suspects believed to be small-time criminals, says Paris prosecutor",https://www.lemonde.fr/en/france/article/2025/11/02/louvre-heist-two-suspects-a-couple-with-children-believed-to-be-small-time-criminals-says-prosecutor_6747026_7.html,Le Monde with AFP,
45,Brazil's right wing seeks to capitalize on the deadliest police raid in its history,https://www.lemonde.fr/en/international/article/2025/11/02/brazil-s-right-wing-seeks-to-capitalize-on-the-deadliest-police-raid-in-its-history_6747020_4.html,"  By Anne-Dominique Correa (Rio de Janeiro, correspondance) ",
46,Why peace in the Middle East depends on the release of Marwan Barghouti,https://www.lemonde.fr/en/opinion/article/2025/11/02/why-peace-in-the-middle-east-depends-on-the-release-of-marwan-barghouti_6747022_23.html,,
47,Is it ever a good idea to... wear a sleeveless puffer vest?,https://www.lemonde.fr/en/lifestyle/article/2025/11/01/is-it-ever-a-good-idea-to-wear-a-sleeveless-puffer-vest_6747010_37.html,,"In fashion, as in life, it is important to know the lines you should not cross. Or else, to do so deliberately."
48,France's new 'unproductive wealth' tax reflects a limited adjustment,https://www.lemonde.fr/en/politics/article/2025/11/02/france-s-new-unproductive-wealth-tax-reflects-a-limited-adjustment_6747019_5.html,  By Denis Cosnard ,"MPs approved on Friday a modification of the real estate wealth tax. Its base was broadened, but the tax rate was reduced by a third for the very wealthy. Its yield remains unclear."
49,French lesbian literature steps into the spotlight with new prize,https://www.lemonde.fr/en/m-le-mag/article/2025/11/02/french-lesbian-literature-steps-into-the-spotlight-with-new-prize_6747015_117.html,  By Clémentine Goldszal ,"The Prix Gouincourt will be awarded for the first time next Friday, a few days after its illustrious model, the Prix Goncourt. It aims to highlight a genre that is becoming increasingly prominent."
50,US-China trade truce shows Beijing has upper hand,https://www.lemonde.fr/en/opinion/article/2025/11/03/us-china-trade-truce-shows-beijing-has-upper-hand_6747045_23.html,,
51,Côte d'Ivoire elections reveal veneer of democracy,https://www.lemonde.fr/en/opinion/article/2025/10/30/cote-d-ivoire-elections-reveal-veneer-of-democracy_6746921_23.html,,
52,'BHV has muddled its own narrative by associating with Shein',https://www.lemonde.fr/en/opinion/article/2025/10/30/by-partnering-with-shein-a-symbol-of-globalized-fast-fashion-the-bhv-department-store-has-muddled-its-own-narrative_6746909_23.html,,
