,title,url,byline,subhed
0,"Sur les marchés financiers, un été euphorique au risque de l’excès d’optimisme",https://www.lemonde.fr/economie/article/2025/08/24/sur-les-marches-financiers-un-ete-euphorique-au-risque-de-l-exces-d-optimisme_6634260_3234.html,,
1,Les nombreuses analogies entre les Etats-Unis de Trump et ceux des « barons voleurs » de 1890,https://www.lemonde.fr/economie/article/2025/08/04/richesse-monopoles-corruption-l-amerique-de-donald-trump-est-elle-revenue-en-1890_6626445_3234.html,  Par Philippe Escande ,
2,"Quand la cave privée enterrée sous la voie publique s’effondre, qui est responsable ?",https://www.lemonde.fr/argent/article/2025/08/22/quand-la-cave-privee-enterree-sous-la-voie-publique-s-effondre-qui-est-responsable_6633448_1657007.html,,
3,L’appel de 23 économistes à Israël pour « un arrêt immédiat de toute politique qui intensifie la famine généralisée à Gaza »,https://www.lemonde.fr/idees/article/2025/08/21/l-appel-de-23-economistes-a-un-arret-immediat-de-toute-politique-qui-intensifie-la-famine-generalisee-a-gaza_6632905_3232.html,,
4,"En Russie, des jeunes femmes africaines contraintes de fabriquer des drones de combat",https://www.lemonde.fr/afrique/video/2025/08/13/en-russie-des-jeunes-femmes-africaines-contraintes-de-fabriquer-des-drones-de-combat_6629046_3212.html,  Par Thomas Eydoux et Marceau Bretonnier (motion design) ,
5,La machine anti-immigration de Donald Trump s’active au cœur de New York,https://www.lemonde.fr/international/video/2025/08/14/la-machine-anti-immigration-de-donald-trump-s-active-au-c-ur-de-new-york_6629527_3210.html,"  Par Brieuc Beckers, Adrien Vande Casteele (motion design) et Fanny Zarifi ",
6,Pourquoi la Russie utilise tellement de drones iraniens Shahed pour attaquer l’Ukraine,https://www.lemonde.fr/international/video/2025/08/07/ukraine-pourquoi-la-russie-intensifie-ses-attaques-de-drones-shahed_6627299_3210.html,  Par Poline Tchoubar et Elisa Bellanger (Motion design) ,
7,Hiroshima : comment s’est déroulé le bombardement atomique le plus dévastateur de l’histoire,https://www.lemonde.fr/histoire/video/2025/08/02/hiroshima-comment-s-est-deroule-le-bombardement-atomique-le-plus-devastateur-de-l-histoire_6626343_4655323.html,  Par Karim El Hadj et Adrien Vande Casteele ,
8,Sud global : Trump fait le jeu de la Chine,https://www.lemonde.fr/idees/article/2025/08/23/sud-global-trump-fait-le-jeu-de-la-chine_6634045_3232.html,,
9,"Pierre Dardot et Christian Laval, trente ans de pensée en commun",https://www.lemonde.fr/idees/article/2025/08/22/pierre-dardot-et-christian-laval-trente-ans-de-pensee-en-commun_6633450_3232.html,  Par Youness Bousenna ,
10,"Face à Donald Trump, « les anciens présidents américains ne veulent pas risquer de compromettre la fonction en parlant de façon irréfléchie »",https://www.lemonde.fr/idees/article/2025/08/19/face-a-trump-les-anciens-presidents-americains-ne-veulent-pas-risquer-de-compromettre-la-fonction-en-parlant-de-facon-irreflechie_6631791_3232.html,  Propos recueillis par Valentine Faure ,
11,L’appel du cardinal d’Alger et du recteur de la Grande Mosquée de Paris : « Nos peuples ne doivent pas être les victimes collatérales des crispations diplomatiques »,https://www.lemonde.fr/idees/article/2025/08/24/l-appel-du-cardinal-d-alger-et-du-recteur-de-la-grande-mosquee-de-paris-nos-peuples-ne-doivent-pas-etre-les-victimes-collaterales-des-crispations-diplomatiques_6634256_3232.html,,
12,"Sur Netflix, le succès phénoménal du film d’animation « K-Pop Demon Hunters »",https://www.lemonde.fr/culture/article/2025/08/23/sur-netflix-le-succes-phenomenal-du-film-d-animation-kpop-demon-hunters_6634067_3246.html,"  Par Hanna Siemiatycki (Séoul, correspondance) ",
13,Essais : une rentrée pour éclairer un monde compliqué,https://www.lemonde.fr/livres/article/2025/08/24/essais-une-rentree-pour-eclairer-un-monde-complique_6634445_3260.html,  Par Florent Georgesco ,
14,"Les replays du week-end : « Titan », « Grasse », « Jack Lang » et « Liza Minnelli »",https://www.lemonde.fr/televisions-radio/article/2025/08/23/les-replays-du-week-end-titan-grasse-jack-lang-et-liza-minnelli_6633628_1655027.html,  Par Sandrine Berthaud-Clair et Catherine Pacary ,
15,"« Hostage » : Suranne Jones et Julie Delpy, duo politique transmanche pris dans la tourmente",https://www.lemonde.fr/culture/article/2025/08/23/hostage-suranne-jones-et-julie-delpy-duo-politique-transmanche-pris-dans-la-tourmente_6634063_3246.html,  Par Thomas Sotinel ,
16,La bavette au cresson et aux courgettes : la recette de Jesse Jenkins,https://www.lemonde.fr/m-styles/article/2025/08/24/la-bavette-au-cresson-et-aux-courgettes-la-recette-de-jesse-jenkins_6634483_4497319.html,  Par Jesse Jenkins ,
17,"La coupe à glace, l’alliée des gourmandises de l’été",https://www.lemonde.fr/m-styles/article/2025/08/24/la-coupe-a-glace-l-alliee-des-gourmandises-de-l-ete_6634448_4497319.html,  Par Julie Lasterade ,
18,Est-ce bien raisonnable de… retourner au boulot en short ?,https://www.lemonde.fr/m-styles/article/2025/08/24/est-ce-bien-raisonnable-de-retourner-au-boulot-en-short_6634442_4497319.html,,
19,"La photo animalière entre frères : « Nous nous sommes enhardis, en arpentant les bois ensemble avec un seul appareil pour deux »",https://www.lemonde.fr/series-d-ete/article/2025/08/24/la-photo-animaliere-entre-freres-nous-nous-sommes-enhardis-en-arpentant-les-bois-ensemble-avec-un-seul-appareil-pour-deux_6634262_3451060.html,,
20," Sur les marchés financiers, un été euphorique au risque de l’excès d’optimisme  ",https://www.lemonde.fr/economie/article/2025/08/24/sur-les-marches-financiers-un-ete-euphorique-au-risque-de-l-exces-d-optimisme_6634260_3234.html,,Wall Street et les Bourses européennes enchaînent les sommets. L’impact des tensions commerciales est relativisé et les résultats des entreprises ont agréablement surpris. Mais les valorisations inquiètent.
21,En direct : Sergueï Lavrov accuse les pays occidentaux de chercher à « empêcher » les négociations de paix,https://www.lemonde.fr/international/live/2025/08/24/en-direct-guerre-en-ukraine-kiev-lance-une-serie-d-attaques-aux-drones-sur-la-russie-le-jour-de-la-fete-de-son-independance_6634258_3210.html,,
22,"Mort de Jean Pormanove : « La loi ne demande à l’Arcom ni d’apprécier la légalité des contenus mis en ligne par des particuliers, ni d’en solliciter le retrait », rappelle son président, Martin Ajdari",https://www.lemonde.fr/idees/article/2025/08/24/mort-de-jean-pormanove-la-loi-ne-demande-a-l-arcom-ni-d-apprecier-la-legalite-des-contenus-mis-en-ligne-par-des-particuliers-ni-d-en-solliciter-le-retrait-rappelle-son-president-martin-ajdari_6634441_3232.html,,
23,"En Bolivie, l’agro-industrie attend beaucoup du retour de la droite au pouvoir",https://www.lemonde.fr/international/article/2025/08/24/en-bolivie-l-agro-industrie-attend-beaucoup-du-retour-de-la-droite-au-pouvoir_6634264_3210.html,,"A Santa Cruz, les gros producteurs de l’agronégoce réclament la fin du « centralisme » et de « l’étatisme » pour rivaliser avec leurs voisins brésiliens et argentins. Le 19 octobre, deux candidats de droite s’affronteront au second tour de la présidentielle."
24,"En Suède, le succès du gangsta rap fait débat",https://www.lemonde.fr/m-le-mag/article/2025/08/24/en-suede-le-succes-du-gangsta-rap-fait-debat_6634269_4500055.html,"  Par Anne-Françoise Hivert (Malmö (Suède), correspondante régionale) ","Faut-il continuer à inviter les têtes d’affiche du genre dans les festivals ? Le pays scandinave s’interroge, alors qu’il fait face depuis dix ans à une hausse continue de la violence et de la criminalité liée au narcotrafic."
25,Est-ce bien raisonnable de… retourner au boulot en short ?,https://www.lemonde.fr/m-styles/article/2025/08/24/est-ce-bien-raisonnable-de-retourner-au-boulot-en-short_6634442_4497319.html,,"Dans la mode comme dans la vie, il convient de connaître les limites à ne pas franchir. Ou alors en connaissance de cause."
26,Jakuta Alikavazovic et Justine Lévy : « Donner à lire les sentiments d’une fille pour sa mère »,https://www.lemonde.fr/livres/article/2025/08/24/jakuta-alikavazovic-et-justine-levy-donner-a-lire-les-sentiments-d-une-fille-pour-sa-mere_6634257_3260.html,  Propos recueillis par Raphaëlle Leyris ,"Les écrivaines Jakuta Alikavazovic, dans « Au grand jamais », et Justine Lévy, dans « Une drôle de peine », auscultent chacune, de façon plus ou moins autobiographique, les relations filiales. Conversation à trois voix."
27,"En Espagne, la récente vague de chaleur a été la plus intense jamais enregistrée",https://www.lemonde.fr/planete/article/2025/08/24/en-espagne-la-recente-vague-de-chaleur-a-ete-la-plus-intense-jamais-enregistree_6634481_3244.html,Le Monde avec AFP,
28,Cadavres retrouvés dans la Seine à Choisy-le-Roi : mise en examen du principal suspect requise pour quatre meurtres,https://www.lemonde.fr/societe/article/2025/08/24/cadavres-retrouves-dans-la-seine-a-choisy-le-roi-mise-en-examen-du-principal-suspect-requise-pour-quatre-meurtres_6634370_3224.html,Le Monde avec AFP,
29,"L’ambroisie, une plante invasive et très allergène, ennemi public numéro un dans les champs",https://www.lemonde.fr/planete/article/2025/08/24/l-ambroisie-une-plante-invasive-et-tres-allergene-ennemi-public-numero-un-dans-les-champs_6634263_3244.html,  Par Lina Tamine ,
30,"Avec son roman « Avale », la comédienne Séphora Pondi dévoile une intensité surprenante",https://www.lemonde.fr/m-le-mag/article/2025/08/24/avec-son-roman-avale-la-comedienne-sephora-pondi-devoile-une-intensite-surprenante_6634304_4500055.html,  Par Clémentine Goldszal ,
31,"Au moins 64 personnes ont été tuées par l’armée israélienne à Gaza en vingt-quatre heures, selon le ministère de la santé local",https://www.lemonde.fr/international/live/2025/08/24/en-direct-gaza-au-moins-64-personnes-ont-ete-tuees-par-l-armee-israelienne-en-vingt-quatre-heures-selon-le-ministere-de-sante-gazaoui_6632172_3210.html,,
32,"La dermatose nodulaire contagieuse détectée pour la première fois dans l’Ain, les bovins du foyer contaminé seront abattus",https://www.lemonde.fr/planete/article/2025/08/24/la-dermatose-nodulaire-contagieuse-detectee-pour-la-premiere-fois-dans-l-ain-les-bovins-du-foyer-contamine-seront-abattus_6634443_3244.html,Le Monde,
33,"Confronté à des manifestations anti-immigration, Londres promet des mesures pour accélérer les recours des demandeurs d’asile",https://www.lemonde.fr/international/article/2025/08/24/confronte-a-des-manifestations-anti-immigration-londres-promet-des-mesures-pour-accelerer-les-recours-des-demandeurs-d-asile_6634447_3210.html,Le Monde avec AFP,
34,"En Ukraine, portrait d’une jeunesse dans le quotidien incertain de la guerre",https://www.lemonde.fr/international/article/2025/08/24/en-ukraine-portrait-d-une-jeunesse-dans-le-quotidien-incertain-de-la-guerre_6634261_3210.html,,
35,"L’abbaye de Daoulas, dans le Finistère, explore l’univers insulaire sous toutes ses facettes",https://www.lemonde.fr/culture/article/2025/08/24/l-abbaye-de-daoulas-dans-le-finistere-explore-l-univers-insulaire-sous-toutes-ses-facettes_6634404_3246.html,  Par Sylvie Kerviel (Daoulas [Finistère] ) ,
36,"« Phantasmagoria » a 30 ans : film d’horreur, magie noire et jeu vidéo",https://www.lemonde.fr/pixels/article/2025/08/24/phantasmagoria-a-30-ans-film-d-horreur-magie-noire-et-jeu-video_6634406_4408996.html,  Par Pierre Trouvé ,
37,Essais : une rentrée pour éclairer un monde compliqué,https://www.lemonde.fr/livres/article/2025/08/24/essais-une-rentree-pour-eclairer-un-monde-complique_6634445_3260.html,  Par Florent Georgesco ,
38,« Maman » : Celle de qui Régis Jauffret tient le goût de la fiction,https://www.lemonde.fr/livres/article/2025/08/24/maman-celle-de-qui-regis-jauffret-tient-le-gout-de-la-fiction_6634405_3260.html,  Par Fabrice Gabriel (Collaborateur du « Monde des livres ») ,
39,Comment les démocrates américains se réinventent autour de l’idée d’« abondance »,https://www.lemonde.fr/international/article/2025/08/24/comment-les-democrates-americains-se-reinventent-autour-de-l-idee-d-abondance_6634255_3210.html,"  Par Corine Lesnes (San Francisco, correspondante) ","Né en Californie et emprunté à la tech, le concept séduit les jeunes du parti. Il prône un Etat interventionniste associé à une déréglementation pour faciliter les investissements et accroître l’offre de biens essentiels tels que le logement, l’énergie, les transports et les soins."
40,Trois expériences érotiques inspirées par… les activités de groupe,https://www.lemonde.fr/series-d-ete/article/2025/08/24/trois-experiences-erotiques-inspirees-par-les-activites-de-groupe_6634219_3451060.html,,"Maïa Mazaurette, chroniqueuse pour « La Matinale », s’est donné pour mission de pimenter vos chaudes nuits d’été. Cette semaine, on frotte ses fantasmes à ceux des autres à travers la littérature érotique, le dessin de nu ou dans un club libertin."
41,"En détruisant Rafah, l’armée israélienne tente d’effacer une histoire plurimillénaire",https://www.lemonde.fr/un-si-proche-orient/article/2025/08/24/la-longue-histoire-de-rafah-a-la-frontiere-sud-de-la-palestine_6634268_6116995.html,,"La ville palestinienne, située à la lisière de l’Egypte et dont le développement remonte aux Pharaons, est désormais un champ de décombres, écrit l’historien Jean-Pierre Filiu dans sa chronique."
42,Sud global : Trump fait le jeu de la Chine,https://www.lemonde.fr/idees/article/2025/08/23/sud-global-trump-fait-le-jeu-de-la-chine_6634045_3232.html,,
43,Tous ces livres qu’on accumule et qu’on ne lira jamais : « J’ai fini par comprendre que c’est moins un fardeau qu’une forme de richesse »,https://www.lemonde.fr/series-d-ete/article/2025/08/22/tous-ces-livres-qu-on-accumule-et-qu-on-ne-lira-jamais-j-ai-fini-par-comprendre-que-c-est-moins-un-fardeau-qu-une-forme-de-richesse_6633307_3451060.html,  Par Thomas Chatterton Williams ,
44,"Dmytro Kuleba, ex-ministre des affaires étrangères ukrainien : « Poutine tirera davantage de bénéfices que nous d’un cessez-le-feu »",https://www.lemonde.fr/international/article/2025/08/16/dmytro-kuleba-ancien-ministre-des-affaires-etrangeres-ukrainien-poutine-tirera-davantage-de-benefices-que-nous-d-un-cessez-le-feu_6630562_3210.html,"  Propos recueillis par Thomas d’Istria (Kiev, correspondant) et Emmanuel Grynszpan (Kiev, envoyé spécial) ",
