,title,subhed,url
0,"         Liveblog  Article in live   Convicted on appeal, Marine Le Pen can run for president after her election ban was reduced  ","An appeals court on Tuesday declared the far-right leader guilty of embezzlement but softened her ban on holding elected office. It also sentenced her to at-home detention with an electronic tag for a year, although that duration could be reduced.",https://www.lemonde.fr/en/france/live/2026/07/07/marine-le-pen-s-embezzlement-trial-ruling-set-to-determine-french-far-right-leader-s-eligibility-to-run-for-president_6755231_7.html
1,Explosions rock Damascus during Macron's visit,,https://www.lemonde.fr/en/syria/article/2026/07/07/explosions-rock-damascus-during-french-president-macron-s-visit_6755225_229.html
2,France faces new heatwave with temperatures reaching 40°C,,https://www.lemonde.fr/en/environment/article/2026/07/06/france-faces-new-heatwave-with-temperatures-reaching-40-c_6755211_114.html
3,'A despicable woman unworthy of her office': Kylian Mbappé responds to racist remarks from Paraguayan senator,The captain of the French national football team responded on Monday to a racist message posted by Celeste Amarilla. The Paraguayan politician's comments came in the wake of the Albirroja's defeat by Les Bleus in the round of 16 of the World Cup.,https://www.lemonde.fr/en/sports/article/2026/07/06/a-despicable-woman-unworthy-of-her-office-kylian-mbappe-responds-to-racist-remarks-from-paraguayan-senator_6755213_9.html
4,"As US disengages from NATO, Europe's militaries ramp up scattered and unsynchronized","In Ankara on July 7 and 8, European leaders from NATO want to show that they can cope with reduced US involvement and boost their defense capabilities to respond to any attack. While efforts are now underway, Europe is still struggling to coordinate them.",https://www.lemonde.fr/en/international/article/2026/07/07/as-us-disengages-from-nato-europe-s-militaries-ramp-up-scattered-and-unsynchronized_6755220_4.html
5,Pyrénées wildfires destroy everything in their path: 'I didn't think I'd make it out alive',"The residents of Ille-sur-Têt, a town that was evacuated, remain in shock as the Trévillach wildfire – the largest the region has seen in 50 years – was still not under control on Monday evening.",https://www.lemonde.fr/en/environment/article/2026/07/07/pyrenees-wildfires-destroy-everything-in-their-path-i-didn-t-think-i-d-make-it-out-alive_6755229_114.html
6,How Malian jihadists and pro-independence groups joined forces to overthrow the junta,"For years, jihadists from JNIM and pro-independence fighters from the FLA harbored deadly hatred for each other. But they put their differences aside to confront their common enemy: the ruling junta in Bamako. Since April 25, they have launched a major offensive.",https://www.lemonde.fr/en/le-monde-africa/article/2026/07/07/how-malian-jihadists-and-pro-independence-groups-joined-forces-to-overthrow-the-junta_6755235_124.html
7,"Ukrainian woman suspected of Monaco bombing shot dead near Kyiv, police says",,https://www.lemonde.fr/en/international/article/2026/07/07/ukrainian-woman-suspected-of-monaco-bombing-shot-dead-near-kyiv-police-says_6755233_4.html
8,"'Never before have 11,000 hectares burned this early in the summer in southern France in at least the past 20 years'",,https://www.lemonde.fr/en/environment/article/2026/07/07/never-before-have-11-000-hectares-burned-this-early-in-the-summer-in-southern-france-in-at-least-the-past-20-years_6755215_114.html
9,Netanyahu government's legal coup challenges Israel's justice system: 'The final nail in the coffin of democracy',,https://www.lemonde.fr/en/international/article/2026/07/07/netanyahu-government-s-legal-coup-challenges-israel-s-justice-system-the-final-nail-in-the-coffin-of-democracy_6755216_4.html
10,Ukraine dreams of becoming the 'arsenal of the free world' as allies are still unsure on how far they want cooperation to go,,https://www.lemonde.fr/en/international/article/2026/07/07/ukraine-dreams-of-becoming-the-arsenal-of-the-free-world-as-allies-are-still-unsure-on-how-far-they-want-cooperation-to-go_6755228_4.html
11,Hamas dissolves its governing bodies in Gaza as stalemate with Israel continues,,https://www.lemonde.fr/en/international/article/2026/07/07/hamas-dissolves-its-governing-bodies-in-gaza-as-stalemate-with-israel-continues_6755221_4.html
12,"Venezuela quake death toll tops 3,500",,https://www.lemonde.fr/en/environment/article/2026/07/06/as-venezuela-quake-death-toll-tops-3-300-dozens-of-unidentified-bodies-buried_6755183_114.html
13,One hundred early works by Claude Monet reunited at Le Havre's André Malraux Museum,,https://www.lemonde.fr/en/culture/article/2026/07/07/one-hundred-early-works-by-claude-monet-reunited-at-le-havre-s-andre-malraux-museum_6755219_30.html
14,"Netflix, Prime Video and Disney+ challenge new French investment rules",,https://www.lemonde.fr/en/economy/article/2026/07/06/netflix-prime-video-and-disney-challenge-new-french-investment-rules_6755196_19.html
15,"By revoking Balogun's red card, FIFA and US score an own goal at the 2026 World Cup",,https://www.lemonde.fr/en/sports/article/2026/07/07/by-revoking-balogun-s-red-card-fifa-and-us-score-an-own-goal-at-the-2026-world-cup_6755230_9.html
16,"US loses to Belgium, ending World Cup dream",,https://www.lemonde.fr/en/international/article/2026/07/07/us-team-loses-to-belgium-sending-world-cup-dream-to-a-halt_6755222_4.html
17,"Frenchman jailed in missing body case confesses to killing wife, says his lawyer",,https://www.lemonde.fr/en/france/article/2026/07/06/frenchman-jailed-in-missing-body-case-confesses-to-killing-wife-says-his-lawyer_6755206_7.html
18,Politicial scientist Alexandra de Hoop Scheffer: 'The United States is grappling with strategic saturation',,https://www.lemonde.fr/en/international/article/2026/07/06/politicial-scientist-alexandra-de-hoop-scheffer-the-us-is-pursuing-a-strategy-of-strategic-saturation_6755177_4.html
19,The possible outcomes of Marine Le Pen's trial,"On Tuesday, the Paris Court of Appeals will deliver its decision in the embezzlement case that could prevent the French far right's leader from running for president.",https://www.lemonde.fr/en/france/article/2026/07/06/the-possible-outcomes-of-marine-le-pen-s-trial_6755208_7.html
20,Philosopher Mélanie Plouviez: 'The rich are not rich alone; they are in a social world that protects them',"Wealth is not determined solely by the possessions and assets one accumulates, philosopher Mélanie Plouviez explains in an interview with Le Monde. Since antiquity, a person's fortune has also been defined by one's social standing, relationships of dominance, dependence and honor.",https://www.lemonde.fr/en/opinion/article/2026/07/05/philosopher-melanie-plouviez-the-rich-are-not-rich-alone-they-are-in-a-social-world-that-protects-them_6755173_23.html
21,Somaliland's high-risk quest for recognition,"The self-proclaimed republic aspires to accede to the international stage. It finds itself at the center of a game of alliances, caught between Israeli, American and Emirati ambitions and threats from Yemen and neighboring Somalia.",https://www.lemonde.fr/en/le-monde-africa/visuel/2026/07/06/somaliland-s-high-risk-quest-for-recognition_6755178_124.html
22,Pope Leo XIV's reminder of the duty of humanity toward migrants,,https://www.lemonde.fr/en/opinion/article/2026/07/06/pope-leo-xiv-s-reminder-of-the-duty-of-humanity-toward-migrants_6755201_23.html
23,Climate change: 'We cannot meet the challenge of adapting housing with the tools of the past. A thorough overhaul is needed',,https://www.lemonde.fr/en/economy/article/2026/07/04/climate-change-we-cannot-meet-the-challenge-of-adapting-housing-with-the-tools-of-the-past-a-thorough-overhaul-is-needed_6755153_19.html
24,"'Diverse France, that of Kylian Mbappé and the national team, is too promising a reality to be used as an electoral punching bag'",,https://www.lemonde.fr/en/opinion/article/2026/07/05/diverse-france-that-of-kylian-mbappe-and-the-national-team-is-too-promising-a-reality-to-be-used-as-an-electoral-punching-bag_6755175_23.html
