,title,subhed,url
0," How the 2016 Nice terrorist attack unfolded, minute-by-minute  ","On July 14, 2016, a terrorist drove a truck into crowds gathered on the famed Promenade des Anglais in the southern French city, killing 86 people. Ten years later, Le Monde looks back at how the tragedy unfolded.",https://www.lemonde.fr/en/france/video/2026/07/13/how-the-2016-nice-terrorist-attack-unfolded-minute-by-minute_6755441_7.html
1,Planes fight fire in Fontainebleau forest near Paris,,https://www.lemonde.fr/en/environment/article/2026/07/13/major-fire-rages-in-fontainebleau-forest-near-paris_6755419_114.html
2,Trump imposes maritime toll in Strait of Hormuz as ship traffic collapses,,https://www.lemonde.fr/en/international/article/2026/07/13/trump-imposes-maritime-toll-in-strait-of-hormuz-as-ship-traffic-collapses_6755446_4.html
3,"Ten years after the July 14 terrorist attack, Nice struggles with a painful process of remembrance",The city has found it difficult to convey the horror that left 86 people dead and more than 400 injured in 2016. Many victims feel that commemorations are 'second rate.',https://www.lemonde.fr/en/france/article/2026/07/14/ten-years-after-the-july-14-terrorist-attack-nice-struggles-with-a-painful-process-of-remembrance_6755447_7.html
4,US immigration agents involved in another fatal shooting,"An ICE agent fatally shot a 26-year-old Colombian man in the town of Biddeford, Maine, on Monday – only one week after a different ICE agent shot and killed a Mexican man in Texas.",https://www.lemonde.fr/en/international/article/2026/07/13/us-immigration-agents-involved-in-another-fatal-shooting_6755445_4.html
5,"'For France, everything is so easy at this World Cup that it's almost unsettling'","The French team have been so dominant at the World Cup that their supporters need to beware of excessive optimism, writes columnist Jérôme Latta.",https://www.lemonde.fr/en/sports/article/2026/07/14/for-france-everything-is-so-easy-at-this-world-cup-that-it-s-almost-unsettling_6755448_9.html
6,'And I thought coke was for stressed-out executives!': Cocaine's ravages among manual workers,"'Cocaine at work' (3/3). Long associated with elite, urban circles, cocaine has now made its way deep into rural France and its mid-sized towns. On construction sites, farms and in warehouses, workers, some barely out of their teens, are turning to the drug to get through the physical toll of their jobs.",https://www.lemonde.fr/en/campus/article/2026/07/13/and-i-thought-coke-was-for-stressed-out-executives-cocaine-s-ravages-among-manual-workers_6755443_11.html
7,"UK police reverse course, launch terror probe into killing of ex-MP Ann Widdecombe",,https://www.lemonde.fr/en/international/article/2026/07/14/uk-police-reverse-course-launch-terror-probe-into-killing-of-ex-mp-ann-widdecombe_6755449_4.html
8,How investigators track the causes of wildfires: 'A snail shell and a stone are valuable clues',,https://www.lemonde.fr/en/environment/article/2026/07/13/how-investigators-track-the-cause-of-wildfires-a-snail-shell-and-a-stone-are-valuable-clues_6755430_114.html
9,France sanctions Russian elite cyberespionage unit 'Turla',,https://www.lemonde.fr/en/pixels/article/2026/07/13/france-sanctions-russian-elite-cyberespionage-unit-turla_6755432_13.html
10,"Macron and the military: 10 years made of mistrust, hope, and budget hikes",,https://www.lemonde.fr/en/politics/article/2026/07/13/macron-and-the-military-10-years-made-of-mistrust-hope-and-budget-hikes_6755429_5.html
11,High levels of banned insecticides found in Nutella and imported honeys,,https://www.lemonde.fr/en/environment/article/2026/07/13/high-levels-of-banned-insecticides-found-in-nutella-and-imported-honeys_6755440_114.html
12,Macron says Europe will defend itself at all costs ahead of Ukraine allies summit,,https://www.lemonde.fr/en/international/article/2026/07/13/macron-says-europe-will-defend-itself-at-all-costs-ahead-of-ukraine-allies-summit_6755434_4.html
13,Alfred Dreyfus statue finally finds place in heart of Paris,,https://www.lemonde.fr/en/politics/article/2026/07/12/alfred-dreyfus-statue-finally-finds-place-in-heart-of-paris_6755409_5.html
14,Prominent Moroccan journalist and critic jailed upon arrival in Tangiers,,https://www.lemonde.fr/en/international/article/2026/07/13/prominent-moroccan-journalist-and-critic-jailed-upon-arrival-in-tangiers_6755442_4.html
15,"'Thank you, dear Hungary, for proving that anything is always possible'",,https://www.lemonde.fr/en/international/article/2026/07/13/thank-you-dear-hungary-for-proving-that-anything-is-always-possible_6755431_4.html
16,"Yves Tramblay, hydrologist: 'Successive heatwaves are causing a very significant and rapid loss of water stored in soils'",,https://www.lemonde.fr/en/environment/article/2026/07/13/yves-tramblay-hydrologist-successive-heatwaves-are-causing-a-very-significant-and-rapid-loss-of-water-stored-in-soils_6755425_114.html
17,"EU eyes phased social media access for children, stops short of outright ban",,https://www.lemonde.fr/en/pixels/article/2026/07/13/eu-eyes-phased-social-media-access-for-children-stops-short-of-outright-ban_6755436_13.html
18,Record-breaking heat wave hits western US,,https://www.lemonde.fr/en/international/article/2026/07/13/record-breaking-heat-wave-hits-western-us_6755423_4.html
19,'It would have been enough to learn the terrible lessons from Gaza to anticipate the current impasse over Iran',The deals that US President Donald Trump so readily boasts about seemed destined to get bogged down in the Middle East right from the start.,https://www.lemonde.fr/en/international/article/2026/07/12/it-would-have-been-enough-to-learn-the-terrible-lessons-from-gaza-to-anticipate-the-current-impasse-over-iran_6755416_4.html
20,"'If they catch me, it's over for me': Senegal's LGBTQ+ community lives in daily fear of repression","In March, Senegal passed a law increasing penalties for same-sex relations, leaving LGBTQ+ people living in fear. Several described their deeply uncertain daily lives, gripped by the constant anxiety of being arrested.",https://www.lemonde.fr/en/international/article/2026/07/12/if-they-catch-me-it-s-over-for-me-senegal-s-lgbtq-community-lives-in-daily-fear-of-repression_6755411_4.html
21,Silicon Valley's next generation feels the AI blues,"In California, the rise of artificial intelligence no longer generates the unanimous enthusiasm it once did. Anxiety is mounting, especially among students and engineers, as jobs have been cut and democratic risks have grown more threatening.",https://www.lemonde.fr/en/m-le-mag/article/2026/07/11/when-it-comes-to-ai-nothing-s-right-silicon-valley-is-torn_6755365_117.html
22,French MPs' vote to establish presumption of legitimate defense for police sets dangerous precedent,,https://www.lemonde.fr/en/opinion/article/2026/07/12/french-mps-vote-to-establish-presumption-of-legitimate-defense-for-police-sets-dangerous-precedent_6755413_23.html
23,Populists' temptation of impunity,,https://www.lemonde.fr/en/opinion/article/2026/07/09/populists-temptation-of-impunity_6755308_23.html
24,Le Pen's presidential bid 'is the ultimate symbol of the erosion of public ethics',,https://www.lemonde.fr/en/opinion/article/2026/07/09/le-pen-s-presidential-bid-is-the-ultimate-symbol-of-the-erosion-of-public-ethics_6755311_23.html
