,title,subhed,url
0, 250 years of American independence: Trump praises US and attacks 'communists' at chaotic celebration  ,"After over an hour's delay due to a heatwave and thunderstorms, Republican President Donald Trump, who made Independence Day into a celebration of his glory, gave a speech, under the rain, in which he claimed that 'America is back.'",https://www.lemonde.fr/en/international/article/2026/07/05/250-years-of-american-independence-trump-praises-us-and-attacks-communists-at-chaotic-celebration_6755164_4.html
1,2026 World Cup: France edge past Paraguay in tense battle to reach the quarter-finals,,https://www.lemonde.fr/en/sports/article/2026/07/05/2026-world-cup-france-edge-past-paraguay-in-tense-battle-to-reach-the-quarter-finals_6755165_9.html
2,"Fires devastate forests in Spain, France and Portugal amid heatwave",,https://www.lemonde.fr/en/international/article/2026/07/05/heatwave-fires-devastate-forests-across-europe_6755166_4.html
3,Clavicular: An American masculinist in Paris gets rejected,"The young influencer rose to fame on social media with his hyper-masculine and aggressive videos. Today, he is widely mocked for his unsuccessful attempts at flirting, which he broadcast live from the streets of Paris.",https://www.lemonde.fr/en/m-le-mag/article/2026/07/05/clavicular-an-american-masculinist-in-paris-gets-rejected_6755167_117.html
4,Tehran sees crowds gather to pray on second day of funeral ceremonies for Iran's Ali Khamenei,"Iranian President Masoud Pezeshkian attended the ceremony on Sunday, accompanied by Iranian allies and members of the team currently negotiating with the US after an initial ceasefire in the US-Israeli war against Iran.",https://www.lemonde.fr/en/international/article/2026/07/05/tehran-sees-crowds-gather-to-pray-on-second-day-of-funeral-ceremonies-for-iran-s-ali-khamenei_6755163_4.html
5,Peruvian and Colombian presidential elections: Expatriate vote helps far right clinch victory,"Peruvians living abroad helped Keiko Fujimori to win the presidency, even though only a minority of Peru's residents voted for her. Expatriate Colombians also massively backed Abelardo de la Espriella, though this was not as decisive.",https://www.lemonde.fr/en/international/article/2026/07/05/peruvian-and-colombian-presidential-elections-expatriate-vote-helps-far-right-clinch-victory_6755161_4.html
6,To go or not? The dilemma for artists and authors invited to far-right-run cities,"Many professionals in the French cultural sector are questioning whether to take part in events held in towns governed by the Rassemblement National, which is waging a cultural offensive.",https://www.lemonde.fr/en/culture/article/2026/07/05/to-go-or-not-the-dilemma-for-artists-and-authors-invited-to-far-right-run-cities_6755160_30.html
7,China releases protestant pastor Ezra Jin,,https://www.lemonde.fr/en/international/article/2026/07/05/china-releases-protestant-pastor-ezra-jin_6755162_4.html
8,"'We sacrificed everything': In Nablus, the relentless decline of Palestinian society",,https://www.lemonde.fr/en/international/article/2026/07/05/we-sacrificed-everything-in-nablus-the-relentless-decline-of-palestinian-society_6755157_4.html
9,Climate change: 'We cannot meet the challenge of adapting housing with the tools of the past. A thorough overhaul is needed',,https://www.lemonde.fr/en/economy/article/2026/07/04/climate-change-we-cannot-meet-the-challenge-of-adapting-housing-with-the-tools-of-the-past-a-thorough-overhaul-is-needed_6755153_19.html
10,'Ireland's GDP trends reflect global strategies of a handful of multinationals more than the actual state of the economy',,https://www.lemonde.fr/en/opinion/article/2026/07/04/ireland-s-gdp-trends-reflect-global-strategies-of-a-handful-of-multinationals-more-than-the-actual-state-of-the-economy_6755154_23.html
11,Trump speaks with Putin and Zelensky ahead of NATO summit,,https://www.lemonde.fr/en/international/article/2026/07/05/trump-speaks-with-putin-and-zelensky-ahead-of-nato-summit_6755156_4.html
12,Man climbs Eiffel Tower and hangs American flag,,https://www.lemonde.fr/en/international/article/2026/07/04/man-climbs-eiffel-tower-and-hangs-american-flag_6755155_4.html
13,"Paul Seixas, the 19-year-old phenom carrying France's Tour hopes",,https://www.lemonde.fr/en/sports/article/2026/07/04/paul-seixas-the-19-year-old-phenom-carrying-france-s-tour-hopes_6755139_9.html
14,'Clipification': How short-form videos are reshaping the media landscape,,https://www.lemonde.fr/en/opinion/article/2026/07/04/clipification-how-short-form-videos-are-reshaping-the-media-landscape_6755147_23.html
15,Germany sees mass protests around far-right AfD congress,,https://www.lemonde.fr/en/international/article/2026/07/04/germany-sees-mass-protests-around-far-right-afd-congress_6755148_4.html
16,China's bridge and highway construction boom runs up against wall of debt in Guizhou,,https://www.lemonde.fr/en/economy/article/2026/07/04/guizhou-where-china-s-bridge-and-highway-construction-boom-runs-up-against-wall-of-debt_6755149_19.html
17,"US gripped by extreme heatwave, disrupting 250th anniversary and World Cup celebrations",,https://www.lemonde.fr/en/environment/article/2026/07/04/us-gripped-by-extreme-heatwave-disrupting-250th-anniversary-and-world-cup-celebrations_6755140_114.html
18,"Michael Olise, France's heaven-sent prodigy",,https://www.lemonde.fr/en/sports/article/2026/07/04/michael-olise-france-s-heaven-sent-prodigy_6755146_9.html
19,What role did France play in the American Revolution?,"On July 4, Americans are celebrating the 250th anniversary of their independence – an event in which the French played a part.",https://www.lemonde.fr/en/videos/video/2026/07/04/what-role-did-france-play-in-the-american-revolution_6755152_108.html
20,'Which side were you on during Brexit? Every candidate in the French presidential election should answer this question',"The lessons from the UK's unprecedented vote to leave the European Union 10 years ago have been all too quickly forgotten, writes Le Monde columnist Alain Frachon.",https://www.lemonde.fr/en/opinion/article/2026/07/03/which-side-were-you-on-during-brexit-every-candidate-in-the-french-presidential-election-should-answer-this-question_6755106_23.html
21,Economist Gita Gopinath: 'Rising imbalances among major powers threaten growth and fuel protectionism',Harvard University economics professor and former International Monetary Fund official Gita Gopinath expresses concern over the level of US federal debt.,https://www.lemonde.fr/en/economy/article/2026/07/03/economist-gita-gopinath-rising-imbalances-among-major-powers-threaten-growth-and-fuel-protectionism_6755102_19.html
22,"'With Trump, the Founding Fathers' belief in the exemplary nature of US presidents has been lost'",,https://www.lemonde.fr/en/opinion/article/2026/07/04/with-trump-the-founding-fathers-belief-in-the-exemplary-nature-of-us-presidents-has-been-lost_6755145_23.html
23,"The right to choose one's death, the final freedom",,https://www.lemonde.fr/en/opinion/article/2026/07/01/the-right-to-choose-one-s-death-the-final-freedom_6755048_23.html
24,"Timothy Snyder, historian: 'Trump's war against Iran shows that evil and folly can march hand in hand'",,https://www.lemonde.fr/en/opinion/article/2026/07/03/timothy-snyder-historian-trump-s-war-against-iran-shows-that-evil-and-folly-can-march-hand-in-hand_6755112_23.html
