,title,url,byline,subhed
0,"Le Danemark, champion de la transition énergétique, mise à nouveau sur son gaz",https://www.lemonde.fr/economie/article/2025/12/06/le-danemark-champion-de-la-transition-energetique-mise-a-nouveau-sur-son-gaz_6656263_3234.html,  Par Marie de Vergès ,
1,Apple visé en France par une action de groupe d’utilisateurs dans le streaming musical,https://www.lemonde.fr/economie/article/2025/11/24/apple-vise-en-france-par-une-action-de-groupe-d-utilisateurs-dans-le-streaming-musical_6654596_3234.html,  Par Alexandre Piquard ,
2,"Même sans acétamipride, le rendement des betteraves rebondit",https://www.lemonde.fr/economie/article/2025/12/06/meme-sans-acetamipride-le-rendement-des-betteraves-rebondit_6656245_3234.html,,
3,"Dominique Méda : « Plus nous tardons à verdir notre industrie, plus notre perte de souveraineté s’aggrave »",https://www.lemonde.fr/idees/article/2025/12/06/dominique-meda-plus-nous-tardons-a-verdir-notre-industrie-plus-notre-perte-de-souverainete-s-aggrave_6656209_3232.html,,
4,Maroc : ce que disent les images des manifestants de la « gen Z » tués et blessés par les forces de l’ordre,https://www.lemonde.fr/afrique/video/2025/12/03/maroc-ce-que-disent-les-images-des-manifestants-de-la-gen-z-tues-et-blesses-par-les-forces-de-l-ordre_6655868_3212.html,"  Par Laureline Savoye, Liselotte Mas, Adrien Vande Casteele (motion design), Elisa Bellanger (motion design) et Simon Roger ",
5,"Quatre-vingts ans après le procès de Nuremberg, comment les images ont révolutionné la justice internationale",https://www.lemonde.fr/international/video/2025/11/20/quatre-vingts-ans-du-proces-de-nuremberg-le-role-determinant-des-images-au-c-ur-de-l-evenement_6654096_3210.html,  Par Elisa Bellanger et Karim El Hadj ,
6,Le récit en vidéo de la traque des terroristes du 13-Novembre jusqu’à l’assaut à Saint-Denis,https://www.lemonde.fr/societe/video/2025/11/14/attentats-du-13-novembre-le-recit-en-video-de-la-traque-des-terroristes-jusqu-a-l-assaut-a-saint-denis_6653355_3224.html,"  Par Brieuc Beckers, Elsa Longueville, Adrien Sahli et Adrien Vande Casteele ",
7,Comment les contenus haineux se sont installés parmi les podcasts les plus écoutés de France,https://www.lemonde.fr/societe/video/2025/11/27/comment-les-contenus-haineux-se-sont-installes-parmi-les-podcasts-les-plus-ecoutes-de-france_6655122_3224.html,  Par Service vidéo du Monde ,
8,De la difficulté de l’Europe à se faire entendre de la Chine de Xi Jinping,https://www.lemonde.fr/idees/article/2025/12/06/de-la-difficulte-de-l-europe-a-se-faire-entendre-de-la-chine-de-xi-jinping_6656258_3232.html,,
9,Faut-il en finir avec la nature ? La question qui divise les penseurs de l’écologie,https://www.lemonde.fr/idees/article/2025/12/06/faut-il-en-finir-avec-la-nature-la-question-qui-divise-les-penseurs-de-l-ecologie_6656213_3232.html,,
10,Comment les idées d’extrême droite se sont diffusées dans les discours institutionnels de la Vᵉ République,https://www.lemonde.fr/idees/article/2025/12/05/comment-les-idees-d-extreme-droite-se-sont-diffusees-dans-les-discours-institutionnels-de-la-v-republique_6656084_3232.html,  Par Claire Legros ,
11,"« Le régime de laïcité protégeait hier la liberté individuelle, il défend aujourd’hui une prétendue “identité nationale” »",https://www.lemonde.fr/idees/article/2025/12/07/le-regime-de-laicite-protegeait-hier-la-liberte-individuelle-il-defend-aujourd-hui-une-pretendue-identite-nationale_6656344_3232.html,,
12,"Romane Bohringer, réalisatrice de « Dites-lui que je l’aime » : « J’ai du mal à m’autoriser à parler de choses que je n’ai pas vécues »",https://www.lemonde.fr/culture/article/2025/12/06/romane-bohringer-realisatrice-de-dites-lui-que-je-l-aime-j-ai-du-mal-a-m-autoriser-a-parler-de-choses-que-je-n-ai-pas-vecues_6656235_3246.html,  Propos recueillis par Boris Bastide ,
13,"« Retourner le monde », d’Octave Debary : au fond du débarras",https://www.lemonde.fr/livres/article/2025/12/07/retourner-le-monde-d-octave-debary-au-fond-du-debarras_6656352_3260.html,  Par Anne Both (Anthropologue et collaboratrice du « Monde des livres ») ,
14,L’incertitude budgétaire met déjà l’audiovisuel public au régime sec,https://www.lemonde.fr/economie/article/2025/12/01/l-incertitude-budgetaire-met-deja-l-audiovisuel-public-au-regime-sec_6655508_3234.html,  Par Aude Dassonville ,
15,"Miss France 2026 : Hinaupoko Devèze, Miss Tahiti, succède à la Martiniquaise Angélique Angarni-Filopon",https://www.lemonde.fr/culture/article/2025/12/07/miss-france-2026-hinaupoko-deveze-miss-tahiti-succede-a-la-martiniquaise-angelique-angarni-filopon_6656307_3246.html,Le Monde avec AFP,
16,Est-ce bien raisonnable de… s’habiller en homme des montagnes à la ville ?,https://www.lemonde.fr/m-styles/article/2025/12/07/est-ce-bien-raisonnable-de-s-habiller-en-homme-des-montagnes-a-la-ville_6656349_4497319.html,,
17,"Le terroir sur le pouce, une tradition française de la street food",https://www.lemonde.fr/m-le-mag/article/2025/12/07/le-terroir-sur-le-pouce-une-tradition-francaise-de-la-street-food_6656336_4500055.html,,
18,"Des Alpes aux Pyrénées, quinze adresses haut perchées",https://www.lemonde.fr/m-styles/article/2025/12/07/des-alpes-aux-pyrenees-quinze-adresses-haut-perchees_6656328_4497319.html,,
19,« On est forcément attachés au chef du rayon poisson » : comment les supermarchés scénarisent le départ à la retraite de leurs employés,https://www.lemonde.fr/m-perso/article/2025/12/07/on-est-forcement-attaches-au-chef-du-rayon-poisson-comment-les-supermarches-scenarisent-le-depart-a-la-retraite-de-leurs-employes_6656326_4497916.html,  Par Djaïd Yamak ,
20, Emmanuel Macron menace la Chine de droits de douane « dans les tout prochains mois »  ,https://www.lemonde.fr/international/article/2025/12/07/emmanuel-macron-menace-la-chine-de-droits-de-douane-dans-les-tout-prochains-mois_6656354_3210.html,Le Monde avec AFP,"Le président français, de retour d’un voyage officiel en Chine, estime que celle-ci doit prendre des mesures pour réduire le déficit commercial."
21,"Le budget, une affaire d’hommes à l’Assemblée comme au Sénat",https://www.lemonde.fr/politique/article/2025/12/07/le-budget-une-affaire-d-hommes-a-l-assemblee-comme-au-senat_6656316_823448.html,,
22,"Tentative de coup d’Etat au Bénin, la présidence dit garder le contrôle",https://www.lemonde.fr/afrique/article/2025/12/07/benin-des-militaires-annoncent-a-la-television-publique-demettre-de-ses-fonctions-le-president-patrice-talon_6656341_3212.html,Le Monde avec AFP,
23,"En direct : la nouvelle stratégie de sécurité américaine est « globalement conforme » à la vision de la Russie, estime le Kremlin",https://www.lemonde.fr/international/live/2025/12/07/en-direct-guerre-en-ukraine-le-kremlin-estime-que-la-nouvelle-strategie-de-securite-americaine-est-conforme-a-la-vision-de-la-russie_6656313_3210.html,,"Le porte-parole du Kremlin, Dmitri Peskov, espère que cette nouvelle stratégie « puisse constituer une modeste garantie à notre capacité de continuer de manière constructive notre travail conjoint pour trouver un règlement pacifique en Ukraine »."
24,"A Lannion, l’interminable déclin de Nokia hante le berceau français des télécoms",https://www.lemonde.fr/economie/article/2025/12/07/a-lannion-l-interminable-declin-de-nokia-hante-le-berceau-francais-des-telecoms_6656314_3234.html,,"Alors que le géant des équipements de télécoms finlandais réduit constamment ses effectifs sur son site breton depuis dix ans, beaucoup redoutent son retrait de ce bastion historique du secteur en France."
25,"Marine Rosset, élue socialiste : « C’est le scoutisme qui m’a amenée à la politique »",https://www.lemonde.fr/campus/article/2025/12/07/marine-rosset-c-est-le-scoutisme-qui-m-a-amenee-a-la-politique_6656346_4401467.html,  Propos recueillis par Charlotte Bozonnet ,"« J’avais 20 ans ». « Le Monde » interroge une personnalité sur ses années d’études et son passage à l’âge adulte. Ce mois-ci, la militante socialiste et ancienne présidente des Scouts et guides de France revient sur les racines de son engagement."
26,Les derniers mois d’une mère racontés par son fils : « On n’imagine pas sa maman dans un si petit corps de vieille personne »,https://www.lemonde.fr/intimites/article/2025/12/07/les-derniers-mois-d-une-mere-racontes-par-son-fils-on-n-imagine-pas-sa-maman-dans-un-si-petit-corps-de-vieille-personne_6656321_6190330.html,,"Le 31 octobre 2025, la mère de Didier est morte. Nicole avait 85 ans. « Le Monde » l’avait rencontrée en 2024, encore vaillante. Son état s’est dégradé en quatre mois. A 64 ans, son fils raconte cette tension des derniers instants, le soulagement coupable et les liens qui se renouent dans le deuil."
27,Le Hamas assure être prêt à remettre ses armes à une autorité palestinienne gouvernant Gaza si l’occupation israélienne cesse,https://www.lemonde.fr/international/article/2025/12/06/le-hamas-assure-etre-pret-a-remettre-ses-armes-a-une-autorite-palestinienne-gouvernant-gaza-si-l-occupation-d-israel-cesse_6656299_3210.html,Le Monde avec AFP,
28,"Miss France 2026 : Hinaupoko Devèze, Miss Tahiti, succède à la Martiniquaise Angélique Angarni-Filopon",https://www.lemonde.fr/culture/article/2025/12/07/miss-france-2026-hinaupoko-deveze-miss-tahiti-succede-a-la-martiniquaise-angelique-angarni-filopon_6656307_3246.html,Le Monde avec AFP,
29,Parmi les meilleurs livres de 2025 : la sélection du « Monde des livres »,https://www.lemonde.fr/livres/article/2025/12/07/parmi-les-meilleurs-livres-de-2025-la-selection-du-monde-des-livres_6656319_3260.html,,
30,"Des Alpes aux Pyrénées, quinze adresses haut perchées",https://www.lemonde.fr/m-styles/article/2025/12/07/des-alpes-aux-pyrenees-quinze-adresses-haut-perchees_6656328_4497319.html,,
31,"EN DIRECT, GP d’Abou Dhabi de F1 : Lando Norris, Max Verstappen et Oscar Piastri à la lutte pour le titre de champion du monde",https://www.lemonde.fr/sport/live/2025/12/07/en-direct-gp-d-abou-dhabi-de-f1-lando-norris-max-verstappen-et-oscar-piastri-a-la-lutte-pour-le-titre-de-champion-du-monde_6656350_3242.html,,
32,Soudan : plusieurs dizaines de morts après une attaque de drones menée par des paramilitaires dans le sud du pays,https://www.lemonde.fr/afrique/article/2025/12/07/soudan-plusieurs-dizaines-de-morts-apres-une-attaque-de-drones-menee-par-des-paramilitaires-dans-le-sud-du-pays_6656340_3212.html,Le Monde avec AFP,
33,"Les réseaux de chaleur urbains, un fort levier de croissance pour Veolia",https://www.lemonde.fr/economie/article/2025/12/07/les-reseaux-de-chaleur-urbains-un-fort-levier-de-croissance-pour-veolia_6656355_3234.html,  Par Bastien Bonnefous ,
34,Est-ce bien raisonnable de… s’habiller en homme des montagnes à la ville ?,https://www.lemonde.fr/m-styles/article/2025/12/07/est-ce-bien-raisonnable-de-s-habiller-en-homme-des-montagnes-a-la-ville_6656349_4497319.html,,
35,"Le Téléthon obtient 83,5 millions d’euros de promesses de dons, en hausse par rapport à 2024",https://www.lemonde.fr/societe/article/2025/12/07/le-telethon-obtient-83-5-millions-d-euros-de-promesses-de-dons-en-hausse-par-rapport-a-2024_6656310_3224.html,Le Monde avec AFP,
36,"« Irène Némirovsky, une vie inachevée », de Dominique Missika : portrait intime",https://www.lemonde.fr/livres/article/2025/12/07/irene-nemirovsky-une-vie-inachevee-de-dominique-missika-portrait-intime_6656343_3260.html,  Par Benoît Hopquin ,
37,Trois restaurants appréciés par nos critiques à tester à Paris,https://www.lemonde.fr/m-gastronomie/article/2025/12/07/trois-restaurants-apprecies-par-nos-critiques-a-tester-a-paris_6656317_4497540.html,  Par Julien Amat et Léo Bourdin ,
38,Les mondes enfantés de l’artiste Julie Béna à Grenoble,https://www.lemonde.fr/culture/article/2025/12/07/les-mondes-enfantes-de-l-artiste-julie-bena-a-grenoble_6656345_3246.html,  Par Emmanuelle Jardonnet (Grenoble ) ,
39,"Les drôles de contes de Frédéric Merlin, le patron qui a accueilli Shein au BHV",https://www.lemonde.fr/m-le-mag/article/2025/12/06/les-droles-de-contes-de-merlin-l-entrepreneur_6656211_4500055.html,,"Depuis qu’il a accueilli une boutique Shein au BHV, Frédéric Merlin est très critiqué. Le patron de 34 ans, se présentant comme un « self made man » issu de la classe moyenne, est en réalité un homme d’affaires multipliant opérations immobilières juteuses et impayés."
40,« Entrisme religieux » : le passage sans encombre de Jean-Luc Mélenchon devant les parlementaires,https://www.lemonde.fr/politique/article/2025/12/06/entrisme-religieux-le-passage-sans-encombre-de-jean-luc-melenchon-devant-les-parlementaires_6656302_823448.html,  Par Christophe Ayad ,"La France insoumise « n’acceptera jamais l’entrisme religieux », a affirmé le fondateur du mouvement devant la commission d’enquête parlementaire sur les liens entre mouvements politiques et réseaux islamistes, samedi 6 décembre."
41,"« Quand j’ouvre ce courrier, j’ai l’impression que mon cœur va lâcher » : une lettre a bouleversé leur famille",https://www.lemonde.fr/intimites/article/2025/12/06/quand-j-ouvre-ce-courrier-j-ai-l-impression-que-mon-c-ur-va-lacher-une-lettre-a-bouleverse-leur-famille_6656205_6190330.html,,"Enfant caché, dénonciation de violences longtemps tues, révélations sur l’histoire familiale… Certains silences ne peuvent être brisés que par un courrier. Ces mots que l’on envoie, que l’on reçoit ou que l’on trouve par hasard dans un tiroir, peuvent tout changer."
42,« Jamais on n’a autant communiqué sans parler aux autres ; ce paradoxe a de telles conséquences sociétales et politiques qu’il est devenu un enjeu universel »,https://www.lemonde.fr/idees/article/2025/12/07/jamais-on-n-a-autant-communique-sans-parler-aux-autres-ce-paradoxe-a-de-telles-consequences-societales-et-politiques-qu-il-est-devenu-un-enjeu-universel_6656311_3232.html,,
43,"« Face au rouleau compresseur du RN, à quoi sert le parti Les Républicains ? »",https://www.lemonde.fr/politique/article/2025/12/07/face-au-rouleau-compresseur-du-rn-a-quoi-sert-le-parti-les-republicains_6656329_823448.html,,
44,De la difficulté de l’Europe à se faire entendre de la Chine de Xi Jinping,https://www.lemonde.fr/idees/article/2025/12/06/de-la-difficulte-de-l-europe-a-se-faire-entendre-de-la-chine-de-xi-jinping_6656258_3232.html,,
