,title,url,byline,subhed
0,Republicans lose ground in Tennessee special election,https://www.lemonde.fr/en/international/article/2025/12/03/republicans-lose-ground-in-tennessee-special-election_6748101_4.html,  By Piotr Smolar (Washington (United States) correspondent) ,
1,War in Ukraine: Trump's envoy makes no progress with Putin,https://www.lemonde.fr/en/international/article/2025/12/03/war-in-ukraine-trump-s-envoy-makes-no-progress-with-putin_6748099_4.html,  By Benjamin Quénelle ,
2,'Nighttime prohibition': Warsaw city center bans alcohol sales at night,https://www.lemonde.fr/en/international/article/2025/12/03/nighttime-prohibition-warsaw-city-center-bans-alcohol-sales-at-night_6748094_4.html,  By Hélène Bienvenu (Warsaw (Poland) correspondent) ,
3,EU threatens to cut trade benefits for countries that refuse to cooperate on immigration,https://www.lemonde.fr/en/international/article/2025/12/03/europe-threatens-to-cut-trade-benefits-for-countries-that-refuse-to-cooperate-on-immigration_6748092_4.html,"  By Philippe Jacqué (Brussels, Europe bureau) ",
4,Bosnia and Herzegovina's Serb entity elects ally of  former leader Dodik,https://www.lemonde.fr/en/international/article/2025/11/24/bosnia-and-herzegovina-s-serb-entity-elects-ally-of-former-leader-dodik_6747765_4.html,  By Rémy Ourdan (Banja Luka (Bosnia and Herzegovina) special correspondent) ,
5,"In France's Somme, bagpipers keep the memory of the Great War alive",https://www.lemonde.fr/en/history/article/2025/11/11/in-france-s-somme-bagpipers-keep-the-memory-of-the-great-war-alive_6747347_157.html,,
6,Latvia: Public mobilization grows in support of treaty for preventing violence against women,https://www.lemonde.fr/en/international/article/2025/11/06/in-latvia-public-mobilization-continues-to-grow-in-support-of-the-istanbul-convention-for-preventing-violence-against-women_6747156_4.html,  By Anne-Françoise Hivert (Malmö (Sweden) correspondent) ,
7,"After Charlie Kirk's murder, Europe's far right swears allegiance to Trump's politics",https://www.lemonde.fr/en/les-decodeurs/article/2025/10/20/the-murder-of-charlie-kirk-how-europe-s-far-right-swore-allegiance-to-trump-s-politics_6746586_8.html,,
8,Suspected member of Louvre heist gang joins others in detention,https://www.lemonde.fr/en/france/article/2025/12/02/suspected-member-of-louvre-heist-gang-joins-others-in-detention_6748088_7.html,Le Monde with AFP,
9,Marseille grapples with drug trafficking: 'They are so many and they have so much money',https://www.lemonde.fr/en/france/article/2025/12/02/marseille-grapples-with-drug-trafficking-they-are-so-many-and-they-have-so-much-money_6748047_7.html,,
10,Foreign interference: Why France is raising its voice and turning to the courts,https://www.lemonde.fr/en/france/article/2025/12/01/foreign-interference-why-france-is-raising-its-voice-and-turning-to-the-courts_6748034_7.html,  By Jacques Follorou ,
11,French mayor convicted and set to be incarcerated in sex-tape blackmail case,https://www.lemonde.fr/en/france/article/2025/12/01/french-mayor-convicted-and-set-to-be-incarcerated-in-sex-tape-blackmail-case_6748032_7.html,  By Richard Schittly (Lyon (France) correspondent) ,
12,"Israel's D9 bulldozer, a tool of destruction in Gaza",https://www.lemonde.fr/en/videos/video/2025/11/27/israel-s-d9-bulldozer-a-tool-of-destruction-in-gaza_6747870_108.html,"  By Liselotte Mas, Elsa Longueville (motion design) and Sinead McCausland ",
13,"Ukraine's Pokrovsk faces fierce fighting, footage analyzed by Le Monde reveals",https://www.lemonde.fr/en/videos/video/2025/11/21/ukraine-s-pokrovsk-faces-fierce-fighting-footage-analyzed-by-le-monde-reveals_6747708_108.html,"  By Alexandre Horn, Gabriel Lecointre (edit), Elisa Bellanger (motion design) and Sinead McCausland ",
14,Afghanistan: Relentless repression continues over four years into Taliban's rule,https://www.lemonde.fr/en/videos/video/2025/10/04/afghanistan-relentless-repression-continues-over-four-years-into-taliban-s-rule_6746092_108.html,"  By Chloé Denis, Félix Pommier (Motion design) and Sinead McCausland ",
15,Watch: Hundreds of thousands march in France against budget cuts,https://www.lemonde.fr/en/videos/video/2025/09/19/french-strikes-watch-what-happened-as-hundreds-of-thousands-marched-against-budget-cuts_6745548_108.html,  By Le Monde's video desk   ,
16,French PM Lecornu's budget strategy is put to the test of Parliament,https://www.lemonde.fr/en/opinion/article/2025/12/02/french-pm-lecornu-s-budget-strategy-is-put-to-the-test-of-parliament_6748072_23.html,,
17,The real questions raised by Macron on news media,https://www.lemonde.fr/en/opinion/article/2025/12/03/the-real-questions-raised-by-macron-on-news-media_6748107_23.html,,
18,"Laurence Nardon: 'Trump has demonstrated unexpected activity in international issues, much to the dismay of his MAGA base'",https://www.lemonde.fr/en/opinion/article/2025/12/03/laurence-nardon-trump-has-demonstrated-unexpected-activity-in-international-issues-much-to-the-dismay-of-his-maga-base_6748102_23.html,,
19,The war in Sudan: A tragic symptom of US powerlessness,https://www.lemonde.fr/en/opinion/article/2025/12/03/the-war-in-sudan-a-tragic-symptom-of-us-powerlessness_6748090_23.html,,
20,The first time Le Monde wrote about Jeffrey Epstein,https://www.lemonde.fr/en/m-le-mag/article/2025/12/01/the-first-time-le-monde-wrote-about-jeffrey-epstein_6748001_117.html,,
21,The last-minute fight to save Gaza's ancient archaeological treasures,https://www.lemonde.fr/en/m-le-mag/article/2025/11/30/the-last-minute-fight-to-save-gaza-s-ancient-archaeological-treasures_6747984_117.html,,
22,The art of being Oscar Wilde's grandson,https://www.lemonde.fr/en/m-le-mag/article/2025/11/30/the-art-of-being-oscar-wilde-s-grandson_6747977_117.html,  By Clémentine Goldszal ,
23,"Gay Talese, the last titan of the American press",https://www.lemonde.fr/en/m-le-mag/article/2025/11/29/gay-talese-the-last-titan-of-the-american-press_6747954_117.html,,
24,"Bayonne's 'Little Louvre,' the Bonnat-Helleu Museum, reopens after 14 years",https://www.lemonde.fr/en/culture/article/2025/11/28/bayonne-s-little-louvre-the-bonnat-helleu-museum-reopens-after-14-years_6747913_30.html,  By Roxana Azimi (Bayonne (France) special correspondent) ,
25,Victor Hugo's interior architecture on display in Paris,https://www.lemonde.fr/en/lifestyle/article/2025/11/23/victor-hugo-s-interior-architecture-on-display-in-paris_6747753_37.html,  By Véronique Lorelle ,
26,A stroll through Cachan: From a royal aqueduct to a panoramic garden,https://www.lemonde.fr/en/lifestyle/article/2025/11/22/a-stroll-through-cachan-from-a-royal-aqueduct-to-a-panoramic-garden_6747720_37.html,,
27,Azzedine Alaïa's Dior collection on view in Paris,https://www.lemonde.fr/en/lifestyle/article/2025/11/21/azzedine-alaia-s-dior-collection-on-view-in-paris_6747679_37.html,  By Elvire von Bardeleben ,
28, Devastated Sudanese families recount el-Fasher massacre  ,https://www.lemonde.fr/en/le-monde-africa/article/2025/12/03/devastated-sudanese-families-recount-el-fasher-massacre-the-rsf-killed-people-point-blank-in-their-homes_6748106_124.html,,"Le Monde spoke with survivors of the takeover of the capital of North Darfur by paramilitary forces at the end of October. They described summary executions, rapes, large-scale human trafficking and efforts to cover up the crimes committed."
29,War in Ukraine: Trump's envoy makes no progress with Putin,https://www.lemonde.fr/en/international/article/2025/12/03/war-in-ukraine-trump-s-envoy-makes-no-progress-with-putin_6748099_4.html,  By Benjamin Quénelle ,
30,Republicans lose ground in Tennessee special election,https://www.lemonde.fr/en/international/article/2025/12/03/republicans-lose-ground-in-tennessee-special-election_6748101_4.html,  By Piotr Smolar (Washington (United States) correspondent) ,
31,The significant trade imbalance between France and China,https://www.lemonde.fr/en/economy/article/2025/12/03/the-significant-trade-imbalance-between-france-and-china_6748097_19.html,"  By Harold Thibault (Shanghai (China) special correspondent) and Jordan Pouille (Beijing (China), correspondent) ","Even as Chinese competition increasingly undermines French industries, including in innovation, many French companies argue that maintaining a presence in China remains essential. President Emmanuel Macron is visiting the country from December 3 to 5."
32,'Nighttime prohibition': Warsaw city center bans alcohol sales at night,https://www.lemonde.fr/en/international/article/2025/12/03/nighttime-prohibition-warsaw-city-center-bans-alcohol-sales-at-night_6748094_4.html,  By Hélène Bienvenu (Warsaw (Poland) correspondent) ,"Nearly 180 municipalities in Poland have already opted to ban the sale of alcohol at night. On November 1, two central districts in Warsaw followed suit. The measure, which was initially intended to apply across the entire capital, has sparked heated debate."
33,"In New York, Chanel embraces Matthieu Blazy's flair for fantasy",https://www.lemonde.fr/en/lifestyle/article/2025/12/03/in-new-york-chanel-embraces-matthieu-blazy-s-flair-for-fantasy_6748108_37.html,,"On December 2, the artistic director of the iconic Paris fashion house staged his first métiers d'art show in a Manhattan subway station. The hypnotic performance featured everything from voluminous dresses and pinstriped suits to fisherman sweaters."
34,Macron targeted by billionaire's media over proposal to 'label' news organizations,https://www.lemonde.fr/en/economy/article/2025/12/03/macron-targeted-by-billionaire-s-media-over-proposal-to-label-news-organizations_6748104_19.html,  By Brice Laemle and Nathalie Segaunes ,"In a video posted on X, the French president pushed back against criticism from Vincent Bolloré's CNews channel and 'Le Journal du Dimanche' over his call to 'label' media outlets."
35,Macron travels to China with slim hopes of swaying Beijing on Ukraine and trade,https://www.lemonde.fr/en/international/article/2025/12/02/macron-travels-to-china-with-slim-hopes-of-swaying-beijing-on-ukraine-and-trade_6748081_4.html,  By Philippe Ricard (Beijing (China) special correspondent) and Harold Thibault (Beijing (China) correspondent) ,
36,2027 Rugby World Cup: Hosts Australia drawn in same pool as New Zealand,https://www.lemonde.fr/en/sports/article/2025/12/03/rugby-world-cup-2027-hosts-australia-face-new-zealand-in-challenging-opening-match_6748103_9.html,Le Monde with AFP,
37,Zelensky urged to reform his leadership amid ongoing peace talks,https://www.lemonde.fr/en/international/article/2025/12/02/zelensky-urged-to-reform-his-leadership-amid-ongoing-peace-talks_6748086_4.html,,
38,EU threatens to cut trade benefits for countries that refuse to cooperate on immigration,https://www.lemonde.fr/en/international/article/2025/12/03/europe-threatens-to-cut-trade-benefits-for-countries-that-refuse-to-cooperate-on-immigration_6748092_4.html,"  By Philippe Jacqué (Brussels, Europe bureau) ",
39,Francis Ford Coppola auctions his watches after  'Megalopolis' disaster,https://www.lemonde.fr/en/culture/article/2025/12/02/francis-ford-coppola-auctions-his-watches-after-megalopolis-disaster_6748080_30.html,  By Arnaud Leparmentier (San Francisco (United States) correspondent) ,
40,Vanessa Dougnac: 'The supremacy of Hinduism in India is unprecedented: a form of internal colonization',https://www.lemonde.fr/en/books/article/2025/12/03/vanessa-dougnac-the-supremacy-of-hinduism-in-india-is-unprecedented-a-form-of-internal-colonization_6748095_33.html,"  Interview by Sophie Landrin (New Delhi, India, correspondent) ",
41,Suspected member of Louvre heist gang joins others in detention,https://www.lemonde.fr/en/france/article/2025/12/02/suspected-member-of-louvre-heist-gang-joins-others-in-detention_6748088_7.html,Le Monde with AFP,
42,Search for Malaysia Airlines flight to resume more than 11 years after plane went missing,https://www.lemonde.fr/en/international/article/2025/12/03/search-for-malaysia-airlines-flight-to-resume-more-than-11-years-after-plane-went-missing_6748098_4.html,Le Monde with AFP,
43,French journalists' unions file legal complaint against Israel over obstructing Gaza access,https://www.lemonde.fr/en/police-and-justice/article/2025/12/03/french-journalists-unions-file-legal-complaint-against-israel-over-obstructing-gaza-access_6748100_105.html,Le Monde with AFP,
44,Christophe Gleizes: The life on hold of a French journalist imprisoned in Algeria,https://www.lemonde.fr/en/le-monde-africa/article/2025/12/02/christophe-gleizes-the-life-on-hold-of-a-french-journalist-imprisoned-in-algeria_6748078_124.html,,
45,Afghan man pleads not guilty to murder charges in US National Guard shooting,https://www.lemonde.fr/en/global-issues/article/2025/12/02/afghan-man-pleads-not-guilty-in-us-national-guard-shooting_6748089_199.html,Le Monde with AFP,
46,All the magnetic poetry of Takis on display at Galerie Xippas in Paris,https://www.lemonde.fr/en/culture/article/2025/12/03/all-the-magnetic-poetry-of-takis-on-display-at-galerie-xippas-in-paris_6748093_30.html,  By Philippe Dagen ,
47,Leonardo DiCaprio and Paul Thomas Anderson: Two Hollywood stars in Paris after the battle,https://www.lemonde.fr/en/culture/article/2025/12/02/leonardo-dicaprio-and-paul-thomas-anderson-two-hollywood-stars-in-paris-after-the-battle_6748084_30.html,  By Mathieu Macheret ,"Absent during the European promotion of the film 'One Battle After Another,' the American actor and director reunited in France to talk about Hollywood and their 30-year friendship."
48,"Jodie Foster: 'Without cinema, I would have been rigid, dry and much more solitary'",https://www.lemonde.fr/en/culture/article/2025/12/01/jodie-foster-without-cinema-i-would-have-been-rigid-dry-and-much-more-solitary_6748037_30.html,,"'I wouldn't be where I am today if...' In this series, Le Monde interviews a figure about a decisive moment in their life. The American actress pays tribute to her mother, with whom she shared a close, almost inseparable bond for many years."
49,"Trump administration targets foreigners, beyond undocumented migrants",https://www.lemonde.fr/en/international/article/2025/12/02/trump-administration-targets-foreigners-beyond-undocumented-migrants_6748059_4.html,  By Piotr Smolar (Washington (United States) correspondent) ,"Following the attack on two National Guard soldiers in Washington, US authorities have stepped up announcements aimed at immigrants, raising the prospect of a possible 'remigration.'"
50,The real questions raised by Macron on news media,https://www.lemonde.fr/en/opinion/article/2025/12/03/the-real-questions-raised-by-macron-on-news-media_6748107_23.html,,
51,"Laurence Nardon: 'Trump has demonstrated unexpected activity in international issues, much to the dismay of his MAGA base'",https://www.lemonde.fr/en/opinion/article/2025/12/03/laurence-nardon-trump-has-demonstrated-unexpected-activity-in-international-issues-much-to-the-dismay-of-his-maga-base_6748102_23.html,,
52,Trump's very special Middle East envoys,https://www.lemonde.fr/en/opinion/article/2025/11/30/trump-s-very-special-middle-east-envoys_6747986_23.html,,
