,title,url,byline,subhed
78,"Entre Emmanuel Macron et Vladimir Poutine, un appel à double tranchant, après trois ans de silence  ",https://www.lemonde.fr/international/article/2025/07/02/entre-emmanuel-macron-et-vladimir-poutine-un-appel-a-double-tranchant-apres-trois-ans-de-silence_6617318_3210.html,"  Par Elsa Conesa (Berlin, correspondante), Philippe Ricard, Claire Gatinois et Benjamin Quénelle ",
79,"Les lettres de Sasha et d’Olga : « Après les dernières attaques, je suis restée muette pendant presque deux jours »  ",https://www.lemonde.fr/m-le-mag/article/2025/07/01/les-lettres-de-sasha-et-d-olga-apres-les-dernieres-attaques-je-suis-restee-muette-pendant-presque-deux-jours_6617295_4500055.html,,
80,"En Russie, une membre de la délégation de l’Union européenne à Moscou agressée  ",https://www.lemonde.fr/international/article/2025/07/01/une-diplomate-europeenne-battue-en-russie_6617284_3210.html,  Par Benjamin Quénelle ,
81," « A ceux que les Etats-Unis rejettent, la Chine ouvre davantage les bras » ",https://www.lemonde.fr/idees/article/2025/07/01/a-ceux-que-les-etats-unis-rejettent-la-chine-ouvre-davantage-les-bras_6617270_3232.html,,
82,L’accord commercial entre le Royaume-Uni et les Etats-Unis entre en vigueur  ,https://www.lemonde.fr/economie/article/2025/06/30/au-royaume-uni-l-accord-sur-les-droits-de-douane-reduits-sur-les-exportations-vers-les-etats-unis-entre-en-vigueur_6616904_3234.html,Le Monde avec AFP,
83,L’accord commercial entre le Royaume-Uni et les Etats-Unis entre en vigueur  ,https://www.lemonde.fr/economie/article/2025/06/30/au-royaume-uni-l-accord-sur-les-droits-de-douane-reduits-sur-les-exportations-vers-les-etats-unis-entre-en-vigueur_6616904_3234.html,Le Monde avec AFP,
84,La taxation canadienne des géants du numérique américains provoque l’ire de Donald Trump  ,https://www.lemonde.fr/economie/article/2025/06/29/la-taxation-canadienne-des-geants-du-numerique-americains-provoque-l-ire-de-donald-trump_6616404_3234.html,"  Par Eliott Dumoulin (Montréal, correspondance) ",
85,Droits de douane avec le reste du monde : les Etats-Unis envisagent de repousser la date butoir du 8 juillet  ,https://www.lemonde.fr/international/article/2025/06/28/droits-de-douane-avec-le-reste-du-monde-les-etats-unis-envisagent-de-repousser-la-date-butoir-du-8-juillet_6616219_3210.html,"  Par Piotr Smolar (Washington, correspondant) ",
86,Donald Trump met fin aux négociations commerciales avec le Canada après la taxe sur les géants du numérique  ,https://www.lemonde.fr/international/article/2025/06/27/donald-trump-met-fin-aux-negociations-commerciales-avec-le-canada-apres-la-taxe-sur-les-geants-du-numerique_6616206_3210.html,Le Monde avec AFP,
87,Donald Trump met fin aux négociations commerciales avec le Canada après la taxe sur les géants du numérique  ,https://www.lemonde.fr/international/article/2025/06/27/donald-trump-met-fin-aux-negociations-commerciales-avec-le-canada-apres-la-taxe-sur-les-geants-du-numerique_6616206_3210.html,Le Monde avec AFP,
88,La Chine dit avoir « confirmé les détails » d’un accord commercial avec les Etats-Unis  ,https://www.lemonde.fr/economie/article/2025/06/27/la-chine-dit-avoir-confirme-les-details-d-un-accord-commercial-avec-les-etats-unis_6616127_3234.html,Le Monde avec AFP,
89,Guerre commerciale : Donald Trump menace d’alourdir les droits de douane si l’Union européenne n’accepte pas un accord « juste »  ,https://www.lemonde.fr/economie/article/2025/06/17/guerre-commerciale-donald-trump-menace-d-alourdir-les-droits-de-douane-si-l-union-europeenne-n-accepte-pas-un-accord-juste_6613885_3234.html,Le Monde avec AFP,
90,Tour de France : le responsable du parcours vous explique comment l’édition 2025 a été tracée pour créer du suspense,https://www.lemonde.fr/sport/video/2025/07/02/tour-de-france-2025-comment-le-parcours-est-trace-pour-creer-du-suspense_6617330_3242.html,  Par Brieuc Beckers et Marceau Bretonnier ,
91, Canicule : un dôme de chaleur s’installe sur la France pour plusieurs jours ,https://www.lemonde.fr/planete/video/2025/06/28/canicule-un-dome-de-chaleur-s-installe-sur-la-france-pour-plusieurs-jours_6616280_3244.html,  Par Service vidéo du Monde (avec Reuters)  ,
92,  Article réservé aux abonnés L’attaque d’Israël en Iran pose les bases d’une ère d’incertitude au Moyen-Orient ,https://www.lemonde.fr/guerre-au-proche-orient/video/2025/06/24/l-attaque-d-israel-en-iran-pose-les-bases-d-une-ere-d-incertitude-au-moyen-orient_6615651_6325529.html,  Propos recueillis par Brieuc Beckers et Elisa Bellanger (motion design) ,
93, Pourquoi certains pays ont le droit à l’arme nucléaire et d’autres pas ? Comprendre en trois minutes ,https://www.lemonde.fr/comprendre-en-3-minutes/video/2025/06/21/quels-pays-detiennent-l-arme-nucleaire-comprendre-en-trois-minutes_6615041_6176282.html,  Par Barbara Marty et Robin Gasser (motion design) ,
94, Ukraine : la Russie lance la plus grande attaque aérienne depuis le début de la guerre ,https://www.lemonde.fr/international/video/2025/06/29/ukraine-la-russie-lance-la-plus-grande-attaque-aerienne-depuis-le-debut-de-la-guerre_6616410_3210.html,  Par Service vidéo du Monde (avec Reuters)  ,
95," En Argentine, Javier Milei dérégule à petits pas le marché des armes ",https://www.lemonde.fr/international/article/2025/06/30/en-argentine-javier-milei-deregule-a-petits-pas-le-marche-des-armes_6617010_3210.html,"  Par Anaïs Dubois (Buenos Aires, correspondance) ",
96,"La première ministre thaïlandaise, Paetongtarn Shinawatra, suspendue par la Cour constitutionnelle  ",https://www.lemonde.fr/international/article/2025/07/01/en-thailande-la-premiere-ministre-paetongtarn-shinawatra-suspendue-par-la-cour-constitutionnelle_6617230_3210.html,Le Monde avec AFP,
97,"La première ministre thaïlandaise, Paetongtarn Shinawatra, suspendue par la Cour constitutionnelle  ",https://www.lemonde.fr/international/article/2025/07/01/en-thailande-la-premiere-ministre-paetongtarn-shinawatra-suspendue-par-la-cour-constitutionnelle_6617230_3210.html,Le Monde avec AFP,
98,"Entre Emmanuel Macron et Vladimir Poutine, un appel à double tranchant, après trois ans de silence  ",https://www.lemonde.fr/international/article/2025/07/02/entre-emmanuel-macron-et-vladimir-poutine-un-appel-a-double-tranchant-apres-trois-ans-de-silence_6617318_3210.html,"  Par Elsa Conesa (Berlin, correspondante), Philippe Ricard, Claire Gatinois et Benjamin Quénelle ",
99,"La guerre éclair en Iran, un révélateur de la « doctrine Trump »  ",https://www.lemonde.fr/international/article/2025/06/30/la-guerre-eclair-en-iran-un-revelateur-de-la-doctrine-trump_6616672_3210.html,,
100,Un bombardement israélien provoque un carnage dans un café de Gaza  ,https://www.lemonde.fr/international/article/2025/07/01/un-bombardement-israelien-provoque-un-carnage-dans-un-cafe-de-gaza_6617209_3210.html,  Par Marie Jo Sader ,
101,Un bombardement israélien provoque un carnage dans un café de Gaza  ,https://www.lemonde.fr/international/article/2025/07/01/un-bombardement-israelien-provoque-un-carnage-dans-un-cafe-de-gaza_6617209_3210.html,  Par Marie Jo Sader ,
102,"Entre la France et l’Algérie, six décennies de tourments endémiques  ",https://www.lemonde.fr/afrique/article/2025/06/29/entre-la-france-et-l-algerie-six-decennies-de-tourments-endemiques_6616401_3212.html,,
103,Des témoignages de soldats provoquent une onde de choc rarissime en Israël sur la faillite morale de son armée à Gaza  ,https://www.lemonde.fr/international/article/2025/07/01/guerre-a-gaza-l-armee-israelienne-interpellee-sur-sa-faillite-morale_6617174_3210.html,"  Par Isabelle Mandraud (Tel-Aviv, envoyée spéciale) ",
104," Entre la France et l’Algérie, reconstruire un lien abîmé, sans illusions ",https://www.lemonde.fr/idees/article/2025/07/02/entre-la-france-et-l-algerie-reconstruire-un-lien-abime-sans-illusions_6617364_3232.html,,
105,"France-Algérie : en 1994, Paris aspiré dans la « décennie noire » algérienne  ",https://www.lemonde.fr/afrique/article/2025/07/02/en-1994-la-france-aspiree-dans-la-decennie-noire-algerienne_6617321_3212.html,,
106,"France-Algérie : en 1994, Paris aspiré dans la « décennie noire » algérienne  ",https://www.lemonde.fr/afrique/article/2025/07/02/en-1994-la-france-aspiree-dans-la-decennie-noire-algerienne_6617321_3212.html,,
107,"« La diplomatie de Donald Trump, hâtivement qualifiée, à tort, d’isolationniste, est interventionniste, y compris là où on ne l’attend pas »  ",https://www.lemonde.fr/idees/article/2025/07/02/la-diplomatie-de-donald-trump-hativement-qualifiee-a-tort-d-isolationniste-est-interventionniste-y-compris-la-ou-on-ne-l-attend-pas_6617317_3232.html,,
108,"Attaques djihadistes d’envergure dans l’ouest du pays du Mali, une région vitale pour l’économie  ",https://www.lemonde.fr/afrique/article/2025/07/01/mali-attaques-djihadistes-d-envergure-dans-l-ouest-du-pays_6617302_3212.html,  Par Benjamin Roger ,
109,"A regarder ce soir : « Congo-Océan, un chemin de fer et de sang », sur Histoire TV  ",https://www.lemonde.fr/culture/article/2025/07/02/congo-ocean-un-chemin-de-fer-et-de-sang-sur-histoire-tv-en-afrique-un-reve-devenu-cauchemar_6617431_3246.html,  Par Catherine Pacary ,
110,"A regarder ce soir : « Congo-Océan, un chemin de fer et de sang », sur Histoire TV  ",https://www.lemonde.fr/culture/article/2025/07/02/congo-ocean-un-chemin-de-fer-et-de-sang-sur-histoire-tv-en-afrique-un-reve-devenu-cauchemar_6617431_3246.html,  Par Catherine Pacary ,
111,"Au Sénégal, la justice confirme la condamnation d’Ousmane Sonko pour diffamation  ",https://www.lemonde.fr/afrique/article/2025/07/02/au-senegal-la-justice-confirme-la-condamnation-d-ousmane-sonko-pour-diffamation_6617419_3212.html,Le Monde avec AFP,
112,Sénégal : nouvelle remise d’une installation militaire par la France  ,https://www.lemonde.fr/afrique/article/2025/07/02/senegal-nouvelle-remise-d-une-installation-militaire-par-la-france_6617349_3212.html,Le Monde avec AFP,
113," Vigilance rouge canicule : en changeant de couleur, la menace change d’échelle ",https://www.lemonde.fr/planete/article/2025/07/01/vigilance-rouge-canicule-en-changeant-de-couleur-la-menace-change-d-echelle_6617208_3244.html,  Par Maryline Baumard ,
114,Les fortes chaleurs imposent une vigilance particulière sur les trains et l’infrastructure ferroviaire  ,https://www.lemonde.fr/economie/article/2025/07/01/les-fortes-chaleurs-imposent-une-vigilance-particuliere-sur-l-infrastructure-ferroviaire_6617170_3234.html,  Par Jonathan Parienté ,
115,Les fortes chaleurs imposent une vigilance particulière sur les trains et l’infrastructure ferroviaire  ,https://www.lemonde.fr/economie/article/2025/07/01/les-fortes-chaleurs-imposent-une-vigilance-particuliere-sur-l-infrastructure-ferroviaire_6617170_3234.html,  Par Jonathan Parienté ,
116,"Ecoles fermées, réacteur nucléaire à l’arrêt et pic de pollution, la vague de chaleur s’éternise dans toute la France  ",https://www.lemonde.fr/planete/article/2025/07/01/canicule-ecoles-fermees-reacteur-nucleaire-a-l-arret-et-pic-de-pollution-la-vague-de-chaleur-s-eternise-dans-toute-la-france_6617175_3244.html,"  Par Matthieu Goar, Stéphane Mandard et Léa Sanchez ",
117,"Des bébés chats pêcheurs, des félins menacés aux pattes en partie palmées, sont nés en France  ",https://www.lemonde.fr/planete/article/2025/06/29/des-bebes-chats-pecheurs-des-felins-menaces-aux-pattes-en-partie-palmees-et-au-pelage-impermeable-sont-nes-en-france_6616333_3244.html,  Par Perrine Mouterde ,
118,"« Face à la canicule, on n’est pas prêts. L’écart entre ce qu’il faudrait faire et la vitesse à laquelle progresse le changement climatique se creuse »  ",https://www.lemonde.fr/planete/article/2025/06/30/canicule-l-ecart-entre-ce-qu-il-faudrait-faire-et-la-vitesse-a-laquelle-progresse-le-changement-climatique-se-creuse-d-annee-en-annee_6616990_3244.html,  Propos recueillis par Audrey Garric ,
119,"« Face à la canicule, on n’est pas prêts. L’écart entre ce qu’il faudrait faire et la vitesse à laquelle progresse le changement climatique se creuse »  ",https://www.lemonde.fr/planete/article/2025/06/30/canicule-l-ecart-entre-ce-qu-il-faudrait-faire-et-la-vitesse-a-laquelle-progresse-le-changement-climatique-se-creuse-d-annee-en-annee_6616990_3244.html,  Propos recueillis par Audrey Garric ,
120,"« Chaque année, c’est pire. Je ne sais pas si on peut tenir encore longtemps comme ça » : les habitants du sud de la France suffoquent  ",https://www.lemonde.fr/planete/article/2025/06/30/episode-caniculaire-dans-le-sud-de-la-france-chaque-annee-c-est-pire-je-ne-sais-pas-si-on-peut-tenir-encore-longtemps-comme-ca_6616950_3244.html,"  Par Sofia Fischer (Nice, correspondance) ",
121,"Dans le sud de l’Europe, la canicule a fait plusieurs victimes de coups de chaleur  ",https://www.lemonde.fr/planete/article/2025/07/01/dans-le-sud-de-l-europe-la-canicule-a-fait-plusieurs-victimes-de-coups-de-chaleur_6617213_3244.html,"  Par Isabelle Piquer (Madrid, correspondance) et Olivier Bonnel (Rome, correspondance) ",
122, L’Assemblée nationale vote pour l’allongement de la durée en centre de rétention administrative pour les étrangers jugés dangereux ,https://www.lemonde.fr/societe/article/2025/07/03/l-assemblee-nationale-vote-pour-l-allongement-de-la-duree-en-centre-de-retention-administrative-pour-les-etrangers-juges-dangereux_6617455_3224.html,Le Monde avec AFP,
123,"A l’Assemblée, Sophie Pantel, la présidente de la commission d’enquête sur les liens entre politiques et réseaux islamistes ou terroristes, démissionne sitôt élue  ",https://www.lemonde.fr/politique/article/2025/07/02/a-l-assemblee-sophie-pantel-la-presidente-de-la-commission-d-enquete-sur-les-liens-entre-politiques-et-reseaux-islamistes-ou-terroristes-demissionne-sitot-elue_6617451_823448.html,Le Monde avec AFP,
124,"A l’Assemblée, Sophie Pantel, la présidente de la commission d’enquête sur les liens entre politiques et réseaux islamistes ou terroristes, démissionne sitôt élue  ",https://www.lemonde.fr/politique/article/2025/07/02/a-l-assemblee-sophie-pantel-la-presidente-de-la-commission-d-enquete-sur-les-liens-entre-politiques-et-reseaux-islamistes-ou-terroristes-demissionne-sitot-elue_6617451_823448.html,Le Monde avec AFP,
125,Présidentielle 2027 : le « Front populaire » lance une primaire qui ne dit pas son nom  ,https://www.lemonde.fr/politique/article/2025/07/02/presidentielle-2027-le-front-populaire-lance-une-primaire-qui-ne-dit-pas-son-nom_6617449_823448.html,  Par Olivier Pérou ,
126,"La loi Duplomb sur l’agriculture validée au Sénat, avant l’ultime vote à l’Assemblée nationale  ",https://www.lemonde.fr/planete/article/2025/07/02/la-loi-duplomb-sur-l-agriculture-validee-au-senat-avant-l-ultime-vote-de-l-assemblee-nationale_6617446_3244.html,Le Monde avec AFP,
127,Yaël Braun-Pivet refuse une demande de poursuivre François Bayrou pour faux témoignage dans l’affaire de Bétharram   ,https://www.lemonde.fr/politique/article/2025/07/02/affaire-betharram-yael-braun-pivet-refuse-une-demande-de-poursuivre-francois-bayrou-pour-faux-temoignage_6617412_823449.html,Le Monde avec AFP,
128,Yaël Braun-Pivet refuse une demande de poursuivre François Bayrou pour faux témoignage dans l’affaire de Bétharram   ,https://www.lemonde.fr/politique/article/2025/07/02/affaire-betharram-yael-braun-pivet-refuse-une-demande-de-poursuivre-francois-bayrou-pour-faux-temoignage_6617412_823449.html,Le Monde avec AFP,
129,Laurent Wauquiez et LR veulent un budget « 0 % hausse d’impôts » et propose un projet de loi contre « la fraude sociale »  ,https://www.lemonde.fr/politique/article/2025/07/02/laurent-wauquiez-et-lr-veulent-un-budget-0-hausse-d-impots-et-propose-un-projet-de-loi-contre-la-fraude-sociale_6617437_823448.html,  Par Alexandre Pedro ,
130,Retraites de l’Etat : des normes qui gonflent les chiffres sur le financement de l’action publique  ,https://www.lemonde.fr/politique/article/2025/07/02/retraites-de-l-etat-des-normes-qui-gonflent-les-chiffres-sur-le-financement-de-l-action-publique_6617433_823448.html,  Par Bertrand Bissuel ,
131, Handicap sévère : la difficile transition de l’enfance vers l’âge adulte ,https://www.lemonde.fr/societe/article/2025/07/02/handicap-severe-la-difficile-transition-de-l-enfance-vers-l-age-adulte_6617435_3224.html,  Par Anne-Aël Durand ,
132,"Pendant la canicule, les sans-abri en première ligne : « On aimait bien se mettre à l’ombre ici, mais ils ont mis une barrière »  ",https://www.lemonde.fr/societe/article/2025/07/01/pendant-la-canicule-les-sans-abri-en-premiere-ligne-on-aimait-bien-se-mettre-a-l-ombre-ici-mais-ils-ont-mis-une-barriere_6617243_3224.html,  Par Dounia Dimou ,
133,"Pendant la canicule, les sans-abri en première ligne : « On aimait bien se mettre à l’ombre ici, mais ils ont mis une barrière »  ",https://www.lemonde.fr/societe/article/2025/07/01/pendant-la-canicule-les-sans-abri-en-premiere-ligne-on-aimait-bien-se-mettre-a-l-ombre-ici-mais-ils-ont-mis-une-barriere_6617243_3224.html,  Par Dounia Dimou ,
134,"Au procès de l’attentat de Condé-sur-Sarthe, jeu de piste audio sur les conversations de la « salle de convivialité »  ",https://www.lemonde.fr/societe/article/2025/07/02/au-proces-de-l-attentat-de-conde-sur-sarthe-jeu-de-pistes-audio-sur-les-conversations-de-la-salle-de-convivialite_6617316_3224.html,  Par Soren Seelow ,
135,"Violette Spillebout et Paul Vannier, rapporteurs de la commission d’enquête sur les violences en milieu scolaire : « Cela dérange de lever le couvercle sur une omerta »  ",https://www.lemonde.fr/societe/article/2025/07/02/violette-spillebout-et-paul-vannier-rapporteurs-de-la-commission-d-enquete-sur-les-violences-en-milieu-scolaire-cela-derange-de-lever-le-couvercle-sur-une-omerta_6617337_3224.html,"  Propos recueillis par Sylvie Lecherbonnier, Violaine Morin et Eléa Pommiers ",
136,Canicule dans les établissements scolaires : « J’ai concocté à ma fille un petit kit de survie »  ,https://www.lemonde.fr/societe/article/2025/07/01/canicule-dans-les-etablissements-scolaires-j-ai-concocte-a-ma-fille-un-petit-kit-de-survie_6617296_3224.html,  Par Minh Dréan ,
137,Canicule dans les établissements scolaires : « J’ai concocté à ma fille un petit kit de survie »  ,https://www.lemonde.fr/societe/article/2025/07/01/canicule-dans-les-etablissements-scolaires-j-ai-concocte-a-ma-fille-un-petit-kit-de-survie_6617296_3224.html,  Par Minh Dréan ,
138,"Face à la canicule, des familles inquiètes pour leurs proches dans les Ehpad publics  ",https://www.lemonde.fr/planete/article/2025/07/02/face-a-la-canicule-des-familles-inquietes-pour-leurs-proches-dans-les-ehpad-publics_6617398_3244.html,  Par Béatrice Jérôme ,
139,Canicule : l’installation massive de volets s’impose dans le débat public  ,https://www.lemonde.fr/societe/article/2025/07/01/canicule-l-installation-massive-de-volets-s-impose-dans-le-debat-public_6617273_3224.html,  Par Véronique Chocron ,
140," Ces dizaines de milliards d’euros d’aides publiques aux entreprises versés sans transparence, ni suivi ",https://www.lemonde.fr/economie/article/2025/07/02/aides-publiques-aux-entreprises-ces-dizaines-de-milliards-d-euros-verses-sans-transparence-ni-suivi_6617319_3234.html,  Par Aline Leclerc et Service économie ,
141,Comment EDF tente d’adapter le fonctionnement de ses centrales nucléaires au dérèglement climatique  ,https://www.lemonde.fr/economie/article/2025/07/02/comment-edf-tente-d-adapter-le-fonctionnement-de-ses-centrales-nucleaires-au-dereglement-climatique_6617344_3234.html,  Par Adrien Pécout ,
142,Comment EDF tente d’adapter le fonctionnement de ses centrales nucléaires au dérèglement climatique  ,https://www.lemonde.fr/economie/article/2025/07/02/comment-edf-tente-d-adapter-le-fonctionnement-de-ses-centrales-nucleaires-au-dereglement-climatique_6617344_3234.html,  Par Adrien Pécout ,
143,"Droits télé : la LFP lance sa chaîne de la Ligue 1, sans Canal+  ",https://www.lemonde.fr/economie/article/2025/07/01/droits-tv-la-lfp-lance-sa-chaine-de-la-ligue-1-sans-canal_6617288_3234.html,  Par Brice Laemle et Alexandre Lemarié ,
144,"La canicule peut coûter 0,3 point de PIB à la France  ",https://www.lemonde.fr/economie/article/2025/07/01/la-canicule-peut-couter-0-3-point-de-pib-a-la-france_6617290_3234.html,  Par Béatrice Madeline ,
145,Les premiers grands départs en vacances perturbés par la grève des contrôleurs aériens  ,https://www.lemonde.fr/economie/article/2025/07/01/les-premiers-grands-departs-en-vacances-perturbes-par-la-greve-des-controleurs-aeriens_6617299_3234.html,  Par Guy Dutheil ,
146,Les premiers grands départs en vacances perturbés par la grève des contrôleurs aériens  ,https://www.lemonde.fr/economie/article/2025/07/01/les-premiers-grands-departs-en-vacances-perturbes-par-la-greve-des-controleurs-aeriens_6617299_3234.html,  Par Guy Dutheil ,
147,Bataille de procédure à la veille d’une audience décisive pour les 330 salariés du Coq sportif  ,https://www.lemonde.fr/economie/article/2025/07/01/bataille-de-procedure-a-la-veille-d-une-audience-decisive-pour-les-330-salaries-du-coq-sportif_6617282_3234.html,  Par Juliette Garnier ,
148,Le grand plongeon du marché automobile français  ,https://www.lemonde.fr/economie/article/2025/07/01/le-grand-plongeon-du-marche-automobile-francais_6617223_3234.html,  Par Sophie Fay ,
149, Pourquoi notre utilisation de l’intelligence artificielle est un gouffre énergétique ,https://www.lemonde.fr/les-decodeurs/article/2025/06/08/pourquoi-notre-utilisation-de-l-ia-est-un-gouffre-energetique_6611132_4355770.html,,
150,125 destinations pour faire le tour du monde sans quitter la France (ou l’Europe)    Grand format  ,https://www.lemonde.fr/les-decodeurs/visuel/2025/05/02/125-destinations-pour-faire-le-tour-du-monde-sans-quitter-la-france-ou-l-europe_6254182_4355771.html,,
151,125 destinations pour faire le tour du monde sans quitter la France (ou l’Europe)    Grand format  ,https://www.lemonde.fr/les-decodeurs/visuel/2025/05/02/125-destinations-pour-faire-le-tour-du-monde-sans-quitter-la-france-ou-l-europe_6254182_4355771.html,,
152,Fin de l’ADSL : comment le très haut débit a changé nos vies  ,https://www.lemonde.fr/les-decodeurs/article/2025/04/19/fin-de-l-adsl-comment-le-tres-haut-debit-a-change-nos-vies_6597827_4355770.html,,
153,Proportionnelle : les enjeux du changement de mode de scrutin  ,https://www.lemonde.fr/les-decodeurs/article/2025/06/04/proportionnelle-les-enjeux-du-changement-de-mode-de-scrutin_6610504_4355770.html,,
154,"Plus de la moitié des ministres du gouvernement Bayrou sont millionnaires, selon leur déclaration de patrimoine  ",https://www.lemonde.fr/les-decodeurs/article/2025/06/12/gouvernement-bayrou-plus-de-la-moitie-des-ministres-sont-millionnaires-selon-leur-declaration-de-patrimoine_6612468_4355770.html,,
155,"Plus de la moitié des ministres du gouvernement Bayrou sont millionnaires, selon leur déclaration de patrimoine  ",https://www.lemonde.fr/les-decodeurs/article/2025/06/12/gouvernement-bayrou-plus-de-la-moitie-des-ministres-sont-millionnaires-selon-leur-declaration-de-patrimoine_6612468_4355770.html,,
156,Comprendre le réchauffement climatique : comment nous avons bouleversé la planète    Grand format  ,https://www.lemonde.fr/les-decodeurs/visuel/2025/07/02/comprendre-le-rechauffement-climatique-comment-nous-avons-bouleverse-la-planete_6176490_4355771.html,,
157,Visualisez les températures maximales et la précocité de la canicule de juin 2025 en France  ,https://www.lemonde.fr/les-decodeurs/article/2025/07/02/visualisez-l-intensite-et-la-precocite-de-la-vague-de-chaleur_6617372_4355770.html,,
158," La commission d’enquête parlementaire sur TikTok fait son bilan : « Chaque mois qui passe sans régulation, des jeunes sont sacrifiés » ",https://www.lemonde.fr/pixels/article/2025/06/24/la-commission-d-enquete-parlementaire-sur-tiktok-fait-son-bilan-chaque-mois-qui-passe-sans-regulation-des-jeunes-sont-sacrifies_6615666_4408996.html,  Propos recueillis par Morgane Tual ,
159,Comment les réseaux sociaux mitonnent une marmite de chefs cuisiniers amateurs  ,https://www.lemonde.fr/pixels/article/2025/06/29/comment-les-reseaux-sociaux-mitonnent-une-marmite-de-chefs-cuisiniers-amateurs_6616402_4408996.html,  Par Lyssia Gingins ,
160,Comment les réseaux sociaux mitonnent une marmite de chefs cuisiniers amateurs  ,https://www.lemonde.fr/pixels/article/2025/06/29/comment-les-reseaux-sociaux-mitonnent-une-marmite-de-chefs-cuisiniers-amateurs_6616402_4408996.html,  Par Lyssia Gingins ,
161,L’emballement sur les réseaux et les médias autour des piqûres pendant la fête de la musique  ,https://www.lemonde.fr/pixels/article/2025/06/27/piqures-sauvages-lors-de-la-fete-de-la-musique-autopsie-d-un-emballement_6616152_4408996.html,,
162,On a testé… « Death Stranding 2 : On the Beach » : quand le livreur de Hideo Kojima prend les armes  ,https://www.lemonde.fr/pixels/article/2025/06/23/on-a-teste-death-stranding-2-on-the-beach-quand-le-livreur-d-hideo-kojima-prend-les-armes_6615447_4408996.html,  Par Pierre Trouvé ,
163,Prison avec sursis pour d’anciens cadres d’Ubisoft : une décision qui devrait faire jurisprudence  ,https://www.lemonde.fr/pixels/article/2025/07/02/prison-avec-sursis-pour-d-anciens-cadres-d-ubisoft-une-decision-qui-devrait-faire-jurisprudence_6617447_4408996.html,"  Par Sofia Fischer (Nice, correspondance) ",
