,title,url,byline,subhed
0,"Après le crash du 787 Dreamliner d’Air India, Boeing à nouveau en plein doute",https://www.lemonde.fr/economie/article/2025/06/12/le-crash-du-787-d-air-india-en-inde-un-nouveau-coup-dur-pour-boeing_6612578_3234.html,  Par Guy Dutheil ,
1,Nucléaire : « Les ogres des données sont partis à la chasse aux électrons »,https://www.lemonde.fr/economie/article/2025/06/04/nucleaire-les-ogres-des-donnees-sont-partis-a-la-chasse-aux-electrons_6610480_3234.html,,
2,IA : « Les robots peuvent-ils battre les loups de Wall Street ? »,https://www.lemonde.fr/economie/article/2025/06/13/ia-les-robots-peuvent-ils-battre-les-loups-de-wall-street_6612704_3234.html,,
3,Retraites : « Tout est factuellement faux dans l’argumentaire en faveur de la capitalisation »,https://www.lemonde.fr/idees/article/2025/06/13/retraites-tout-est-factuellement-faux-dans-l-argumentaire-en-faveur-de-la-capitalisation_6612666_3232.html,,
4,Les bombes planantes : l’astuce de la Russie pour recycler ses vieilles armes,https://www.lemonde.fr/international/video/2025/05/13/les-bombes-planantes-l-astuce-de-la-russie-pour-recycler-ses-vieilles-armes_6605754_3210.html,  Par Thomas Eydoux et Marceau Bretonnier (Motion design) ,
5,Vidéo. Donald Trump et Elon Musk se disputent publiquement,https://www.lemonde.fr/international/video/2025/06/06/video-donald-trump-et-elon-musk-se-disputent-publiquement_6610835_3210.html,  Par Service vidéo du Monde ,
6,Comment les journalistes dronistes sont pris pour cibles par l’armée israélienne dans la bande de Gaza,https://www.lemonde.fr/international/video/2025/05/25/gaza-comment-les-journalistes-dronistes-sont-pris-pour-cibles-par-l-armee-israelienne_6608357_3210.html,"  Par Forbidden Stories, Bellingcat et Cellule Enquête vidéo ",
7,Ukraine : ce que l’on sait de l’attaque de drones inédite lancée contre des bases russes,https://www.lemonde.fr/international/video/2025/06/02/ukraine-ce-que-l-on-sait-de-l-attaque-de-drones-inedite-lancee-contre-des-bases-russes_6610251_3210.html,  Par Clara De Antoni et Service vidéo du Monde ,
8,L’équité fiscale passe par la taxation des ultrariches,https://www.lemonde.fr/idees/article/2025/06/13/l-equite-fiscale-passe-par-la-taxation-des-ultrariches_6612698_3232.html,,
9,"La « victimisation secondaire », ce concept retenu lors du procès Depardieu qui n’existe pas dans le droit pénal français",https://www.lemonde.fr/idees/article/2025/06/11/la-victimisation-secondaire-ce-concept-retenu-lors-du-proces-depardieu-qui-n-existe-pas-dans-le-droit-penal-francais_6612171_3232.html,  Par Anne-Toscane Viudes ,
10,"« Le débat sur les fonds de pension suscite toujours autant de passions, car il est imprégné d’idéologie »",https://www.lemonde.fr/idees/article/2025/06/12/le-debat-sur-les-fonds-de-pension-suscite-toujours-autant-de-passions-car-il-est-impregne-d-ideologie_6612481_3232.html,,
11,« La fermeture du Palais de la découverte ou sa réduction serait une perte pour l’ensemble de la communauté internationale »,https://www.lemonde.fr/sciences/article/2025/06/13/la-fermeture-du-palais-de-la-decouverte-ou-sa-reduction-serait-une-perte-pour-l-ensemble-de-la-communaute-internationale_6612692_1650684.html,,
12,"Avec « Life of Chuck », Mike Flanagan raconte, à rebours, le cours d’une existence ordinaire",https://www.lemonde.fr/culture/article/2025/06/11/avec-life-of-chuck-mike-flanagan-raconte-a-rebours-le-cours-d-une-existence-ordinaire_6612216_3246.html,  Par Mathieu Macheret ,
13,La « Correspondance » de François Truffaut avec ses maîtres et ses pairs,https://www.lemonde.fr/livres/article/2025/06/13/correspondance-avec-des-cineastes-francois-truffaut-ses-maitres-et-ses-pairs_6612669_3260.html,  Par Amaury da Cunha ,
14,"« Télétravail du sexe », sur Tënk : de l’autre côté de l’écran, la vie réelle des « camgirls »",https://www.lemonde.fr/culture/article/2025/06/13/teletravail-du-sexe-sur-tenk-de-l-autre-cote-de-l-ecran-la-vie-reelle-des-camgirls_6612728_3246.html,  Par Sandrine Berthaud-Clair ,
15,"Dans le procès de Harvey Weinstein à New York, la procédure pour viol a été jugée nulle",https://www.lemonde.fr/cinema/article/2025/06/12/proces-weinstein-a-new-york-la-procedure-pour-le-chef-d-accusation-de-viol-jugee-nulle_6612569_3476.html,Le Monde avec AFP,
16,Caviar de courgettes et ricotta fouettée sur toast : la recette de Jesse Jenkins,https://www.lemonde.fr/les-recettes-du-monde/article/2025/06/13/caviar-de-courgettes-et-ricotta-fouettee-sur-toast-la-recette-de-jesse-jenkins_6612699_5324493.html,  Par Jesse Jenkins ,
17,Fendi rend hommage à la première collection de Karl Lagerfeld pour la marque romaine,https://www.lemonde.fr/m-styles/article/2025/06/13/fendi-rend-hommage-a-la-premiere-collection-de-karl-lagerfeld-pour-la-marque-romaine_6612664_4497319.html,  Par Maud Gabrielson ,
18,"A Ouches et Iguerande, l’héritage gastronomique de César et Léo Troisgros",https://www.lemonde.fr/m-styles/article/2025/06/13/a-ouches-et-iguerande-l-heritage-gastronomique-de-cesar-et-leo-troisgros_6612651_4497319.html,,
19,Des éléments de langage en boucle sur les chaînes d’info après le « drame de Nogent »,https://www.lemonde.fr/m-perso/article/2025/06/12/sur-le-drame-de-nogent-des-chaines-d-info-en-boucle-de-l-ensauvagement-aux-parents-laxistes_6612577_4497916.html,,
20,         Live  Article se déroulant en direct   Attaques d’Israël contre l’Iran : Téhéran dénonce une « déclaration de guerre » ; Emmanuel Macron réaffirme « le droit d’Israël à assurer sa sécurité »  ,https://www.lemonde.fr/international/live/2025/06/13/en-direct-attaques-d-israel-contre-l-iran-teheran-denonce-une-declaration-de-guerre-les-operations-israeliennes-se-poursuivent_6612642_3210.html,,"L’Etat hébreu a mené des bombardements, tôt vendredi, contre des sites militaires et nucléaires à Téhéran et à Natanz. Les gardiens de la révolution, l’armée idéologique du régime iranien, ont juré de venger la mort de leur chef, le général Hossein Salami."
21,"La Russie a perdu plus d’un million de soldats, tués ou blessés, depuis le début de l’invasion de l’Ukraine",https://www.lemonde.fr/international/live/2025/06/13/en-direct-guerre-en-ukraine-la-russie-a-perdu-plus-d-un-million-de-soldats-tues-ou-blesses-depuis-le-debut-de-l-invasion_6611146_3210.html,,"« Un million de morts en vain : la Russie n’a atteint aucun des objectifs stratégiques de son invasion à grande échelle. Et elle n’y parviendra pas », a assuré, en réaction, le ministre des affaires étrangères ukrainien, Andrii Sybiha."
22,"Municipales 2026 : à Paris, Pierre-Yves Bournazel croit en son « moment »",https://www.lemonde.fr/politique/article/2025/06/13/municipales-2026-a-paris-pierre-yves-bournazel-croit-en-son-moment_6612661_823448.html,  Par Hélène Bekmezian ,"Après deux candidatures avortées en 2014 et 2020, le conseiller de Paris et élu Horizons espère ravir le fauteuil de l’Hôtel de Ville en 2026. Et se dit prêt à occuper l’espace entre les candidats de gauche et la probable candidate de droite, Rachida Dati, dont il fut le porte-parole au ministère de la justice."
23,"Après le crash d’un avion en Inde, l’unique survivant raconte : « Je n’arrive toujours pas à croire que j’ai pu sortir vivant de tout ça »",https://www.lemonde.fr/international/article/2025/06/13/apres-le-crash-d-un-avion-en-inde-l-unique-survivant-raconte-je-n-arrive-toujours-pas-a-croire-que-j-ai-pu-sortir-vivant-de-tout-ca_6612723_3210.html,Le Monde avec AFP,"Vishwash Kumar Ramesh était assis à l’avant gauche de l’appareil, tout près d’une des portes de secours. Selon le dernier bilan, les secouristes ont extirpé au total 265 corps calcinés des débris de l’avion et des ruines des bâtiments qu’il a percutés, au sol."
24,"Dans l’Antarctique, les manchots empereurs pourraient disparaître encore plus vite que prévu",https://www.lemonde.fr/planete/article/2025/06/13/dans-l-antarctique-les-manchots-empereurs-pourraient-disparaitre-encore-plus-vite-que-prevu_6612721_3244.html,  Par Perrine Mouterde ,"Selon une étude de la British Antarctic Survey, la population de cette espèce polaire a décliné de 22 % en quinze ans, en raison de la perte de glace de mer et d’autres conséquences du réchauffement climatique."
25,"Bac de français : revivez la matinée d’épreuves, les sujets et les corrigés",https://www.lemonde.fr/campus/live/2025/06/13/en-direct-bac-de-francais-2025-les-reponses-a-vos-questions-sur-les-sujets-une-bonne-copie-sera-celle-qui-sait-mobiliser-des-passages-precis-de-la-piece-sans-s-embrouiller_6612653_4401467.html,,
26,Surveillance : l’extension des « boîtes noires » au crime organisé censurée par le Conseil constitutionnel,https://www.lemonde.fr/pixels/article/2025/06/13/surveillance-l-extension-des-boites-noires-au-crime-organise-censuree-par-le-conseil-constitutionnel_6612706_4408996.html,  Par Florian Reynaud ,
27,"Orages : 28 départements du sud-ouest et du nord-ouest, dont Paris, en vigilance orange vendredi après-midi",https://www.lemonde.fr/planete/article/2025/06/13/orages-28-departements-du-sud-ouest-et-du-nord-ouest-dont-paris-en-vigilance-orange-vendredi-apres-midi_6612670_3245.html,Le Monde avec AFP,
28,"Retraites : jugé trop « engagé », un rapport du Conseil d’orientation des retraites finalement amendé",https://www.lemonde.fr/politique/article/2025/06/13/retraites-juge-trop-engage-un-rapport-du-conseil-d-orientation-des-retraites-finalement-amende_6612690_823448.html,  Par Bertrand Bissuel et Malika Cheklal  ,
29,"L’état des nappes phréatiques en France est « satisfaisant », malgré des « niveaux inquiétants » dans des territoires des Pyrénées-Orientales et de l’Aude",https://www.lemonde.fr/planete/article/2025/06/13/l-etat-des-nappes-phreatiques-en-france-est-satisfaisant-malgre-des-niveaux-inquietants-dans-des-territoires-des-pyrenees-orientales-et-de-l-aude_6612722_3244.html,Le Monde avec AFP,
30,Au Grand Palais se rejoue la genèse du Centre Pompidou,https://www.lemonde.fr/culture/article/2025/06/13/au-grand-palais-se-rejoue-la-genese-du-centre-pompidou_6612709_3246.html,  Par Isabelle Regnier ,
31,"Au procès de l’attentat de Condé-sur-Sarthe, la difficile reconstruction de deux gardiens de prison : « Je suis dans un service administratif aujourd’hui »",https://www.lemonde.fr/societe/article/2025/06/13/au-proces-de-l-attentat-de-conde-sur-sarthe-la-difficile-reconstruction-de-deux-gardiens-de-prison-je-suis-dans-un-service-administratif-aujourd-hui_6612696_3224.html,  Par Soren Seelow ,
32,"En Egypte, arrestation et expulsion de dizaines de participants à la marche de solidarité internationale avec Gaza",https://www.lemonde.fr/international/article/2025/06/13/en-egypte-des-marcheurs-en-direction-de-gaza-ont-ete-arretes_6612697_3210.html,"  Par Laure Stephan (Beyrouth, correspondance) ",
33,Quand Aurélien Pradié et Dominique de Villepin échangent aux Bernardins sur la dignité en politique,https://www.lemonde.fr/politique/article/2025/06/13/quand-aurelien-pradie-et-dominique-de-villepin-echangent-aux-bernardins-sur-la-dignite-en-politique_6612717_823448.html,  Par Alexandre Pedro ,
34,"Aux Antilles, une vague d’homicides sur fond d’explosion des trafics",https://www.lemonde.fr/societe/article/2025/06/13/aux-antilles-une-vague-d-homicides-sur-fond-d-explosion-des-trafics_6612702_3224.html,"  Par Amandine Ascensio (Pointe-à-Pitre, correspondance) et Jean-Michel Hauteville (Fort-de-France, correspondant) ",
35,L’offensive des pays du Golfe dans l’intelligence artificielle,https://www.lemonde.fr/economie/article/2025/06/13/l-offensive-des-pays-du-golfe-dans-l-intelligence-artificielle_6612691_3234.html,"  Par Alexandre Piquard et Hélène Sallon (Beyrouth, correspondante) ",
36,La lèpre était présente sur le continent américain avant l’arrivée des colons européens,https://www.lemonde.fr/sciences/article/2025/06/13/la-lepre-etait-presente-sur-le-continent-americain-avant-l-arrivee-des-colons-europeens_6612705_1650684.html,  Par Samia Hanachi ,
37,"Günther Uecker, artiste allemand qui avait le clou pour marque de fabrique, est mort",https://www.lemonde.fr/disparitions/article/2025/06/13/gunther-uecker-artiste-allemand-qui-avait-le-clou-pour-marque-de-fabrique-est-mort_6612711_3382.html,  Par Philippe Dagen ,
38,Quatre essais pour découvrir le taoïsme et la spiritualité chinoise,https://www.lemonde.fr/le-monde-des-religions/article/2025/06/13/quatre-essais-pour-decouvrir-le-taoisme-et-la-spiritualite-chinoise_6612662_6038514.html,  Par Youness Bousenna et Gaétan Supertino ,
39,Le récit de l’attaque fulgurante et massive d’Israël contre l’Iran,https://www.lemonde.fr/international/article/2025/06/13/israel-lance-une-attaque-fulgurante-et-massive-contre-l-iran_6612685_3210.html,,"Sans précédent par son ampleur et les cibles visées, l’offensive israélienne déclenchée dans la nuit de jeudi à vendredi a frappé non seulement les installations nucléaires de la république islamique, mais aussi sa chaîne de commandement militaire, des bases de missiles et des scientifiques impliqués dans le programme nucléaire."
40,Attaque d’Israël contre l’Iran : les Etats-Unis se tiennent en retrait pour protéger leurs forces au Proche-Orient,https://www.lemonde.fr/international/article/2025/06/13/attaque-d-israel-contre-l-iran-les-etats-unis-se-tiennent-en-retrait-de-facon-demonstrative-pour-proteger-leurs-forces-au-proche-orient_6612673_3210.html,"  Par Piotr Smolar (Washington, correspondant) ","Le communiqué publié par le secrétaire d’Etat, Marco Rubio, ne manifeste aucune forme de solidarité avec l’Etat hébreu. Cette réaction peut traduire une forme d’irritation à l’égard de Benyamin Nétanyahou, qui, en ordonnant les frappes, torpille les négociations avec Téhéran, relancées par Donald Trump en mars."
41,"A l’origine du meurtre de Mélanie G., un adolescent « en perte de repères quant à la valeur de la vie humaine »",https://www.lemonde.fr/societe/article/2025/06/11/a-l-origine-du-meurtre-de-melanie-g-un-adolescent-en-perte-de-repere-quant-a-la-valeur-de-la-vie-humaine_6612271_3224.html,  Par Laura Motet ,"Au lendemain de la mort de Mélanie G., la surveillante poignardée par un élève à l’entrée du collège de Nogent, le procureur de la République de Chaumont a précisé les circonstances du drame et le profil de l’adolescent en garde à vue."
42,L’équité fiscale passe par la taxation des ultrariches,https://www.lemonde.fr/idees/article/2025/06/13/l-equite-fiscale-passe-par-la-taxation-des-ultrariches_6612698_3232.html,,
43,"« Dans le conflit entre la Russie et l’Ukraine, la question territoriale est importante, certes, mais pas autant qu’il n’y paraît »",https://www.lemonde.fr/idees/article/2025/06/12/dans-le-conflit-entre-la-russie-et-l-ukraine-la-question-territoriale-est-importante-certes-mais-pas-autant-qu-il-n-y-parait_6612531_3232.html,,
44,IA : « Les robots peuvent-ils battre les loups de Wall Street ? »,https://www.lemonde.fr/economie/article/2025/06/13/ia-les-robots-peuvent-ils-battre-les-loups-de-wall-street_6612704_3234.html,,
