,title,url,byline,subhed
0,"Sur les marchés financiers, un été euphorique au risque de l’excès d’optimisme",https://www.lemonde.fr/economie/article/2025/08/24/sur-les-marches-financiers-un-ete-euphorique-au-risque-de-l-exces-d-optimisme_6634260_3234.html,,
1,Les nombreuses analogies entre les Etats-Unis de Trump et ceux des « barons voleurs » de 1890,https://www.lemonde.fr/economie/article/2025/08/04/richesse-monopoles-corruption-l-amerique-de-donald-trump-est-elle-revenue-en-1890_6626445_3234.html,  Par Philippe Escande ,
2,"Quand la cave privée enterrée sous la voie publique s’effondre, qui est responsable ?",https://www.lemonde.fr/argent/article/2025/08/22/quand-la-cave-privee-enterree-sous-la-voie-publique-s-effondre-qui-est-responsable_6633448_1657007.html,,
3,L’appel de 23 économistes à Israël pour « un arrêt immédiat de toute politique qui intensifie la famine généralisée à Gaza »,https://www.lemonde.fr/idees/article/2025/08/21/l-appel-de-23-economistes-a-un-arret-immediat-de-toute-politique-qui-intensifie-la-famine-generalisee-a-gaza_6632905_3232.html,,
4,Pourquoi la Russie utilise tellement de drones iraniens Shahed pour attaquer l’Ukraine,https://www.lemonde.fr/international/video/2025/08/07/ukraine-pourquoi-la-russie-intensifie-ses-attaques-de-drones-shahed_6627299_3210.html,  Par Poline Tchoubar et Elisa Bellanger (Motion design) ,
5,Pourquoi tout le monde s’arrache l’Arctique ? Comprendre en trois minutes,https://www.lemonde.fr/comprendre-en-3-minutes/video/2025/08/14/pourquoi-tout-le-monde-s-arrache-l-arctique-comprendre-en-trois-minutes_6629216_6176282.html,  Par Laurent Selinder et Arthur Navet (Motion design) ,
6,La machine anti-immigration de Donald Trump s’active au cœur de New York,https://www.lemonde.fr/international/video/2025/08/14/la-machine-anti-immigration-de-donald-trump-s-active-au-c-ur-de-new-york_6629527_3210.html,"  Par Brieuc Beckers, Adrien Vande Casteele (motion design) et Fanny Zarifi ",
7,Hiroshima : comment s’est déroulé le bombardement atomique le plus dévastateur de l’histoire,https://www.lemonde.fr/histoire/video/2025/08/02/hiroshima-comment-s-est-deroule-le-bombardement-atomique-le-plus-devastateur-de-l-histoire_6626343_4655323.html,  Par Karim El Hadj et Adrien Vande Casteele ,
8,Sud global : Trump fait le jeu de la Chine,https://www.lemonde.fr/idees/article/2025/08/23/sud-global-trump-fait-le-jeu-de-la-chine_6634045_3232.html,,
9,"Pierre Dardot et Christian Laval, trente ans de pensée en commun",https://www.lemonde.fr/idees/article/2025/08/22/pierre-dardot-et-christian-laval-trente-ans-de-pensee-en-commun_6633450_3232.html,  Par Youness Bousenna ,
10,"Face à Donald Trump, « les anciens présidents américains ne veulent pas risquer de compromettre la fonction en parlant de façon irréfléchie »",https://www.lemonde.fr/idees/article/2025/08/19/face-a-trump-les-anciens-presidents-americains-ne-veulent-pas-risquer-de-compromettre-la-fonction-en-parlant-de-facon-irreflechie_6631791_3232.html,  Propos recueillis par Valentine Faure ,
11,L’appel du cardinal d’Alger et du recteur de la Grande Mosquée de Paris : « Nos peuples ne doivent pas être les victimes collatérales des crispations diplomatiques »,https://www.lemonde.fr/idees/article/2025/08/24/l-appel-du-cardinal-d-alger-et-du-recteur-de-la-grande-mosquee-de-paris-nos-peuples-ne-doivent-pas-etre-les-victimes-collaterales-des-crispations-diplomatiques_6634256_3232.html,,
12,"Sur Netflix, le succès phénoménal du film d’animation « K-Pop Demon Hunters »",https://www.lemonde.fr/culture/article/2025/08/23/sur-netflix-le-succes-phenomenal-du-film-d-animation-kpop-demon-hunters_6634067_3246.html,"  Par Hanna Siemiatycki (Séoul, correspondance) ",
13,"Les brèves critiques de la rentrée littéraire : Basile Panurgias, Anne B. Ragde, Ferdinand von Saar…",https://www.lemonde.fr/livres/article/2025/08/24/les-breves-critiques-de-la-rentree-litteraire-basile-panurgias-anne-b-ragde-ferdinand-von-saar_6634574_3260.html,"  Par Philippe-Jean Catinchi, Ambre Andarelli, Elena Balzamo (Collaboratrice du « Monde des livres ») et Florence Noiville ",
14,"RTL a recruté Augustin Trapenard, Anne-Sophie Lapix et André Dussolier pour revenir dans le jeu des radios à la rentrée",https://www.lemonde.fr/economie/article/2025/08/24/rtl-a-recrute-augustin-trapenard-anne-sophie-lapix-et-andre-dussolier-pour-revenir-dans-le-jeu-des-radios-a-la-rentree_6634573_3234.html,  Par Aude Dassonville ,
15,"L’abbaye de Daoulas, dans le Finistère, explore l’univers insulaire sous toutes ses facettes",https://www.lemonde.fr/culture/article/2025/08/24/l-abbaye-de-daoulas-dans-le-finistere-explore-l-univers-insulaire-sous-toutes-ses-facettes_6634404_3246.html,  Par Sylvie Kerviel (Daoulas [Finistère] ) ,
16,"Soizic Fougeront et Laure Gravier, décoratrices d’antérieur",https://www.lemonde.fr/m-styles/article/2025/08/24/soizic-fougeront-et-laure-gravier-decoratrices-d-anterieur_6634488_4497319.html,  Par Léa Outier ,
17,La bavette au cresson et aux courgettes : la recette de Jesse Jenkins,https://www.lemonde.fr/m-styles/article/2025/08/24/la-bavette-au-cresson-et-aux-courgettes-la-recette-de-jesse-jenkins_6634483_4497319.html,  Par Jesse Jenkins ,
18,"La coupe à glace, l’alliée des gourmandises de l’été",https://www.lemonde.fr/m-styles/article/2025/08/24/la-coupe-a-glace-l-alliee-des-gourmandises-de-l-ete_6634448_4497319.html,  Par Julie Lasterade ,
19,"La photo animalière entre frères : « Nous nous sommes enhardis, en arpentant les bois ensemble avec un seul appareil pour deux »",https://www.lemonde.fr/series-d-ete/article/2025/08/24/la-photo-animaliere-entre-freres-nous-nous-sommes-enhardis-en-arpentant-les-bois-ensemble-avec-un-seul-appareil-pour-deux_6634262_3451060.html,,
20," Au Maroc, une atmosphère de fin de règne pour Mohammed VI  ",https://www.lemonde.fr/series-d-ete/article/2025/08/24/au-maroc-une-atmosphere-de-fin-de-regne-pour-mohammed-vi_6634562_3451060.html,,"« L’énigme Mohammed VI » (1/6). Vingt-six ans après son intronisation en 1999, le souverain marocain reste un personnage complexe dans son rapport au pouvoir. Alors que son état de santé interroge, la perspective de sa succession attise luttes d’influence et coups bas entre factions de l’élite."
21,Charles Kushner convoqué au Quai d’Orsay après avoir critiqué « l’absence d’action suffisante » d’Emmanuel Macron contre l’antisémitisme,https://www.lemonde.fr/international/article/2025/08/24/charles-kushner-ambassadeur-des-etats-unis-en-france-convoque-au-quai-d-orsay-apres-avoir-critique-l-absence-d-action-suffisante-d-emmanuel-macron-contre-l-antisemitisme_6634567_3211.html,  Par Philippe Ricard ,
22,"Cadavres découverts dans la Seine : l’hypothèse de crimes homophobes en série pour le principal suspect, mis en examen",https://www.lemonde.fr/societe/article/2025/08/24/cadavres-decouverts-dans-la-seine-l-hypothese-de-crimes-homophobes-en-serie-pour-le-principal-suspect-mis-en-examen_6634556_3224.html,  Par Soren Seelow ,
23,"Pour la rentrée des gauches, invectives à répétition et unionistes à la peine",https://www.lemonde.fr/politique/article/2025/08/24/pour-la-rentree-des-gauches-invectives-a-repetition-et-unionistes-a-la-peine_6634571_823448.html,"  Par Sandrine Cassini, Malika Cheklal  et Olivier Pérou ","Alors que communistes, écologistes et « insoumis » ont chacun tenu leurs universités politiques ce week-end, ces derniers ont de nouveau rejeté l’idée d’une union de la gauche, que ce soit pour les élections municipales de 2026 ou la présidentielle de 2027."
24,"En Italie, Matteo Salvini charge à nouveau la politique d’Emmanuel Macron",https://www.lemonde.fr/international/article/2025/08/24/en-italie-matteo-salvini-charge-a-nouveau-la-politique-d-emmanuel-macron_6634572_3210.html,"  Par Allan Kaval (Rome, correspondant) ","Deux jours après la convocation de l’ambassadrice d’Italie par le Quai d’Orsay, le vice-président du conseil italien a redoublé ses critiques contre le président français, présenté comme un dangereux va t’en guerre sur le dossier ukrainien."
25,Ligue 1 : Olivier Giroud offre une victoire sur le fil à Lille contre Monaco,https://www.lemonde.fr/sport/article/2025/08/24/ligue-1-olivier-giroud-offre-une-victoire-sur-le-fil-a-lille-contre-monaco_6634575_3242.html,Le Monde avec AFP,"Le LOSC l’a emporté face à l’AS Monaco (1-0), dimanche, en clôture de la deuxième journée de Ligue 1, grâce à un but de l’attaquant de 38 ans."
26,"La fille du poète controversé Ezra Pound, une inlassable défenseuse de son œuvre",https://www.lemonde.fr/series-d-ete/article/2025/08/24/la-fille-du-poete-controverse-ezra-pound-une-inlassable-defenseuse-de-son-uvre_6634267_3451060.html,,"« Une œuvre en héritage, saison 2 » (7/8). Mary de Rachewiltz a hérité de la lourde mission de veiller sur la postérité de son père, le poète américain Ezra Pound, mort en 1972, dont les écrits sont entachés par son allégeance au fascisme et par ses propos antisémites. Malgré la distance qu’il lui imposa de son vivant, elle continue de vouer une admiration sans bornes à son œuvre immense."
27,"SpaceX : un vol test de la mégafusée Starship annulé, nouveau revers pour Elon Musk",https://www.lemonde.fr/sciences/article/2025/08/25/spacex-un-vol-test-de-la-megafusee-starship-annule-nouveau-revers-pour-elon-musk_6634610_1650684.html,Le Monde avec AFP,
28,Ce qu’il ne fallait pas manquer de l’actualité du week-end,https://www.lemonde.fr/les-decodeurs/article/2025/08/24/ce-qu-il-ne-fallait-pas-manquer-de-l-actualite-du-week-end_6634561_4355770.html,Le Monde,
29,"En direct, guerre en Ukraine : Volodymyr Zelensky réaffirme que la présence de troupes occidentales en cas de cessez-le-feu est « importante » pour Kiev",https://www.lemonde.fr/international/live/2025/08/24/en-direct-guerre-en-ukraine-volodymyr-zelensky-reaffirme-que-la-presence-de-troupes-occidentales-en-cas-de-cessez-le-feu-est-importante-pour-kiev_6634258_3210.html,,
30,"En direct, Gaza : au moins 42 personnes sont mortes dans l’enclave dimanche, rapporte la défense civile",https://www.lemonde.fr/international/live/2025/08/24/en-direct-gaza-dix-palestiniens-tues-dans-des-bombardements-et-tirs-israeliens-dimanche-soir-selon-l-agence-wafa_6632172_3210.html,,
31,Rock en Seine : le groupe Kneecap évoque la situation à Gaza mais évite la polémique,https://www.lemonde.fr/culture/article/2025/08/25/rock-en-seine-le-groupe-kneecap-evoque-la-situation-a-gaza-mais-evite-la-polemique_6634608_3246.html,Le Monde avec AFP,
32,"En Guadeloupe, Bruno Retailleau annonce des renforts pour lutter contre la délinquance et le narcotrafic",https://www.lemonde.fr/politique/article/2025/08/24/en-guadeloupe-bruno-retailleau-annonce-des-renforts-pour-lutter-contre-la-delinquance-et-le-narcotrafic_6634566_823448.html,"  Par Amandine Ascensio (Pointe-à-Pitre, correspondance) ",
33,"En Guinée, un des trois partis suspendus par la junte au pouvoir va contester en justice une décision « illégale »",https://www.lemonde.fr/afrique/article/2025/08/25/en-guinee-un-des-trois-partis-suspendus-par-la-junte-au-pouvoir-va-contester-en-justice-une-decision-illegale_6634609_3212.html,Le Monde avec AFP,
34,Le succès toujours plus fou du Labubu entraine pénurie et multiplication des contrefaçons,https://www.lemonde.fr/economie/article/2025/08/24/en-chine-comme-aux-etats-unis-le-succes-toujours-plus-fou-du-labubu_6634259_3234.html,"  Par Jordan Pouille (Pékin, correspondance) ",
35,"Jonathan Rowe, le joueur anglais de l’Olympique de Marseille qui s’était battu avec Adrien Rabiot, transféré à Bologne",https://www.lemonde.fr/football/article/2025/08/24/jonathan-rowe-le-joueur-anglais-de-l-olympique-de-marseille-qui-s-etait-battu-avec-adrien-rabiot-transfere-a-bologne_6634555_1616938.html,  Par Service Sports (avec AFP)  ,
36,"Israël bombarde la capitale du Yémen, Sanaa, deux jours après une frappe des houthistes sur l’Etat hébreu",https://www.lemonde.fr/international/article/2025/08/24/israel-bombarde-la-capitale-du-yemen-sanaa-au-lendemain-d-une-frappe-des-houthis-sur-l-etat-hebreu_6634521_3210.html,Le Monde avec AP et AFP,
37,"Jerry Adler, acteur américain qui a incarné Hesh Rabkin dans « Les Sopranos », est mort à l’âge de 96 ans",https://www.lemonde.fr/disparitions/article/2025/08/24/jerry-adler-acteur-americain-qui-a-incarne-hesh-rabkin-dans-les-sopranos-est-mort-a-l-age-de-96-ans_6634563_3382.html,Le Monde avec AP,
38,Saint-Raphaël crée la polémique en inaugurant une stèle en hommage aux « victimes du communisme »,https://www.lemonde.fr/politique/article/2025/08/24/saint-raphael-cree-la-polemique-en-inaugurant-une-stele-en-hommage-aux-victimes-du-communisme_6634559_823448.html,"  Par Sofia Fischer (Saint-Raphaël [Var], envoyée spéciale) ",
39,Comment les démocrates américains se réinventent autour de l’idée d’« abondance »,https://www.lemonde.fr/international/article/2025/08/24/comment-les-democrates-americains-se-reinventent-autour-de-l-idee-d-abondance_6634255_3210.html,"  Par Corine Lesnes (San Francisco, correspondante) ","Né en Californie et emprunté à la tech, le concept séduit les jeunes du parti. Il prône un Etat interventionniste associé à une déréglementation pour faciliter les investissements et accroître l’offre de biens essentiels tels que le logement, l’énergie, les transports et les soins."
40,"En détruisant Rafah, l’armée israélienne tente d’effacer une histoire plurimillénaire",https://www.lemonde.fr/un-si-proche-orient/article/2025/08/24/la-longue-histoire-de-rafah-a-la-frontiere-sud-de-la-palestine_6634268_6116995.html,,"La ville palestinienne, située à la lisière de l’Egypte et dont le développement remonte aux Pharaons, est désormais un champ de décombres, écrit l’historien Jean-Pierre Filiu dans sa chronique."
41,Trois expériences érotiques inspirées par… les activités de groupe,https://www.lemonde.fr/series-d-ete/article/2025/08/24/trois-experiences-erotiques-inspirees-par-les-activites-de-groupe_6634219_3451060.html,,"Maïa Mazaurette, chroniqueuse pour « La Matinale », s’est donné pour mission de pimenter vos chaudes nuits d’été. Cette semaine, on frotte ses fantasmes à ceux des autres à travers la littérature érotique, le dessin de nu ou dans un club libertin."
42,Sud global : Trump fait le jeu de la Chine,https://www.lemonde.fr/idees/article/2025/08/23/sud-global-trump-fait-le-jeu-de-la-chine_6634045_3232.html,,
43,Tous ces livres qu’on accumule et qu’on ne lira jamais : « J’ai fini par comprendre que c’est moins un fardeau qu’une forme de richesse »,https://www.lemonde.fr/series-d-ete/article/2025/08/22/tous-ces-livres-qu-on-accumule-et-qu-on-ne-lira-jamais-j-ai-fini-par-comprendre-que-c-est-moins-un-fardeau-qu-une-forme-de-richesse_6633307_3451060.html,  Par Thomas Chatterton Williams ,
44,"Mort de Jean Pormanove : « La loi ne demande à l’Arcom ni d’apprécier la légalité des contenus mis en ligne par des particuliers, ni d’en solliciter le retrait », rappelle son président, Martin Ajdari",https://www.lemonde.fr/idees/article/2025/08/24/mort-de-jean-pormanove-la-loi-ne-demande-a-l-arcom-ni-d-apprecier-la-legalite-des-contenus-mis-en-ligne-par-des-particuliers-ni-d-en-solliciter-le-retrait-rappelle-son-president-martin-ajdari_6634441_3232.html,,
