,title,subhed,url
0," Military victory, political stalemate: The US's strategic myopia in the Middle East  ","Two weeks after launching the war against Iran alongside Israel, the Trump administration appears not to have anticipated Iranian strikes against neighboring countries, the closure of the Strait of Hormuz or the organized succession within the Iranian regime. It is also becoming clear that the two allies do not share the same priorities.",https://www.lemonde.fr/en/international/article/2026/03/13/military-victory-political-stalemate-the-us-s-strategic-myopia-in-the-middle-east_6751405_4.html
1,"After a soldier killed in Iraq, France confronts the costs of its Middle East engagement",Emmanuel Macron announced the death of a French service member in a drone strike claimed by a pro-Iranian armed group. Six other soldiers were wounded.,https://www.lemonde.fr/en/international/article/2026/03/13/after-a-soldier-killed-in-iraq-france-confronts-the-costs-of-its-middle-east-engagement_6751406_4.html
2,New war in Lebanon is price of international community's silence,"Ever since Israel and Lebanon signed a theoretical truce in November 2024, which Israel never respected, the international community has stayed almost entirely silent, implicitly accepting the rule of force over international law.",https://www.lemonde.fr/en/opinion/article/2026/03/13/new-war-in-lebanon-is-price-of-international-community-s-silence_6751400_23.html
3,"Pritzker Prize honors Chilean Smiljan Radic, architect of interiority","Ten years after Alejandro Aravena, Radic has become the second Chilean to be awarded what is considered the Nobel Prize of architecture.",https://www.lemonde.fr/en/culture/article/2026/03/13/pritzker-prize-honors-chilean-smiljan-radic-architect-of-interiority_6751404_30.html
4,France's far right sets measured ambitions for local elections,"While the Rassemblement National is fielding candidates in 34 municipalities with over 100,000 residents, its highest hopes lie with Perpignan – already under the party's control – Toulon and Nice. It is mainly focusing on medium-sized cities in the northeast and southeast of France, its two traditional strongholds.",https://www.lemonde.fr/en/politics/article/2026/03/13/france-s-far-right-sets-measured-ambitions-for-local-elections_6751407_5.html
5,Hong Kong's complex role in bypassing sanctions against Russia,,https://www.lemonde.fr/en/international/article/2026/03/13/hong-kong-s-complex-role-in-bypassing-sanctions-against-russia_6751398_4.html
6,Middle East wars bring risks and windfalls for TotalEnergies,,https://www.lemonde.fr/en/economy/article/2026/03/13/middle-east-wars-bring-risks-and-windfalls-for-totalenergies_6751394_19.html
7,"Gunman in fatal Virginia university shooting was IS supporter, authorities say",,https://www.lemonde.fr/en/international/article/2026/03/13/gunman-in-fatal-virginia-university-shooting-id-d-as-is-supporter_6751395_4.html
8,"In this northern French town, far-right voters are no longer an 'anomaly'",,https://www.lemonde.fr/en/politics/article/2026/03/13/in-this-northern-french-town-far-right-voters-are-no-longer-an-anomaly_6751401_5.html
9,Paris's museum of medieval art explores unicorns of all kinds,,https://www.lemonde.fr/en/culture/article/2026/03/13/exploring-unicorns-of-all-kinds-at-the-musee-de-cluny_6751399_30.html
10,"'The risk of stagflation returning is low, but that doesn't account for Donald Trump'",,https://www.lemonde.fr/en/opinion/article/2026/03/13/the-risk-of-stagflation-returning-is-low-but-that-doesn-t-account-for-donald-trump_6751396_23.html
11,Polish president vetoes €40 billion EU defense funding plan,,https://www.lemonde.fr/en/international/article/2026/03/12/polish-president-vetoes-40-billion-eu-defense-funding-plan_6751391_4.html
12,Duplantis clears 6.31 meters to set his 15th pole vault world record,,https://www.lemonde.fr/en/sports/article/2026/03/12/duplantis-clears-6-31-meters-to-set-his-15th-pole-vault-world-record_6751392_9.html
13,"Benjamin Netanyahu, a prime minister without checks and balances",,https://www.lemonde.fr/en/international/article/2026/03/12/benjamin-netanyahu-a-prime-minister-without-checks-and-balances_6751356_4.html
14,How Paris mobility transformed under Anne Hidalgo's two terms,,https://www.lemonde.fr/en/politics/article/2026/03/12/how-paris-mobility-transformed-under-anne-hidalgo-s-two-terms_6751371_5.html
15,French cities' steady march toward free public transport,,https://www.lemonde.fr/en/economy/article/2026/03/12/french-cities-steady-march-toward-free-public-transport_6751388_19.html
16,"'Municipal elections pose the greatest risks for culture – except in Paris, which enjoys an extraordinary privilege'",,https://www.lemonde.fr/en/opinion/article/2026/03/12/municipal-elections-pose-the-greatest-risks-for-culture-except-in-paris-which-enjoys-an-extraordinary-privilege_6751382_23.html
17,Jeffrey Epstein's Parisian lives,"Over 18 years, the extremely kitsch property at 22 Avenue Foch served Epstein as a European office, a salon for artists and scientists and, above all, one of the places where he committed his sexual crimes.",https://www.lemonde.fr/en/international/article/2026/03/12/jeffrey-epstein-s-parisian-lives_6751369_4.html
18,"Pete Hegseth, the embodiment of Trump's war in Iran","The US secretary of defense, a former Fox News host, has ardently defended the operation against the Islamic Republic. He has disregarded rules of engagement and boasted about American supremacy.",https://www.lemonde.fr/en/international/article/2026/03/11/pete-hegseth-the-embodiment-of-trump-s-war-in-iran_6751345_4.html
19,The ghosts of the new Chilean president's family,"José Antonio Kast, who will be sworn in on Wednesday, makes no secret of his admiration for Augusto Pinochet's regime. He is less forthcoming about his father's past as a former Wehrmacht soldier and his family's role during the atrocities committed in Paine during the 1973 coup.",https://www.lemonde.fr/en/international/article/2026/03/10/the-ghosts-of-the-new-chilean-president-s-family-stronghold_6751308_4.html
20,The 2026 municipal elections herald a pivotal political period for France,,https://www.lemonde.fr/en/opinion/article/2026/03/13/the-2026-municipal-elections-herald-a-pivotal-political-period-for-france_6751409_23.html
21,'The Iranian people remain the first and last losers of the war in the Middle East',,https://www.lemonde.fr/en/opinion/article/2026/03/12/anoush-ganjipour-philosopher-the-iranian-people-remain-the-first-and-last-losers-of-the-war-in-the-middle-east_6751348_23.html
22,"Dominique Eddé, Lebanese writer: 'The present moment is overwhelming; it is one of destruction. All that remains is to think and to stand tall'",,https://www.lemonde.fr/en/opinion/article/2026/03/10/dominique-edde-lebanese-writer-the-present-moment-is-overwhelming-it-is-one-of-destruction-all-that-remains-is-to-think-and-to-stand-tall_6751298_23.html
