,title,subhed,url,byline
0, Venezuela: How the US spent months preparing the military operation to capture Maduro  ,"Images verified by Le Monde made it possible to reconstruct the US's vast military deployment at sea, on land and in the air in the months leading up to the abduction of the Venezuelan president.",https://www.lemonde.fr/en/international/article/2026/01/07/venezuela-how-the-us-spent-months-preparing-the-military-operation-to-capture-maduro_6749185_4.html,
1,"Iran's regime faces combined pressure from street protests, Israel and US",,https://www.lemonde.fr/en/international/article/2026/01/07/iran-s-regime-faces-combined-pressure-from-street-protests-israel-and-us_6749189_4.html,  By Ghazal Golshiri 
2,French judges alarmed by rumors of potential US sanctions,,https://www.lemonde.fr/en/international/article/2026/01/08/french-judges-alarmed-by-rumors-of-potential-us-sanctions_6749193_4.html,  By Grégoire Biseau (Bordeaux) and Franck Johannès 
3,"In Gaza, the war is creating a new generation of deaf children","According to a survey by a local non-profit organization, 35,000 children and adults have partially or completely lost their hearing during the two years of war that followed the Hamas attack in October 2023.",https://www.lemonde.fr/en/international/article/2026/01/08/in-gaza-the-war-is-creating-a-new-generation-of-deaf-children_6749191_4.html,  By Marie Jo Sader 
4,US immigration officer kills woman in Minneapolis,An officer shot and killed a woman whom US officials accused of trying to run over ICE agents with her vehicle. The city's mayor has called that claim 'bullshit' and demanded that federal immigration agents leave the city.,https://www.lemonde.fr/en/international/article/2026/01/07/us-immigration-officer-kills-woman-in-minneapolis_6749188_4.html,Le Monde with AFP
5,Semyon Bychkov appointed music director of the Opéra national de Paris,"The American-naturalized conductor, aged 73, is succeeding Gustavo Dudamel, who resigned in May 2023.",https://www.lemonde.fr/en/culture/article/2026/01/08/semyon-bychkov-appointed-music-director-of-the-opera-national-de-paris_6749192_30.html,  By Sylvie Kerviel 
6,"Gaza's grandparents, shattered pillars of a traumatized society","Elderly people, whose health is often fragile and mobility reduced, feel as if they are reliving the tragedy of the Nakba, the forced exodus of Palestinians during the creation of Israel in 1948.",https://www.lemonde.fr/en/international/article/2026/01/07/gaza-s-grandparents-shattered-pillars-of-a-traumatized-society_6749187_4.html,  By Marie Jo Sader 
7,"US will control Venezuelan oil sales 'indefinitely,' energy secretary says",,https://www.lemonde.fr/en/international/article/2026/01/07/us-will-control-venezuelan-oil-sales-indefinitely-energy-secretary-says_6749183_4.html,Le Monde with AFP
8,'Whoever controls Greenland influences a key area of European security policy',,https://www.lemonde.fr/en/opinion/article/2026/01/07/whoever-controls-greenland-influences-a-key-area-of-european-security-policy_6749176_23.html,
9,Maduro Kidnapping: 'There is a tragic irony in seeing Donald Trump cast himself as Venezuela's liberator',,https://www.lemonde.fr/en/opinion/article/2026/01/07/kidnapping-of-maduro-there-is-a-tragic-irony-in-seeing-donald-trump-cast-himself-as-venezuela-s-liberator_6749190_23.html,
10,Trump plots offer to buy Greenland as NATO ally Denmark seethes,,https://www.lemonde.fr/en/international/article/2026/01/07/trump-plots-to-buy-greenland-rubio-plans-us-denmark-meeting_6749186_4.html,Le Monde with AFP
11,"Europe yet to give 'clear, unequivocal answer' on Ukraine defense, Zelensky says",,https://www.lemonde.fr/en/international/article/2026/01/07/europe-yet-to-give-clear-unequivocal-answer-on-ukraine-defense-zelensky_6749182_4.html,Le Monde with AFP
12,France bans food imports containing certain pesticides,,https://www.lemonde.fr/en/international/article/2026/01/07/france-bans-food-imports-containing-pesticides-amidst-opposition-to-mercosur-trade-deal_6749181_4.html,Le Monde with AFP
13,US seizes Russian-flagged oil tanker in the Atlantic,,https://www.lemonde.fr/en/international/article/2026/01/07/us-seizes-russian-flagged-oil-tanker-in-the-atlantic_6749177_5.html,Le Monde with AFP
14,"In Paris, Ukraine's allies express hopes and fears over US security guarantees",,https://www.lemonde.fr/en/international/article/2026/01/07/in-paris-ukraine-s-allies-express-hopes-and-fears-over-us-security-guarantees_6749169_4.html,  By Claire Gatinois and Philippe Ricard 
15,Greenland: Europe rejects US threats over sovereignty but finds options limited,,https://www.lemonde.fr/en/international/article/2026/01/07/greenland-europe-rejects-us-threats-over-sovereignty-but-finds-options-limited_6749175_4.html,  By Anne-Françoise Hivert (Malmö (Sweden) correspondent) and Chloé Hoorman 
16,Brigitte Bardot buried in Saint-Tropez as cause of death revealed,,https://www.lemonde.fr/en/france/article/2026/01/07/brigitte-bardot-to-be-buried-in-saint-tropez-as-cause-of-death-revealed_6749165_7.html,Le Monde with AFP
17,French writer sued by family members over novel allegedly depicting them as Nazi collaborators,,https://www.lemonde.fr/en/france/article/2026/01/07/french-writer-sued-by-family-members-over-novel-allegedly-depicting-them-as-nazi-collaborators_6749184_7.html,Le Monde with AFP
18,"Under Trump, the feats of the US military regularly run into the great void of the 'day after'",,https://www.lemonde.fr/en/economy/article/2026/01/07/under-trump-the-feats-of-the-us-military-regularly-run-into-the-great-void-of-the-day-after_6749173_19.html,
19,"'If tomorrow, the US decides to seize Greenland, neither Denmark nor the EU has the means to stop it'","Donald Trump's military operation in Venezuela should show Europeans that the US is a predator for Europe, just like Russia and China, argues former United Nations under-secretary-general Jean-Marie Guéhenno.",https://www.lemonde.fr/en/opinion/article/2026/01/06/if-tomorrow-the-us-decides-to-seize-greenland-neither-denmark-nor-the-eu-has-the-means-to-stop-it_6749149_23.html,
20,"Maduro, the failed heir to Hugo Chavez's Bolivarian Revolution","The Venezuelan president, recently abducted by the US, was chosen by Hugo Chavez as his successor and narrowly elected in 2013. Over 13 years in power, he has eliminated political opposition, tightened control over state institutions and overseen a 70% collapse in GDP as a quarter of Venezuelans fled the country.",https://www.lemonde.fr/en/international/article/2026/01/06/maduro-the-failed-heir-to-hugo-chavez-s-bolivarian-revolution_6749137_4.html,"  By Marie Delcas (Bogota (Colombia), correspondent) "
21,Maduro capture marks new blow to dying international order,Venezuela's allies condemned an 'illegal act of aggression' while countries aligned with the US urged restraint but sought to avoid directly criticizing Donald Trump.,https://www.lemonde.fr/en/international/article/2026/01/04/us-intervention-in-venezuela-marks-new-blow-to-dying-international-order_6749053_4.html,  By Philippe Ricard 
22,EU-Mercosur deal: France's diplomatic gamble falls short,,https://www.lemonde.fr/en/opinion/article/2026/01/07/eu-mercosur-deal-france-s-diplomatic-gamble-falls-short_6749172_23.html,
23,"'Trump and Putin share a common enemy, liberal Europe, but they have two divergent strategic projects'",,https://www.lemonde.fr/en/opinion/article/2026/01/06/trump-and-putin-share-a-common-enemy-liberal-europe-but-they-have-two-divergent-strategic-projects_6749139_23.html,
24,"'A spirit of reconquest has taken hold in Washington, particularly driven by Secretary of State Marco Rubio'",,https://www.lemonde.fr/en/opinion/article/2026/01/06/a-spirit-of-reconquest-has-taken-hold-in-washington-particularly-driven-by-secretary-of-state-marco-rubio_6749152_23.html,
