,title,subhed,url
0, Strait of Hormuz becomes site of asymmetric naval war with uncertain outcome  ,"Despite the military might of the US, which has sent two aircraft carriers to the region, Iran has the capability to disrupt operations with its drones and the threat of mines, which, for now, are enough to block navigation through the strategic maritime passage.",https://www.lemonde.fr/en/international/article/2026/03/19/strait-of-hormuz-becomes-site-of-asymmetric-naval-war-with-uncertain-outcome_6751599_4.html
1,"Attacks on Gulf energy facilities intensify, fueling fears of a 'gas war'",,https://www.lemonde.fr/en/international/article/2026/03/19/attacks-on-gulf-energy-facilities-intensify-fueling-fears-of-a-gas-war_6751601_4.html
2,Paris mayoral frontrunner Grégoire faces fierce attacks from rivals in debate,,https://www.lemonde.fr/en/politics/article/2026/03/19/paris-mayoral-frontrunner-gregoire-faces-fierce-attacks-from-rivals-in-debate_6751591_5.html
3,How Budapest became a hub for Western nationalists under Viktor Orban,"The Hungarian capital, popular among hard-right circles in the West, is home to a number of think tanks and conferences promoting the image of Prime Minister Viktor Orban with the approach of the legislative elections on April 12.",https://www.lemonde.fr/en/international/article/2026/03/19/how-budapest-became-a-hub-for-western-nationalists-under-viktor-orban_6751589_4.html
4,Anger erupts in Sicily after US Navy helicopters land in a protected area,"Local officials condemned the use of military aircraft on a UNESCO-listed site, highlighting the ambiguity of Giorgia Meloni's stance on the war waged by the US and Israel.",https://www.lemonde.fr/en/international/article/2026/03/19/in-sicily-anger-erupts-after-us-navy-helicopters-land-in-a-protected-area_6751579_4.html
5,French far right failed to confirm local gains in mid-sized cities,Almost all the medium-sized cities where Marine Le Pen's Rassemblement National party has made significant gains since 2014 are concentrated in the north and along the Mediterranean coast.,https://www.lemonde.fr/en/politics/article/2026/03/19/french-far-right-failed-to-confirm-local-gains-in-mid-sized-cities_6751588_5.html
6,"Yazidi genocide trial: Sabri Essid, the 'monster' husband who became a slave owner","On Wednesday, the French jihadist's ex-wife told the court about the man he had been before he turned to jihad. In France, she was the first woman to suffer his violence and perversion. Then, in Syria, the terrorist found the ideal environment to freely unleash his desire to dominate.",https://www.lemonde.fr/en/france/article/2026/03/19/yazidi-genocide-trial-sabri-essid-the-monster-husband-who-became-a-slave-owner_6751596_7.html
7,"Iran 'boycotting' United States but not World Cup, says football federation chief",,https://www.lemonde.fr/en/international/article/2026/03/19/iran-boycotting-united-states-but-not-world-cup-says-football-federation-chief_6751594_4.html
8,UK meningitis outbreak cases rise to at least 27,,https://www.lemonde.fr/en/health/article/2026/03/19/uk-meningitis-outbreak-cases-rise-to-at-least-27_6751605_14.html
9,Claude Le Roy: 'CAF has completely lost its mind with this absurd decision' to strip Senegal of title,,https://www.lemonde.fr/en/le-monde-africa/article/2026/03/19/caf-has-completely-lost-its-mind-with-this-absurd-decision-denounces-claude-le-roy-after-morocco-s-victory-at-afcon-is-announced_6751583_124.html
10,"FBI probing counterterrorism official who quit over Iran war, US media reports",,https://www.lemonde.fr/en/international/article/2026/03/19/fbi-probing-counterterrorism-official-who-quit-over-iran-war-us-media-reports_6751597_4.html
11,Display cases remain empty at Paris exhibit disrupted by Lebanon war,,https://www.lemonde.fr/en/culture/article/2026/03/19/at-the-arab-world-institute-an-exhibition-on-byblos-lebanon-s-millennia-old-city-loses-key-artwork-due-to-war_6751584_30.html
12,"French singer Patrick Bruel faces rape inquiry, says prosecutor",,https://www.lemonde.fr/en/police-and-justice/article/2026/03/19/french-singer-patrick-bruel-faces-rape-inquiry-says-prosecutor_6751582_105.html
13,US Fed raises inflation forecast over 'uncertain' Iran war impact,,https://www.lemonde.fr/en/economy/article/2026/03/18/us-fed-raises-inflation-outlook-over-uncertain-iran-war-impact_6751577_19.html
14,"Belgian court set to rule on farmer's lawsuit against TotalEnergies, but will wait for French justice first",,https://www.lemonde.fr/en/environment/article/2026/03/19/belgian-court-set-to-rule-on-farmer-s-lawsuit-against-totalenergies-but-will-wait-for-french-justice-first_6751581_114.html
15,"Barcelona, Liverpool, Bayern and Atlético move to Champions League quarter-finals",,https://www.lemonde.fr/en/international/article/2026/03/19/barcelona-liverpool-bayern-and-atletico-move-to-champions-league-quarter-finals_6751585_4.html
16,Rosalía launches her world tour in Lyon,,https://www.lemonde.fr/en/culture/article/2026/03/18/rosal-a-launches-her-world-tour-in-lyon_6751547_30.html
17,Macron reveals 'Free France' as name of new aircraft carrier,,https://www.lemonde.fr/en/france/article/2026/03/18/macron-reveals-free-france-as-name-of-new-aircraft-carrier_6751572_7.html
18,"Shahed drones, the symbol of Russia-Iran cooperation",,https://www.lemonde.fr/en/international/article/2026/03/18/shahed-drones-are-a-symbol-of-cooperation-between-tehran-and-moscow_6751549_4.html
19,"In Paris, Reza Pahlavi, son of Iran's last shah, builds his network","Reza Pahlavi has been based in the French capital since the US-Israeli strikes on Iran started, making moves in anticipation of the Islamic Republic's fall.",https://www.lemonde.fr/en/m-le-mag/article/2026/03/18/in-paris-reza-pahlavi-heir-to-iran-s-last-shah-builds-his-network_6751573_117.html
20,Five takeaways from the first round of French local elections,"The 2026 municipal elections have already concluded in the vast majority of French towns, with a mayor being directly elected in the first round. In larger cities, however, the right and the Socialists are in the lead for the second round.",https://www.lemonde.fr/en/les-decodeurs/article/2026/03/17/2026-municipal-elections-five-key-takeaways-from-the-first-round_6751512_8.html
21,Violence in restaurant kitchens exposes deep wounds in fine dining,The recent allegations against renowned Danish chef René Redzepi highlight the urgent need for a profound overhaul of management practices in the restaurant industry. Initiatives are spreading in France to break the silence surrounding abuse in the sector.,https://www.lemonde.fr/en/opinion/article/2026/03/17/violence-in-restaurant-kitchens-exposes-deep-wounds-in-fine-dining_6751540_23.html
22,Europeans' justified mistrust in Trump's war in Iran,,https://www.lemonde.fr/en/opinion/article/2026/03/19/europeans-justified-mistrust-in-trump-s-war-in-iran_6751604_23.html
23,'The war scripted by Trump is being tested by an Iranian regime determined to survive at any cost',,https://www.lemonde.fr/en/opinion/article/2026/03/18/the-war-as-scripted-by-donald-trump-is-now-being-tested-by-an-iranian-regime-that-is-determine-to-survive-at-any-cost_6751555_23.html
24,France's national political crisis is taking root locally,,https://www.lemonde.fr/en/opinion/article/2026/03/17/france-s-national-political-crisis-is-taking-root-locally_6751535_23.html
