,title,subhed,url
0," Jordan Bardella, a princess and 'Paris Match': The story of a PR gamble  ",The relationship between Marine Le Pen's lieutenant and an aristocratic student raised in the international jet set made the front page of 'Paris Match.' The media empire of Vincent Bolloré has seized the opportunity to 'glamorize' the likely far-right presidential candidate.,https://www.lemonde.fr/en/politics/article/2026/04/13/jordan-bardella-and-maria-carolina-of-bourbon-two-sicilies-the-story-of-a-media-gamble_6752380_5.html
1,Trump vows US will 'eliminate' any Iranian ships that approach blockade,,https://www.lemonde.fr/en/international/article/2026/04/13/trump-vows-us-will-eliminate-any-iranian-ships-that-approach-blockade_6752381_4.html
2,"French court condemns 'organized, opaque and illegal' terrorist funding system in Lafarge trial",,https://www.lemonde.fr/en/france/article/2026/04/14/french-court-condemns-organized-opaque-and-illegal-terrorist-funding-system-in-lafarge-trial_6752386_7.html
3,"With Orban's defeat, the French far right loses a key ally",Hungary's election outcome strips the Rassemblement National of a vital partner in its ideological war against the European Commission.,https://www.lemonde.fr/en/politics/article/2026/04/13/with-orban-s-defeat-the-french-far-right-loses-a-key-ally_6752378_5.html
4,Spanish Prime Minister Pedro Sanchez's wife charged with corruption,"A judge formally charged Begona Gomez with embezzlement, influence peddling, corruption in business dealings and misappropriation of funds. It is now up to the courts to decide whether she will stand trial.",https://www.lemonde.fr/en/international/article/2026/04/14/spanish-prime-minister-pedro-sanchez-s-wife-charged-with-corruption_6752383_4.html
5,Quebec's maple syrup harvest weakened by climate change,"As the world's leading producer of maple syrup, Quebec is working to better adapt its industry to increasingly unpredictable climate conditions.",https://www.lemonde.fr/en/environment/article/2026/04/13/quebec-s-maple-syrup-harvest-weakened-by-climate-change_6752379_114.html
6,Will California's next governor be a Republican?,The crowded field of Democratic candidates running in the gubernatorial election raises the possibility that a Trump-aligned Republican could win in November in this deeply progressive state.,https://www.lemonde.fr/en/international/article/2026/04/14/will-california-s-next-governor-be-a-republican_6752385_4.html
7,"'Enough of war!': Pope Leo XIV publicly opposes Trump, who fiercely criticizes him in return",,https://www.lemonde.fr/en/international/article/2026/04/13/enough-of-war-pope-leo-xiv-publicly-opposes-trump-who-fiercely-criticizes-him-in-return_6752364_4.html
8,Fugitive former Brazilian intelligence chief detained by US immigration,,https://www.lemonde.fr/en/international/article/2026/04/14/fugitive-former-brazilian-intelligence-chief-detained-by-us-immigration_6752384_4.html
9,Lebanon divided over prospect of talks with Israel,,https://www.lemonde.fr/en/international/article/2026/04/13/lebanon-divided-over-prospect-of-talks-with-israel_6752368_4.html
10,Parenting: Why the morning rush drives us crazy,,https://www.lemonde.fr/en/intimacy/article/2026/04/13/parenting-why-the-morning-rush-drives-us-crazy_6752376_310.html
11,Russian and Belarusian swimmers free to compete under their own flag,,https://www.lemonde.fr/en/sports/article/2026/04/13/russian-and-belarusian-swimmers-free-to-compete-under-their-own-flag_6752382_9.html
12,The EU-related reforms awaiting Hungary's Péter Magyar,,https://www.lemonde.fr/en/international/article/2026/04/13/the-eu-related-reforms-awaiting-hungary-s-peter-magyar_6752371_4.html
13,Trump's threat to blockade Strait of Hormuz leaves more questions than answers,,https://www.lemonde.fr/en/international/article/2026/04/13/trump-s-threat-to-blockade-strait-of-hormuz-leaves-more-questions-than-answers_6752365_4.html
14,Lafarge ex-CEO sentenced to six years in prison for funding jihadists in Syria,,https://www.lemonde.fr/en/syria/article/2026/04/13/french-court-rules-cement-company-lafarge-guilty-of-funding-syria-jihadists_6752366_229.html
15,Hungary's Magyar vows to bring in 'new era',,https://www.lemonde.fr/en/international/article/2026/04/13/hungary-s-pm-elect-magyar-vows-to-bring-in-new-era_6752373_4.html
16,French lawmakers to debate bill to return looted colonial-era art,,https://www.lemonde.fr/en/france/article/2026/04/13/french-lawmakers-to-debate-bill-to-return-colonial-era-art_6752358_7.html
17,French foreign minister revives old argument defending Israel's moral superiority,,https://www.lemonde.fr/en/france/article/2026/04/13/french-foreign-minister-revives-old-argument-defending-israel-s-moral-superiority_6752372_7.html
18,Taylor Swift announces 12th album 'The Life of a Showgirl' for 'pre pre-order',,https://www.lemonde.fr/en/culture/article/2025/08/12/taylor-swift-announces-12th-album-the-life-of-a-showgirl-for-pre-pre-order_6744286_30.html
19,"Pope embarks on African tour, a strategic continent for Catholicism","From April 13 to 23, Pope Léon XIV is set to visit Algeria, Cameroon, Angola and Equatorial Guinea. The trip symbolizes the shift in the center of gravity of the Catholic Church, whose future now lies in Africa.",https://www.lemonde.fr/en/le-monde-africa/article/2026/04/12/pope-embarks-on-african-tour-a-strategic-continent-for-catholicism_6752335_124.html
20,Hungary celebrates 'return to Europe' after Orban's crushing electoral defeat,"Péter Magyar's party, Tisza, won more than 53% of the vote in the legislative elections, far ahead of the prime minister's Fidesz, which managed barely 38%. Tisza is expected to secure 138 out of the 199 seats in Parliament, giving it a constitutional supermajority.",https://www.lemonde.fr/en/international/article/2026/04/13/hungary-celebrates-return-to-europe-after-orban-s-crushing-electoral-defeat_6752356_4.html
21,"Chambord, the second-most visited château in France, strives to fund much-needed renovation","The director of the Loire Valley estate, Pierre Dubreuil, has launched a large-scale crowdfunding campaign aimed at the general public in order to complete the renovation budget.",https://www.lemonde.fr/en/france/article/2026/04/12/chambord-the-second-most-visited-chateau-in-france-strives-to-fund-much-needed-renovation_6752332_7.html
22,"'Far from modernizing Hungary, Orban's economic policy has led the country into a dead end'",,https://www.lemonde.fr/en/opinion/article/2026/04/13/far-from-modernizing-hungary-orban-s-economic-policy-has-led-the-country-into-a-dead-end_6752357_23.html
23,"Thomas Piketty: '1789, 1945, 2026: Three French debt crises'",,https://www.lemonde.fr/en/opinion/article/2026/04/11/thomas-piketty-1789-1945-2026-three-french-debt-crises_6752307_23.html
24,"'Lebanon's resilience is celebrated, as if survival were admirable rather than imposed'",,https://www.lemonde.fr/en/opinion/article/2026/04/13/lebanon-s-resilience-is-celebrated-as-if-survival-were-admirable-rather-than-imposed_6752377_23.html
