,title,url,byline,subhed
0,"Le Bitcoin dépasse 124 000 dollars, un nouveau record porté par Wall Street et la législation américaine",https://www.lemonde.fr/economie/article/2025/08/14/le-bitcoin-depasse-124-000-dollars-un-nouveau-record-porte-par-wall-street-et-la-legislation-americaine_6629256_3234.html,Le Monde avec AFP,
1,Les nombreuses analogies entre les Etats-Unis de Trump et ceux des « barons voleurs » de 1890,https://www.lemonde.fr/economie/article/2025/08/04/richesse-monopoles-corruption-l-amerique-de-donald-trump-est-elle-revenue-en-1890_6626445_3234.html,  Par Philippe Escande ,
2,"Pour les entreprises françaises, une reprise des fusions et acquisitions est attendue dès la rentrée",https://www.lemonde.fr/economie/article/2025/08/14/pour-les-entreprises-francaises-une-reprise-des-fusions-et-acquisitions-est-attendue-des-la-rentree_6629389_3234.html,,
3,"« Les racines du mal budgétaire français sont à chercher au-delà de nos frontières, dans l’échec d’un système fiscal international à bout de souffle »",https://www.lemonde.fr/idees/article/2025/08/13/les-racines-du-mal-budgetaire-francais-sont-a-chercher-au-dela-de-nos-frontieres-dans-l-echec-d-un-systeme-fiscal-international-a-bout-de-souffle_6629005_3232.html,,
4,VIDEO | L’Europe en proie aux incendies,https://www.lemonde.fr/international/video/2025/08/13/video-l-europe-en-proie-aux-incendies_6629027_3210.html,  Par Service vidéo du Monde ,
5,Guerre en Ukraine : « Tout ce qui concerne l’Ukraine doit être discuté avec l’Ukraine »,https://www.lemonde.fr/international/video/2025/08/13/guerre-en-ukraine-tout-ce-qui-concerne-l-ukraine-doit-etre-discute-avec-l-ukraine_6629054_3210.html,  Par Service vidéo du Monde ,
6,"En Russie, des jeunes femmes africaines contraintes de fabriquer des drones de combat",https://www.lemonde.fr/afrique/video/2025/08/13/en-russie-des-jeunes-femmes-africaines-contraintes-de-fabriquer-des-drones-de-combat_6629046_3212.html,  Par Thomas Eydoux et Marceau Bretonnier (motion design) ,
7,Hiroshima : comment s’est déroulé le bombardement atomique le plus dévastateur de l’histoire,https://www.lemonde.fr/histoire/video/2025/08/02/hiroshima-comment-s-est-deroule-le-bombardement-atomique-le-plus-devastateur-de-l-histoire_6626343_4655323.html,  Par Karim El Hadj et Adrien Vande Casteele ,
8,Nouvelle-Calédonie : un accord à remettre sur le métier,https://www.lemonde.fr/idees/article/2025/08/14/nouvelle-caledonie-un-accord-a-remettre-sur-le-metier_6629460_3232.html,,
9,« Je ne résiste pas à l’envie de demander à André Comte-Sponville : “A quoi penses-tu quand tu fais un pot-au-feu ?” »,https://www.lemonde.fr/series-d-ete/article/2025/08/14/je-ne-resiste-pas-a-l-envie-de-demander-a-andre-comte-sponville-a-quoi-penses-tu-quand-tu-fais-un-pot-au-feu_6629390_3451060.html,,
10,"Pour les entreprises françaises, une reprise des fusions et acquisitions est attendue dès la rentrée",https://www.lemonde.fr/economie/article/2025/08/14/pour-les-entreprises-francaises-une-reprise-des-fusions-et-acquisitions-est-attendue-des-la-rentree_6629389_3234.html,,
11,Avoirs russes : « Un “prêt de réparation” à l’Ukraine constituerait une avance sur l’obligation du Kremlin de payer des dommages de guerre »,https://www.lemonde.fr/idees/article/2025/08/14/avoirs-russes-un-pret-de-reparation-a-l-ukraine-constituerait-une-avance-sur-l-obligation-du-kremlin-de-payer-des-dommages-de-guerre_6629504_3232.html,,
12,"Avec « En boucle », Junta Yamaguchi fait tourner un manège cinématographique follement ludique",https://www.lemonde.fr/culture/article/2025/08/13/avec-en-boucle-junta-yamaguchi-fait-tourner-un-manege-cinematographique-follement-ludique_6629019_3246.html,  Par Murielle Joudet ,
13,"La mort de Sonallah Ibrahim, éternel frondeur de la littérature arabe",https://www.lemonde.fr/disparitions/article/2025/08/14/la-mort-de-sonallah-ibrahim-eternel-frondeur-de-la-litterature-arabe_6629533_3382.html,"  Par Laure Stephan (Beyrouth, correspondance) ",
14,"« Journal de la bombe, une vie atomique », sur France Culture : une série d’été détonante écrite à la première personne",https://www.lemonde.fr/culture/article/2025/08/06/journal-de-la-bombe-une-vie-atomique-sur-france-culture-une-serie-d-ete-detonante-ecrite-a-la-premiere-personne_6627129_3246.html,  Par Emilie Grangeray ,
15,"Le nouvel album de Taylor Swift, « The Life of a Showgirl », sortira le 3 octobre",https://www.lemonde.fr/culture/article/2025/08/14/le-nouvel-album-de-taylor-swift-the-life-of-a-showgirl-sortira-le-3-octobre_6629223_3246.html,Le Monde avec AFP,
16,La radio à l’ancienne toujours fidèle au poste,https://www.lemonde.fr/m-styles/article/2025/08/11/la-radio-a-l-ancienne-toujours-fidele-au-poste_6628186_4497319.html,  Par Sabine Maida ,
17,La Corée du Sud bouscule le marché de la beauté,https://www.lemonde.fr/economie/article/2025/08/11/la-coree-du-sud-bouscule-le-marche-de-la-beaute_6628049_3234.html,  Par Juliette Garnier ,
18,"Lucile Viaud, designer en Bretagne : la fibre du verre",https://www.lemonde.fr/series-d-ete/article/2025/08/10/lucile-viaud-designer-en-bretagne-la-fibre-du-verre_6627940_3451060.html,,
19,Pourquoi les attrape-peluches de fête foraine nous rendent aussi gagas,https://www.lemonde.fr/les-decodeurs/article/2025/08/10/pourquoi-les-attrape-peluches-de-fete-foraine-nous-rendent-aussi-gagas_6627656_4355770.html,  Par William Audureau ,
20," En Israël, l’extrême droite veut valider un projet de colonie qui couperait la Cisjordanie en deux  ",https://www.lemonde.fr/international/article/2025/08/14/en-israel-l-extreme-droite-veut-valider-un-projet-de-colonie-qui-couperait-la-cisjordanie-en-deux_6629539_3210.html,"  Par Luc Bronner (Jérusalem, correspondant) ","Le ministre des finances, Bezalel Smotrich, qui plaide pour la construction des 3 000 logements de la colonie E1, juge qu’elle porterait un « coup de grâce » à la possibilité d’un Etat palestinien."
21,"En direct, guerre en Ukraine : Donald Trump souhaite une réunion tripartite « très rapidement » dans laquelle Vladimir Poutine et Volodymyr Zelensky « passeront un accord »",https://www.lemonde.fr/international/live/2025/08/15/en-direct-guerre-en-ukraine-donald-trump-souhaite-une-reunion-tripartite-tres-rapidement-dans-laquelle-vladimir-poutine-et-volodymyr-zelensky-passeront-un-accord_6627648_3210.html,,
22,"Canicule : les températures supérieures à 40 °C, autrefois exceptionnelles en France, se banalisent avec le réchauffement climatique",https://www.lemonde.fr/planete/article/2025/08/14/canicule-les-temperatures-superieures-a-40-c-autrefois-exceptionnelles-en-france-se-banalisent-avec-le-rechauffement-climatique_6629528_3244.html,  Par Matthieu Goar ,
23,La machine anti-immigration de Donald Trump s’active au cœur de New York,https://www.lemonde.fr/international/video/2025/08/14/la-machine-anti-immigration-de-donald-trump-s-active-au-c-ur-de-new-york_6629527_3210.html,"  Par Brieuc Beckers, Adrien Vande Casteele (motion design) et Fanny Zarifi ","Depuis le début du mois de mai 2025, l’agence fédérale de l’immigration multiplie les arrestations de migrants dans les tribunaux administratifs de New York. Une « politique de la terreur » fortement critiquée par les avocats présents sur place."
24,Pollution aux plastiques : les négociations pour aboutir à un éventuel traité mondial repoussées à vendredi,https://www.lemonde.fr/planete/article/2025/08/15/pollution-aux-plastiques-les-negociations-pour-aboutir-a-un-eventuel-traite-mondial-repoussees-a-vendredi_6629577_3244.html,Le Monde avec AFP,La séquence de discussion tenue à Genève devait prendre fin jeudi soir. De profondes divisions demeurent entre les pays dits à forte ambition et ceux essentiellement pétroliers qui refusent toute contrainte sur la production de plastique.
25,"L’histoire inédite de « Lydia Tows », espionne du KGB infiltrée en France mais jamais démasquée",https://www.lemonde.fr/international/article/2025/08/14/inflitree-mais-jamais-demasquee-l-histoire-inedite-d-une-espionne-du-kgb-en-france_6629170_3210.html,,"A l’issue d’une enquête dans les archives et auprès de témoins, « Le Monde » a reconstitué le parcours, totalement méconnu, de « Lydia Tows », une agente russe décédée à Paris en 1999. En association avec un policier français, elle mena durant des décennies une mission d’infiltration aux effets dévastateurs."
26,"David Grossman, écrivain israélien : « Je cherche à me ménager un accès direct au cœur de l’incendie »",https://www.lemonde.fr/series-d-ete/article/2025/08/14/david-grossman-je-cherche-a-me-menager-un-acces-direct-au-c-ur-de-l-incendie_6629221_3451060.html,  Propos recueillis par Nicolas Weill ,"« Ecrire, quand ça commence, quand ça finit » (5/5). Le romancier et intellectuel de gauche israélien évoque la nécessité vitale qu’est pour lui, depuis plus de quarante ans, l’écriture, et son rapport central à la politique."
27,"En direct, Gaza : le point sur la situation",https://www.lemonde.fr/international/live/2025/08/15/en-direct-gaza-le-point-sur-la-situation_6628849_3210.html,,
28,"Portugal, Grèce, Albanie, Espagne : l’Europe du Sud en proie aux incendies et à la canicule",https://www.lemonde.fr/planete/article/2025/08/14/portugal-grece-albanie-espagne-l-europe-du-sud-en-proie-aux-incendies-et-a-la-canicule_6629499_3244.html,Le Monde avec AFP,
29,"Pharmaciens en colère : neuf officines sur dix fermées samedi 16 août, selon un de leur principaux syndicats",https://www.lemonde.fr/societe/article/2025/08/14/pharmaciens-en-colere-neuf-officines-sur-dix-fermees-samedi-16-aout-selon-un-syndicat_6629520_3224.html,Le Monde avec AFP,
30,"Contre les téléchargements illégaux de fichiers musicaux, une riposte bien orchestrée",https://www.lemonde.fr/series-d-ete/article/2025/08/14/contre-les-telechargements-illegaux-de-fichiers-musicaux-une-riposte-bien-orchestree_6629536_3451060.html,  Par Pierre Trouvé ,
31,Guerre de décolonisation du Cameroun  : « Emmanuel Macron est très en deçà de ce qu’on pouvait attendre »,https://www.lemonde.fr/afrique/article/2025/08/14/guerre-de-decolonisation-du-cameroun-emmanuel-macron-est-tres-en-deca-de-ce-qu-on-pouvait-attendre_6629535_3212.html,  Par Mathilde Boussion ,
32,"Hipgnosis, le duo de graphistes qui a fait des disques de Pink Floyd des œuvres d’art",https://www.lemonde.fr/series-d-ete/article/2025/08/14/hipgnosis-le-duo-de-graphistes-qui-a-fait-des-disques-de-pink-floyd-des-uvres-d-art_6629517_3451060.html,,
33,Le Mexique accentue sa coopération avec les Etats-Unis sur le narcotrafic,https://www.lemonde.fr/international/article/2025/08/14/le-mexique-accentue-sa-cooperation-avec-les-etats-unis-sur-le-narcotrafic_6629512_3210.html,"  Par Anne Vigna (Mexico, correspondante) ",
34,"Au Honduras, l’état d’urgence en vigueur depuis 2022 a entraîné des violences et des abus de pouvoir, selon une ONG",https://www.lemonde.fr/international/article/2025/08/14/au-honduras-l-etat-d-urgence-en-vigueur-depuis-2022-a-entraine-des-violences-et-des-abus-de-pouvoir-selon-une-ong_6629543_3210.html,Le Monde avec AFP,
35,Un olivier rendant hommage à Ilan Halimi abattu à Epinay-sur-Seine,https://www.lemonde.fr/societe/article/2025/08/14/un-olivier-rendant-hommage-a-ilan-halimi-abattu-a-epinay-sur-seine_6629542_3224.html,Le Monde avec AFP,
36,Mali : le djihad économique d’Al-Qaida pour « asphyxier » Bamako,https://www.lemonde.fr/afrique/article/2025/08/14/mali-le-djihad-economique-d-al-qaida-pour-asphyxier-bamako_6629532_3212.html,  Par Seydou Nomoko ,
37,"Aux urgences, l’IA peut aider les médecins face aux traumatisés sévères",https://www.lemonde.fr/sciences/article/2025/08/14/aux-urgences-l-ia-peut-aider-les-medecins-face-aux-traumatises-severes_6629509_1650684.html,  Par Anaëlle Charlier ,
38,"Quatre corps découverts dans la Seine, à Choisy-le-Roi ",https://www.lemonde.fr/societe/article/2025/08/14/quatre-corps-decouverts-dans-la-seine-a-choisy-le-roi_6629531_3224.html,Le Monde avec AFP,
39,"A la veille du sommet Trump-Poutine en Alaska, l’amertume des Ukrainiens",https://www.lemonde.fr/international/article/2025/08/14/a-la-veille-du-sommet-trump-poutine-en-alaska-l-amertume-des-ukrainiens_6629211_3210.html,"  Par Thomas d’Istria (Kiev, correspondant) ","Les menaces de Washington contre Moscou ne sont plus prises au sérieux en Ukraine et l’absence de Volodymyr Zelensky à la rencontre entre les présidents américain et russe, vendredi 15 août, choque. La conviction à Kiev est que la Russie ne renoncera jamais à prendre le contrôle de tout le pays et à décider de son avenir."
40,"Françoise Thom, historienne : « Face à Vladimir Poutine, les Européens sont en position de force, mais ils ne le savent pas »",https://www.lemonde.fr/idees/article/2025/08/13/francoise-thom-face-a-vladimir-poutine-les-europeens-sont-en-position-de-force-mais-ils-ne-le-savent-pas_6628776_3232.html,,"L’administration Trump est en train de réaliser le sauvetage du régime russe, dont elle a besoin pour racketter l’Europe, estime, dans une tribune au « Monde », la spécialiste de la Russie, à deux jours de la rencontre entre Donald Trump et Vladimir Poutine."
41,"L’état de santé des enfants se dégrade rapidement aux Etats-Unis, creusant l’écart avec les pays à haut revenu",https://www.lemonde.fr/planete/article/2025/08/14/l-etat-de-sante-des-enfants-se-degrade-rapidement-aux-etats-unis-creusant-l-ecart-avec-les-pays-a-haut-revenu_6629505_3244.html,  Par Stéphane Foucart ,"Le large panorama de la santé pédiatrique outre-Atlantique, dressé par une étude publiée dans l’édition du mardi 12 août du « Journal of the American Medical Association » (« JAMA »), a tous les traits d’une catastrophe invisible."
42,Nouvelle-Calédonie : un accord à remettre sur le métier,https://www.lemonde.fr/idees/article/2025/08/14/nouvelle-caledonie-un-accord-a-remettre-sur-le-metier_6629460_3232.html,,
43,« Je ne résiste pas à l’envie de demander à André Comte-Sponville : “A quoi penses-tu quand tu fais un pot-au-feu ?” »,https://www.lemonde.fr/series-d-ete/article/2025/08/14/je-ne-resiste-pas-a-l-envie-de-demander-a-andre-comte-sponville-a-quoi-penses-tu-quand-tu-fais-un-pot-au-feu_6629390_3451060.html,,
44,"Le succès de la revue « Le Grand Continent », qui engrange les abonnés",https://www.lemonde.fr/economie/article/2025/08/12/le-succes-de-la-revue-le-grand-continent-qui-engrange-les-abonnes_6628529_3234.html,  Par Aude Dassonville ,
