,title,url,byline,subhed
164,Prison avec sursis pour d’anciens cadres d’Ubisoft : une décision qui devrait faire jurisprudence  ,https://www.lemonde.fr/pixels/article/2025/07/02/prison-avec-sursis-pour-d-anciens-cadres-d-ubisoft-une-decision-qui-devrait-faire-jurisprudence_6617447_4408996.html,"  Par Sofia Fischer (Nice, correspondance) ",
165,"Intelligence artificielle : les échanges aigres-doux entre Sam Altman et Mark Zuckerberg, nouveaux rivaux de la tech  ",https://www.lemonde.fr/economie/article/2025/07/02/intelligence-artificielle-les-echanges-aigres-doux-entre-sam-altman-et-mark-zuckerberg-nouveaux-rivaux-de-la-tech_6617423_3234.html,  Par Alexandre Piquard ,
166,Harcèlement chez Ubisoft : trois anciens cadres condamnés à des peines allant jusqu’à trois ans de prison avec sursis  ,https://www.lemonde.fr/pixels/article/2025/07/02/harcelement-chez-ubisoft-trois-anciens-cadres-condamnes-a-des-peines-allant-jusqu-a-trois-ans-de-prison-avec-sursis_6617387_4408996.html,Le Monde avec AFP,
167," Intelligence artificielle : les échanges aigres-doux entre Sam Altman et Mark Zuckerberg, nouveaux rivaux de la tech ",https://www.lemonde.fr/economie/article/2025/07/02/intelligence-artificielle-les-echanges-aigres-doux-entre-sam-altman-et-mark-zuckerberg-nouveaux-rivaux-de-la-tech_6617423_3234.html,  Par Alexandre Piquard ,
168,"L’utilisation de ChatGPT aurait des conséquences sur le fonctionnement cérébral, selon une étude du MIT  ",https://www.lemonde.fr/sciences/article/2025/07/01/l-utilisation-de-chatgpt-pourrait-influencer-nos-capacites-cognitives_6617187_1650684.html,  Par Laure Belot ,
169,"L’utilisation de ChatGPT aurait des conséquences sur le fonctionnement cérébral, selon une étude du MIT  ",https://www.lemonde.fr/sciences/article/2025/07/01/l-utilisation-de-chatgpt-pourrait-influencer-nos-capacites-cognitives_6617187_1650684.html,  Par Laure Belot ,
170,"Le grand oral du bac à l’ère de ChatGPT : « Dès qu’on creuse sur les connaissances ou l’argumentation, il n’y a plus personne »  ",https://www.lemonde.fr/campus/article/2025/06/30/bac-2025-le-grand-oral-a-l-epreuve-de-chatgpt_6616944_4401467.html,  Par Sylvie Lecherbonnier ,
171,"Dans les démocraties, la reconnaissance faciale gagne du terrain face au vide législatif  ",https://www.lemonde.fr/international/article/2025/06/28/dans-les-democraties-la-reconnaissance-faciale-gagne-du-terrain-face-au-vide-legislatif_6616255_3210.html,"  Par Julie Zaugg  (Londres, correspondance) ",
172,"La reconnaissance faciale, puissant outil de contrôle et de répression dans les régimes autoritaires  ",https://www.lemonde.fr/international/article/2025/06/28/la-reconnaissance-faciale-puissant-outil-de-controle-et-de-repression-dans-les-regimes-autoritaires_6616221_3210.html,,
173,"La reconnaissance faciale, puissant outil de contrôle et de répression dans les régimes autoritaires  ",https://www.lemonde.fr/international/article/2025/06/28/la-reconnaissance-faciale-puissant-outil-de-controle-et-de-repression-dans-les-regimes-autoritaires_6616221_3210.html,,
174,Droit d’auteur : les entreprises d’IA remportent deux victoires judiciaires partielles aux Etats-Unis  ,https://www.lemonde.fr/pixels/article/2025/06/25/droit-d-auteur-un-tribunal-americain-accorde-une-victoire-partielle-a-la-societe-d-ia-anthropic_6615902_4408996.html,  Par Alexandre Piquard ,
175,La vision artificielle rattrapée par la physique  ,https://www.lemonde.fr/sciences/article/2025/06/25/la-vision-artificielle-rattrapee-par-la-physique_6615859_1650684.html,,
176,« Le déclin de la couverture vaccinale aux Etats-Unis peut et va avoir des conséquences planétaires »,https://www.lemonde.fr/idees/article/2025/07/02/le-declin-de-la-couverture-vaccinale-aux-etats-unis-peut-et-va-avoir-des-consequences-planetaires_6617406_3232.html,,
177,"« Quand nous en sommes rendus à déscolariser des milliers d’enfants parce qu’on cuit, il est l’heure d’agir »",https://www.lemonde.fr/idees/article/2025/07/02/canicule-quand-nous-en-sommes-rendus-a-descolariser-des-milliers-d-enfants-parce-qu-on-cuit-il-est-l-heure-d-agir_6617384_3232.html,,
178,"Christophe Cailleaux et Amélie Hart, enseignants : « Le ministère de l’éducation nationale s’émeut de la “catastrophe” du numérique tout en l’entretenant »",https://www.lemonde.fr/idees/article/2025/07/02/christophe-cailleaux-et-amelie-hart-enseignants-le-ministere-de-l-education-nationale-s-emeut-de-la-catastrophe-du-numerique-tout-en-l-entretenant_6617369_3232.html,,
179," Vendre ou consolider ? Le dilemme des clubs avec leur section féminine, variable d’ajustement de la crise du football français ",https://www.lemonde.fr/sport/article/2025/07/02/vendre-ou-consolider-le-dilemme-des-clubs-avec-leur-section-feminine-variable-d-ajustement-de-la-crise-du-football-francais_6617329_3242.html,  Par Anthony Hernandez ,
180,Les prochains lives sport du « Monde »  ,https://www.lemonde.fr/football/article/2024/06/15/les-prochains-lives-sport-du-monde_6157620_1616939.html,Le Monde,
181,Les prochains lives sport du « Monde »  ,https://www.lemonde.fr/football/article/2024/06/15/les-prochains-lives-sport-du-monde_6157620_1616939.html,Le Monde,
182,"Un rapport parlementaire évalue à 3,7 milliards d’euros les dépenses totales de l’Etat pour les Jeux de Paris 2024  ",https://www.lemonde.fr/sport/article/2025/07/02/un-rapport-parlementaire-evalue-a-3-7-milliards-d-euros-les-depenses-totales-de-l-etat-pour-les-jeux-de-paris-2024_6617418_3242.html,  Par Nicolas Lepeltier ,
183,La transformation invisible du gazon de Wimbledon  ,https://www.lemonde.fr/sport/article/2025/07/02/la-transformation-invisible-du-gazon-de-wimbledon_6617392_3242.html,  Par Jérôme Porier (envoyé spécial à Wimbledon) ,
184,Tour de France : le responsable du parcours vous explique comment l’édition 2025 a été tracée pour créer du suspense    07:52  ,https://www.lemonde.fr/sport/video/2025/07/02/tour-de-france-2025-comment-le-parcours-est-trace-pour-creer-du-suspense_6617330_3242.html,  Par Brieuc Beckers et Marceau Bretonnier ,
185,Tour de France : le responsable du parcours vous explique comment l’édition 2025 a été tracée pour créer du suspense    07:52  ,https://www.lemonde.fr/sport/video/2025/07/02/tour-de-france-2025-comment-le-parcours-est-trace-pour-creer-du-suspense_6617330_3242.html,  Par Brieuc Beckers et Marceau Bretonnier ,
186,"Droits télé : la LFP lance sa chaîne de la Ligue 1, sans Canal+  ",https://www.lemonde.fr/economie/article/2025/07/01/droits-tv-la-lfp-lance-sa-chaine-de-la-ligue-1-sans-canal_6617288_3234.html,  Par Brice Laemle et Alexandre Lemarié ,
187,"Nicolas Mahut, éliminé au premier tour du tournoi de double, dit adieu à Wimbledon, théâtre de son match le plus mémorable  ",https://www.lemonde.fr/sport/article/2025/07/02/nicolas-mahut-elimine-au-premier-tour-du-tournoi-de-double-dit-adieu-a-wimbledon-theatre-de-son-match-le-plus-memorable_6617448_3242.html,  Par Yanis Soul ,
188," Dans « L’Aventura », de Sophie Letourneur, grandeurs et misères de vacances en famille ",https://www.lemonde.fr/culture/article/2025/07/02/dans-l-aventura-de-sophie-letourneur-grandeurs-et-miseres-de-vacances-en-famille_6617377_3246.html,  Par Mathieu Macheret ,
189,Le folk magnétique de Beth Gibbons fait chavirer les Nuits de Fourvière  ,https://www.lemonde.fr/culture/article/2025/07/01/la-folk-magnetique-de-beth-gibbons-fait-chavirer-les-nuits-de-fourviere_6617200_3246.html,  Par Franck Colombani (Lyon) ,
190,Le folk magnétique de Beth Gibbons fait chavirer les Nuits de Fourvière  ,https://www.lemonde.fr/culture/article/2025/07/01/la-folk-magnetique-de-beth-gibbons-fait-chavirer-les-nuits-de-fourviere_6617200_3246.html,  Par Franck Colombani (Lyon) ,
191,Nostalgie punk au festival Retro C Trop  ,https://www.lemonde.fr/culture/article/2025/06/30/nostalgie-punk-au-festival-retro-c-trop_6616939_3246.html,"  Par Stéphane Davet (Tilloloy, Somme) ",
192,"Pierre-François Souyri : « Admirer les œuvres d’Hokusai, c’est un peu voyager au Japon »  ",https://www.lemonde.fr/culture/article/2025/07/01/pierre-francois-souyri-admirer-les-uvres-d-hokusai-c-est-un-peu-voyager-au-japon_6617294_3246.html,  Propos recueillis par Sylvie Kerviel ,
193,Quand action sociale rime avec architecture bioclimatique  ,https://www.lemonde.fr/culture/article/2025/07/02/quand-action-sociale-rime-avec-architecture-bioclimatique_6617413_3246.html,  Par Isabelle Regnier ,
194,Quand action sociale rime avec architecture bioclimatique  ,https://www.lemonde.fr/culture/article/2025/07/02/quand-action-sociale-rime-avec-architecture-bioclimatique_6617413_3246.html,  Par Isabelle Regnier ,
195,"« Islands », jeu de pistes pervers dans une station balnéaire  ",https://www.lemonde.fr/culture/article/2025/07/02/islands-jeu-de-pistes-pervers-dans-une-station-balneaire_6617357_3246.html,  Par Jacques Mandelbaum ,
196,"Dans « Rêves », le réalisateur Dag Johan Haugerud plonge dans les brumes intérieures d’un amour adolescent à Oslo  ",https://www.lemonde.fr/culture/article/2025/07/02/dans-reves-le-realisateur-dag-johan-haugerud-plonge-dans-les-brumes-interieures-d-un-amour-adolescent-a-oslo_6617363_3246.html,  Par Boris Bastide ,
197," Agnès Riva, romancière très urbaine ",https://www.lemonde.fr/livres/article/2025/06/29/agnes-riva-romanciere-tres-urbaine_6616369_3260.html,  Par Florence Bouchy (Collaboratrice du « Monde des livres ») ,
198,"« Le Chemin de la frontière », de Grete Weil : écrire contre l’affliction et la terreur  ",https://www.lemonde.fr/livres/article/2025/06/28/le-chemin-de-la-frontiere-de-grete-weil-ecrire-contre-l-affliction-et-la-terreur_6616245_3260.html,  Par Christine Lecerf (Collaboratrice du « Monde des livres ») ,
199,"« Le Chemin de la frontière », de Grete Weil : écrire contre l’affliction et la terreur  ",https://www.lemonde.fr/livres/article/2025/06/28/le-chemin-de-la-frontiere-de-grete-weil-ecrire-contre-l-affliction-et-la-terreur_6616245_3260.html,  Par Christine Lecerf (Collaboratrice du « Monde des livres ») ,
200,"La mort de Florence Delay, écrivaine lumineuse, académicienne et lauréate du prix Femina, en 1983  ",https://www.lemonde.fr/disparitions/article/2025/07/02/la-mort-de-florence-delay-ecrivaine-lumineuse-academicienne-et-laureate-du-prix-femina-en-1983_6617396_3382.html,  Par Fabrice Gabriel (Collaborateur du « Monde des livres ») ,
201,"« Remy de Gourmont. Une vie fin-de-siècle », de Thierry Gillybœuf : le scrutateur impitoyable  ",https://www.lemonde.fr/livres/article/2025/07/02/remy-de-gourmont-une-vie-fin-de-siecle-de-thierry-gillyb-uf-le-scrutateur-impitoyable_6617416_3260.html,  Par François Angelier (Collaborateur du « Monde des livres ») ,
202,"L’académicienne Florence Delay, lauréate du prix Femina en 1983 pour « Riche et légère », est morte  ",https://www.lemonde.fr/disparitions/article/2025/07/01/l-academicienne-florence-delay-laureate-du-prix-femina-en-1983-pour-riche-et-legere-est-morte_6617262_3382.html,Le Monde avec AFP,
203,"L’académicienne Florence Delay, lauréate du prix Femina en 1983 pour « Riche et légère », est morte  ",https://www.lemonde.fr/disparitions/article/2025/07/01/l-academicienne-florence-delay-laureate-du-prix-femina-en-1983-pour-riche-et-legere-est-morte_6617262_3382.html,Le Monde avec AFP,
204,"« Ajisaï », d’Aki Shimazaki : la muse mystérieuse  ",https://www.lemonde.fr/livres/article/2025/07/01/ajisai-d-aki-shimazaki-la-muse-mysterieuse_6617194_3260.html,  Par Juliette Einhorn (Collaboratrice du « Monde des livres ») ,
205,"Tillie Walden, autrice de bande dessinée : « Il faut parfois faire le vide en soi pour parvenir à créer »  ",https://www.lemonde.fr/livres/article/2025/06/30/tillie-walden-autrice-de-bande-dessinee-il-faut-parfois-faire-le-vide-en-soi-pour-parvenir-a-creer_6617016_3260.html,  Par Alexis Duval ,
206, Des os de baleine préhistoriques retrouvés dans les Landes ,https://www.lemonde.fr/sciences/video/2025/06/27/des-os-de-baleine-prehistoriques-retrouves-dans-les-landes_6616110_1650684.html,,
207,Les premiers chercheurs américains menacés par l’administration Trump accueillis à l’université d’Aix-Marseille  ,https://www.lemonde.fr/sciences/article/2025/06/26/les-premiers-chercheurs-americains-menaces-par-l-administration-trump-accueillis-a-l-universite-d-aix-marseille_6616048_1650684.html,Le Monde avec AFP,
208,Les premiers chercheurs américains menacés par l’administration Trump accueillis à l’université d’Aix-Marseille  ,https://www.lemonde.fr/sciences/article/2025/06/26/les-premiers-chercheurs-americains-menaces-par-l-administration-trump-accueillis-a-l-universite-d-aix-marseille_6616048_1650684.html,Le Monde avec AFP,
209,L’exploration inédite de la biodiversité du dôme thermique de l’océan Pacifique    Grand format  ,https://www.lemonde.fr/sciences/visuel/2025/06/27/l-exploration-inedite-de-la-biodiversite-du-dome-thermique-de-l-ocean-pacifique_6616077_1650684.html,,
210,Inquiétudes autour d’une thérapie génique dans la myopathie de Duchenne  ,https://www.lemonde.fr/sciences/article/2025/06/26/inquietudes-autour-d-une-therapie-genique-dans-la-myopathie-de-duchenne_6616027_1650684.html,  Par Sylvie Burnouf ,
211,"Le temps des cerises, volé par une mouche vorace  ",https://www.lemonde.fr/sciences/article/2025/06/27/le-temps-des-cerises-vole-par-une-mouche-vorace_6616106_1650684.html,,
212,"Le temps des cerises, volé par une mouche vorace  ",https://www.lemonde.fr/sciences/article/2025/06/27/le-temps-des-cerises-vole-par-une-mouche-vorace_6616106_1650684.html,,
213,Handicap sévère : la difficile transition de l’enfance vers l’âge adulte  ,https://www.lemonde.fr/societe/article/2025/07/02/handicap-severe-la-difficile-transition-de-l-enfance-vers-l-age-adulte_6617435_3224.html,  Par Anne-Aël Durand ,
214,Immunothérapies des cancers : des cellules CAR-T produites in vivo  ,https://www.lemonde.fr/sciences/article/2025/07/02/immunotherapies-des-cancers-des-cellules-car-t-produites-in-vivo_6617417_1650684.html,  Par Florence Rosier ,
215, « Je ne veux pas donner l’impression d’être une pince » : l’amitié à l’épreuve du budget ,https://www.lemonde.fr/campus/article/2025/06/27/je-ne-veux-pas-donner-l-impression-d-etre-une-pince-l-amitie-a-l-epreuve-du-budget_6616072_4401467.html,  Par Audrey Parmentier ,
216,"Adrien, 30 ans, maître-nageur, 3 200 euros par mois : « Je cumule deux jobs pour avoir un train de vie plus confortable »  ",https://www.lemonde.fr/campus/article/2025/06/30/adrien-30-ans-maitre-nageur-3-200-euros-par-mois-je-cumule-deux-jobs-pour-avoir-un-train-de-vie-plus-confortable_6616667_4401467.html,  Propos recueillis par Emma Barets ,
217,"Adrien, 30 ans, maître-nageur, 3 200 euros par mois : « Je cumule deux jobs pour avoir un train de vie plus confortable »  ",https://www.lemonde.fr/campus/article/2025/06/30/adrien-30-ans-maitre-nageur-3-200-euros-par-mois-je-cumule-deux-jobs-pour-avoir-un-train-de-vie-plus-confortable_6616667_4401467.html,  Propos recueillis par Emma Barets ,
218,"A la Cité internationale universitaire de Paris, depuis cent ans, « les Nations unies en miniature »  ",https://www.lemonde.fr/campus/article/2025/06/29/a-la-cite-internationale-universitaire-de-paris-depuis-cent-ans-les-nations-unies-en-miniature_6616340_4401467.html,,
219,"Les séjours étudiants à l’étranger, des accélérateurs de carrière, en particulier celle des cadres  ",https://www.lemonde.fr/campus/article/2025/07/01/les-sejours-etudiants-a-l-etranger-des-accelerateurs-de-carriere-en-particulier-celle-des-cadres_6617214_4401467.html,  Par Séverin Graveleau ,
220,Logement des étudiants : la Cour des comptes reproche à l’Etat de naviguer à vue  ,https://www.lemonde.fr/campus/article/2025/07/02/logement-des-etudiants-la-cour-des-comptes-reproche-a-l-etat-de-naviguer-a-vue_6617450_4401467.html,  Par Véronique Chocron et Soazig Le Nevé ,
221,Logement des étudiants : la Cour des comptes reproche à l’Etat de naviguer à vue  ,https://www.lemonde.fr/campus/article/2025/07/02/logement-des-etudiants-la-cour-des-comptes-reproche-a-l-etat-de-naviguer-a-vue_6617450_4401467.html,  Par Véronique Chocron et Soazig Le Nevé ,
222,"L’internat, lieu privilégié des agressions  ",https://www.lemonde.fr/societe/article/2025/07/02/violences-a-l-ecole-l-internat-lieu-privilegie-des-agressions_6617338_3224.html,  Par Violaine Morin ,
223,"Sacia, étudiante algérienne : « J’étais tellement heureuse. Je me disais : je suis à Paris, j’ai réussi quelque chose »  ",https://www.lemonde.fr/campus/article/2025/07/02/sacia-etudiante-algerienne-j-etais-tellement-heureuse-je-me-disais-je-suis-a-paris-j-ai-reussi-quelque-chose_6617326_4401467.html,  Par Charlotte Bozonnet ,
224,"Réchauffement climatique : pourquoi l’objectif de 1,5 °C est désormais hors d’atteinte   podcast  ",https://www.lemonde.fr/podcasts/article/2025/07/01/rechauffement-climatique-pourquoi-l-objectif-de-1-5-c-est-desormais-hors-d-atteinte_6617173_5463015.html,,
225,"Réchauffement climatique : pourquoi l’objectif de 1,5 °C est désormais hors d’atteinte   podcast  ",https://www.lemonde.fr/podcasts/article/2025/07/01/rechauffement-climatique-pourquoi-l-objectif-de-1-5-c-est-desormais-hors-d-atteinte_6617173_5463015.html,,
226,Surtourisme : comment les grandes villes étouffent sous l’afflux de voyageurs   podcast  ,https://www.lemonde.fr/podcasts/article/2025/06/30/surtourisme-comment-les-grandes-villes-etouffent-sous-l-afflux-de-voyageurs_6616623_5463015.html,,
227,SNCF : que change l’arrivée de la concurrence sur les rails ?   podcast  ,https://www.lemonde.fr/podcasts/article/2025/06/27/sncf-que-change-l-arrivee-de-la-concurrence-sur-les-rails_6616068_5463015.html,,
228, La foi des Noirs-Américains devant l’objectif de Carrie Mae Weems : « Ma mère allait à l’église dans les buissons » ,https://www.lemonde.fr/m-le-mag/article/2025/06/29/la-foi-des-noirs-americains-devant-l-objectif-de-carrie-mae-weems-ma-mere-allait-a-l-eglise-dans-les-buissons_6616342_4500055.html,,
229,"Les lettres de Sasha et d’Olga : « Après les dernières attaques, je suis restée muette pendant presque deux jours »  ",https://www.lemonde.fr/m-le-mag/article/2025/07/01/les-lettres-de-sasha-et-d-olga-apres-les-dernieres-attaques-je-suis-restee-muette-pendant-presque-deux-jours_6617295_4500055.html,,
230,"Les lettres de Sasha et d’Olga : « Après les dernières attaques, je suis restée muette pendant presque deux jours »  ",https://www.lemonde.fr/m-le-mag/article/2025/07/01/les-lettres-de-sasha-et-d-olga-apres-les-dernieres-attaques-je-suis-restee-muette-pendant-presque-deux-jours_6617295_4500055.html,,
231,La mort mystérieuse de Pier Paolo Pasolini hante toujours l’Italie cinquante ans après  ,https://www.lemonde.fr/m-le-mag/article/2025/06/27/cinquante-ans-apres-la-mort-de-pasolini-hante-toujours-l-italie_6616083_4500055.html,,
232,« Jurassic Park » ou les increvables dinosaures du box-office  ,https://www.lemonde.fr/m-le-mag/article/2025/06/29/jurassic-park-ou-les-increvables-dinosaures-du-box-office_6616360_4500055.html,  Par Samuel Blumenfeld ,
233,"Anna Wintour dans « Le Monde », une curiosité grandissante pour « la papesse de la mode »  ",https://www.lemonde.fr/m-le-mag/article/2025/07/02/anna-wintour-dans-le-monde-une-curiosite-grandissante-pour-la-papesse-de-la-mode_6617407_4500055.html,,
234,"Anna Wintour dans « Le Monde », une curiosité grandissante pour « la papesse de la mode »  ",https://www.lemonde.fr/m-le-mag/article/2025/07/02/anna-wintour-dans-le-monde-une-curiosite-grandissante-pour-la-papesse-de-la-mode_6617407_4500055.html,,
235,"En Belgique, la députée transgenre Petra De Sutter reprend l’université  ",https://www.lemonde.fr/m-le-mag/article/2025/06/29/en-belgique-la-deputee-transgenre-petra-de-sutter-reprend-l-universite_6616358_4500055.html,  Par Hugues Dorzée ,
236,"En Chine, la « Dalifornie », un eldorado bohème pour jeunes en quête de sens  ",https://www.lemonde.fr/m-le-mag/article/2025/06/29/en-chine-la-dalifornie-un-eldorado-boheme-pour-jeunes-en-quete-de-sens_6616329_4500055.html,,
237, Cinq ressources pour parler de la canicule avec vos enfants ,https://www.lemonde.fr/intimites/article/2025/07/01/cinq-ressources-pour-parler-de-la-canicule-avec-vos-enfants_6617254_6190330.html,  Par Cécile Cazenave ,
238,"Amours de jeunesse : « Je tombe éperdument amoureux d’elle et puis, comme un lâche salaud, je détruis tout et je lui brise le cœur »  ",https://www.lemonde.fr/intimites/article/2025/07/01/amours-de-jeunesse-je-tombe-eperdument-amoureux-d-elle-et-puis-comme-un-lache-salaud-je-detruis-tout-et-je-lui-brise-le-c-ur_6617179_6190330.html,  Propos recueillis par Charlotte Herzog ,
239,"Amours de jeunesse : « Je tombe éperdument amoureux d’elle et puis, comme un lâche salaud, je détruis tout et je lui brise le cœur »  ",https://www.lemonde.fr/intimites/article/2025/07/01/amours-de-jeunesse-je-tombe-eperdument-amoureux-d-elle-et-puis-comme-un-lache-salaud-je-detruis-tout-et-je-lui-brise-le-c-ur_6617179_6190330.html,  Propos recueillis par Charlotte Herzog ,
240,"Le dépistage néonatal s’étend en France, pour quoi faire ?  ",https://www.lemonde.fr/sciences/article/2025/06/30/le-depistage-neonatal-s-etend-en-france-pour-quoi-faire_6617004_1650684.html,,
241,"Clarisse Crémer, navigatrice : « Je n’étais pas là pour les deux premiers anniversaires de ma fille »  ",https://www.lemonde.fr/intimites/article/2025/06/29/clarisse-cremer-navigatrice-je-n-etais-pas-la-pour-les-deux-premiers-anniversaires-de-ma-fille_6616373_6190330.html,  Propos recueillis par Guillemette Faure ,
242,"Sur WhatsApp, le monde parallèle des ados devenus influenceurs à l’insu de leurs parents  ",https://www.lemonde.fr/pixels/article/2025/06/29/sur-whatsapp-le-monde-parallele-des-ados-devenus-influenceurs-a-l-insu-de-leurs-parents_6616352_4408996.html,,
243,"Sur WhatsApp, le monde parallèle des ados devenus influenceurs à l’insu de leurs parents  ",https://www.lemonde.fr/pixels/article/2025/06/29/sur-whatsapp-le-monde-parallele-des-ados-devenus-influenceurs-a-l-insu-de-leurs-parents_6616352_4408996.html,,
244,"« Plus le monde est complexe, plus il faut faire avec nos désaccords et savoir se disputer »  ",https://www.lemonde.fr/intimites/article/2025/06/29/nicole-et-bernard-prieur-philosophe-et-psychanalyste-plus-le-monde-est-complexe-plus-il-faut-faire-avec-nos-desaccords-et-savoir-se-disputer_6616334_6190330.html,  Propos recueillis par Clara Georges ,
245,"« Les pratiques cherchant à faire des sens, de la chair et du sexe le théâtre d’une expérience spirituelle se démocratisent »  ",https://www.lemonde.fr/le-monde-des-religions/article/2025/06/28/les-pratiques-cherchant-a-faire-des-sens-de-la-chair-et-du-sexe-le-theatre-d-une-experience-spirituelle-se-democratisent_6616237_6038514.html,,
246," Dans le milieu de la soudure, deux compétitions et deux visions du métier ",https://www.lemonde.fr/m-perso/article/2025/06/30/la-france-buissonniere-etincelles-au-pays-de-la-soudure_6616555_4497916.html,,
247,"Les concerts dans les laveries automatiques : « Ici, on peut se tromper, partager une chanson qui nous plaît. Sans jamais être jugé ni moqué »  ",https://www.lemonde.fr/m-perso/article/2025/06/29/les-concerts-dans-les-laveries-automatiques-du-son-qui-lessive-ici-on-peut-se-tromper-partager-une-chanson-qui-nous-plait-sans-jamais-etre-juge-ni-moque_6616355_4497916.html,,
248,"Les concerts dans les laveries automatiques : « Ici, on peut se tromper, partager une chanson qui nous plaît. Sans jamais être jugé ni moqué »  ",https://www.lemonde.fr/m-perso/article/2025/06/29/les-concerts-dans-les-laveries-automatiques-du-son-qui-lessive-ici-on-peut-se-tromper-partager-une-chanson-qui-nous-plait-sans-jamais-etre-juge-ni-moque_6616355_4497916.html,,
249,"Vous aimez Grand Corps Malade, vous aimerez Saint-Denis  ",https://www.lemonde.fr/m-perso/article/2025/06/29/vous-aimez-grand-corps-malade-vous-aimerez-saint-denis_6616354_4497916.html,  Par Julien Thèves ,
250,"Dans un atelier de cueillette de plantes comestibles : « Dans les forêts, nous passons à côté de trésors dont nous ignorons tout ! »  ",https://www.lemonde.fr/m-perso/article/2025/06/29/dans-un-atelier-de-cueillette-de-plantes-comestibles-dans-les-forets-nous-passons-a-cote-de-tresors-dont-nous-ignorons-tout_6616351_4497916.html,,
251,Pourquoi les parkings de supermarchés se couvrent de laveries automatiques dans les zones rurales et périurbaines  ,https://www.lemonde.fr/m-perso/article/2025/06/28/dans-les-zones-rurales-et-periurbaines-les-laveries-automatiques-en-plein-essor-moins-cheres-que-le-pressing-et-beaucoup-plus-pratiques_6616230_4497916.html,,
252,Pourquoi les parkings de supermarchés se couvrent de laveries automatiques dans les zones rurales et périurbaines  ,https://www.lemonde.fr/m-perso/article/2025/06/28/dans-les-zones-rurales-et-periurbaines-les-laveries-automatiques-en-plein-essor-moins-cheres-que-le-pressing-et-beaucoup-plus-pratiques_6616230_4497916.html,,
253,"Un apéro avec Mallory Wanecque : « J’ai grandi dans les pétanques, l’amour, la galère aussi »  ",https://www.lemonde.fr/m-perso/article/2025/06/27/un-apero-avec-mallory-wanecque-j-ai-grandi-dans-les-petanques-l-amour-la-galere-aussi_6616184_4497916.html,  Par Maroussia Dubreuil ,
