,title,subhed,url,byline
0, Israel unites against the 'existential threat' of Iran: 'We need to get rid of this regime that hates us'  ,"With schools, non-food shopping centers and restaurants closed, Israelis have been living since Saturday under air raid alerts and Iranian missile strikes. These attacks have already claimed several lives.",https://www.lemonde.fr/en/international/article/2026/03/02/israel-unites-against-the-existential-threat-of-iran-we-need-to-get-rid-of-this-regime-that-hates-us_6751000_4.html,
1,Europeans ready for defensive military actions in region after Iranian strikes in the Gulf,"French President Emmanuel Macron, German Chancellor Friedrich Merz and British Prime Minister Keir Starmer said they were 'appalled by the indiscriminate and disproportionate missile attacks' launched by Iran in response to the US-Israeli offensive.",https://www.lemonde.fr/en/international/article/2026/03/02/europeans-ready-for-defensive-military-actions-in-region-after-iranian-strikes-in-the-gulf_6750996_4.html,"  By Elsa Conesa (Berlin (Germany) correspondent), Chloé Hoorman and Philippe Jacqué (Brussels, Europe bureau) "
2,What we know about the US-Israeli operation that killed Ali Khamenei,Iranian Supreme Leader Ayatollah Ali Khamenei was killed in a major attack by Israel and the United States over the weekend.,https://www.lemonde.fr/en/international/video/2026/03/02/what-we-know-about-the-us-israeli-operation-that-killed-ali-khamenei_6751001_4.html,  By Le Monde's video desk   
3,French nuclear 'umbrella' for Europe now increasingly discussed among allies,"French President Emmanuel Macron will deliver a speech on nuclear deterrence on Monday, with Europeans expected to pay close attention amid threats from Russia and growing doubts over the United States' reliability as a NATO ally.",https://www.lemonde.fr/en/international/article/2026/03/02/french-nuclear-umbrella-for-europe-now-increasingly-discussed-among-allies_6751006_4.html,"  By Hélène Bienvenu (Warsaw (Poland) correspondent), Elsa Conesa (Berlin (Germany) correspondent), Philippe Ricard and Elise Vincent "
4,Trump's war of trial and error in Iran,"The president has made numerous, often confusing media appearances since the start of the offensive on February 28, while only a third of Americans believe that the US-Israeli airstrikes are justified.",https://www.lemonde.fr/en/international/article/2026/03/02/trump-feeling-his-way-along-the-war-on-iran_6750994_4.html,  By Piotr Smolar (Washington (United States) correspondent) 
5,Gulf monarchies face a dilemma after Iran attacks them in retaliation for US-Israeli strikes,,https://www.lemonde.fr/en/international/article/2026/03/01/us-israeli-strikes-on-iran-gulf-monarchies-face-a-dilemma-after-iran-s-retaliation-attacks-target-them_6750988_4.html,  By Hélène Sallon (Beirut (Lebanon) correspondent) 
6,French police arrest activists blocking ship allegedly transporting uranium from Russia,,https://www.lemonde.fr/en/economy/article/2026/03/02/french-police-arrest-activists-blocking-ship-allegedly-transporting-uranium-from-russia_6751007_19.html,Le Monde with AFP
7,Amsterdam's Rijksmuseum says discovers new Rembrandt painting,,https://www.lemonde.fr/en/culture/article/2026/03/02/rembrandt-painting-whose-whereabouts-were-unknown-for-65-years-to-be-displayed-in-amsterdam_6751005_30.html,Le Monde with AFP
8,French domestic security forces placed on high alert following airstrikes on Iran,,https://www.lemonde.fr/en/international/article/2026/03/02/french-domestic-security-forces-placed-on-high-alert-following-airstrikes-on-iran_6750991_4.html,  By Christophe Ayad and Laura Motet 
9,Photographer Robert Frank's love letter to Paris,,https://www.lemonde.fr/en/m-le-mag/article/2026/03/02/photographer-robert-frank-s-love-letter-to-paris_6750992_117.html,
10,Melania Trump to chair UN Security Council as Iran war rages,,https://www.lemonde.fr/en/international/article/2026/03/02/melania-trump-to-chair-un-security-council-as-iran-war-rages_6750993_4.html,Le Monde with AFP
11,"The 'great replacement' theory: 'A hateful, conspiratorial phrase' now in 'everyday language'",,https://www.lemonde.fr/en/opinion/article/2026/03/02/the-great-replacement-theory-a-hateful-conspiratorial-phrase-now-in-everyday-language_6750990_23.html,
12,FBI probing Texas shooting that killed two as potential act of terrorism,,https://www.lemonde.fr/en/international/article/2026/03/02/fbi-probing-texas-shooting-that-killed-two-as-potential-act-of-terrorism_6750995_4.html,Le Monde with AP
13,"Belgium, with France's assistance, seizes suspected Russian 'shadow fleet' tanker",,https://www.lemonde.fr/en/international/article/2026/03/01/belgium-with-france-s-assistance-seizes-suspected-russian-shadow-fleet-tanker_6750977_4.html,Le Monde with AFP
14,"Four years after Russia's invasion, Ukrainian soldiers are 'tired, but we're holding strong'",,https://www.lemonde.fr/en/international/article/2026/03/01/four-years-after-russia-s-invasion-ukrainian-soldiers-are-tired-but-we-re-holding-strong_6750985_4.html,"  By Rémy Ourdan (Kyiv and Dnipro, Ukraine, special correspondent) "
15,An intense debate over the fate of looted artworks displayed in Paris,,https://www.lemonde.fr/en/culture/article/2026/03/01/an-intense-debate-over-the-fate-of-looted-artworks-displayed-in-paris_6750975_30.html,  By Jean-Louis Jeannelle (specialist in literary studies ) 
16,Mélenchon's attempt to embody an 'antifascist arc' backs the rest of the left into a corner,,https://www.lemonde.fr/en/politics/article/2026/02/28/melenchon-s-attempt-to-embody-an-antifascist-front-backs-the-rest-of-the-left-into-a-corner_6750960_5.html,
17,Risk of open war between Afghanistan and Pakistan appears contained for now,,https://www.lemonde.fr/en/international/article/2026/02/28/risk-of-open-war-between-afghanistan-and-pakistan-appears-contained-for-now_6750946_4.html,  By Jacques Follorou 
18,Prosecution requests questionably harsh sentences at murdered teacher Samuel Paty's appeals trial,,https://www.lemonde.fr/en/france/article/2026/02/28/prosecution-requests-questionably-harsh-sentences-at-murdered-teacher-samuel-paty-s-appeals-trial_6750957_7.html,  By Soren Seelow 
19,"Attacks on Iran: US and Israel are committing 'a crime of aggression,' says Bernie Sanders' former adviser","An influential voice in the progressive camp and former advisor to Senator Bernie Sanders, Matthew Duss harshly criticizes Donald Trump's actions following Saturday's strikes, stating that 'this war is unfortunately the culmination of decades of a militarist foreign policy.'",https://www.lemonde.fr/en/international/article/2026/03/01/attacks-on-iran-us-and-israel-are-committing-a-crime-of-aggression-says-bernie-sanders-former-adviser_6750976_4.html,  Interview by Piotr Smolar (Washington (United States) correspondent) 
20,France-Germany-UK's balancing act in response to US-Israeli offensive against Iran,"In a joint statement indicating a form of tacit support without offensive participation, France, Germany and the United Kingdom stressed that they had not participated in the strikes against Tehran and criticized the Iranian attacks against countries in the region.",https://www.lemonde.fr/en/international/article/2026/02/28/france-germany-uk-s-balancing-act-in-response-to-us-israeli-offensive-against-iran_6750969_4.html,  By Philippe Ricard 
21,"Ali Khamenei, Iran's supreme leader and symbol of a repressive regime, has died","The successor to Ayatollah Khomeini in 1989, Ali Khamenei embodied the Islamic Republic, setting its political course both domestically and abroad. Over the course of his rule, and faced with the country's isolation, he chose to harden the regime and brutally repress any dissent. He died on Saturday, February 28, at the age of 86.",https://www.lemonde.fr/en/obituaries/article/2026/03/01/ali-khamenei-iran-s-supreme-leader-and-representative-of-the-regime-s-hard-line-faction-has-died_6750973_15.html,  By Ghazal Golshiri 
22,Trump's war of choice in Iran,,https://www.lemonde.fr/en/opinion/article/2026/03/01/trump-s-war-of-choice-in-iran_6750980_23.html,
23,Dominique Méda: 'Another food system is possible',,https://www.lemonde.fr/en/opinion/article/2026/02/28/dominique-meda-another-food-system-is-possible_6750954_23.html,
24,'The Louvre director's resignation raises an old question: Why do cultural execs go mad?',,https://www.lemonde.fr/en/opinion/article/2026/02/27/the-louvre-director-s-resignation-raises-an-old-question-why-do-cultural-execs-go-mad_6750939_23.html,
