,title,url,byline,subhed
0,"China ramps up retaliatory measures against Japan, suspending travel and seafood purchases",https://www.lemonde.fr/en/international/article/2025/11/21/china-ramps-up-retaliatory-measures-against-japan-suspending-travel-and-seafood-purchases_6747692_4.html,  By Harold Thibault (Beijing (China) correspondent) ,
1,"Israel steps up military operations in Lebanon, Gaza Strip and West Bank",https://www.lemonde.fr/en/international/article/2025/11/21/israel-steps-up-military-operations-in-lebanon-gaza-strip-and-west-bank_6747688_4.html,"  By Luc Bronner (Jerusalem, correspondent) ",
2,"West Bank: After nine months of Israeli military operations, refugee camps are 'uninhabitable'",https://www.lemonde.fr/en/international/article/2025/11/21/west-bank-after-nine-months-of-israeli-military-operations-refugee-camps-are-uninhabitable_6747678_4.html,,
3,"In Germany, the AfD is divided over its stance on Russia",https://www.lemonde.fr/en/international/article/2025/11/21/in-germany-the-afd-is-divided-over-its-stance-on-russia_6747677_4.html,  By Elsa Conesa (Berlin (Germany) correspondent) ,
4,"In France's Somme, bagpipers keep the memory of the Great War alive",https://www.lemonde.fr/en/history/article/2025/11/11/in-france-s-somme-bagpipers-keep-the-memory-of-the-great-war-alive_6747347_157.html,,
5,Latvia: Public mobilization grows in support of treaty for preventing violence against women,https://www.lemonde.fr/en/international/article/2025/11/06/in-latvia-public-mobilization-continues-to-grow-in-support-of-the-istanbul-convention-for-preventing-violence-against-women_6747156_4.html,  By Anne-Françoise Hivert (Malmö (Sweden) correspondent) ,
6,"After Charlie Kirk's murder, Europe's far right swears allegiance to Trump's politics",https://www.lemonde.fr/en/les-decodeurs/article/2025/10/20/the-murder-of-charlie-kirk-how-europe-s-far-right-swore-allegiance-to-trump-s-politics_6746586_8.html,,
7,Sanctions against Russia spark rift between US and Europe over China,https://www.lemonde.fr/en/international/article/2025/09/15/sanctions-against-russia-spark-rift-between-us-and-europe-over-china_6745411_4.html,"  By Philippe Jacqué (Brussels, Europe bureau), Philippe Ricard and Harold Thibault (Beijing (China) correspondent) ",
8,French army chief warns France should be 'prepared to lose children' in face of Russian threat,https://www.lemonde.fr/en/france/article/2025/11/20/outcry-after-french-army-chief-s-prepared-to-lose-children-warning_6747661_7.html,Le Monde with AFP,
9,"Lafarge terrorism financing trial: Bruno Lafont, the CEO who 'didn't ask questions'",https://www.lemonde.fr/en/france/article/2025/11/20/lafarge-terrorism-financing-trial-bruno-lafont-the-ceo-who-didn-t-ask-questions_6747662_7.html,  By Soren Seelow ,
10,Migrants piloting small boats across Channel are increasingly being prosecuted,https://www.lemonde.fr/en/france/article/2025/11/20/migrants-piloting-small-boats-across-channel-are-increasingly-being-prosecuted_6747642_7.html,  By Julia Pascual ,
11,"Nicolas Guillou, French ICC judge sanctioned by the US: 'You are effectively blacklisted by much of the world's banking system'",https://www.lemonde.fr/en/international/article/2025/11/19/nicolas-guillou-french-icc-judge-sanctioned-by-the-us-you-are-effectively-blacklisted-by-much-of-the-world-s-banking-system_6747628_4.html,  Interview by Stéphanie Maupas (The Hague (Netherlands) correspondent) ,
12,Afghanistan: Relentless repression continues over four years into Taliban's rule,https://www.lemonde.fr/en/videos/video/2025/10/04/afghanistan-relentless-repression-continues-over-four-years-into-taliban-s-rule_6746092_108.html,"  By Chloé Denis, Félix Pommier (Motion design) and Sinead McCausland ",
13,Watch: Hundreds of thousands march in France against budget cuts,https://www.lemonde.fr/en/videos/video/2025/09/19/french-strikes-watch-what-happened-as-hundreds-of-thousands-marched-against-budget-cuts_6745548_108.html,  By Le Monde's video desk   ,
14,Emmys 2025: 'Adolescence' star Owen Cooper becomes youngest winner for best supporting actor,https://www.lemonde.fr/en/videos/video/2025/09/15/emmys-2025-adolescence-star-owen-cooper-becomes-youngest-winner-for-best-supporting-actor_6745427_108.html,  By Le Monde's video desk   ,
15,"From 'influence peddling' to 'corruption,' what is French Culture Minister Rachida Dati accused of?",https://www.lemonde.fr/en/videos/video/2025/09/06/from-influence-peddling-to-corruption-what-is-french-culture-minister-rachida-dati-accused-of_6745094_108.html,"  By Alexis Tromas, Arthur Navet  and Sinead McCausland ",
16,The 'everlasting peace' in Gaza promised by Trump is off to a troubled start,https://www.lemonde.fr/en/opinion/article/2025/11/21/the-everlasting-peace-in-gaza-promised-by-trump-is-off-to-a-troubled-start_6747687_23.html,,
17,Ukraine: The danger to Europe of a Trump-Putin axis,https://www.lemonde.fr/en/opinion/article/2025/11/21/ukraine-the-danger-to-europe-of-a-trump-putin-axis_6747694_23.html,,
18,"Junk food, an enormous cost to society",https://www.lemonde.fr/en/opinion/article/2025/11/20/junk-food-an-enormous-cost-to-society_6747657_23.html,,
19,'Daily references to the Bataclan on social media reveal the scale of the moral and technological challenge we face',https://www.lemonde.fr/en/opinion/article/2025/11/20/daily-references-to-the-bataclan-on-social-media-reveal-the-scale-of-the-moral-and-technological-challenge-we-face_6747641_23.html,,
20,London's 'mudlarks' scour the Thames for treasure,https://www.lemonde.fr/en/m-le-mag/article/2025/11/17/london-s-mudlarks-scour-the-thames-for-treasure_6747519_117.html,,
21,"At Paris Photo, British photographer Jack Davison's portrait marathon",https://www.lemonde.fr/en/m-le-mag/article/2025/11/16/at-paris-photo-british-photographer-jack-davison-s-portrait-marathon_6747506_117.html,  By Emmanuelle Lequeux ,
22,Designer Pieter Mulier writes a new chapter in Alaïa's history,https://www.lemonde.fr/en/m-le-mag/article/2025/11/16/designer-pieter-mulier-writes-a-new-chapter-in-alaia-s-history_6747501_117.html,,
23,'Jewelry is easy to steal and circulate': When gems vanish without a trace,https://www.lemonde.fr/en/m-le-mag/article/2025/11/15/jewelry-is-easy-to-steal-and-circulate-when-gems-vanish-without-a-trace_6747478_117.html,,
24,Azzedine Alaïa's Dior collection on view in Paris,https://www.lemonde.fr/en/lifestyle/article/2025/11/21/azzedine-alaia-s-dior-collection-on-view-in-paris_6747679_37.html,  By Elvire von Bardeleben ,
25,"In Paris, five restaurants where vegetarians and carnivores can both eat",https://www.lemonde.fr/en/lifestyle/article/2025/11/18/in-paris-five-restaurants-where-vegetarians-and-carnivores-can-both-eat_6747589_37.html,,
26,"At the Opéra Bastille, Wagner's 'Valkyries' shines thanks to its singers",https://www.lemonde.fr/en/culture/article/2025/11/15/at-the-opera-bastille-wagner-s-valkyries-shines-thanks-to-its-singers_6747475_30.html,  By Marie-Aude Roux ,
27,Sophie Ristelhueber's coronation at Paris Photo,https://www.lemonde.fr/en/m-le-mag/article/2025/11/14/sophie-ristelhueber-s-coronation-at-paris-photo_6747465_117.html,,
28, War in Ukraine: What we know about Donald Trump's 28-point peace plan  ,https://www.lemonde.fr/en/international/article/2025/11/21/war-in-ukraine-what-we-know-about-donald-trump-s-28-point-peace-plan_6747683_4.html,Le Monde with AFP,"The US's proposed plan, revealed by the Financial Times and Agence France-Presse, notably calls for Kyiv to concede the regions of Donetsk and Luhansk to Russia and to reduce its army."
29,The 'everlasting peace' in Gaza promised by Trump is off to a troubled start,https://www.lemonde.fr/en/opinion/article/2025/11/21/the-everlasting-peace-in-gaza-promised-by-trump-is-off-to-a-troubled-start_6747687_23.html,,
30,"Israel steps up military operations in Lebanon, Gaza Strip and West Bank",https://www.lemonde.fr/en/international/article/2025/11/21/israel-steps-up-military-operations-in-lebanon-gaza-strip-and-west-bank_6747688_4.html,"  By Luc Bronner (Jerusalem, correspondent) ",
31,"In Brazil, the far right passes a highly repressive law targeting armed factions",https://www.lemonde.fr/en/international/article/2025/11/21/in-brazil-the-far-right-passes-a-highly-repressive-law-targeting-armed-factions_6747674_4.html,  By Bruno Meyerfeld (Rio de Janeiro (Brazil) correspondent) ,"The original bill, introduced by President Luiz Inacio Lula da Silva and intended to tackle the funding of criminal groups, was transformed by far-right lawmakers."
32,"International aid to fight AIDS, tuberculosis and malaria is declining: 'Countries will have to accelerate pathway to self-reliance'",https://www.lemonde.fr/en/environment/article/2025/11/21/international-aid-to-fight-aids-tuberculosis-and-malaria-is-declining-countries-will-have-to-accelerate-pathway-to-self-reliance_6747685_114.html,  Interview by Delphine Roucaute ,"Peter Sands, the director of the Global Fund to Fight AIDS, tuberculosis and malaria, discusses the stakes of the donor countries' summit set to open in Johannesburg on Friday."
33,Azzedine Alaïa's Dior collection on view in Paris,https://www.lemonde.fr/en/lifestyle/article/2025/11/21/azzedine-alaia-s-dior-collection-on-view-in-paris_6747679_37.html,  By Elvire von Bardeleben ,"The Galerie Dior is showcasing around one hundred pieces from the personal collection of French-Tunisian designer Azzedine Alaïa, a renowned fashion collector. This rare and captivating exhibition is richly documented and unprecedented in scope."
34,Aya Nakamura's 'Destinée': Singer's fifth album brims with renewed energy,https://www.lemonde.fr/en/culture/article/2025/11/21/aya-nakamura-s-destinee-singer-s-fifth-album-brims-with-renewed-energy_6747693_30.html,  By Stéphanie Binet ,"The singer steps out of her comfort zone, experimenting with Caribbean shatta and sultry R&B while staying true to her zouk roots."
35,30-plus nations oppose COP30 draft over fossil fuel omission,https://www.lemonde.fr/en/international/article/2025/11/21/30-plus-nations-oppose-cop30-draft-over-fossil-fuel-omission_6747682_4.html,Le Monde with AFP,
36,"West Bank: After nine months of Israeli military operations, refugee camps are 'uninhabitable'",https://www.lemonde.fr/en/international/article/2025/11/21/west-bank-after-nine-months-of-israeli-military-operations-refugee-camps-are-uninhabitable_6747678_4.html,,
37,President Trump suggests Democratic lawmakers who urge military to ignore illegal orders could be executed,https://www.lemonde.fr/en/international/article/2025/11/21/president-trump-suggests-demomcratic-lawmakers-who-urge-military-to-ignore-illegal-orders-could-be-executed_6747675_4.html,Le Monde with AFP,
38,"China ramps up retaliatory measures against Japan, suspending travel and seafood purchases",https://www.lemonde.fr/en/international/article/2025/11/21/china-ramps-up-retaliatory-measures-against-japan-suspending-travel-and-seafood-purchases_6747692_4.html,  By Harold Thibault (Beijing (China) correspondent) ,
39,"Yeb Sano, a Filipino activist attending his 22nd UN Climate Change Conference: 'Despite the challenges, we cannot afford to lose hope'",https://www.lemonde.fr/en/environment/article/2025/11/21/yeb-sano-a-filipino-activist-attending-his-22nd-un-climate-change-conference-despite-the-challenges-we-cannot-afford-to-lose-hope_6747681_114.html,  By Perrine Mouterde ,
40,US health agency website updated to reflect Trump administration's vaccine skepticism,https://www.lemonde.fr/en/international/article/2025/11/20/us-health-agency-website-updated-to-reflect-trump-administration-s-vaccine-skepticism_6747670_4.html,Le Monde with AFP,
41,Dutch operators of synthetic drug sales website will stand trial over deaths of at least 45 people,https://www.lemonde.fr/en/international/article/2025/11/21/in-the-netherlands-the-operators-of-a-synthetic-drug-sales-website-will-stand-trial-over-the-deaths-of-at-least-45-people_6747673_4.html,"  By Jean-Pierre Stroobants (Brussels, correspondent) ",
42,Colombia faces controversy after an airstrike on an armed group with minors,https://www.lemonde.fr/en/international/article/2025/11/21/colombia-faces-controversy-after-an-airstrike-on-an-armed-group-with-minors_6747672_4.html,"  By Marie Delcas (Bogota (Colombia), correspondent) ",
43,Frida Kahlo self-portrait sells for $54.66 million,https://www.lemonde.fr/en/international/article/2025/11/21/frida-kahlo-self-portrait-sells-for-54-66-million_6747676_4.html,Le Monde with AFP,
44,"In Germany, the AfD is divided over its stance on Russia",https://www.lemonde.fr/en/international/article/2025/11/21/in-germany-the-afd-is-divided-over-its-stance-on-russia_6747677_4.html,  By Elsa Conesa (Berlin (Germany) correspondent) ,
45,"Olivier Saillard, curator of 'Azzedine Alaïa's Dior Collection': 'These are pieces that have never before been exhibited'",https://www.lemonde.fr/en/lifestyle/article/2025/11/21/olivier-saillard-curator-of-azzedine-alaia-s-dior-collection-these-are-pieces-that-have-never-before-been-exhibited_6747680_37.html,  Interview by Elvire von Bardeleben ,
46,Ukraine enlists civilians in its hunt for Russian drones,https://www.lemonde.fr/en/international/article/2025/11/20/ukraine-enlists-civilians-in-its-hunt-for-russian-drones_6747666_4.html,,
47,"Nicolas Guillou, French ICC judge sanctioned by the US: 'You are effectively blacklisted by much of the world's banking system'",https://www.lemonde.fr/en/international/article/2025/11/19/nicolas-guillou-french-icc-judge-sanctioned-by-the-us-you-are-effectively-blacklisted-by-much-of-the-world-s-banking-system_6747628_4.html,  Interview by Stéphanie Maupas (The Hague (Netherlands) correspondent) ,"Six judges and three prosecutors at the International Criminal Court have been sanctioned by the Trump administration. In an interview with Le Monde, Guillou discusses the impact of these measures on his work and daily life."
48,"Fluctuating pay, seasonal work: Welcome to China's 'iPhone City'",https://www.lemonde.fr/en/economy/article/2025/11/20/fluctuating-pay-seasonal-work-welcome-to-china-s-iphone-city_6747643_19.html,,"Foxconn's production lines, driven by Apple's marketing strategy, need workers only for part of the year. Still, many are drawn to the overtime pay and bonuses."
49,Inequality on the rise in France amid a staggering surge in income among the ultrarich,https://www.lemonde.fr/en/politics/article/2025/11/20/inequality-on-the-rise-in-france-amid-a-staggering-surge-in-income-among-the-ultrarich_6747640_5.html,  By Denis Cosnard ,"The wealthiest 0.1% of French people earn, on average, 167 times more than the quarter of households with the lowest incomes, according to France's National Institute of Statistics and Economic Studies. The gap has widened dramatically over the past 20 years, while reforms introduced by Emmanuel Macron have reduced the tax rate for the richest households."
50,Ukraine: The danger to Europe of a Trump-Putin axis,https://www.lemonde.fr/en/opinion/article/2025/11/21/ukraine-the-danger-to-europe-of-a-trump-putin-axis_6747694_23.html,,
51,Reindustrializing France requires greater coherence,https://www.lemonde.fr/en/opinion/article/2025/11/18/reindustrializing-france-requires-greater-coherence_6747571_23.html,,
52,"Junk food, an enormous cost to society",https://www.lemonde.fr/en/opinion/article/2025/11/20/junk-food-an-enormous-cost-to-society_6747657_23.html,,
