,title,url,byline,subhed
254,Ils sont fous ces Romains ! Trois virées pour réviser l’Antiquité  ,https://www.lemonde.fr/intimites/article/2025/06/27/ils-sont-fous-ces-romains-trois-virees-pour-reviser-l-antiquite_6616178_6190330.html,  Par Yoanna Sultan-R'bibo ,
255," Dans le Var, la Design Parade entre utopie et dystopie ",https://www.lemonde.fr/m-styles/article/2025/07/02/dans-le-var-la-design-parade-entre-utopie-et-dystopie_6617415_4497319.html,"  Par Véronique Lorelle (Toulon, envoyée spéciale) ",
256,"A Paris, la décennie de Demna chez Balenciaga racontée dans une exposition  ",https://www.lemonde.fr/m-styles/article/2025/07/02/a-paris-la-decennie-de-demna-chez-balenciaga-racontee-dans-une-exposition_6617335_4497319.html,  Par Maud Gabrielson ,
257,"A Paris, la décennie de Demna chez Balenciaga racontée dans une exposition  ",https://www.lemonde.fr/m-styles/article/2025/07/02/a-paris-la-decennie-de-demna-chez-balenciaga-racontee-dans-une-exposition_6617335_4497319.html,  Par Maud Gabrielson ,
258,"Anna Wintour dans « Le Monde », une curiosité grandissante pour « la papesse de la mode »  ",https://www.lemonde.fr/m-le-mag/article/2025/07/02/anna-wintour-dans-le-monde-une-curiosite-grandissante-pour-la-papesse-de-la-mode_6617407_4500055.html,,
259,"Vert, violet, rose : trois recettes végétariennes pour pigmenter son assiette  ",https://www.lemonde.fr/les-recettes-du-monde/article/2025/07/01/vert-violet-rose-trois-recettes-vegetariennes-pour-pigmenter-son-assiette_6617168_5324493.html,  Par Le Goût du Monde ,
260,"A Château Peybonhomme-les-Tours, une ouverture rose dans le bordelais  ",https://www.lemonde.fr/m-styles/article/2025/07/02/a-chateau-peybonhomme-les-tours-une-ouverture-rose-dans-le-bordelais_6617386_4497319.html,  Par Rémi Barroux ,
261,"A Château Peybonhomme-les-Tours, une ouverture rose dans le bordelais  ",https://www.lemonde.fr/m-styles/article/2025/07/02/a-chateau-peybonhomme-les-tours-une-ouverture-rose-dans-le-bordelais_6617386_4497319.html,  Par Rémi Barroux ,
262,Santé : faut-il s’assurer lors d’un séjour à l’étranger ?  ,https://www.lemonde.fr/argent/article/2025/07/02/sante-faut-il-s-assurer-lors-d-un-sejour-a-l-etranger_6617328_1657007.html,  Par Caroline Robin ,
263,La e-Méhari est-elle en prise avec l’époque ?  ,https://www.lemonde.fr/m-styles/article/2025/07/01/la-e-mehari-est-elle-en-prise-avec-l-epoque_6617275_4497319.html,  Par Julien Thèves ,
264," A Landerneau, l’animal comme inépuisable filon artistique ",https://www.lemonde.fr/culture/article/2025/07/02/a-landerneau-l-animal-comme-inepuisable-filon-artistique_6617441_3246.html,  Par Philippe Dagen (Landerneau [Finistère]) ,
265,"Dans le Var, la Design Parade entre utopie et dystopie  ",https://www.lemonde.fr/m-styles/article/2025/07/02/dans-le-var-la-design-parade-entre-utopie-et-dystopie_6617415_4497319.html,"  Par Véronique Lorelle (Toulon, envoyée spéciale) ",
266,"Dans le Var, la Design Parade entre utopie et dystopie  ",https://www.lemonde.fr/m-styles/article/2025/07/02/dans-le-var-la-design-parade-entre-utopie-et-dystopie_6617415_4497319.html,"  Par Véronique Lorelle (Toulon, envoyée spéciale) ",
267,"Anna Wintour dans « Le Monde », une curiosité grandissante pour « la papesse de la mode »  ",https://www.lemonde.fr/m-le-mag/article/2025/07/02/anna-wintour-dans-le-monde-une-curiosite-grandissante-pour-la-papesse-de-la-mode_6617407_4500055.html,,
268,"A Château Peybonhomme-les-Tours, une ouverture rose dans le bordelais  ",https://www.lemonde.fr/m-styles/article/2025/07/02/a-chateau-peybonhomme-les-tours-une-ouverture-rose-dans-le-bordelais_6617386_4497319.html,  Par Rémi Barroux ,
269,"Dans « L’Aventura », de Sophie Letourneur, grandeurs et misères de vacances en famille  ",https://www.lemonde.fr/culture/article/2025/07/02/dans-l-aventura-de-sophie-letourneur-grandeurs-et-miseres-de-vacances-en-famille_6617377_3246.html,  Par Mathieu Macheret ,
270,"Dans « L’Aventura », de Sophie Letourneur, grandeurs et misères de vacances en famille  ",https://www.lemonde.fr/culture/article/2025/07/02/dans-l-aventura-de-sophie-letourneur-grandeurs-et-miseres-de-vacances-en-famille_6617377_3246.html,  Par Mathieu Macheret ,
271,"Avec « Materialists », Celine Song filme l’amour au temps cruel du dating  ",https://www.lemonde.fr/culture/article/2025/07/02/avec-materialists-celine-song-filme-l-amour-au-temps-cruel-du-dating_6617367_3246.html,  Par Boris Bastide ,
272,"Dans « Rêves », le réalisateur Dag Johan Haugerud plonge dans les brumes intérieures d’un amour adolescent à Oslo  ",https://www.lemonde.fr/culture/article/2025/07/02/dans-reves-le-realisateur-dag-johan-haugerud-plonge-dans-les-brumes-interieures-d-un-amour-adolescent-a-oslo_6617363_3246.html,  Par Boris Bastide ,
273, Santé : faut-il s’assurer lors d’un séjour à l’étranger ? ,https://www.lemonde.fr/argent/article/2025/07/02/sante-faut-il-s-assurer-lors-d-un-sejour-a-l-etranger_6617328_1657007.html,  Par Caroline Robin ,
274,"Ce qui change le 1ᵉʳ juillet pour votre budget : chômage, gaz, saisie sur salaire, rénovation énergétique, voitures électriques, crédits immobiliers, loyers, obsèques…  ",https://www.lemonde.fr/argent/article/2025/07/01/ce-qui-change-le-1-juillet-pour-votre-budget-chomage-gaz-saisie-sur-salaire-renovation-energetique-voitures-electriques-credits-immobiliers-loyers-obseques_6617182_1657007.html,  Par Aurélie Blondel ,
275,"Ce qui change le 1ᵉʳ juillet pour votre budget : chômage, gaz, saisie sur salaire, rénovation énergétique, voitures électriques, crédits immobiliers, loyers, obsèques…  ",https://www.lemonde.fr/argent/article/2025/07/01/ce-qui-change-le-1-juillet-pour-votre-budget-chomage-gaz-saisie-sur-salaire-renovation-energetique-voitures-electriques-credits-immobiliers-loyers-obseques_6617182_1657007.html,  Par Aurélie Blondel ,
276,Quand un créancier tente de contourner l’interdiction de saisir la résidence principale d’un entrepreneur  ,https://www.lemonde.fr/argent/article/2025/06/30/quand-un-creancier-tente-de-contourner-l-interdiction-de-saisir-la-residence-principale-d-un-entrepreneur_6616668_1657007.html,,
277,Location meublée touristique : la TVA est-elle due ?  ,https://www.lemonde.fr/argent/article/2025/06/29/location-meublee-touristique-la-tva-est-elle-due_6616336_1657007.html,"  Par Baptiste Bochart (Juriste chez JD2M, jedeclaremonmeuble.com) ",
278,Pourra-t-on encore s’assurer demain ?  ,https://www.lemonde.fr/argent/article/2025/06/18/pourra-t-on-encore-s-assurer-demain_6614133_1657007.html,  Par Nathalie Coulaud ,
279,Pourra-t-on encore s’assurer demain ?  ,https://www.lemonde.fr/argent/article/2025/06/18/pourra-t-on-encore-s-assurer-demain_6614133_1657007.html,  Par Nathalie Coulaud ,
280,Comment sont imposées les actions gratuites ?  ,https://www.lemonde.fr/argent/article/2025/06/22/comment-sont-imposees-les-actions-gratuites_6615217_1657007.html,"  Par Lucie Dugué (Ingénieure patrimoniale, Edmond de Rothschild) ",
281,L’action de groupe devient transfrontière  ,https://www.lemonde.fr/argent/article/2025/06/21/l-action-de-groupe-devient-transfrontiere_6615043_1657007.html,  Par Rafaële Rivais ,
282," A Pau, l’expérimentation du « management en équipes autonomes » a changé le quotidien des aides à domicile ",https://www.lemonde.fr/emploi/article/2025/07/02/a-pau-l-experimentation-du-management-en-equipes-autonomes-a-change-le-quotidien-des-aides-a-domicile_6617334_1698637.html,  Par Jules Thomas ,
283,La Cour des comptes secouée par la question du maintien en activité des magistrats  ,https://www.lemonde.fr/politique/article/2025/07/02/la-cour-des-comptes-secouee-par-la-question-du-maintien-en-activite-des-magistrats_6617314_823448.html,  Par Rémi Dupré ,
284,La Cour des comptes secouée par la question du maintien en activité des magistrats  ,https://www.lemonde.fr/politique/article/2025/07/02/la-cour-des-comptes-secouee-par-la-question-du-maintien-en-activite-des-magistrats_6617314_823448.html,  Par Rémi Dupré ,
285,Les premiers grands départs en vacances perturbés par la grève des contrôleurs aériens  ,https://www.lemonde.fr/economie/article/2025/07/01/les-premiers-grands-departs-en-vacances-perturbes-par-la-greve-des-controleurs-aeriens_6617299_3234.html,  Par Guy Dutheil ,
286,"Manageur amoureux, prends garde à toi !  ",https://www.lemonde.fr/emploi/article/2025/07/01/manageur-amoureux-prends-garde-a-toi_6617186_1698637.html,,
287,Deliveroo condamné une nouvelle fois pour travail dissimulé de ses livreurs  ,https://www.lemonde.fr/economie/article/2025/07/02/deliveroo-condamne-une-nouvelle-fois-pour-travail-dissimule-de-ses-livreurs_6617453_3234.html,Le Monde avec AFP,
288,Deliveroo condamné une nouvelle fois pour travail dissimulé de ses livreurs  ,https://www.lemonde.fr/economie/article/2025/07/02/deliveroo-condamne-une-nouvelle-fois-pour-travail-dissimule-de-ses-livreurs_6617453_3234.html,Le Monde avec AFP,
289,Princesse Tam-Tam et Comptoir des cotonniers placés en redressement judiciaire  ,https://www.lemonde.fr/economie/article/2025/07/02/princesse-tam-tam-et-comptoir-des-cotonniers-places-en-redressement-judiciaire_6617438_3234.html,Le Monde avec AFP,
290,"Canicule : « Au travail, notre attention diminue, le risque de se blesser avec les machines augmente aussi »  ",https://www.lemonde.fr/economie/article/2025/07/02/canicule-au-travail-notre-attention-diminue-le-risque-de-se-blesser-avec-les-machines-augmente-aussi_6617408_3234.html,  Propos recueillis par Aline Leclerc et Béatrice Madeline ,
291," Canicule : « A Châtillon, rénover toutes nos écoles prendrait vingt-six ans, c’est trop lent » ",https://www.lemonde.fr/planete/article/2025/07/02/avec-les-agents-de-la-ville-de-chatillon-mobilises-pendant-la-canicule-nous-installons-des-stores-quelques-ventilateurs-nous-avons-bien-conscience-que-c-est-du-palliatif_6617345_3244.html,  Par Matthieu Goar ,
292,"A Pau, l’expérimentation du « management en équipes autonomes » a changé le quotidien des aides à domicile  ",https://www.lemonde.fr/emploi/article/2025/07/02/a-pau-l-experimentation-du-management-en-equipes-autonomes-a-change-le-quotidien-des-aides-a-domicile_6617334_1698637.html,  Par Jules Thomas ,
293,"A Pau, l’expérimentation du « management en équipes autonomes » a changé le quotidien des aides à domicile  ",https://www.lemonde.fr/emploi/article/2025/07/02/a-pau-l-experimentation-du-management-en-equipes-autonomes-a-change-le-quotidien-des-aides-a-domicile_6617334_1698637.html,  Par Jules Thomas ,
294,"Aux urgences de l’hôpital d’Argenteuil, quelques coups de chaud et la crainte d’un été « compliqué »  ",https://www.lemonde.fr/planete/article/2025/07/02/aux-urgences-de-l-hopital-d-argenteuil-quelques-coups-de-chaud-et-la-crainte-d-un-ete-complique_6617320_3244.html,  Par Delphine Roucaute ,
295,Canicule : l’installation massive de volets s’impose dans le débat public  ,https://www.lemonde.fr/societe/article/2025/07/01/canicule-l-installation-massive-de-volets-s-impose-dans-le-debat-public_6617273_3224.html,  Par Véronique Chocron ,
296,Un rapport parlementaire préconise des « mesures-chocs » pour relancer l’investissement locatif  ,https://www.lemonde.fr/societe/article/2025/07/01/un-rapport-parlementaire-preconise-des-mesures-chocs-pour-relancer-l-investissement-locatif_6617229_3224.html,  Par Claire Ané ,
297,Un rapport parlementaire préconise des « mesures-chocs » pour relancer l’investissement locatif  ,https://www.lemonde.fr/societe/article/2025/07/01/un-rapport-parlementaire-preconise-des-mesures-chocs-pour-relancer-l-investissement-locatif_6617229_3224.html,  Par Claire Ané ,
298,"Municipales 2026 : à Paris, Emmanuel Grégoire désigné candidat du Parti socialiste  ",https://www.lemonde.fr/politique/article/2025/06/30/paris-emmanuel-gregoire-designe-candidat-du-parti-socialiste-aux-municipales-2026_6617030_823448.html,  Par Hélène Bekmezian ,
299,Financement des transports : la RATP et la région Ile-de-France parviennent à un accord  ,https://www.lemonde.fr/economie/article/2025/06/30/financement-des-transports-la-ratp-et-la-region-ile-de-france-parviennent-a-un-accord_6617027_3234.html,  Par Jonathan Parienté ,
300," A Gaza, avec le père Gabriel Romanelli : « La population est à bout de forces » ",https://www.lemonde.fr/le-monde-des-religions/article/2025/06/22/a-gaza-avec-le-pere-gabriel-romanelli-la-population-est-a-bout-de-forces_6615226_6038514.html,  Par Catherine Dupeyron ,
301,"Franck Frégosi, politiste : « En France, l’Etat est en quête du “musulman idéal” et mène une politique de domestication de l’islam »  ",https://www.lemonde.fr/le-monde-des-religions/article/2025/06/29/franck-fregosi-politiste-en-france-l-etat-est-en-quete-du-musulman-ideal-et-mene-une-politique-de-domestication-de-l-islam_6616344_6038514.html,  Propos recueillis par Cyprien Mycinski ,
302,"Franck Frégosi, politiste : « En France, l’Etat est en quête du “musulman idéal” et mène une politique de domestication de l’islam »  ",https://www.lemonde.fr/le-monde-des-religions/article/2025/06/29/franck-fregosi-politiste-en-france-l-etat-est-en-quete-du-musulman-ideal-et-mene-une-politique-de-domestication-de-l-islam_6616344_6038514.html,  Propos recueillis par Cyprien Mycinski ,
303,"Qu’est ce que le projet scientifique du « Coran européen », attaqué par l’extrême droite  ",https://www.lemonde.fr/le-monde-des-religions/article/2025/06/15/coran-europeen-que-contient-vraiment-ce-projet-scientifique-attaque-par-l-extreme-droite_6613237_6038514.html,  Par Youness Bousenna ,
304,"Claude Arpi, spécialiste du Tibet : « La succession du dalaï-lama n’est pas qu’une question spirituelle, c’est un levier géopolitique »  ",https://www.lemonde.fr/le-monde-des-religions/article/2025/07/01/claude-arpi-specialiste-du-tibet-la-succession-du-dalai-lama-n-est-pas-qu-une-question-spirituelle-c-est-un-levier-geopolitique_6617279_6038514.html,,
305,Notre-Dame de Paris : les maquettes des futurs vitraux contemporains bientôt exposées au Grand Palais  ,https://www.lemonde.fr/religions/article/2025/06/30/notre-dame-de-paris-les-maquettes-des-futurs-vitraux-contemporains-bientot-exposees-au-grand-palais_6616521_1653130.html,Le Monde avec AFP,
306,Notre-Dame de Paris : les maquettes des futurs vitraux contemporains bientôt exposées au Grand Palais  ,https://www.lemonde.fr/religions/article/2025/06/30/notre-dame-de-paris-les-maquettes-des-futurs-vitraux-contemporains-bientot-exposees-au-grand-palais_6616521_1653130.html,Le Monde avec AFP,
307,"« Les pratiques cherchant à faire des sens, de la chair et du sexe le théâtre d’une expérience spirituelle se démocratisent »  ",https://www.lemonde.fr/le-monde-des-religions/article/2025/06/28/les-pratiques-cherchant-a-faire-des-sens-de-la-chair-et-du-sexe-le-theatre-d-une-experience-spirituelle-se-democratisent_6616237_6038514.html,,
308,"Foucauld Giuliani, philosophe : « Trump substitue à Dieu “son” propre dieu, un dieu qui appelle à la guerre et la soutient »  ",https://www.lemonde.fr/idees/article/2025/06/23/foucauld-giuliani-philosophe-trump-substitue-a-dieu-son-propre-dieu-un-dieu-qui-appelle-a-la-guerre-et-la-soutient_6615471_3232.html,,
309," Les films à l’affiche cette semaine : « L’Accident de piano », « L’Aventura », « Rêves », « Materialists »… ",https://www.lemonde.fr/culture/article/2025/07/02/les-films-a-l-affiche-cette-semaine-l-accident-de-piano-l-aventura-reves-materialists_6617312_3246.html,"  Par Jacques Mandelbaum, Mathieu Macheret, Boris Bastide et Jean-François Rauger ",
310,"Les séries de la semaine : « Squid Game », « The Bear » et « Carmen Curlers »  ",https://www.lemonde.fr/culture/article/2025/07/01/les-series-de-la-semaine-squid-game-the-bear-et-carmen-curlers_6617164_3246.html,  Par Pauline Croquet et Audrey Fournier ,
311,"Les séries de la semaine : « Squid Game », « The Bear » et « Carmen Curlers »  ",https://www.lemonde.fr/culture/article/2025/07/01/les-series-de-la-semaine-squid-game-the-bear-et-carmen-curlers_6617164_3246.html,  Par Pauline Croquet et Audrey Fournier ,
312,"Nos idées de concerts et festivals : Mozart, Nine Inch Nails, Zaho de Sagazan, Vitaa…  ",https://www.lemonde.fr/culture/article/2025/06/30/nos-idees-de-concerts-et-festivals-mozart-nine-inch-nails-zaho-de-sagazan-vitaa_6616556_3246.html,"  Par Stéphanie Binet, Franck Colombani, Stéphane Davet, Pierre Gervasoni, Patrick Labesse et Marie-Aude Roux ",
313,Quels gestes de premiers secours adopter face à des urgences vitales ?  ,https://www.lemonde.fr/sante/article/2025/06/29/quels-gestes-de-premiers-secours-adopter-face-a-des-urgences-vitales_6616348_1651302.html,  Par Fanny Arlandis ,
314,"Nos choix de BD et mangas en juin : « Les Guerres invisibles », « Albertine a disparu », « Blanche »…  ",https://www.lemonde.fr/culture/article/2025/06/28/nos-choix-de-bd-et-mangas-en-juin-les-guerres-invisibles-albertine-a-disparu-blanche_6616225_3246.html,"  Par Pauline Croquet, Angèle Guicharnaud, Adrien Le Gal et Frédéric Potet ",
315,"Nos choix de BD et mangas en juin : « Les Guerres invisibles », « Albertine a disparu », « Blanche »…  ",https://www.lemonde.fr/culture/article/2025/06/28/nos-choix-de-bd-et-mangas-en-juin-les-guerres-invisibles-albertine-a-disparu-blanche_6616225_3246.html,"  Par Pauline Croquet, Angèle Guicharnaud, Adrien Le Gal et Frédéric Potet ",
316,Trois restaurants appréciés par nos critiques à tester à Paris  ,https://www.lemonde.fr/le-monde-passe-a-table/article/2025/06/27/trois-restaurants-apprecies-par-nos-critiques-a-tester-a-paris_6616066_6082232.html,  Par Léo Bourdin et Elisa Nguyen Phung ,
317,"Nos choix de livres cette semaine : « Je vous dédie mon silence », « La Déflagration », « Le Chemin de la frontière »…  ",https://www.lemonde.fr/culture/article/2025/06/26/nos-choix-de-livres-cette-semaine-je-vous-dedie-mon-silence-la-deflagration-le-chemin-de-la-frontiere_6615922_3246.html,"  Par Marie Dejoux (Historienne et collaboratrice du « Monde des livres »), Florence Bouchy (Collaboratrice du « Monde des livres »), Christine Lecerf (Collaboratrice du « Monde des livres ») et Florence Noiville ",
318, Israël-Hamas : « Le Monde » face à la guerre des images ,https://www.lemonde.fr/le-monde-et-vous/article/2023/11/28/israel-hamas-le-monde-face-a-la-guerre-des-images_6202800_6065879.html,,
319,La Matinale du Monde a 10 ans : les coulisses de la fabrication d’une édition  ,https://www.lemonde.fr/le-monde-et-vous/article/2025/05/11/la-matinale-du-monde-a-10-ans-les-coulisses-de-la-fabrication-d-une-edition_6604881_6065879.html,  Par Alexandre Pouchard (Rédacteur en chef de La Matinale) ,
320,La Matinale du Monde a 10 ans : les coulisses de la fabrication d’une édition  ,https://www.lemonde.fr/le-monde-et-vous/article/2025/05/11/la-matinale-du-monde-a-10-ans-les-coulisses-de-la-fabrication-d-une-edition_6604881_6065879.html,  Par Alexandre Pouchard (Rédacteur en chef de La Matinale) ,
321,La Matinale du Monde fête ses 10 ans : ses lecteurs racontent pourquoi ils ne « peuvent plus s’en passer »  ,https://www.lemonde.fr/le-monde-et-vous/article/2025/05/11/la-matinale-du-monde-fete-ses-10-ans-ses-lecteurs-racontent-pourquoi-ils-ne-peuvent-plus-s-en-passer_6604897_6065879.html,  Propos recueillis par Matthias Blamont et Marlène Duretz ,
322,Mille et une manières de profiter du « Monde »  ,https://www.lemonde.fr/le-monde-et-vous/article/2023/10/29/mille-et-une-manieres-de-profiter-du-monde_6197214_6065879.html,,
323,"« Le Monde » répond à vos questions sur sa ligne éditoriale, sa gouvernance et la vie de sa rédaction  ",https://www.lemonde.fr/le-monde-et-vous/live/2025/07/01/le-monde-repond-a-vos-questions-sur-sa-ligne-editoriale-sa-gouvernance-et-la-vie-de-sa-redaction_6617202_6065879.html,,
324,"« Le Monde » répond à vos questions sur sa ligne éditoriale, sa gouvernance et la vie de sa rédaction  ",https://www.lemonde.fr/le-monde-et-vous/live/2025/07/01/le-monde-repond-a-vos-questions-sur-sa-ligne-editoriale-sa-gouvernance-et-la-vie-de-sa-redaction_6617202_6065879.html,,
325,"Thomas Soret, fonctionnaire atteint de surdicécité : « Jusqu’à récemment, c’était ubuesque : on devait se déclarer soit sourd, soit aveugle »  ",https://www.lemonde.fr/le-monde-et-vous/article/2025/06/23/thomas-soret-fonctionnaire-atteint-de-surdicecite-jusqu-a-recemment-c-etait-ubuesque-on-devait-se-declarer-soit-sourd-soit-aveugle_6615405_6065879.html,  Par Isabelle Hennebelle ,
326,"Pierre Haski, président de Reporters sans frontières : « Le cocktail actuel est angoissant pour l’avenir du journalisme »  ",https://www.lemonde.fr/le-monde-et-vous/article/2025/06/15/pierre-haski-president-de-reporters-sans-frontieres-le-cocktail-actuel-est-angoissant-pour-l-avenir-du-journalisme_6613279_6065879.html,  Propos recueillis par Brice Laemle ,
327, Les meilleurs coussins de voyage ,https://www.lemonde.fr/guides-d-achat/article/2023/06/09/les-meilleurs-coussins-de-voyage_6176870_5306571.html, Par    Philippe Fontaine ,
328,Les meilleurs gaufriers  ,https://www.lemonde.fr/guides-d-achat/article/2023/10/04/les-meilleurs-gaufriers_6192421_5306571.html, Par    Philippe Fontaine ,
329,Les meilleurs gaufriers  ,https://www.lemonde.fr/guides-d-achat/article/2023/10/04/les-meilleurs-gaufriers_6192421_5306571.html, Par    Philippe Fontaine ,
330,Les meilleurs grille-pains  ,https://www.lemonde.fr/guides-d-achat/article/2025/04/17/les-meilleurs-grille-pains_6596973_5306571.html, Par    Philippe Fontaine ,
331,Les meilleurs balais vapeur  ,https://www.lemonde.fr/guides-d-achat/article/2025/04/15/les-meilleurs-balais-vapeur_6596301_5306571.html, Par    Alexandra Bellamy ,
332,Les meilleures machines à café à grains à moins de 500 euros  ,https://www.lemonde.fr/guides-d-achat/article/2024/07/31/les-meilleures-machines-a-cafe-a-grains-a-moins-de-500-euros_6262976_5306571.html, Par    Philippe Fontaine ,
333,Les meilleures machines à café à grains à moins de 500 euros  ,https://www.lemonde.fr/guides-d-achat/article/2024/07/31/les-meilleures-machines-a-cafe-a-grains-a-moins-de-500-euros_6262976_5306571.html, Par    Philippe Fontaine ,
334,Les meilleurs pianos numériques pas chers pour débutants  ,https://www.lemonde.fr/guides-d-achat/article/2022/01/17/les-meilleurs-pianos-numeriques-pas-chers-pour-debutants_6109833_5306571.html, Par    Paul Montag ,
335,Voici notre guide d’achat des meilleurs robots pâtissiers  ,https://www.lemonde.fr/guides-d-achat/article/2024/04/05/les-meilleurs-robots-patissiers_6226175_5306571.html, Par    Philippe Fontaine ,
