,title,url,byline,subhed
0,Escaping New York's winter and its 'communist' mayor for Miami,https://www.lemonde.fr/en/international/article/2025/12/25/escaping-new-york-s-winter-and-its-communist-mayor-for-miami_6748833_4.html,  By Georgia Husson ,
1,Bethlehem celebrates Christmas in climate of 'fear and uncertainty',https://www.lemonde.fr/en/international/article/2025/12/25/bethlehem-celebrates-christmas-in-climate-of-fear-and-uncertainty_6748826_4.html,,
2,"In Turkey, the fall of a star television presenter exposes internal power struggles",https://www.lemonde.fr/en/international/article/2025/12/25/in-turkey-the-fall-of-a-star-television-presenter-exposes-internal-power-struggles_6748825_4.html,  By Nicolas Bourcier (Istanbul (Turkey) correspondent) ,
3,Algeria demands 'apologies' and 'reparations' from France for its colonial past,https://www.lemonde.fr/en/international/article/2025/12/24/algeria-demands-apologies-and-reparations-from-france-for-its-colonial-past_6748813_4.html,"  By Frédéric Bobin and Hamid Nasri (Algiers, Algeria, correspondent) ",
4,'Trump's ideological challenge to Europe is more dangerous than the security one',https://www.lemonde.fr/en/opinion/article/2025/12/11/trump-s-ideological-challenge-to-europe-is-more-dangerous-than-the-security-one_6748393_23.html,,
5,"Attacked by Trump, Europe wavers between denial and fear of reprisals",https://www.lemonde.fr/en/international/article/2025/12/11/attacked-by-trump-europe-wavers-between-denial-and-fear-of-reprisals_6748382_4.html,"  By Philippe Jacqué (Brussels, Europe bureau) and Virginie Malingre (Brussels, Europe bureau) ",
6,Bosnia and Herzegovina's Serb entity elects ally of  former leader Dodik,https://www.lemonde.fr/en/international/article/2025/11/24/bosnia-and-herzegovina-s-serb-entity-elects-ally-of-former-leader-dodik_6747765_4.html,  By Rémy Ourdan (Banja Luka (Bosnia and Herzegovina) special correspondent) ,
7,"In France's Somme, bagpipers keep the memory of the Great War alive",https://www.lemonde.fr/en/history/article/2025/11/11/in-france-s-somme-bagpipers-keep-the-memory-of-the-great-war-alive_6747347_157.html,,
8,Why more young people are turning to religion,https://www.lemonde.fr/en/france/article/2025/12/25/why-more-young-people-are-turning-to-religion_6748827_7.html,  By Sarah Belouezzane ,
9,French biathlon team races ahead on the unpredictable road to the Olympics,https://www.lemonde.fr/en/sports/article/2025/12/25/french-biathlon-team-races-ahead-on-the-unpredictable-road-to-the-olympics_6748823_9.html,"  By Thomas Saintourens (Le Grand-Bornand (France), special correspondent) ",
10,"'Knowing they will all be together without me is hard': Christmas, a lonely time for many struggling students",https://www.lemonde.fr/en/france/article/2025/12/24/knowing-they-will-all-be-together-without-me-is-hard-christmas-a-time-of-loneliness-for-many-struggling-students_6748800_7.html,  By Jeanne Boyer ,
11,French anesthesiologist sentenced to life imprisonment after poisoning 30 patients,https://www.lemonde.fr/en/france/article/2025/12/24/french-anesthesiologist-sentenced-to-life-imprisonment-after-poisoning-30-patients_6748795_7.html,  By Willy Graff ,
12,The French studio behind a viral Christmas ad,https://www.lemonde.fr/en/videos/video/2025/12/12/the-french-studio-behind-a-viral-christmas-ad_6748436_108.html,"  By Le Monde's video desk, Antoine Apelbaum   and Sinead McCausland (Le Monde in English) ",
13,"Israel's D9 bulldozer, a tool of destruction in Gaza",https://www.lemonde.fr/en/videos/video/2025/11/27/israel-s-d9-bulldozer-a-tool-of-destruction-in-gaza_6747870_108.html,"  By Liselotte Mas, Elsa Longueville (motion design) and Sinead McCausland ",
14,"Ukraine's Pokrovsk faces fierce fighting, footage analyzed by Le Monde reveals",https://www.lemonde.fr/en/videos/video/2025/11/21/ukraine-s-pokrovsk-faces-fierce-fighting-footage-analyzed-by-le-monde-reveals_6747708_108.html,"  By Alexandre Horn, Gabriel Lecointre (edit), Elisa Bellanger (motion design) and Sinead McCausland ",
15,Afghanistan: Relentless repression continues over four years into Taliban's rule,https://www.lemonde.fr/en/videos/video/2025/10/04/afghanistan-relentless-repression-continues-over-four-years-into-taliban-s-rule_6746092_108.html,"  By Chloé Denis, Félix Pommier (Motion design) and Sinead McCausland ",
16,2026 budget: The risk of deadlock,https://www.lemonde.fr/en/opinion/article/2025/12/24/2026-budget-the-risk-of-deadlock_6748812_23.html,,
17,Cambodia-Thailand conflict: The poison of nationalism,https://www.lemonde.fr/en/opinion/article/2025/12/23/cambodia-thailand-conflict-the-poison-of-nationalism_6748780_23.html,,
18,The geopolitics of microprocessors: A harsh lesson for Europeans,https://www.lemonde.fr/en/opinion/article/2025/12/22/the-geopolitics-of-microprocessors-a-harsh-lesson-for-europeans_6748750_23.html,,
19,"'In Spain, the Sánchez government holds on, but its future appears seriously in doubt'",https://www.lemonde.fr/en/opinion/article/2025/12/21/in-spain-the-sanchez-government-holds-on-but-its-future-appears-seriously-in-doubt_6748732_23.html,,
20,Disneyland Paris at 40: When Mickey Mouse said 'bonjour' to Paris,https://www.lemonde.fr/en/m-le-mag/article/2025/12/22/disneyland-paris-at-40-when-mickey-mouse-said-bonjour-to-paris_6748740_117.html,,
21,Madagascar's metalheads lead charge of anger: 'It's easier to make yourself heard when you scream',https://www.lemonde.fr/en/m-le-mag/article/2025/12/21/madagascar-s-metalheads-lead-charge-of-anger-it-s-easier-to-make-yourself-heard-when-you-scream_6748730_117.html,,
22,Da Vinci's secret tunnels at Milan's Sforza Castle appear to be nothing more than sewers,https://www.lemonde.fr/en/m-le-mag/article/2025/12/21/da-vinci-s-secret-tunnels-at-milan-s-sforza-castle-appear-to-be-nothing-more-than-sewers_6748712_117.html,  By Allan Kaval (Rome (Italy) correspondent) ,
23,Trump and the 'derangement syndrome' driving people crazy,https://www.lemonde.fr/en/m-le-mag/article/2025/12/20/trump-and-the-derangement-syndrome-driving-people-crazy_6748696_117.html,  By Clément Ghys ,
24,Five creative craft workshops to enjoy doing in Paris with your child,https://www.lemonde.fr/en/intimacy/article/2025/12/13/in-paris-five-creative-craft-workshops-to-enjoy-doing-with-your-child_6748451_310.html,  By Tiphaine Thuillier ,
25,Jewels of power go on display in Paris,https://www.lemonde.fr/en/culture/article/2025/12/11/the-power-gems-on-display-in-paris_6748374_30.html,  By Valentin Pérez   ,
26,Five spots in Paris to enjoy a (great) plant-based sandwich,https://www.lemonde.fr/en/lifestyle/article/2025/12/04/in-paris-five-spots-to-enjoy-a-great-plant-based-sandwich_6748131_37.html,  By Lucas Scaltritti ,
27,"Bayonne's 'Little Louvre,' the Bonnat-Helleu Museum, reopens after 14 years",https://www.lemonde.fr/en/culture/article/2025/11/28/bayonne-s-little-louvre-the-bonnat-helleu-museum-reopens-after-14-years_6747913_30.html,  By Roxana Azimi (Bayonne (France) special correspondent) ,
28, Trump says US launched deadly strikes on Islamic State in Nigeria after group targeted Christians  ,https://www.lemonde.fr/en/international/article/2025/12/26/trump-says-us-launched-deadly-strikes-on-islamic-state-in-nigeria_6748837_4.html,Le Monde with AFP,"The attacks mark the first by US forces in Nigeria under Trump, and come after the Republican berated the West African nation in October and November, saying Christians there faced an 'existential threat' that amounted to 'genocide' amid Nigeria's myriad armed conflicts."
29,"Pope urges Russia, Ukraine dialogue in Christmas blessing",https://www.lemonde.fr/en/international/article/2025/12/25/pope-urges-russia-ukraine-dialogue-in-christmas-blessing_6748829_4.html,Le Monde with AFP,
30,Zelensky says he held talks on Ukraine with US envoys,https://www.lemonde.fr/en/international/article/2025/12/25/zelensky-says-has-had-talks-on-ukraine-with-us-envoys_6748830_4.html,Le Monde with AFP,
31,Europe's relentless semiconductor decline,https://www.lemonde.fr/en/economy/article/2025/12/25/europe-s-relentless-semiconductor-decline_6748832_19.html,,"'Chips: The Oil of the 21st Century' (3/5). When the Chips Act, the plan by the 27 European Union member states to reduce their dependence on the US and China for semiconductors, came into force in 2023, the goal initially appeared 'out of reach.'"
32,'Tyranny is booming': Kimmel warns of rising fascism in Christmas message to UK viewers,https://www.lemonde.fr/en/culture/article/2025/12/26/tyranny-is-booming-kimmel-warns-of-rising-fascism-in-christmas-message-to-uk-viewers_6748835_30.html,Le Monde with AP and AFP,"The talk show host took aim at US President Donald Trump in a message aired on Channel 4 on Thursday, dubbed 'The Alternative Christmas Message.' Kimmel appealed to Britons not to give up on Americans."
33,Pop goes the cocktail! Five champagne cocktail recipes for the end-of-year festivities,https://www.lemonde.fr/en/lifestyle/article/2025/12/26/pop-goes-the-cocktail-five-champagne-cocktail-recipes-for-the-end-of-year-festivities_6748836_37.html,  By Laure Gasparotto ,"While the idea may offend some purists, champagne features prominently in many cocktail recipes. Five bartenders share their personal creations, all featuring prestigious and sublime bubbly."
34,Escaping New York's winter and its 'communist' mayor for Miami,https://www.lemonde.fr/en/international/article/2025/12/25/escaping-new-york-s-winter-and-its-communist-mayor-for-miami_6748833_4.html,  By Georgia Husson ,"'My Christmas under Trump' (4/5). Journalist Georgia Husson settled in New York right in the middle of the holiday season preparations. Just a few hours' flight from the Big Apple, the state draws wealthy New Yorkers in search of sunshine, peace and quiet and extravagant gifts."
35,Bethlehem celebrates Christmas in climate of 'fear and uncertainty',https://www.lemonde.fr/en/international/article/2025/12/25/bethlehem-celebrates-christmas-in-climate-of-fear-and-uncertainty_6748826_4.html,,
36,Turkey detains dozens of IS suspects planning attacks on Christmas and New Year's celebrations,https://www.lemonde.fr/en/international/article/2025/12/26/turkey-detains-dozens-of-is-suspects-planning-attacks-on-christmas-and-new-year-s-celebrations_6748834_4.html,Le Monde with AP and AFP,
37,Syria says detained senior IS jihadist in Damascus,https://www.lemonde.fr/en/international/article/2025/12/24/syria-says-detained-senior-is-jihadist-in-damascus_6748818_4.html,Le Monde with AFP,
38,"In his first Christmas as pope, Leo XIV denounces a 'distorted economy'",https://www.lemonde.fr/en/international/article/2025/12/25/in-his-first-christmas-as-pope-leo-xiv-denounces-a-distorted-economy_6748822_4.html,Le Monde with AFP,
39,French biathlon team races ahead on the unpredictable road to the Olympics,https://www.lemonde.fr/en/sports/article/2025/12/25/french-biathlon-team-races-ahead-on-the-unpredictable-road-to-the-olympics_6748823_9.html,"  By Thomas Saintourens (Le Grand-Bornand (France), special correspondent) ",
40,Explosion at Nigerian mosque kills five,https://www.lemonde.fr/en/international/article/2025/12/25/explosion-at-nigerian-mosque-kills-at-least-seven_6748820_4.html,Le Monde with AP and AFP,
41,"In Turkey, the fall of a star television presenter exposes internal power struggles",https://www.lemonde.fr/en/international/article/2025/12/25/in-turkey-the-fall-of-a-star-television-presenter-exposes-internal-power-struggles_6748825_4.html,  By Nicolas Bourcier (Istanbul (Turkey) correspondent) ,
42,'Taylor Swift: The End of an Era' on Disney+: Behind the scenes of a record-breaking tour,https://www.lemonde.fr/en/culture/article/2025/12/25/taylor-swift-the-end-of-an-era-on-disney-behind-the-scenes-of-a-record-breaking-tour_6748824_30.html,  By Catherine Pacary ,
43,"From a best-seller, director Paul Feig turns 'The Housemaid' into a run-of-the-mill film",https://www.lemonde.fr/en/culture/article/2025/12/25/from-a-best-seller-director-paul-feig-turns-the-housemaid-into-a-run-of-the-mill-film_6748821_30.html,  By Murielle Joudet ,
44,Digital regulation: Thierry Breton faces sanctions as US-EU dispute intensifies,https://www.lemonde.fr/en/international/article/2025/12/24/digital-regulation-thierry-breton-faces-sanctions-as-us-eu-dispute-intensifies_6748809_4.html,  By Philippe Ricard ,
45,"After passing an interim budget bill, PM Lecornu's approach faces scrutiny",https://www.lemonde.fr/en/politics/article/2025/12/24/2026-budget-after-passing-an-stopgap-budget-bill-pm-lecornu-s-approach-faces-scrutiny_6748807_5.html,  By Mariama Darame and Nathalie Segaunes ,
46,Algeria demands 'apologies' and 'reparations' from France for its colonial past,https://www.lemonde.fr/en/international/article/2025/12/24/algeria-demands-apologies-and-reparations-from-france-for-its-colonial-past_6748813_4.html,"  By Frédéric Bobin and Hamid Nasri (Algiers, Algeria, correspondent) ",
47,Why more young people are turning to religion,https://www.lemonde.fr/en/france/article/2025/12/25/why-more-young-people-are-turning-to-religion_6748827_7.html,  By Sarah Belouezzane ,"Many researchers have observed a resurgence of religious commitment among young people in France, often accompanied by a certain rigorism. This renewed spiritual quest is linked both to the anxieties of our era and, at times, a search for identity."
48,Is Paris finally embracing musical theater?,https://www.lemonde.fr/en/culture/article/2025/12/22/is-paris-finally-embracing-musical-theater_6748764_30.html,  By Sandrine Blanchard and Rosita Boisseau ,"Long considered unpopular by the French, musicals have flourished recently in the capital. But is this just a mere trend to which the French will inevitably turn their noses up?"
49,"White, snowy Christmas: The truth behind a misleading cliché",https://www.lemonde.fr/en/les-decodeurs/article/2025/12/23/white-snowy-christmas-the-truth-behind-a-misleading-cliche_6748789_8.html,,"Long associated with imagery of the Three Wise Men, the depiction of Christmas took on a wintry turn in the 16th century. Yet the chances of seeing snow in France on December 25 have never been lower."
50,2026 budget: The risk of deadlock,https://www.lemonde.fr/en/opinion/article/2025/12/24/2026-budget-the-risk-of-deadlock_6748812_23.html,,
51,"'Private geoengineering comes at a cost, and that cost is public'",https://www.lemonde.fr/en/opinion/article/2025/12/19/private-geoengineering-comes-at-a-cost-and-that-cost-is-public_6748677_23.html,,
52,'Ocean Viking migrant rescue ship stands as the last guardian of the law in international waters',https://www.lemonde.fr/en/opinion/article/2025/12/21/ocean-viking-migrant-rescue-ship-stands-as-the-last-guardian-of-the-law-in-international-waters_6748713_23.html,,
