,title,subhed,url,byline
0, Iran's crackdown reaches unprecedented levels: 'There were layers of bodies stacked on top of each other'  ,"Point-blank shootings at protests, hangars filled with corpses and omnipresent security forces: Multiple accounts gathered by Le Monde attest to the unparalleled violence used by authorities to suppress the demonstrations.",https://www.lemonde.fr/en/international/article/2026/01/14/iran-s-crackdown-reaches-unprecedented-levels-there-were-layers-of-bodies-stacked-on-top-of-each-other_6749432_4.html,  By Ghazal Golshiri 
1,France to send troops to Greenland for joint exercise with several European countries,,https://www.lemonde.fr/en/international/article/2026/01/14/greenland-denmark-announces-boosted-military-presence-on-the-island-from-today_6749426_4.html,Le Monde with AFP
2,Zelensky to declare 'state of emergency' in Ukraine's energy sector,,https://www.lemonde.fr/en/international/article/2026/01/15/zelensky-to-declare-state-of-emergency-in-ukraine-s-energy-sector_6749438_4.html,Le Monde with AFP
3,US suspends immigrant visa procedures for nationals of 75 countries,"According to Fox News, the measure is set to affect citizens of Somalia, Russia, Afghanistan, Brazil, Iran, Iraq, Egypt, Nigeria, Thailand and Yemen, among others, but does not affect tourist, business or other visas.",https://www.lemonde.fr/en/international/article/2026/01/14/us-suspends-immigrant-visa-procedures-for-nationals-of-75-countries_6749430_4.html,Le Monde with AFP
4,South Korean prosecutors seek death penalty for Yoon Suk Yeol over martial law declaration,Prosecutors argued that the former conservative South Korean president was guilty of leading an insurrection 'in order to remain in power by usurping judicial and legislative authority.' The verdict is expected on February 19.,https://www.lemonde.fr/en/international/article/2026/01/15/south-korean-prosecutors-seek-death-penalty-for-yoon-suk-yeol-over-martial-law-declaration_6749437_4.html,  By Philippe Mesmer (Tokyo (Japan) correspondent) 
5,"'In the face of Donald Trump's imperialism, realism means defending the law as an indispensable tool'","As the president shows his eagerness to dismantle any form of checks and balances both within and beyond the US borders, the principles of law paradoxically endure, explains Le Monde columnist Gilles Paris.",https://www.lemonde.fr/en/opinion/article/2026/01/14/in-the-face-of-donald-trump-s-imperialism-realism-means-defending-the-law-as-an-indispensable-tool_6749435_23.html,
6,"After celebrating Maduro ouster, Venezuelan migrants in US fear what lies ahead","After celebrating the abduction of Nicolas Maduro, Venezuelan asylum seekers in the US have begun to have doubts. In Denver, Colorado, where they number in the tens of thousands, many now fear having to go back to their country with the Chavistas still in power.",https://www.lemonde.fr/en/international/article/2026/01/14/after-celebrating-maduro-ouster-venezuelan-migrants-in-us-fear-what-lies-ahead_6749433_4.html,
7,Astronauts from the Crew-11 space mission leave the ISS,,https://www.lemonde.fr/en/international/article/2026/01/15/astronauts-from-the-crew-11-space-mission-leave-the-iss_6749441_4.html,Le Monde with AFP
8,50 French farmers arrested after storming agricultural ministry building in Paris,,https://www.lemonde.fr/en/economy/article/2026/01/15/50-french-farmers-arrested-after-storming-agricultural-ministry-building-in-paris_6749440_19.html,Le Monde with AFP
9,French Assemblée Nationale rejects no-confidence motions filed by LFI and RN in protest against free trade treaty,,https://www.lemonde.fr/en/france/article/2026/01/14/french-national-assembly-rejects-no-confidence-motions-filed-by-lfi-and-rn-in-protest-against-free-trade-treaty_6749434_7.html,Le Monde with AFP
10,Venezuela's interim president announces 'new political era',,https://www.lemonde.fr/en/international/article/2026/01/15/venezuela-s-interim-president-announces-new-political-era_6749439_4.html,Le Monde with AFP
11,US-backed plan to end war in Gaza moves into second phase,,https://www.lemonde.fr/en/international/article/2026/01/15/us-backed-plan-to-end-war-in-gaza-moves-into-second-phase_6749436_4.html,Le Monde with AFP
12,Russia steps up Ukraine strikes as polar cold grips the country,,https://www.lemonde.fr/en/international/article/2026/01/14/russia-steps-up-ukraine-strikes-as-polar-cold-grips-the-country_6749424_4.html,"  By Emmanuel Grynszpan and Thomas d’Istria (Kyiv, correspondent) "
13,Chiara Ferragni acquitted in charity cake and Easter egg fraud trial,,https://www.lemonde.fr/en/international/article/2026/01/14/chiara-ferragni-acquitted-in-charity-cake-and-easter-egg-fraud-trial_6749431_4.html,Le Monde with AFP
14,2025 ranks among the three hottest years ever recorded,,https://www.lemonde.fr/en/environment/article/2026/01/14/2025-ranks-among-the-three-hottest-years-ever-recorded_6749418_114.html,  By Audrey Garric 
15,Corsican nationalist's assassination questions 'myth' of criminal code of honor,,https://www.lemonde.fr/en/france/article/2026/01/14/corsican-nationalist-s-assassination-questions-myth-of-criminal-code-of-honor_6749421_7.html,"  By Paul Ortoli (Ajaccio (Corsica), special correspondent) "
16,Author Chimamanda Ngozi Adichie denounces Nigerian healthcare after baby son's death,,https://www.lemonde.fr/en/international/article/2026/01/14/author-chimamanda-ngozi-adichie-denounces-nigerian-healthcare-after-her-baby-son-s-death_6749425_4.html,Le Monde with AFP
17,Louvre's higher ticket prices for non-European visitors take effect,,https://www.lemonde.fr/en/france/article/2026/01/14/louvre-s-higher-ticket-prices-for-non-european-visitors-take-effect_6749406_7.html,Le Monde with AFP
18,EU says Ukraine will spend most of €90 billion loan on military needs,,https://www.lemonde.fr/en/international/article/2026/01/14/eu-says-ukraine-will-spend-most-of-90-billion-loan-on-military-needs_6749420_4.html,Le Monde with AFP
19,"Long before coveting Greenland, the US expanded by opening its checkbook","From the early 19th century on, the United States expanded by acquiring territory through purchase or force. By expressing interest in Greenland, Donald Trump has revived that tradition.",https://www.lemonde.fr/en/international/article/2026/01/13/long-before-sizing-up-greenland-the-us-expanded-by-opening-its-checkbook_6749390_4.html,  By Arnaud Leparmentier (San Francisco (United States) correspondent) 
20,'The Islamic Republic of Iran is entering its final phase',"Hemmed in by domestic and external crises, the Islamic Republic of Iran is now finding itself with nowhere left to turn, analyzes Farid Vahid, the co-director of the Observatory of North Africa and the Middle East at the Fondation Jean Jaurès.",https://www.lemonde.fr/en/opinion/article/2026/01/13/the-islamic-republic-of-iran-is-entering-its-final-phase_6749342_23.html,
21,Paris launches project for Montparnasse renovation,The architect Renzo Piano unveiled his new renovation plan for the shopping center. Construction is hoped to start in 2028.,https://www.lemonde.fr/en/economy/article/2026/01/13/paris-launches-project-for-montparnasse-renovation_6749346_19.html,  By Emeline Cazi 
22,Trump's disastrous undermining of the Federal Reserve,,https://www.lemonde.fr/en/opinion/article/2026/01/14/trump-s-disastrous-undermining-of-the-federal-reserve_6749416_23.html,
23,'Corporate America is crushing the planet with its profits',,https://www.lemonde.fr/en/opinion/article/2026/01/14/corporate-america-is-crushing-the-planet-with-its-profits_6749403_23.html,
24,Quinn Slobodian: 'The US discarding the post-1945 international system is a bold and reckless gamble',,https://www.lemonde.fr/en/opinion/article/2026/01/12/quinn-slobodian-the-us-discarding-the-post-1945-international-system-is-a-bold-and-reckless-gamble_6749331_23.html,
