,title,url,byline,subhed
0,"Crise grecque de la dette : dix ans après le référendum sur l’austérité, la population reste traumatisée",https://www.lemonde.fr/economie/article/2025/08/15/crise-grecque-de-la-dette-dix-ans-apres-le-referendum-sur-l-austerite-la-population-reste-traumatisee_6629645_3234.html,,
1,Les nombreuses analogies entre les Etats-Unis de Trump et ceux des « barons voleurs » de 1890,https://www.lemonde.fr/economie/article/2025/08/04/richesse-monopoles-corruption-l-amerique-de-donald-trump-est-elle-revenue-en-1890_6626445_3234.html,  Par Philippe Escande ,
2,Expulsion de squatteurs et faute de l’huissier,https://www.lemonde.fr/argent/article/2025/08/15/expulsion-de-squatteurs-et-faute-de-l-huissier_6629687_1657007.html,,
3,"« Les racines du mal budgétaire français sont à chercher au-delà de nos frontières, dans l’échec d’un système fiscal international à bout de souffle »",https://www.lemonde.fr/idees/article/2025/08/13/les-racines-du-mal-budgetaire-francais-sont-a-chercher-au-dela-de-nos-frontieres-dans-l-echec-d-un-systeme-fiscal-international-a-bout-de-souffle_6629005_3232.html,,
4,La machine anti-immigration de Donald Trump s’active au cœur de New York,https://www.lemonde.fr/international/video/2025/08/14/la-machine-anti-immigration-de-donald-trump-s-active-au-c-ur-de-new-york_6629527_3210.html,"  Par Brieuc Beckers, Adrien Vande Casteele (motion design) et Fanny Zarifi ",
5,Pourquoi tout le monde s’arrache l’Arctique ? Comprendre en trois minutes,https://www.lemonde.fr/comprendre-en-3-minutes/video/2025/08/14/pourquoi-tout-le-monde-s-arrache-l-arctique-comprendre-en-trois-minutes_6629216_6176282.html,  Par Laurent Selinder et Arthur Navet (Motion design) ,
6,Pourquoi la Russie utilise tellement de drones iraniens Shahed pour attaquer l’Ukraine,https://www.lemonde.fr/international/video/2025/08/07/ukraine-pourquoi-la-russie-intensifie-ses-attaques-de-drones-shahed_6627299_3210.html,  Par Poline Tchoubar et Elisa Bellanger (Motion design) ,
7,Hiroshima : comment s’est déroulé le bombardement atomique le plus dévastateur de l’histoire,https://www.lemonde.fr/histoire/video/2025/08/02/hiroshima-comment-s-est-deroule-le-bombardement-atomique-le-plus-devastateur-de-l-histoire_6626343_4655323.html,  Par Karim El Hadj et Adrien Vande Casteele ,
8,Nouvelle-Calédonie : un accord à remettre sur le métier,https://www.lemonde.fr/idees/article/2025/08/14/nouvelle-caledonie-un-accord-a-remettre-sur-le-metier_6629460_3232.html,,
9,« Je ne résiste pas à l’envie de demander à André Comte-Sponville : “A quoi penses-tu quand tu fais un pot-au-feu ?” »,https://www.lemonde.fr/series-d-ete/article/2025/08/14/je-ne-resiste-pas-a-l-envie-de-demander-a-andre-comte-sponville-a-quoi-penses-tu-quand-tu-fais-un-pot-au-feu_6629390_3451060.html,,
10,"Pour les entreprises françaises, une reprise des fusions et acquisitions est attendue dès la rentrée",https://www.lemonde.fr/economie/article/2025/08/14/pour-les-entreprises-francaises-une-reprise-des-fusions-et-acquisitions-est-attendue-des-la-rentree_6629389_3234.html,,
11,"« En Serbie, les plénums étudiants apparaissent comme des lieux de respiration civique »",https://www.lemonde.fr/idees/article/2025/08/15/en-serbie-les-plenums-etudiants-apparaissent-comme-des-lieux-de-respiration-civique_6629938_3232.html,,
12,"Avec « En boucle », Junta Yamaguchi fait tourner un manège cinématographique follement ludique",https://www.lemonde.fr/culture/article/2025/08/13/avec-en-boucle-junta-yamaguchi-fait-tourner-un-manege-cinematographique-follement-ludique_6629019_3246.html,  Par Murielle Joudet ,
13,"A quoi va ressembler la rentrée littéraire 2025 : Emmanuel Carrère, Catherine Millet, Alain Mabanckou, Audur Ava Olafsdottir…",https://www.lemonde.fr/livres/article/2025/08/15/rentree-litteraire-2025-emmanuel-carrere-catherine-millet-alain-mabanckou-audur-ava-olafsdottir-lectures-prometteuses_6629686_3260.html,,
14,"« Fille de la nation », sur Canal+ : Zdenka Havlickova, une figure oubliée de l’histoire tchèque",https://www.lemonde.fr/culture/article/2025/08/15/fille-de-la-nation-sur-canal-zdenka-havlickova-une-figure-oubliee-de-l-histoire-tcheque_6629916_3246.html,  Par Thomas Sotinel ,
15,"A Saint-Rémy-de-Provence, une plongée dans l’arène taurine et torride de Picasso",https://www.lemonde.fr/culture/article/2025/08/15/a-saint-remy-de-provence-une-plongee-dans-l-arene-taurine-et-torride-de-picasso_6629892_3246.html,  Par Harry Bellet (Saint-Rémy-de-Provence (Bouches-du-Rhône)) ,
16,"Louise Trotter, la manière sobre",https://www.lemonde.fr/series-d-ete/article/2025/08/15/louise-trotter-la-maniere-sobre_6629941_3451060.html,  Par Valentin Pérez ,
17,"Que faire, que voir, où aller ? L’agenda culturel et art de vivre en France à partir du 16 août",https://www.lemonde.fr/m-styles/article/2025/08/15/que-faire-que-voir-ou-aller-l-agenda-culturel-et-art-de-vivre-en-france-a-partir-du-16-aout_6629939_4497319.html,  Par Marie-Anne Bruschi ,
18,"« Il n’a pas tout compris mais, ce qu’il a retenu, c’est que leur mère adorée était bien vivante à leurs côtés grâce à l’église »",https://www.lemonde.fr/m-styles/article/2025/08/15/il-n-a-pas-tout-compris-mais-ce-qu-il-a-retenu-c-est-que-leur-mere-adoree-etait-bien-vivante-a-leurs-cotes-grace-a-l-eglise_6629929_4497319.html,,
19,Pourquoi les attrape-peluches de fête foraine nous rendent aussi gagas,https://www.lemonde.fr/les-decodeurs/article/2025/08/10/pourquoi-les-attrape-peluches-de-fete-foraine-nous-rendent-aussi-gagas_6627656_4355770.html,  Par William Audureau ,
20,"         Live  Article se déroulant en direct   Donald Trump et Vladimir Poutine n’annoncent pas d’accord sur l’Ukraine mais font état de « progrès », après leur rencontre en Alaska  ",https://www.lemonde.fr/international/live/2025/08/15/en-direct-rencontre-poutine-trump-le-sommet-historique-entre-les-deux-dirigeants-et-leurs-conseillers-est-en-cours_6627648_3210.html,,"Les deux dirigeants se sont entretenus, en compagnie de leurs conseillers, pendant près de trois heures à Anchorage, en Alaska. Le président américain a affirmé qu’il allait appeler Volodymyr Zelensky, alors que son homologue russe a dit espérer que « l’entente » trouvée pourra ouvrir « la voie à la paix en Ukraine », sans en préciser la teneur."
21,"« Un enfant né en 2020 vit l’été 2025 comme un été brûlant, mais le même été lui semblera normal une fois adulte »",https://www.lemonde.fr/planete/article/2025/08/15/cette-canicule-incarne-la-realite-du-rechauffement-climatique-et-aide-a-la-prise-de-conscience_6629926_3244.html,  Propos recueillis par Stéphane Foucart ,"Le climatologue Christophe Cassou revient sur les causes de l’épisode caniculaire en cours, qui touche toute l’Europe méditerranéenne, et constate la défaillance des politiques publiques d’adaptation."
22,"A Capri, la villa Lysis, le baron et ses trop jeunes favoris",https://www.lemonde.fr/series-d-ete/article/2025/08/15/a-capri-la-villa-lysis-le-baron-et-ses-trop-jeunes-favoris_6629644_3451060.html,,"« L’Italie par ses villas » (5/6). Dans le golfe de Naples, les majestueuses bâtisses ont abrité les frasques et les larmes d’idéalistes de la haute société européenne venus s’y réfugier dès le XIXᵉ siècle. Plus tard, la lumière de l’île a attiré les nazis et les fascistes comme les révolutionnaires russes."
23,"Ligue 1 : Marseille ouvre sa saison par une défaite à Rennes, pourtant réduit à dix",https://www.lemonde.fr/sport/article/2025/08/15/ligue-1-marseille-ouvre-sa-saison-par-une-defaite-a-rennes-pourtant-reduit-a-dix_6629952_3242.html,Le Monde avec AFP,"L’Olympique de Marseille, en supériorité numérique pendant une heure et malgré deux poteaux touchés, a cédé en Bretagne, vendredi soir, sur un but dans le temps additionnel de Ludovic Blas (0-1). Cette rencontre a lancé la nouvelle saison de ligue 1 qui se poursuit samedi."
24,"Pink Floyd, le meilleur ennemi du punk",https://www.lemonde.fr/series-d-ete/article/2025/08/15/pink-floyd-le-meilleur-ennemi-du-punk_6629944_3451060.html,,"« Les 50 ans de “Wish You Were Here”» (5/5). Au moment de sa sortie, en 1975, l’album ne fait pas l’unanimité, tant le groupe britannique incarne une institution rock embourgeoisée pour ceux qui s’apprêtent à l’assaillir derrière les Sex Pistols."
25,Pollution plastique : l’obstruction des pays pétroliers entraîne un échec cuisant des négociations sur un traité international,https://www.lemonde.fr/planete/article/2025/08/15/pollution-plastique-l-obstruction-des-pays-petroliers-entraine-un-echec-cuisant-des-negociations-sur-un-traite-international_6629921_3244.html,  Par Sylvie Burnouf ,
26,"A quoi va ressembler la rentrée littéraire 2025 : Emmanuel Carrère, Catherine Millet, Alain Mabanckou, Audur Ava Olafsdottir…",https://www.lemonde.fr/livres/article/2025/08/15/rentree-litteraire-2025-emmanuel-carrere-catherine-millet-alain-mabanckou-audur-ava-olafsdottir-lectures-prometteuses_6629686_3260.html,,
27,Incendie dans l’Aude : le week-end du 15 août placé sous un « très haut niveau de vigilance »,https://www.lemonde.fr/planete/article/2025/08/15/incendie-dans-l-aude-le-week-end-du-15-aout-sous-un-tres-haut-niveau-de-vigilance_6629950_3244.html,Le Monde avec AFP,
28,Un accord entre la ville de Washington et l’administration Trump sur la prise en main de la police dans la capitale,https://www.lemonde.fr/international/article/2025/08/16/un-accord-entre-la-ville-de-washington-et-l-administration-trump-sur-la-prise-en-main-de-la-police-dans-la-capitale_6630018_3210.html,Le Monde avec AFP,
29,Cadavres retrouvés dans la Seine : une enquête pour homicide ouverte pour l’un des quatre corps,https://www.lemonde.fr/societe/article/2025/08/15/cadavres-retrouves-dans-la-seine-une-enquete-pour-homicide-ouverte-pour-l-un-des-quatre-corps_6629942_3224.html,Le Monde avec AFP,
30,"« Depuis 2021, la guerre menée contre les femmes est peu à peu remportée par les talibans »",https://www.lemonde.fr/idees/article/2025/08/15/depuis-2021-la-guerre-menee-contre-les-femmes-est-peu-a-peu-remportee-par-les-talibans_6629900_3232.html,,
31,« Une avancée pour protéger les familles » : les frais bancaires lors d’une succession ne pourront pas dépasser 850 euros,https://www.lemonde.fr/argent/article/2025/08/15/les-frais-bancaires-lors-d-une-succession-ne-pourront-pas-depasser-850-euros_6629948_1657007.html,Le Monde avec AFP,
32,"Abattage d’un olivier à la mémoire d’Ilan Halimi : pour Emmanuel Macron, la République sera « toujours intransigeante » face à l’antisémitisme",https://www.lemonde.fr/societe/article/2025/08/15/une-enquete-a-ete-ouverte-apres-qu-un-olivier-rendant-hommage-a-ilan-halimi-a-ete-abattu-a-epinay-sur-seine_6629542_3225.html,Le Monde avec AFP,
33,"Fermeture des pharmacies le 16 août : derrière le mouvement, de fortes tensions avec le gouvernement dans le cadre des économies sur la santé",https://www.lemonde.fr/societe/article/2025/08/15/fermeture-des-pharmacies-le-16-aout-derriere-le-mouvement-de-fortes-tensions-avec-le-gouvernement-dans-le-cadre-des-economies-sur-la-sante_6629937_3224.html,  Par Eléa Pommiers ,
34,L’armée israélienne confirme mener des opérations en périphérie de la ville de Gaza,https://www.lemonde.fr/international/live/2025/08/16/en-direct-gaza-le-point-sur-la-situation_6628849_3210.html,,
35,"Incendies au Portugal : un premier mort dans l’est du pays, annonce le président de la République",https://www.lemonde.fr/international/article/2025/08/15/incendies-au-portugal-un-premier-mort-dans-l-est-du-pays-annonce-le-president-de-la-republique_6629946_3210.html,Le Monde avec AFP,
36,"Canicule : toute l’Espagne désormais en alerte, risque d’incendie « très élevé à extrême » pour une très grande partie du pays",https://www.lemonde.fr/international/article/2025/08/15/toute-l-espagne-desormais-en-alerte-canicule-risque-d-incendie-tres-eleve-a-extreme-dans-une-grande-partie-du-pays_6629935_3210.html,Le Monde avec AFP,
37,Les tests génétiques exigés par World Athletics et visant à « déterminer le sexe biologique » des participantes se heurtent à la législation française,https://www.lemonde.fr/sport/article/2025/08/15/les-tests-genetiques-exiges-par-world-athletics-se-heurtent-a-la-legislation-francaise_6629940_3242.html,  Par Patricia Jolly ,
38,"Au Danemark, un accident entre un train et un véhicule agricole fait un mort et plusieurs blessés",https://www.lemonde.fr/international/article/2025/08/15/au-danemark-un-accident-entre-un-train-et-un-vehicule-agricole-fait-un-mort-et-plusieurs-blesses_6629947_3210.html,Le Monde avec AFP,
39,Classement de Shanghaï 2025 : Paris-Saclay se maintient dans le « top 15 »,https://www.lemonde.fr/societe/article/2025/08/15/classement-de-shanghai-2025-paris-saclay-se-maintient-dans-le-top-15_6629690_3224.html,  Par Eléa Pommiers ,"Les Etats-Unis dominent toujours le palmarès, avec huit des dix premières places. Outre Paris-Saclay, trois universités françaises figurent parmi les cent premières : Paris Sciences et lettres, Sorbonne Université et l’université Paris Cité."
40,"Crise grecque de la dette : dix ans après le référendum sur l’austérité, la population reste traumatisée",https://www.lemonde.fr/economie/article/2025/08/15/crise-grecque-de-la-dette-dix-ans-apres-le-referendum-sur-l-austerite-la-population-reste-traumatisee_6629645_3234.html,,"Dix ans après le référendum sur le troisième plan d’austérité proposé par les créanciers de la Grèce, l’économie du pays va mieux, mais une grande partie des habitants est encore dans une situation difficile."
41,"Entre Trump et Poutine, une longue relation opaque et toxique",https://www.lemonde.fr/international/article/2025/08/15/entre-donald-trump-et-vladimir-poutine-une-relation-toxique-et-opaque_6629682_3210.html,"  Par Piotr Smolar (Washington, correspondant) ","Le président américain nourrit depuis près de vingt ans une fascination manifeste pour son homologue russe, qu’il doit rencontrer lors d’un sommet consacré à l’Ukraine vendredi, en Alaska. Son empire immobilier a largement bénéficié de capitaux privés russes."
42,"David Grossman, écrivain israélien : « Je cherche à me ménager un accès direct au cœur de l’incendie »",https://www.lemonde.fr/series-d-ete/article/2025/08/14/david-grossman-je-cherche-a-me-menager-un-acces-direct-au-c-ur-de-l-incendie_6629221_3451060.html,  Propos recueillis par Nicolas Weill ,
43,"Pour les entreprises françaises, une reprise des fusions et acquisitions est attendue dès la rentrée",https://www.lemonde.fr/economie/article/2025/08/14/pour-les-entreprises-francaises-une-reprise-des-fusions-et-acquisitions-est-attendue-des-la-rentree_6629389_3234.html,,
44,"« La présence militaire américaine au Japon a toujours été destinée à assurer une ligne de défense face à la Chine et la Russie, plus qu’à protéger l’Archipel »",https://www.lemonde.fr/international/article/2025/08/15/la-presence-militaire-americaine-au-japon-a-toujours-ete-destinee-a-assurer-une-ligne-de-defense-face-a-la-chine-et-la-russie-plus-qu-a-proteger-l-archipel_6629914_3210.html,"  Propos recueillis par Philippe Pons (Tokyo, correspondant) ",
