,title,url,byline,subhed
0,"Ces dizaines de milliards d’euros d’aides publiques aux entreprises versés sans transparence, ni suivi",https://www.lemonde.fr/economie/article/2025/07/02/aides-publiques-aux-entreprises-ces-dizaines-de-milliards-d-euros-verses-sans-transparence-ni-suivi_6617319_3234.html,  Par Aline Leclerc et Service économie ,
1,Les start-up françaises ont de plus en plus de mal à lever des fonds,https://www.lemonde.fr/economie/article/2025/06/26/en-quete-de-rentabilite-la-french-tech-peine-a-lever-des-fonds_6615964_3234.html,  Par Vincent Fagot ,
2,"« Avec Donald Trump, pas besoin de devinettes : la chasse au Musk est un spectacle gratuit offert en mondovision par la Maison Blanche »",https://www.lemonde.fr/economie/article/2025/07/02/avec-donald-trump-pas-besoin-de-devinettes-la-chasse-au-musk-est-un-spectacle-gratuit-offert-en-mondovision-par-la-maison-blanche_6617354_3234.html,,
3,"« La réforme des retraites, adoptée mais non délibérée, s’impose sans être acceptée par une grande partie de la société »",https://www.lemonde.fr/idees/article/2025/07/01/la-reforme-des-retraites-adoptee-mais-non-deliberee-s-impose-sans-etre-acceptee-par-une-grande-partie-de-la-societe_6617224_3232.html,,
4,Tour de France : le responsable du parcours vous explique comment l’édition 2025 a été tracée pour créer du suspense,https://www.lemonde.fr/sport/video/2025/07/02/tour-de-france-2025-comment-le-parcours-est-trace-pour-creer-du-suspense_6617330_3242.html,  Par Brieuc Beckers et Marceau Bretonnier ,
5,Gaza : enquête sur une distribution alimentaire qui a tourné à la fusillade contre des civils,https://www.lemonde.fr/international/video/2025/06/29/gaza-enquete-sur-une-distribution-alimentaire-qui-a-tourne-a-la-fusillade-contre-des-civils_6616416_3210.html,"  Par Alexandre Horn, Poline Tchoubar, Juliette Prigent et Liselotte Mas ",
6,Pourquoi certains pays ont le droit à l’arme nucléaire et d’autres pas ? Comprendre en trois minutes,https://www.lemonde.fr/comprendre-en-3-minutes/video/2025/06/21/quels-pays-detiennent-l-arme-nucleaire-comprendre-en-trois-minutes_6615041_6176282.html,  Par Barbara Marty et Robin Gasser (motion design) ,
7,L’attaque d’Israël en Iran pose les bases d’une ère d’incertitude au Moyen-Orient,https://www.lemonde.fr/guerre-au-proche-orient/video/2025/06/24/l-attaque-d-israel-en-iran-pose-les-bases-d-une-ere-d-incertitude-au-moyen-orient_6615651_6325529.html,  Propos recueillis par Brieuc Beckers et Elisa Bellanger (motion design) ,
8,"Entre la France et l’Algérie, reconstruire un lien abîmé, sans illusions",https://www.lemonde.fr/idees/article/2025/07/02/entre-la-france-et-l-algerie-reconstruire-un-lien-abime-sans-illusions_6617364_3232.html,,
9,"Après des décennies de déni, le lent réveil des économistes devant l’urgence écologique",https://www.lemonde.fr/idees/article/2025/06/29/le-lent-reveil-des-economistes-devant-l-urgence-ecologique_6616346_3232.html,,
10,« L’idée d’une violence croissante de la rue à laquelle les policiers ne feraient que répondre est un leurre »,https://www.lemonde.fr/idees/article/2025/06/30/sebastian-roche-politiste-l-idee-d-une-violence-croissante-de-la-rue-a-laquelle-les-policiers-ne-feraient-que-repondre-est-un-leurre_6616665_3232.html,,
11,« Le déclin de la couverture vaccinale aux Etats-Unis peut et va avoir des conséquences planétaires »,https://www.lemonde.fr/idees/article/2025/07/02/le-declin-de-la-couverture-vaccinale-aux-etats-unis-peut-et-va-avoir-des-consequences-planetaires_6617406_3232.html,,
12,« Rapaces » : un thriller nerveux au cœur de la presse à sensation,https://www.lemonde.fr/culture/article/2025/07/02/rapaces-un-thriller-nerveux-au-c-ur-de-la-presse-a-sensation_6617383_3246.html,  Par Boris Bastide ,
13,"« Remy de Gourmont. Une vie fin-de-siècle », de Thierry Gillybœuf : le scrutateur impitoyable",https://www.lemonde.fr/livres/article/2025/07/02/remy-de-gourmont-une-vie-fin-de-siecle-de-thierry-gillyb-uf-le-scrutateur-impitoyable_6617416_3260.html,  Par François Angelier (Collaborateur du « Monde des livres ») ,
14,A voir ce soir : le documentaire « En route ! » sur france.tv,https://www.lemonde.fr/culture/article/2025/06/27/en-route-sur-france-tv-comment-la-nationale-7-a-fait-recette-de-cuisine_6616177_3246.html,  Par Catherine Pacary ,
15,"Le rappeur P. Diddy reconnu non coupable de trafic sexuel et d’association de malfaiteurs, mais coupable de transport de personnes à des fins de prostitution",https://www.lemonde.fr/culture/article/2025/07/02/p-diddy-reconnu-non-coupable-de-trafic-sexuel-et-d-association-de-malfaiteurs-mais-coupable-de-transport-de-personnes-a-des-fins-de-prostitution_6617410_3246.html,Le Monde avec AFP,
16,"Dans le Var, la Design Parade entre utopie et dystopie",https://www.lemonde.fr/m-styles/article/2025/07/02/dans-le-var-la-design-parade-entre-utopie-et-dystopie_6617415_4497319.html,"  Par Véronique Lorelle (Toulon, envoyée spéciale) ",
17,"Anna Wintour dans « Le Monde », une curiosité grandissante pour « la papesse de la mode »",https://www.lemonde.fr/m-le-mag/article/2025/07/02/anna-wintour-dans-le-monde-une-curiosite-grandissante-pour-la-papesse-de-la-mode_6617407_4500055.html,,
18,"A Château Peybonhomme-les-Tours, une ouverture rose dans le bordelais",https://www.lemonde.fr/m-styles/article/2025/07/02/a-chateau-peybonhomme-les-tours-une-ouverture-rose-dans-le-bordelais_6617386_4497319.html,  Par Rémi Barroux ,
19,"Dans le milieu de la soudure, deux compétitions et deux visions du métier",https://www.lemonde.fr/m-perso/article/2025/06/30/la-france-buissonniere-etincelles-au-pays-de-la-soudure_6616555_4497916.html,,
20, Présidentielle 2027 : le « Front populaire » lance une primaire qui ne dit pas son nom  ,https://www.lemonde.fr/politique/article/2025/07/02/presidentielle-2027-le-front-populaire-lance-une-primaire-qui-ne-dit-pas-son-nom_6617449_823448.html,  Par Olivier Pérou ,"Réunis autour de Lucie Castets, Olivier Faure, Marine Tondelier, Clémentine Autain et François Ruffin ont acté le « principe d’un processus de désignation d’un candidat commun ». Les modalités doivent être validées d’ici à décembre pour une désignation de candidat entre mai et octobre 2026."
21,"« La diplomatie de Donald Trump, hâtivement qualifiée, à tort, d’isolationniste, est interventionniste, y compris là où on ne l’attend pas »",https://www.lemonde.fr/idees/article/2025/07/02/la-diplomatie-de-donald-trump-hativement-qualifiee-a-tort-d-isolationniste-est-interventionniste-y-compris-la-ou-on-ne-l-attend-pas_6617317_3232.html,,
22,"Projet d’attentat masculiniste déjoué : une première en France, où la menace « incel » est émergente",https://www.lemonde.fr/societe/article/2025/07/02/projet-d-attentat-masculiniste-dejoue-une-premiere-en-france-ou-la-menace-incel-est-emergente_6617439_3224.html,  Par Christophe Ayad ,
23,"La loi Duplomb sur l’agriculture validée au Sénat, avant l’ultime vote à l’Assemblée nationale",https://www.lemonde.fr/planete/article/2025/07/02/la-loi-duplomb-sur-l-agriculture-validee-au-senat-avant-l-ultime-vote-de-l-assemblee-nationale_6617446_3244.html,Le Monde avec AFP,"Le texte qui vise à « lever les contraintes » des agriculteurs, passé lundi par une commission mixte paritaire qui avait permis l’écriture d’un texte de compromis entre députés et sénateurs, a été adopté à 232 voix contre 103 à la Chambre haute."
24,Prison avec sursis pour d’anciens cadres d’Ubisoft : une décision qui devrait faire jurisprudence,https://www.lemonde.fr/pixels/article/2025/07/02/prison-avec-sursis-pour-d-anciens-cadres-d-ubisoft-une-decision-qui-devrait-faire-jurisprudence_6617447_4408996.html,"  Par Sofia Fischer (Nice, correspondance) ","Pour les avocats des parties civiles, le tribunal, en reconnaissant le harcèlement sexuel environnemental en entreprise, estime que laisser s’installer un tel climat peut désormais constituer un délit."
25,« Le déclin de la couverture vaccinale aux Etats-Unis peut et va avoir des conséquences planétaires »,https://www.lemonde.fr/idees/article/2025/07/02/le-declin-de-la-couverture-vaccinale-aux-etats-unis-peut-et-va-avoir-des-consequences-planetaires_6617406_3232.html,,"Le secrétaire d’Etat américain à la santé vient de bouleverser totalement le comité national d’experts sur la vaccination, en y nommant des personnalités sans compétences en la matière et, pour certaines, antivax. Dans une tribune au « Monde », un collectif d’experts français s’inquiète des répercussions de cette décision."
26,L’enquête sur l’assassinat du juge Renaud à Lyon : cinquante ans de malédictions,https://www.lemonde.fr/societe/article/2025/07/02/l-enquete-sur-l-assassinat-du-juge-renaud-a-lyon-cinquante-ans-de-maledictions_6617325_3224.html,,"Après un demi-siècle d’échecs judiciaires, la famille du juge d’instruction abattu en 1975 dans une rue de Lyon demande la restitution des scellés de l’enquête et une relance des investigations scientifiques."
27,"En Iran, les otages français Cécile Kohler et Jacques Paris inculpés d’espionnage pour le compte d’Israël",https://www.lemonde.fr/international/article/2025/07/02/iran-les-otages-francais-cecile-kohler-et-jacques-paris-inculpes-d-espionnage-pour-le-compte-d-israel_6617454_3210.html,Le Monde avec AFP,
28,Revivez notre direct sur la canicule : quarante départements de l’Est et du Centre en vigilance orange jeudi,https://www.lemonde.fr/planete/live/2025/07/02/en-direct-canicule-encore-quarante-departements-de-l-est-et-du-centre-en-vigilance-orange-jeudi_6616968_3244.html,,
29,L’Assemblée nationale vote pour l’allongement de la durée en centre de rétention administrative pour les étrangers jugés dangereux,https://www.lemonde.fr/societe/article/2025/07/03/l-assemblee-nationale-vote-pour-l-allongement-de-la-duree-en-centre-de-retention-administrative-pour-les-etrangers-juges-dangereux_6617455_3224.html,Le Monde avec AFP,
30,La Commission européenne affaiblit son objectif de réduction des émissions carbone pour 2040 dans l’espoir d’en faciliter l’adoption,https://www.lemonde.fr/planete/article/2025/07/02/climat-la-commission-affaiblit-son-objectif-de-reduction-des-emissions-carbone-pour-2040-dans-l-espoir-d-en-faciliter-l-adoption_6617443_3244.html,"  Par Virginie Malingre (Bruxelles, bureau européen) ",
31,Un magnat de la finance ouzbek kidnappé au cœur de Paris avant d’être relâché contre le paiement d’une rançon,https://www.lemonde.fr/societe/article/2025/07/02/un-magnat-de-la-finance-ouzbek-kidnappe-en-plein-paris-avant-d-etre-relache-contre-le-paiement-d-une-rancon_6617429_3224.html,  Par Antoine Albertini ,
32,Volodymyr Zelensky assure que Kiev et Washington « clarifient les détails » du soutien militaire américain à l’Ukraine,https://www.lemonde.fr/international/live/2025/07/02/en-direct-guerre-en-ukraine-volodymyr-zelensky-assure-que-kiev-et-washington-clarifient-les-details-du-soutien-militaire-americain_6616331_3210.html,,
33,Deliveroo condamné une nouvelle fois pour travail dissimulé de ses livreurs,https://www.lemonde.fr/economie/article/2025/07/02/deliveroo-condamne-une-nouvelle-fois-pour-travail-dissimule-de-ses-livreurs_6617453_3234.html,Le Monde avec AFP,
34,Grève de contrôleurs aériens : les compagnies aériennes appelées à annuler 40 % des vols dans les aéroports parisiens vendredi,https://www.lemonde.fr/economie/article/2025/07/02/greve-de-controleurs-aeriens-les-compagnies-aeriennes-appelees-a-annuler-40-des-vols-dans-les-aeroports-parisiens-vendredi_6617442_3234.html,Le Monde avec AFP,
35,Laurent Wauquiez et LR veulent un budget « 0 % hausse d’impôts » et propose un projet de loi contre « la fraude sociale »,https://www.lemonde.fr/politique/article/2025/07/02/laurent-wauquiez-et-lr-veulent-un-budget-0-hausse-d-impots-et-propose-un-projet-de-loi-contre-la-fraude-sociale_6617437_823448.html,  Par Alexandre Pedro ,
36,Turquie : nouvelle vague d’arrestations contre le principal parti de l’opposition,https://www.lemonde.fr/international/article/2025/07/02/turquie-nouvelle-vague-d-arrestations-contre-le-principal-parti-de-l-opposition_6617375_3210.html,  Par Nicolas Bourcier ,
37,Intoxications alimentaires dans l’Aisne : « un lien biologique formel » existe « entre le lieu d’approvisionnement et la contamination des malades »,https://www.lemonde.fr/planete/article/2025/07/02/intoxications-alimentaires-dans-l-aisne-un-lien-biologique-formel-existe-entre-le-lieu-d-approvisionnement-et-la-contamination-des-malades_6617445_3244.html,Le Monde avec AFP,
38,Plan social au « Point » : la mise en place d’un nouvel outil d’intelligence artificielle aboutit à la disparition du service correction,https://www.lemonde.fr/economie/article/2025/07/02/plan-social-au-point-la-mise-en-place-d-un-nouvel-outil-d-intelligence-artificielle-aboutit-a-la-disparition-du-service-correction_6617444_3234.html,  Par Brice Laemle ,
39,"Entre Emmanuel Macron et Vladimir Poutine, un appel à double tranchant, après trois ans de silence",https://www.lemonde.fr/international/article/2025/07/02/entre-emmanuel-macron-et-vladimir-poutine-un-appel-a-double-tranchant-apres-trois-ans-de-silence_6617318_3210.html,"  Par Elsa Conesa (Berlin, correspondante), Philippe Ricard, Claire Gatinois et Benjamin Quénelle ","Le président français et son homologue russe ont échangé plus de deux heures, mardi, sur la situation en Iran et en Ukraine, notamment. Sur ce dernier sujet, ils n’ont pu que constater leurs divergences, irréconciliables."
40,Visualisez les températures maximales et la précocité de la canicule de juin 2025 en France,https://www.lemonde.fr/les-decodeurs/article/2025/07/02/visualisez-l-intensite-et-la-precocite-de-la-vague-de-chaleur_6617372_4355770.html,,"Le 30 juin 2025 a été la journée la plus chaude jamais enregistrée pour un mois de juin. En ces premiers jours de juillet, le pays continue de suffoquer. La vague de chaleur s’est avérée intense sur tout le territoire."
41,"Ces dizaines de milliards d’euros d’aides publiques aux entreprises versés sans transparence, ni suivi",https://www.lemonde.fr/economie/article/2025/07/02/aides-publiques-aux-entreprises-ces-dizaines-de-milliards-d-euros-verses-sans-transparence-ni-suivi_6617319_3234.html,  Par Aline Leclerc et Service économie ,"Au cours de six mois d’auditions, la commission d’enquête sénatoriale a cheminé dans les méandres des aides publiques, insistant sur le déni démocratique que pose l’absence de transparence et d’évaluation de ce qui constitue, aujourd’hui, le premier budget de l’Etat, en pleine crise des finances publiques."
42,"Entre la France et l’Algérie, reconstruire un lien abîmé, sans illusions",https://www.lemonde.fr/idees/article/2025/07/02/entre-la-france-et-l-algerie-reconstruire-un-lien-abime-sans-illusions_6617364_3232.html,,
43,"« Avec Donald Trump, pas besoin de devinettes : la chasse au Musk est un spectacle gratuit offert en mondovision par la Maison Blanche »",https://www.lemonde.fr/economie/article/2025/07/02/avec-donald-trump-pas-besoin-de-devinettes-la-chasse-au-musk-est-un-spectacle-gratuit-offert-en-mondovision-par-la-maison-blanche_6617354_3234.html,,
44,"« La diplomatie de Donald Trump, hâtivement qualifiée, à tort, d’isolationniste, est interventionniste, y compris là où on ne l’attend pas »",https://www.lemonde.fr/idees/article/2025/07/02/la-diplomatie-de-donald-trump-hativement-qualifiee-a-tort-d-isolationniste-est-interventionniste-y-compris-la-ou-on-ne-l-attend-pas_6617317_3232.html,,
45, Revivez notre direct sur la canicule : quarante départements de l’Est et du Centre en vigilance orange jeudi ,https://www.lemonde.fr/planete/live/2025/07/02/en-direct-canicule-encore-quarante-departements-de-l-est-et-du-centre-en-vigilance-orange-jeudi_6616968_3244.html,,
46,Comment la canicule nuit au sommeil… et à la santé  ,https://www.lemonde.fr/planete/article/2025/07/02/comment-la-canicule-nuit-au-sommeil-et-a-la-sante_6617434_3244.html,  Par Delphine Roucaute ,
47,Comment la canicule nuit au sommeil… et à la santé  ,https://www.lemonde.fr/planete/article/2025/07/02/comment-la-canicule-nuit-au-sommeil-et-a-la-sante_6617434_3244.html,  Par Delphine Roucaute ,
48,La Méditerranée en surchauffe : les scientifiques « effrayés » par une canicule marine à la précocité inédite  ,https://www.lemonde.fr/planete/article/2025/07/02/la-mediterranee-en-surchauffe-les-scientifiques-effrayes-par-une-canicule-marine-a-la-precocite-inedite_6617414_3244.html,  Par Audrey Garric et Léa Sanchez ,
49,"Face à la canicule, des familles inquiètes pour leurs proches dans les Ehpad publics  ",https://www.lemonde.fr/planete/article/2025/07/02/face-a-la-canicule-des-familles-inquietes-pour-leurs-proches-dans-les-ehpad-publics_6617398_3244.html,  Par Béatrice Jérôme ,
50,"« Quand nous en sommes rendus à déscolariser des milliers d’enfants parce qu’on cuit, il est l’heure d’agir »  ",https://www.lemonde.fr/idees/article/2025/07/02/canicule-quand-nous-en-sommes-rendus-a-descolariser-des-milliers-d-enfants-parce-qu-on-cuit-il-est-l-heure-d-agir_6617384_3232.html,,
51,"« Quand nous en sommes rendus à déscolariser des milliers d’enfants parce qu’on cuit, il est l’heure d’agir »  ",https://www.lemonde.fr/idees/article/2025/07/02/canicule-quand-nous-en-sommes-rendus-a-descolariser-des-milliers-d-enfants-parce-qu-on-cuit-il-est-l-heure-d-agir_6617384_3232.html,,
52,Visualisez les températures maximales et la précocité de la canicule de juin 2025 en France  ,https://www.lemonde.fr/les-decodeurs/article/2025/07/02/visualisez-l-intensite-et-la-precocite-de-la-vague-de-chaleur_6617372_4355770.html,,
53,Comment EDF tente d’adapter le fonctionnement de ses centrales nucléaires au dérèglement climatique  ,https://www.lemonde.fr/economie/article/2025/07/02/comment-edf-tente-d-adapter-le-fonctionnement-de-ses-centrales-nucleaires-au-dereglement-climatique_6617344_3234.html,  Par Adrien Pécout ,
54," « La diplomatie de Donald Trump, hâtivement qualifiée, à tort, d’isolationniste, est interventionniste, y compris là où on ne l’attend pas » ",https://www.lemonde.fr/idees/article/2025/07/02/la-diplomatie-de-donald-trump-hativement-qualifiee-a-tort-d-isolationniste-est-interventionniste-y-compris-la-ou-on-ne-l-attend-pas_6617317_3232.html,,
55,"Donald Trump visite l’« Alcatraz des alligators » en Floride, nouveau symbole de sa politique migratoire  ",https://www.lemonde.fr/international/article/2025/07/02/donald-trump-inaugure-l-alcatraz-des-alligators-en-floride-nouveau-symbole-de-sa-politique-migratoire_6617310_3210.html,Le Monde avec AFP,
56,"Donald Trump visite l’« Alcatraz des alligators » en Floride, nouveau symbole de sa politique migratoire  ",https://www.lemonde.fr/international/article/2025/07/02/donald-trump-inaugure-l-alcatraz-des-alligators-en-floride-nouveau-symbole-de-sa-politique-migratoire_6617310_3210.html,Le Monde avec AFP,
57,Le Sénat approuve de justesse le projet de loi budgétaire de Donald Trump   ,https://www.lemonde.fr/international/article/2025/07/01/projet-de-loi-budgetaire-de-donald-trump-approbation-de-justesse-du-senat_6617283_3210.html,Le Monde avec AFP,
58,"Raphaël Maurel, juriste : « De plus en plus d’actions internationales ne prennent même plus la peine de se justifier en droit »  ",https://www.lemonde.fr/idees/article/2025/07/01/raphael-maurel-juriste-de-plus-en-plus-d-actions-internationales-ne-prennent-meme-plus-la-peine-de-se-justifier-en-droit_6617240_3232.html,,
59,L’administration Trump dépose une plainte contre Los Angeles pour sa politique « sanctuaire » envers les immigrés sans-papiers  ,https://www.lemonde.fr/international/article/2025/06/30/l-administration-trump-depose-une-plainte-contre-los-angeles-pour-sa-politique-sanctuaire-envers-les-immigres-clandestins_6617029_3210.html,Le Monde avec AFP,
60,L’administration Trump dépose une plainte contre Los Angeles pour sa politique « sanctuaire » envers les immigrés sans-papiers  ,https://www.lemonde.fr/international/article/2025/06/30/l-administration-trump-depose-une-plainte-contre-los-angeles-pour-sa-politique-sanctuaire-envers-les-immigres-clandestins_6617029_3210.html,Le Monde avec AFP,
61,"Anne Deysine, juriste et américaniste : « La décision de la Cour suprême américaine marque l’avènement d’une société sans droit »  ",https://www.lemonde.fr/idees/article/2025/06/30/anne-deysine-juriste-et-americaniste-la-decision-de-la-cour-supreme-marque-l-avenement-d-une-societe-sans-droit_6616945_3232.html,  Propos recueillis par Pascal Riché ,
62,"Le Canada annule sa taxe visant les entreprises américaines du numérique, espérant un accord commercial avec les Etats-Unis  ",https://www.lemonde.fr/economie/article/2025/06/30/le-canada-annule-sa-taxe-visant-les-geants-de-la-tech-esperant-un-accord-commercial-avec-les-etats-unis_6616705_3234.html,Le Monde avec AFP,
63," En Iran, les otages français Cécile Kohler et Jacques Paris inculpés d’espionnage pour le compte d’Israël ",https://www.lemonde.fr/international/article/2025/07/02/iran-les-otages-francais-cecile-kohler-et-jacques-paris-inculpes-d-espionnage-pour-le-compte-d-israel_6617454_3210.html,Le Monde avec AFP,
64,"Bernard Haykel, spécialiste de la péninsule Arabique : « Il y a une ambivalence dans la pensée stratégique d’Israël »  ",https://www.lemonde.fr/idees/article/2025/07/02/proche-orient-il-y-a-une-ambivalence-dans-la-pensee-strategique-d-israel_6617327_3232.html,,
65,"Bernard Haykel, spécialiste de la péninsule Arabique : « Il y a une ambivalence dans la pensée stratégique d’Israël »  ",https://www.lemonde.fr/idees/article/2025/07/02/proche-orient-il-y-a-une-ambivalence-dans-la-pensee-strategique-d-israel_6617327_3232.html,,
66,"Louis Arnaud, ancien otage français détenu à Evin, en Iran : « Ce n’est pas seulement une prison qui a été réduite en cendres, mais le bastion de la résistance »  ",https://www.lemonde.fr/idees/article/2025/07/01/louis-arnaud-ancien-otage-francais-detenu-a-evin-en-iran-ce-n-est-pas-seulement-une-prison-qui-a-ete-reduite-en-cendres-mais-le-bastion-de-la-resistance_6617271_3232.html,,
67,"Raphaël Maurel, juriste : « De plus en plus d’actions internationales ne prennent même plus la peine de se justifier en droit »  ",https://www.lemonde.fr/idees/article/2025/07/01/raphael-maurel-juriste-de-plus-en-plus-d-actions-internationales-ne-prennent-meme-plus-la-peine-de-se-justifier-en-droit_6617240_3232.html,,
68,Un bombardement israélien provoque un carnage dans un café de Gaza  ,https://www.lemonde.fr/international/article/2025/07/01/un-bombardement-israelien-provoque-un-carnage-dans-un-cafe-de-gaza_6617209_3210.html,  Par Marie Jo Sader ,
69,Un bombardement israélien provoque un carnage dans un café de Gaza  ,https://www.lemonde.fr/international/article/2025/07/01/un-bombardement-israelien-provoque-un-carnage-dans-un-cafe-de-gaza_6617209_3210.html,  Par Marie Jo Sader ,
70,Des témoignages de soldats provoquent une onde de choc rarissime en Israël sur la faillite morale de son armée à Gaza  ,https://www.lemonde.fr/international/article/2025/07/01/guerre-a-gaza-l-armee-israelienne-interpellee-sur-sa-faillite-morale_6617174_3210.html,"  Par Isabelle Mandraud (Tel-Aviv, envoyée spéciale) ",
71,« Il faut être pour Nétanyahou lorsqu’il affaiblit la menace iranienne ; et ardemment contre lui lorsqu’il détruit Gaza »  ,https://www.lemonde.fr/idees/article/2025/07/01/il-faut-etre-pour-netanyahou-lorsqu-il-affaiblit-la-menace-iranienne-et-ardemment-contre-lui-lorsqu-il-detruit-gaza_6617167_3232.html,,
72, Volodymyr Zelensky assure que Kiev et Washington « clarifient les détails » du soutien militaire américain à l’Ukraine ,https://www.lemonde.fr/international/live/2025/07/02/en-direct-guerre-en-ukraine-volodymyr-zelensky-assure-que-kiev-et-washington-clarifient-les-details-du-soutien-militaire-americain_6616331_3210.html,,
73,"En Pologne, le soutien à l’entrée de l’Ukraine dans l’UE s’érode  ",https://www.lemonde.fr/international/article/2025/07/02/en-pologne-le-soutien-a-l-entree-de-l-ukraine-dans-l-ue-s-erode_6617397_3210.html,  Par Filip Meyer ,
74,"En Pologne, le soutien à l’entrée de l’Ukraine dans l’UE s’érode  ",https://www.lemonde.fr/international/article/2025/07/02/en-pologne-le-soutien-a-l-entree-de-l-ukraine-dans-l-ue-s-erode_6617397_3210.html,  Par Filip Meyer ,
75,Les Etats-Unis annoncent renoncer à livrer certaines armes à l’Ukraine  ,https://www.lemonde.fr/international/article/2025/07/02/les-etats-unis-annoncent-renoncer-a-livrer-certaines-armes-a-l-ukraine_6617376_3210.html,Le Monde avec AFP,
76,"Jean-Noël Barrot, sur le nucléaire iranien : « Il est essentiel que nos intérêts de sécurité soient pris en compte »  ",https://www.lemonde.fr/international/article/2025/07/02/jean-noel-barrot-sur-le-nucleaire-iranien-il-est-essentiel-que-nos-interets-de-securite-soient-pris-en-compte_6617350_3210.html,"  Propos recueillis par Claire Gatinois, Stéphanie Le Bars et Philippe Ricard ",
77,"Entre Emmanuel Macron et Vladimir Poutine, un appel à double tranchant, après trois ans de silence  ",https://www.lemonde.fr/international/article/2025/07/02/entre-emmanuel-macron-et-vladimir-poutine-un-appel-a-double-tranchant-apres-trois-ans-de-silence_6617318_3210.html,"  Par Elsa Conesa (Berlin, correspondante), Philippe Ricard, Claire Gatinois et Benjamin Quénelle ",
