,title,url,byline,subhed
0,"Le succès de la revue « Le Grand Continent », qui engrange les abonnés",https://www.lemonde.fr/economie/article/2025/08/12/le-succes-de-la-revue-le-grand-continent-qui-engrange-les-abonnes_6628529_3234.html,  Par Aude Dassonville ,
1,Les nombreuses analogies entre les Etats-Unis de Trump et ceux des « barons voleurs » de 1890,https://www.lemonde.fr/economie/article/2025/08/04/richesse-monopoles-corruption-l-amerique-de-donald-trump-est-elle-revenue-en-1890_6626445_3234.html,  Par Philippe Escande ,
2,Mezzanine sans garde-corps : qui indemnise l’adolescente tombée dans le vide ?,https://www.lemonde.fr/argent/article/2025/08/11/mezzanine-sans-garde-corps-qui-indemnise-l-adolescente-tombee-dans-le-vide_6628052_1657007.html,,
3,« La reconnaissance d’un droit fondamental à l’eau doit se décliner en engagements opposables »,https://www.lemonde.fr/idees/article/2025/08/12/la-reconnaissance-d-un-droit-fondamental-a-l-eau-doit-se-decliner-en-engagements-opposables_6628323_3232.html,,
4,De quoi Rachida Dati est-elle accusée ? Comprendre en trois minutes,https://www.lemonde.fr/comprendre-en-3-minutes/video/2025/08/12/de-quoi-rachida-dati-est-elle-accusee-comprendre-en-trois-minutes_6628329_6176282.html,  Par Alexis Tromas et Arthur Navet (Motion design) ,
5,Quels usages font les jeunes des applications de rencontre ? Comprendre en trois minutes,https://www.lemonde.fr/comprendre-en-3-minutes/video/2025/08/07/quels-usages-font-les-jeunes-des-applications-de-rencontre-comprendre-en-trois-minutes_6627253_6176282.html,  Par Allison Zarouri et Olivier Escher (motion design) ,
6,"Etats-Unis : Donald Trump déploie la garde nationale pour « nettoyer » Washington, DC",https://www.lemonde.fr/international/video/2025/08/12/etats-unis-donald-trump-deploie-la-garde-nationale-pour-nettoyer-washington-dc_6628552_3210.html,  Par Service vidéo du Monde ,
7,Hiroshima : comment s’est déroulé le bombardement atomique le plus dévastateur de l’histoire,https://www.lemonde.fr/histoire/video/2025/08/02/hiroshima-comment-s-est-deroule-le-bombardement-atomique-le-plus-devastateur-de-l-histoire_6626343_4655323.html,  Par Karim El Hadj et Adrien Vande Casteele ,
8,L’irruption de Trump dans le Caucase du Sud,https://www.lemonde.fr/idees/article/2025/08/12/l-irruption-de-trump-dans-le-caucase-du-sud_6628521_3232.html,,
9,"Loi Duplomb : une censure partielle « historique », mais sans recours au principe de précaution",https://www.lemonde.fr/idees/article/2025/08/11/loi-duplomb-une-censure-partielle-historique-mais-sans-recours-au-principe-de-precaution_6628038_3232.html,,
10,"La fronde inédite de Donald Trump contre Francesca Albanese, rapporteuse spéciale de l’ONU pour les territoires palestiniens",https://www.lemonde.fr/un-si-proche-orient/article/2025/08/10/la-fronde-inedite-de-donald-trump-contre-francesca-albanese-rapporteuse-speciale-de-l-onu-pour-les-territoires-palestiniens_6627653_6116995.html,,
11,"« Non, les enfants de familles défavorisées ne sont pas condamnés aux écrans »",https://www.lemonde.fr/idees/article/2025/08/12/non-les-enfants-de-familles-defavorisees-ne-sont-pas-condamnes-aux-ecrans_6628556_3232.html,,
12,"Au Festival de Locarno, Julie Pacino, comme une version féminine de David Lynch",https://www.lemonde.fr/culture/article/2025/08/12/au-festival-de-locarno-julie-pacino-comme-une-version-feminine-de-david-lynch_6628520_3246.html,"  Par Clarisse Fabre (Locarno, Suisse - envoyée spéciale) ",
13,"« Nom », de Krikor Beledian : le travail de mémoire d’un Arménien en exil",https://www.lemonde.fr/livres/article/2025/08/10/nom-de-krikor-beledian-le-travail-de-memoire-d-un-armenien-en-exil_6627833_3260.html,  Par Florent Georgesco ,
14,"« Journal de la bombe, une vie atomique », sur France Culture : une série d’été détonante écrite à la première personne",https://www.lemonde.fr/culture/article/2025/08/06/journal-de-la-bombe-une-vie-atomique-sur-france-culture-une-serie-d-ete-detonante-ecrite-a-la-premiere-personne_6627129_3246.html,  Par Emilie Grangeray ,
15,"Taylor Swift annonce la sortie de son douzième album, « The Life of a Showgirl »",https://www.lemonde.fr/culture/article/2025/08/12/taylor-swift-annonce-la-sortie-de-son-douzieme-album-the-life-of-a-showgirl_6628502_3246.html,Le Monde avec AFP,
16,La radio à l’ancienne toujours fidèle au poste,https://www.lemonde.fr/m-styles/article/2025/08/11/la-radio-a-l-ancienne-toujours-fidele-au-poste_6628186_4497319.html,  Par Sabine Maida ,
17,La Corée du Sud bouscule le marché de la beauté,https://www.lemonde.fr/economie/article/2025/08/11/la-coree-du-sud-bouscule-le-marche-de-la-beaute_6628049_3234.html,  Par Juliette Garnier ,
18,"Lucile Viaud, designer en Bretagne : la fibre du verre",https://www.lemonde.fr/series-d-ete/article/2025/08/10/lucile-viaud-designer-en-bretagne-la-fibre-du-verre_6627940_3451060.html,,
19,Pourquoi les attrape-peluches de fête foraine nous rendent aussi gagas,https://www.lemonde.fr/les-decodeurs/article/2025/08/10/pourquoi-les-attrape-peluches-de-fete-foraine-nous-rendent-aussi-gagas_6627656_4355770.html,  Par William Audureau ,
20, Les Européens rappellent leur opposition à des modifications des frontières de l’Ukraine « par la force »  ,https://www.lemonde.fr/international/article/2025/08/12/avant-la-rencontre-trump-poutine-les-europeens-rappellent-leur-opposition-a-des-modifications-des-frontieres-par-la-force_6628522_3210.html,"  Par Cédric Vallet (Bruxelles, correspondance) ","Les chefs d’Etat et de gouvernement de l’UE, à l’exception du Hongrois Viktor Orban, ont publié une déclaration commune avant le sommet entre les présidents américain et russe en Alaska, qui portera notamment sur l’Ukraine."
21,"Les températures dépassent 30 °C sur les trois quarts de la France, les chaleurs vont persister pendant encore plusieurs jours",https://www.lemonde.fr/planete/article/2025/08/12/canicule-5-departements-en-vigilance-rouge-pour-la-journee-de-mercredi-les-trois-quarts-du-pays-en-vigilance-orange_6628557_3244.html,Le Monde,
22,Nouvelle-Calédonie : le FLNKS rejette officiellement l’accord de Bougival,https://www.lemonde.fr/politique/article/2025/08/13/nouvelle-caledonie-le-flnks-rejette-officiellement-l-accord-de-bougival_6628677_823448.html,Le Monde avec AFP,
23,Gaza : des mères d’otages israéliens se rendent à Genève pour plaider la fin de la guerre,https://www.lemonde.fr/international/live/2025/08/13/en-direct-gaza-des-meres-d-otages-israeliens-se-rendent-a-geneve-pour-plaider-la-fin-de-la-guerre_6626647_3210.html,,"Dimanche, six journalistes, dont quatre de la chaîne qatarie Al-Jazira, ont été tués lors d’un bombardement israélien, parmi lesquels Anas Al-Sharif, que l’armée israélienne a reconnu avoir tué, le qualifiant de « terroriste »."
24,"Laurent Vallet, président de l’INA, suspendu après son interpellation pour l’achat de 600 euros de cocaïne",https://www.lemonde.fr/actualite-medias/article/2025/08/12/laurent-vallet-president-de-l-ina-interpelle-pour-achat-de-cocaine-a-la-fin-de-juillet_6628531_3236.html,Le Monde avec AFP,"Laurent Vallet a été interpellé à Paris le 29 juillet après s’être fait livrer de la cocaïne à son domicile. La ministre de la culture, Rachida Dati, a annoncé mardi sa suspension, en attente d’informations supplémentaires."
25,"Tour préliminaire de Ligue des champions : l’OGC Nice, battu par le Benfica Lisbonne, éliminé en qualification",https://www.lemonde.fr/sport/article/2025/08/12/tour-preliminaire-de-ligue-des-champions-l-ogc-nice-battu-par-le-benfica-lisbonne-elimine-en-qualification_6628578_3242.html,Le Monde avec AFP,"Surpassés par les Portugais à Benfica, les Niçois devront désormais se concentrer sur la Ligue Europa."
26,"A la villa Feltrinelli sur le lac de Garde, des oligarques russes et le spectre de Mussolini",https://www.lemonde.fr/series-d-ete/article/2025/08/12/a-la-villa-feltrinelli-sur-le-lac-de-garde-des-oligarques-russes-et-le-spectre-de-mussolini_6628321_3451060.html,,"« L’Italie par ses villas » (2/6). Sur le lac de Garde, la maison qui accueillit, un temps, le Duce est devenue un hôtel cinq étoiles. L’esprit du dictateur côtoie celui d’un ancien propriétaire, communiste et éditeur de renom."
27,"Ukraine : des « groupes » de soldats russes ont avancé d’environ 10 kilomètres sur le front, confirme Volodymyr Zelensky",https://www.lemonde.fr/international/live/2025/08/13/en-direct-guerre-en-ukraine-des-groupes-de-soldats-russes-ont-avance-d-environ-10-kilometres-sur-le-front-confirme-volodymyr-zelensky_6627648_3210.html,,
28,Un contrôleur de l’aéroport Paris-CDG suspendu pour avoir lancé « Free Palestine » à l’équipage de la compagnie israélienne El Al,https://www.lemonde.fr/guerre-au-proche-orient/article/2025/08/12/un-controleur-de-l-aeroport-paris-cdg-suspendu-pour-avoir-lance-free-palestine-a-l-equipage-de-la-compagnie-israelienne-el-al_6628577_6325529.html,Le Monde avec AFP,
29,Emmanuel Macron reconnaît que la France a mené une « guerre » au Cameroun pendant la décolonisation,https://www.lemonde.fr/afrique/article/2025/08/12/emmanuel-macron-reconnait-que-la-france-a-mene-une-guerre-au-cameroun-pendant-la-decolonisation_6628569_3212.html,Le Monde avec AFP,
30,"Lots de fromages rappelés : un « lien possible » avec vingt et un cas de listériose dont deux morts, selon le gouvernement",https://www.lemonde.fr/planete/article/2025/08/12/lots-de-fromages-rappeles-un-lien-possible-avec-21-cas-de-listeriose-dont-deux-morts-selon-le-gouvernement_6628547_3245.html,Le Monde avec AFP,
31,"L’inflation aux Etats-Unis, plus faible que prévu, renforce le scénario d’une prochaine baisse des taux de la Fed",https://www.lemonde.fr/economie/article/2025/08/12/l-inflation-americaine-plus-faible-que-prevu-renforce-le-scenario-d-une-prochaine-baisse-des-taux-de-la-fed_6628573_3234.html,"  Par Nicolas Chapuis (New York, correspondant) ",
32,Le Mexique extrade vers les Etats-Unis 26 personnes accusées de trafic de drogue,https://www.lemonde.fr/international/article/2025/08/13/le-mexique-extrade-vers-les-etats-unis-26-personnes-accusees-de-trafic-de-drogue_6628611_3210.html,Le Monde avec AFP,
33,"Marthe Robin, sainte ou faussaire ? La vie énigmatique de la « stigmatisée de la Drôme »",https://www.lemonde.fr/series-d-ete/article/2025/08/12/c-est-jesus-qui-parle-par-moi-la-vie-enigmatique-de-marthe-robin-la-stigmatisee-de-la-drome_6628324_3451060.html,  Par Virginie Larousse ,
34,"SOS Racisme porte plainte contre l’ex-ministre Noëlle Lenoir, pour des propos à caractère raciste sur les Algériens",https://www.lemonde.fr/societe/article/2025/08/12/propos-a-caractere-raciste-sur-les-algeriens-sos-racisme-porte-plainte-contre-l-ex-ministre-noelle-lenoir_6628571_3224.html,Le Monde avec AFP,
35,Les tensions entre Roger Waters et David Gilmour : la face cachée du succès de Pink Floyd,https://www.lemonde.fr/series-d-ete/article/2025/08/12/les-tensions-entre-roger-waters-et-david-gilmour-la-face-cachee-du-succes-de-pink-floyd_6628548_3451060.html,,
36,L’histoire d’amour entre un vieil homme et son « grand chêne » de 300 ou 400 ans,https://www.lemonde.fr/planete/article/2025/08/12/l-histoire-d-amour-entre-un-vieil-homme-et-son-grand-chene-le-plus-haut-de-son-espece-au-monde_6628549_3244.html,"  Par Maryline Baumard (Reynès [Pyrénées-orientales], envoyée spéciale) ",
37,"A Marseille, les agents hospitaliers des Baumettes sont en grève",https://www.lemonde.fr/societe/article/2025/08/12/a-marseille-les-agents-hospitaliers-des-baumettes-sont-en-greve_6628574_3224.html,"  Par Luc Leroux (Marseille, correspondant) ",
38,Des marins sénégalais dans les bateaux de pêche bretons : « Ils sont bosseurs et ont l’esprit maritime »,https://www.lemonde.fr/societe/article/2025/08/12/des-marins-senegalais-dans-les-bateaux-de-peche-bretons-ils-sont-bosseurs-et-ont-l-esprit-maritime_6628326_3224.html,,
39,Donald Trump ne veut pas de Volodymyr Zelensky pendant sa rencontre avec Vladimir Poutine en Alaska,https://www.lemonde.fr/international/article/2025/08/12/donald-trump-ne-veut-pas-de-volodymyr-zelensky-pendant-sa-rencontre-avec-vladimir-poutine-en-alaska_6628311_3210.html,"  Par Arnaud Leparmentier (New York, correspondant) ","A quatre jours d’un sommet avec le chef de l’Etat russe pour négocier la paix en Ukraine, le président américain s’est agacé du refus du président ukrainien de céder une partie de son territoire à la Russie."
40,"En Ukraine, l’armée russe opère une importante percée à Donetsk, à quelques jours du sommet entre Trump et Poutine",https://www.lemonde.fr/international/article/2025/08/12/l-armee-russe-opere-une-importante-percee-dans-la-region-de-donetsk_6628523_3210.html,"  Par Emmanuel Grynszpan (Kiev, envoyé spécial) ",L’avancée russe menace les deux dernières agglomérations de la zone encore sous contrôle ukrainien. Une évolution du front au pire moment pour Kiev.
41,« Il est temps que la France reprenne l’initiative au Moyen-Orient » : l’appel de 35 anciens ambassadeurs,https://www.lemonde.fr/idees/article/2025/08/12/il-est-temps-que-la-france-reprenne-l-initiative-au-moyen-orient-l-appel-de-34-anciens-ambassadeurs_6628318_3232.html,,"Dans une tribune au « Monde », un collectif de diplomates appelle à renouer avec la défense du droit international sur les dossiers emblématiques du Moyen-Orient, soulignant que la retenue de la France « a pu conduire à minimiser des faits graves »."
42,L’irruption de Trump dans le Caucase du Sud,https://www.lemonde.fr/idees/article/2025/08/12/l-irruption-de-trump-dans-le-caucase-du-sud_6628521_3232.html,,
43,« Le nombre d’abonnés à la nouvelle chaîne du football français permettra de répondre à la question “Aimons-nous encore la Ligue 1 ?” »,https://www.lemonde.fr/sport/article/2025/08/11/le-nombre-d-abonnes-a-la-nouvelle-chaine-du-football-francais-permettra-de-repondre-a-la-question-aimons-nous-encore-la-ligue-1_6628290_3242.html,,
44,"La fronde inédite de Donald Trump contre Francesca Albanese, rapporteuse spéciale de l’ONU pour les territoires palestiniens",https://www.lemonde.fr/un-si-proche-orient/article/2025/08/10/la-fronde-inedite-de-donald-trump-contre-francesca-albanese-rapporteuse-speciale-de-l-onu-pour-les-territoires-palestiniens_6627653_6116995.html,,
