,title,subhed,url
0, PSG beat Arsenal on penalties to retain Champions League title  ,"Paris Saint-Germain and Arsenal went to a penalty shoot-out in Budapest on Saturday after a 1-1 draw, then PSG beat the Gunners with a final score of 4-3.",https://www.lemonde.fr/en/sports/article/2026/05/30/psg-and-arsenal-go-to-extra-time-in-champions-league-final_6753978_9.html
1,Mexico's secret cooperation with the US on deportations exposed in new report,,https://www.lemonde.fr/en/international/article/2026/05/30/mexico-s-secret-cooperation-with-the-us-on-deportations-exposed-in-new-report_6753976_4.html
2,"Palestinian refugees forced to flee the southern Lebanon: 'All my life, I have only known displacement'",,https://www.lemonde.fr/en/international/article/2026/05/30/palestinian-refugees-forced-to-flee-the-southern-lebanon-all-my-life-i-have-only-known-displacement_6753972_4.html
3,Teenager Moïse Kouamé’s French Open run ends in third round defeat,"The 17-year-old lost in the French Open's third round to Alejandro Tabilo 4-6, 6-3, 6-4, 7-6 (9).",https://www.lemonde.fr/en/sports/article/2026/05/31/teenager-moise-kouame-s-french-open-run-ends-in-third-round-defeat_6753982_9.html
4,SoftBank to spend $87.5 billion on AI centers in France,"The company's founder Masayoshi Son, 68, said he made the decision after meeting French President Emmanuel Macron during a visit to Tokyo in April and that France's status as an energy exporter had played a key role. Data centers are huge consumers of energy.",https://www.lemonde.fr/en/france/article/2026/05/31/softbank-to-spend-87-5-billion-on-ai-centers-in-france_6753981_7.html
5,"Paul McCartney blends rock and melancholic ballads in 'The Boys of Dungeon Lane,' his 20th solo album","The Beatles' co-founder invited the band's drummer, Ringo Starr, for a duet on the album. Starr, meanwhile, released his own record in April.",https://www.lemonde.fr/en/culture/article/2026/05/31/paul-mccartney-blends-rock-and-melancholic-ballads-in-the-boys-of-dungeon-lane-his-20th-solo-album_6753980_30.html
6,"José Tolentino de Mendonça, the poet cardinal reconciling the Church and contemporary art","The Portuguese prelate has become a prominent figure in the world of contemporary art, befriending artists and film stars. As the driving force behind the Vatican Pavilion at the recently opened Venice Biennale, he has used his progressive outlook to help bridge the Church and a world that long viewed it with suspicion.",https://www.lemonde.fr/en/m-le-mag/article/2026/05/30/jose-tolentino-de-mendonca-the-poet-cardinal-reconciling-the-church-and-contemporary-art_6753974_117.html
7,Teenager Moïse Kouamé’s French Open run ends in third round defeat,,https://www.lemonde.fr/en/sports/article/2026/05/31/teenager-moise-kouame-s-french-open-run-ends-in-third-round-defeat_6753982_9.html
8,France heatwave sparks calls for more supervision at swimming areas after multiple drownings,,https://www.lemonde.fr/en/france/article/2026/05/29/france-heatwave-sparks-calls-for-more-supervision-at-swimming-areas-after-multiple-drownings_6753955_7.html
9,The oil crisis suits TotalEnergies' CEO perfectly,,https://www.lemonde.fr/en/economy/article/2026/05/30/the-oil-crisis-suits-totalenergies-ceo-perfectly_6753962_19.html
10,"In Chongqing, China, the 'bangbang' porters are no longer in demand",,https://www.lemonde.fr/en/international/article/2026/05/30/in-chongqing-china-the-bangbang-porters-are-no-longer-in-demand_6753963_4.html
11,"The little-known story of Bella Ariel, a Lanvin model murdered at Auschwitz",,https://www.lemonde.fr/en/lifestyle/article/2026/05/30/the-little-known-story-of-bella-ariel-a-lanvin-model-murdered-at-auschwitz_6753964_37.html
12,"Cheesecake, panna cotta, chocolate fondant: When olive oil finds its way into dessert",,https://www.lemonde.fr/en/lifestyle/article/2026/05/30/cheesecake-panna-cotta-chocolate-fondant-when-olive-oil-finds-its-way-into-dessert_6753975_37.html
13,Chancellor Friedrich Merz's unpopularity fuels talk of finding a replacement,,https://www.lemonde.fr/en/international/article/2026/05/30/chancellor-friedrich-merz-s-unpopularity-fuels-talk-of-finding-a-replacement_6753957_4.html
14,Aya Nakamura returns to the stage to claim her crown as the queen of the Stade de France,,https://www.lemonde.fr/en/culture/article/2026/05/30/aya-nakamura-returns-to-the-stage-to-claim-her-crown-as-the-queen-of-the-stade-de-france_6753969_30.html
15,Trump insists on red lines as Iran deal remains elusive after two-hour White House meeting,,https://www.lemonde.fr/en/international/article/2026/05/29/trump-says-making-final-decision-on-potential-iran-deal_6753956_4.html
16,Champions League final in Budapest highlights Orban's contested legacy,,https://www.lemonde.fr/en/sports/article/2026/05/29/champions-league-final-in-budapest-highlights-orban-s-contested-legacy_6753953_9.html
17,Russian drone crash in Romania: NATO still seeks defense systems adapted to drone incursions,,https://www.lemonde.fr/en/international/article/2026/05/29/russian-drone-crash-in-romania-nato-still-seeks-defense-systems-adapted-to-drone-incursions_6753950_4.html
18,Climate change suspected of contributing to recent surge in hantavirus cases in Argentina,,https://www.lemonde.fr/en/environment/article/2026/05/29/hantavirus-climate-change-suspected-of-contributing-to-recent-surge-in-cases-in-argentina_6753948_114.html
19,Who will manage to capture the 'middle' electorate Macron seized 10 years ago?,"Among French President Emmanuel Macron's political heirs, and even on the left, some are starting to believe that the presidential campaign could play out in the middle, amid the collapse of France's former governing parties.",https://www.lemonde.fr/en/politics/article/2026/05/29/2027-french-election-who-will-manage-to-capture-the-middle-electorate-macron-seized-10-years-ago_6753937_5.html
20,The Bolloré protégée spreading Russian propaganda in France,"Xenia Fedorova, the former director of the now-banned Russian channel RT France, has free rein to advance the Kremlin's version of events without contradiction across the media empire of far-right billionaire Vincent Bolloré.",https://www.lemonde.fr/en/politics/article/2026/05/29/the-bollore-protegee-spreading-russian-propaganda-in-france_6753949_5.html
21,"'Reckless, racist, incompetent and treasonous': Bruce Springsteen delivers scathing indictment of Trump at Washington concert","During the final concert of his US tour, the 76-year-old artist accused the Republican president of 'destroying the American idea and our reputation around the world.'",https://www.lemonde.fr/en/international/article/2026/05/29/a-reckless-racist-incompetent-and-treasonous-bruce-springsteen-delivers-scathing-indictment-of-trump-at-washington-concert_6753930_4.html
22,Ukraine's lesson in resilience,,https://www.lemonde.fr/en/opinion/article/2026/05/30/ukraine-s-lesson-in-resilience_6753971_23.html
23,"By backtracking on environmental progress, Macron is 'betraying' the French, former members of the Climate Convention write",,https://www.lemonde.fr/en/opinion/article/2026/05/28/by-backtracking-on-environmental-progress-macron-is-betraying-the-french-former-members-of-the-climate-convention-write_6753898_23.html
24,Political scientist Robert Kagan: 'War in Iran risks permanently weakening the position of the US in the world',,https://www.lemonde.fr/en/opinion/article/2026/05/28/political-scientist-robert-kagan-war-in-iran-risks-weakening-the-us-position-in-the-world-for-years-to-come_6753917_23.html
