,title,url,byline,subhed
0,"Des salariés en grève contre la réduction du travail à distance : « Si je n’ai pas le télétravail, ma vie est complètement dédiée à mon entreprise »",https://www.lemonde.fr/economie/article/2025/07/04/des-salaries-en-greve-contre-la-reduction-du-teletravail-vu-comme-un-nouveau-droit-social_6617876_3234.html,"  Par Marc Angrand, Pierre Manière et Anne Rodier ",
1,"Larry Ellison, le retour du flambeur de la Silicon Valley",https://www.lemonde.fr/economie/article/2025/07/04/larry-ellison-le-retour-du-flambeur-de-la-silicon-valley_6617858_3234.html,  Par Philippe Escande ,
2,« Les compagnies aériennes en ont assez de rejouer chaque été “vols au-dessus d’un nid de grévistes” »,https://www.lemonde.fr/economie/article/2025/07/04/les-compagnies-aeriennes-en-ont-assez-de-rejouer-chaque-ete-vols-au-dessus-d-un-nid-de-grevistes_6618106_3234.html,,
3,ZFE : « La campagne de désinformation a atteint des niveaux tels qu’il n’était plus possible de débattre des véritables problèmes causés par ce dispositif »,https://www.lemonde.fr/idees/article/2025/07/04/zfe-la-campagne-de-desinformation-a-atteint-des-niveaux-tels-qu-il-n-etait-plus-possible-de-debattre-des-veritables-problemes-causes-par-ce-dispositif_6618118_3232.html,,
4,Ukraine : la Russie lance la plus grande attaque aérienne depuis le début de la guerre,https://www.lemonde.fr/international/video/2025/06/29/ukraine-la-russie-lance-la-plus-grande-attaque-aerienne-depuis-le-debut-de-la-guerre_6616410_3210.html,  Par Service vidéo du Monde (avec Reuters)  ,
5,L’attaque d’Israël en Iran pose les bases d’une ère d’incertitude au Moyen-Orient,https://www.lemonde.fr/guerre-au-proche-orient/video/2025/06/24/l-attaque-d-israel-en-iran-pose-les-bases-d-une-ere-d-incertitude-au-moyen-orient_6615651_6325529.html,  Propos recueillis par Brieuc Beckers et Elisa Bellanger (motion design) ,
6,Gaza : enquête sur une distribution alimentaire qui a tourné à la fusillade contre des civils,https://www.lemonde.fr/international/video/2025/06/29/gaza-enquete-sur-une-distribution-alimentaire-qui-a-tourne-a-la-fusillade-contre-des-civils_6616416_3210.html,"  Par Alexandre Horn, Poline Tchoubar, Juliette Prigent et Liselotte Mas ",
7,Tour de France : le responsable du parcours vous explique comment l’édition 2025 a été tracée pour créer du suspense,https://www.lemonde.fr/sport/video/2025/07/02/tour-de-france-2025-comment-le-parcours-est-trace-pour-creer-du-suspense_6617330_3242.html,  Par Brieuc Beckers et Marceau Bretonnier ,
8,Une loi budgétaire au coût exorbitant pour Donald Trump,https://www.lemonde.fr/idees/article/2025/07/04/etats-unis-une-loi-budgetaire-au-cout-exorbitant_6618105_3232.html,,
9,"La baisse de la population à Paris, une mauvaise querelle",https://www.lemonde.fr/idees/article/2025/07/03/la-baisse-de-la-population-a-paris-une-mauvaise-querelle_6617473_3232.html,,
10,"« On perd des femmes au moment du concours », Normale-Sup veut former ses jurys d’entrée pour sortir des stéréotypes de genre",https://www.lemonde.fr/campus/article/2025/07/03/on-perd-des-femmes-au-moment-du-concours-normale-sup-veut-former-ses-jurys-d-entree-pour-sortir-des-stereotypes-de-genre_6617479_4401467.html,  Propos recueillis par Charlotte Bozonnet ,
11,ZFE : « L’intérêt général ne se conçoit pas en surplomb »,https://www.lemonde.fr/idees/article/2025/07/04/zfe-l-interet-general-ne-se-concoit-pas-en-surplomb_6618183_3232.html,,
12,"La mort de Michael Madsen, acteur américain rebelle, féroce « Mr Blonde » de « Reservoir Dogs »",https://www.lemonde.fr/disparitions/article/2025/07/04/la-mort-de-michael-madsen-acteur-americain-rebelle-feroce-mr-blonde-de-reservoir-dogs_6618092_3382.html,  Par Boris Bastide ,
13,"« Microvoyage », de Rémy Oudghiri : la chronique « essai » de Roger-Pol Droit",https://www.lemonde.fr/livres/article/2025/07/04/microvoyage-de-remy-oudghiri-la-chronique-essai-de-roger-pol-droit_6618140_3260.html,,
14,A voir ce soir : le documentaire « En route ! » sur france.tv,https://www.lemonde.fr/culture/article/2025/06/27/en-route-sur-france-tv-comment-la-nationale-7-a-fait-recette-de-cuisine_6616177_3246.html,  Par Catherine Pacary ,
15,"Oasis revient sur scène, seize ans après la séparation du groupe",https://www.lemonde.fr/culture/article/2025/07/04/oasis-lance-une-tournee-mondiale-de-retrouvailles-a-cardiff-trente-ans-apres-le-premier-album-du-groupe_6618016_3246.html,Le Monde avec AFP,
16,"Le maillot de bain drapé, éloge de la lenteur",https://www.lemonde.fr/m-styles/article/2025/07/04/le-maillot-de-bain-drape-eloge-de-la-lenteur_6618175_4497319.html,,
17,"« Il suffit qu’une femme entre dans son champ de vision et que, par malheur, elle pose son attention sur lui, pour que ses mâchoires se serrent »",https://www.lemonde.fr/m-styles/article/2025/07/04/il-suffit-qu-une-femme-entre-dans-son-champ-de-vision-et-que-par-malheur-elle-pose-son-attention-sur-lui-pour-que-ses-machoires-se-serrent_6618168_4497319.html,,
18,La polenta au confit de tomates : la recette d’Aline Girard,https://www.lemonde.fr/m-styles/article/2025/07/04/la-polenta-au-confit-de-tomates-la-recette-d-aline-girard_6618110_4497319.html,  Par Camille Labro ,
19,Travail le 1ᵉʳ-Mai : la crainte d’une « brèche » appelée à s’élargir,https://www.lemonde.fr/politique/article/2025/07/04/travail-le-1-mai-la-crainte-d-une-breche-appelee-a-s-elargir_6618145_823448.html,  Par Bertrand Bissuel ,
20, Le Hamas dit être prêt à « engager immédiatement » des négociations portant sur une trêve dans la bande de Gaza  ,https://www.lemonde.fr/international/article/2025/07/04/treve-dans-la-bande-de-gaza-le-hamas-dit-etre-pret-a-engager-immediatement-des-negociations_6618187_3210.html,Le Monde avec AFP,"Le Jihad islamique, principal allié du mouvement islamiste palestinien, a annoncé soutenir cette décision, tout en demandant des « garanties supplémentaires » permettant d’assurer qu’Israël « ne reprendra pas son agression » une fois les otages libérés."
21,"Affaire Carlos Ghosn : menacée d’une peine d’inéligibilité, Rachida Dati joue la course de lenteur",https://www.lemonde.fr/societe/article/2025/07/04/affaire-carlos-ghosn-menacee-d-une-peine-d-ineligibilite-rachida-dati-joue-la-course-de-lenteur_6618153_3224.html,  Par Hélène Bekmezian et Rémi Dupré ,
22,"Au procès de l’attentat de Condé-sur-Sarthe, le réquisitoire de l’avocat de Michaël Chiolo contre la perpétuité réelle et les prisons françaises",https://www.lemonde.fr/societe/article/2025/07/04/au-proces-de-l-attentat-de-conde-sur-sarthe-le-requisitoire-de-l-avocat-de-michael-chiolo-contre-la-perpetuite-reelle-et-les-prisons-francaises_6618189_3224.html,  Par Soren Seelow ,
23,En direct : Volodymyr Zelensky annonce une coproduction d’armes entre l’Ukraine et le Danemark,https://www.lemonde.fr/international/live/2025/07/05/en-direct-guerre-en-ukraine-volodymyr-zelensky-annonce-une-coproduction-d-armes-avec-le-danemark_6616331_3210.html,,"Le président ukrainien est aussi revenu sur l’attaque massive de missiles russes dans la nuit de jeudi à vendredi : « C’était difficile, mais un grand nombre d’entre eux ont été abattus. » Volodymyr Zelensky dit avoir convenu avec Donald Trump de « renforcer la protection » du ciel ukrainien, lors d’un appel téléphonique vendredi."
24,"En Tunisie, des migrants chassés, leurs défenseurs poursuivis",https://www.lemonde.fr/international/article/2025/07/04/en-tunisie-des-migrants-chasses-leurs-defenseurs-poursuivis_6617866_3210.html,,"« 2015-2025 : Dix ans de crise migratoire » (5/5). Depuis deux ans, le régime du président tunisien, Kaïs Saïed, financé par l’Union européenne, repousse les Subsahariens loin des villes, parfois violemment, et combat toute personne ou association qui les soutient."
25,"Le Tour de France, une affaire qui n’a pas besoin de maillot jaune français pour rester florissante",https://www.lemonde.fr/sport/article/2025/07/04/le-tour-de-france-une-affaire-qui-n-a-pas-besoin-de-maillot-jaune-francais-pour-rester-florissante_6618152_3242.html,  Par Oscar Korbosli ,"Depuis 1985 et la victoire de Bernard Hinault, la Grande Boucle échappe aux coureurs tricolores, ce qui n’altère en rien les finances de la société organisatrice, Amaury Sport Organisation."
26,"Entre les photographes Nan Goldin et David Armstrong, une amitié à toutes épreuves",https://www.lemonde.fr/m-le-mag/article/2025/07/04/entre-les-photographes-nan-goldin-et-david-armstrong-une-amitie-a-toutes-epreuves_6617877_4500055.html,,"Inséparables depuis leur rencontre, adolescents, à Boston, Nan Goldin et David Armstrong ont documenté l’underground new-yorkais à partir de la fin des années 1970, traversant ensemble les addictions et les ravages du sida. Cet été, ils sont exposés aux Rencontres de la photographie et à la Fondation LUMA, à Arles."
27,Boualem Sansal exclu d’une vague de grâces présidentielles par Alger,https://www.lemonde.fr/afrique/article/2025/07/04/boualem-sansal-exclu-d-une-vague-de-graces-presidentielles-par-alger-a-l-occasion-de-la-fete-de-l-independance_6618186_3212.html,Le Monde avec AFP,
28,"Donald Trump promulgue le One Big Beautiful Bill, sa loi budgétaire tentaculaire, le jour de la fête nationale",https://www.lemonde.fr/international/article/2025/07/05/donald-trump-promulgue-le-one-big-beautiful-bill-sa-loi-budgetaire-tentaculaire-pour-la-fete-nationale_6618255_3210.html,Le Monde avec AFP et Reuters,
29,"A l’Assemblée nationale, l’embarrassant rapport de Sophia Chikirou sur la Chine",https://www.lemonde.fr/politique/article/2025/07/04/a-l-assemblee-nationale-l-embarrassant-rapport-de-sophia-chikirou-sur-la-chine_6618158_823448.html,  Par Pierre Januel ,
30,Coupe du monde des clubs : le club brésilien de Fluminense premier qualifié pour les demi-finales aux dépens d’Al-Hilal,https://www.lemonde.fr/sport/article/2025/07/05/coupe-du-monde-des-clubs-le-club-bresilien-de-fluminense-premier-qualifie-pour-les-demi-finales-aux-depens-d-al-hilal_6618222_3242.html,Le Monde avec AFP,
31,Réseau dentaire Nobel Santé : mise en examen de dirigeants pour des fraudes soupçonnées à l’Assurance-maladie,https://www.lemonde.fr/societe/article/2025/07/05/reseau-dentaire-nobel-sante-mise-en-examen-de-dirigeants-pour-des-fraudes-soupconnees-a-l-assurance-maladie_6618321_3224.html,Le Monde avec AFP,
32,"La Bosnie-Herzégovine annule le mandat d’arrêt contre le chef des Serbes, Milorad Dodik, qui s’est présenté à la justice",https://www.lemonde.fr/international/article/2025/07/04/la-bosnie-herzegovine-annule-le-mandat-d-arret-contre-le-chef-des-serbes-milorad-dodik_6618188_3210.html,Le Monde avec AFP,
33,"Au moins 13 morts dans des inondations au Texas, où de nouvelles précipitations sont attendues",https://www.lemonde.fr/planete/article/2025/07/05/etats-unis-au-moins-13-morts-dans-des-inondations-au-texas-ou-de-nouvelles-precipitations-sont-attendues_6618288_3244.html,Le Monde avec AFP,
34,PFAS : la consommation de l’eau du robinet interdite dans 16 communes du Grand-Est,https://www.lemonde.fr/planete/article/2025/07/04/pfas-la-consommation-de-l-eau-du-robinet-interdite-dans-quatre-communes-de-la-meuse_6618146_3244.html,Le Monde avec AFP,
35,« Une internationale d’intellectuels conservateurs aiguille le débat public dans plusieurs pays »,https://www.lemonde.fr/idees/article/2025/07/04/une-internationale-d-intellectuels-conservateurs-aiguille-le-debat-public-dans-plusieurs-pays_6618155_3232.html,,
36,"Distancée par CNews, BFM-TV défend sa réputation",https://www.lemonde.fr/economie/article/2025/07/04/distancee-par-cnews-bfm-tv-defend-sa-reputation_6618179_3234.html,  Par Aude Dassonville ,
37,"Canicule : 13 départements du Sud-Est en vigilance orange, retour au vert prévu lundi",https://www.lemonde.fr/planete/article/2025/07/04/canicule-13-departements-du-sud-est-en-vigilance-orange-retour-au-vert-prevu-lundi_6618165_3244.html,Le Monde avec AFP,
38,"Kazuhiko Torishima, l’autre homme derrière le manga « Dragon Ball »",https://www.lemonde.fr/culture/article/2025/07/04/kazuhiko-torishima-l-autre-homme-derriere-le-manga-dragon-ball_6618176_3246.html,  Par Pauline Croquet ,
39,L’entraîneur Joël Chenal accusé de harcèlement sexuel : l’affaire que le ski français n’a pas voulu voir pendant des années,https://www.lemonde.fr/sport/article/2025/07/04/l-affaire-de-violences-sexuelles-que-le-ski-francais-n-a-pas-voulu-voir-pendant-des-annees_6617874_3242.html,,"Des jeunes skieuses, toutes mineures au moment des faits, dénoncent le harcèlement sexuel qu’elles disent avoir subi de la part du vice-champion olympique de ski."
40,"Des salariés en grève contre la réduction du travail à distance : « Si je n’ai pas le télétravail, ma vie est complètement dédiée à mon entreprise »",https://www.lemonde.fr/economie/article/2025/07/04/des-salaries-en-greve-contre-la-reduction-du-teletravail-vu-comme-un-nouveau-droit-social_6617876_3234.html,"  Par Marc Angrand, Pierre Manière et Anne Rodier ","Chez Free et à la Société générale, des salariés contestent des annonces de réduction du télétravail, mises en place au nom de l’efficacité et de la cohésion. Mais les salariés ne veulent pas lâcher un système désormais vécu comme un nouveau droit social."
41,Nos vingt-sept livres coups de cœur pour l’été 2025,https://www.lemonde.fr/livres/article/2025/07/03/nos-vingt-sept-livres-coups-de-c-ur-pour-l-ete-2025_6617463_3260.html,  Par Le Monde des livres ,"Jon Fosse, La Grande Sophie, Richard Russo, Adèle Yon ou Raymond Aron, Vincent Debaene, Carlo Ossola, Clara Serra… Le choix des plumes du « Monde des livres »."
42,« Le projet de réforme de l’audiovisuel public cache une bataille culturelle dont France Inter est la principale cible »,https://www.lemonde.fr/idees/article/2025/07/04/le-projet-de-reforme-de-l-audiovisuel-public-cache-une-bataille-culturelle-dont-france-inter-est-la-principale-cible_6617860_3232.html,,
43,"La « guerre préventive », ce symptôme de l’affaissement du droit international au profit de la loi du plus fort",https://www.lemonde.fr/idees/article/2025/07/02/la-guerre-preventive-ce-symptome-de-l-affaissement-du-droit-international-au-profit-de-la-loi-du-plus-fort_6617341_3232.html,  Par Claire Legros ,
44,"Contre les violences scolaires, renforcer le contrôle de l’Etat",https://www.lemonde.fr/idees/article/2025/07/03/contre-les-violences-scolaires-renforcer-le-controle-de-l-etat_6617633_3232.html,,
