,title,url,byline,subhed
0,"Près de Grenoble, la station de l’Alpe du Grand Serre dit adieu au ski",https://www.lemonde.fr/economie/article/2025/06/25/pres-de-grenoble-la-station-de-l-alpe-du-grand-serre-dit-adieu-au-ski_6615893_3234.html,  Par Jessica Gourdon ,
1,"En quête de rentabilité, la French tech peine à lever des fonds",https://www.lemonde.fr/economie/article/2025/06/26/en-quete-de-rentabilite-la-french-tech-peine-a-lever-des-fonds_6615964_3234.html,  Par Vincent Fagot ,
2,Worldline : « L’enquête “Dirty Payments” confirme les errances de gouvernance d’une entreprise assoiffée de croissance »,https://www.lemonde.fr/economie/article/2025/06/26/worldline-l-enquete-dirty-payments-confirme-les-errances-de-gouvernance-d-une-entreprise-assoiffee-de-croissance_6615973_3234.html,,
3,Voiture électrique : « Les constructeurs chinois reportent désormais leurs espoirs sur l’Europe »,https://www.lemonde.fr/idees/article/2025/06/25/voiture-electrique-les-constructeurs-chinois-reportent-desormais-leurs-espoirs-sur-l-europe_6615843_3232.html,,
4,L’attaque d’Israël en Iran pose les bases d’une ère d’incertitude au Moyen-Orient,https://www.lemonde.fr/guerre-au-proche-orient/video/2025/06/24/l-attaque-d-israel-en-iran-pose-les-bases-d-une-ere-d-incertitude-au-moyen-orient_6615651_6325529.html,  Propos recueillis par Brieuc Beckers et Elisa Bellanger (motion design) ,
5,L’allocution de Benyamin Nétanyahou après les frappes américaines en Iran,https://www.lemonde.fr/international/video/2025/06/22/l-allocution-de-benyamin-netanyahou-apres-les-frappes-americaines-en-iran_6615273_3210.html,  Par Service vidéo du Monde ,
6,Pourquoi certains pays ont le droit à l’arme nucléaire et d’autres pas ? Comprendre en trois minutes,https://www.lemonde.fr/comprendre-en-3-minutes/video/2025/06/21/quels-pays-detiennent-l-arme-nucleaire-comprendre-en-trois-minutes_6615041_6176282.html,  Par Barbara Marty et Robin Gasser (motion design) ,
7,Ukraine : ce que l’on sait de l’attaque de drones inédite lancée contre des bases russes,https://www.lemonde.fr/international/video/2025/06/02/ukraine-ce-que-l-on-sait-de-l-attaque-de-drones-inedite-lancee-contre-des-bases-russes_6610251_3210.html,  Par Clara De Antoni et Service vidéo du Monde ,
8,OTAN : un sommet pour Donald Trump,https://www.lemonde.fr/idees/article/2025/06/26/otan-un-sommet-pour-donald-trump_6615974_3232.html,,
9,"Javier Blas, journaliste : « Les courtiers en matières premières sont les derniers aventuriers du capitalisme sauvage »",https://www.lemonde.fr/idees/article/2025/06/23/javier-blas-journaliste-les-courtiers-en-matieres-premieres-sont-les-derniers-aventuriers-du-capitalisme-sauvage_6615404_3232.html,,
10,"La « démocratie militante », cette notion qui permet aux démocraties de se défendre contre leurs ennemis intérieurs",https://www.lemonde.fr/idees/article/2025/06/25/la-democratie-militante-cette-notion-qui-permet-aux-democraties-de-se-defendre-contre-leurs-ennemis-interieurs_6615720_3232.html,  Par Marion Dupont ,
11,"« Maintenant qu’Israël et les Etats-Unis ont démontré leur force de frappe, c’est l’heure de la diplomatie avec l’Iran »",https://www.lemonde.fr/idees/article/2025/06/25/maintenant-qu-israel-et-les-etats-unis-ont-demontre-leur-force-de-frappe-c-est-l-heure-de-la-diplomatie-avec-l-iran_6615883_3232.html,,
12,"Alvaro Vitali, comique italien qui apparaît dans plusieurs films de Fellini, est mort",https://www.lemonde.fr/disparitions/article/2025/06/26/alvaro-vitali-comique-italien-qui-apparait-dans-plusieurs-films-de-fellini-est-mort_6616004_3382.html,  Par Jean-François Rauger ,
13,"« True crime », une sélection de parutions",https://www.lemonde.fr/livres/article/2025/06/26/true-crime-une-selection-de-parutions_6615952_3260.html,  Par Antoine Albertini ,
14,"Romain Weber, réalisateur de « Malcolm X, colère noire », sur France Culture : « Malcolm X n’est pas facile à aimer »",https://www.lemonde.fr/culture/article/2025/06/25/romain-weber-realisateur-de-malcolm-x-colere-noire-sur-france-culture-malcolm-x-n-est-pas-facile-a-aimer_6615882_3246.html,  Par Emilie Grangeray ,
15,« Sous hypnose » : l’histoire folle d’un couple d’entrepreneurs au bord du gouffre sentimental,https://www.lemonde.fr/culture/article/2025/06/25/sous-hypnose-l-histoire-folle-d-un-couple-d-entrepreneurs-au-bord-du-gouffre-sentimental_6615875_3246.html,  Par Clarisse Fabre ,
16,"Le serviteur muet, une élégante mise en bouchées",https://www.lemonde.fr/m-styles/article/2025/06/26/le-serviteur-muet-une-elegante-mise-en-bouchees_6616002_4497319.html,  Par Julie Lasterade ,
17,"A Calais, l’imaginaire de Yiqing Yin se reflète dans ses robes éthérées",https://www.lemonde.fr/m-styles/article/2025/06/26/a-calais-l-imaginaire-de-yiqing-yin-se-reflete-dans-ses-robes-etherees_6615950_4497319.html,  Par Sophie Abriat ,
18,Un été à l’ombre des rosés : la sélection du « Monde » à travers toute la France,https://www.lemonde.fr/m-styles/article/2025/06/26/un-ete-a-l-ombre-des-roses-la-selection-du-monde-a-travers-toute-la-france_6615947_4497319.html,,
19,« Les applications de rencontre ont tout intérêt à réduire notre vie sentimentale à des ratés sans lendemain »,https://www.lemonde.fr/m-perso/article/2025/06/22/les-applications-de-rencontre-ont-tout-interet-a-reduire-notre-vie-sentimentale-a-des-rates-sans-lendemain_6615271_4497916.html,  Propos recueillis par Antonin Gratien ,
20,         Live  Article se déroulant en direct   L’ayatollah Khamenei affirme que Donald Trump a « exagéré » l’impact des frappes américaines sur l’Iran  ,https://www.lemonde.fr/international/live/2025/06/26/en-direct-iran-israel-l-ayatollah-khamenei-affirme-que-donald-trump-a-exagere-l-impact-des-frappes-americaines-sur-le-territoire-iranien_6614739_3210.html,,"Le Guide suprême de la République islamique s’est exprimé, jeudi, pour se féliciter de la « victoire » de l’Iran après le cessez-le-feu avec Israël et menacer à nouveau les bases américaines au Moyen-Orient en cas de nouvelles attaques."
21,La « liste noire » des entreprises françaises malades de la dette s’allonge,https://www.lemonde.fr/economie/article/2025/06/26/la-liste-noire-des-entreprises-francaises-malades-de-la-dette-s-allonge_6615946_3234.html,  Par Isabelle Chaperon ,
22,"Orages : des dégâts partout en France, jusqu’à l’Assemblée nationale",https://www.lemonde.fr/planete/video/2025/06/26/orages-des-degats-partout-en-france-jusqu-a-l-assemblee-nationale_6615967_3244.html,  Par Service vidéo du Monde ,
23,Gabriel Attal : « Je ne vois pas de projet de société commun aujourd’hui entre Les Républicains et nous »,https://www.lemonde.fr/politique/article/2025/06/26/gabriel-attal-je-ne-vois-pas-de-projet-de-societe-commun-aujourd-hui-entre-les-republicains-et-nous_6615976_823448.html,  Propos recueillis par Mariama Darame et Nathalie Segaunes ,"Libéral économiquement, ferme sur le régalien, progressiste sur les questions de société… L’ancien premier ministre, à la tête du parti Renaissance, décrypte pour « Le Monde » la ligne politique qu’il espère porter pour 2027."
24,"Gaza : 35 personnes tuées par les forces israéliennes, selon la défense civile ; le premier ministre espagnol dénonce une « situation catastrophique de génocide »",https://www.lemonde.fr/international/article/2025/06/26/gaza-35-personnes-tuees-par-les-forces-israeliennes-selon-la-defense-civile-le-premier-ministre-espagnol-denonce-une-situation-catastrophique-de-genocide_6615997_3210.html,Le Monde avec AFP,"Les appels se multiplient à l’étranger et en Israël pour une trêve sur le front de Gaza. En marge d’une réunion du Conseil européen, à Bruxelles, Pedro Sanchez a réclamé « un accès immédiat et urgent à l’aide humanitaire » dans le territoire palestinien."
25,"L’ascension fulgurante de Zohran Mamdani à New York, indice d’une vaste aspiration au changement chez les démocrates",https://www.lemonde.fr/international/article/2025/06/26/l-ascension-fulgurante-de-zohran-mamdani-a-new-york-indice-d-une-vaste-aspiration-au-changement-chez-les-democrates_6615982_3210.html,"  Par Piotr Smolar (Washington, correspondant) ","Le représentant du camp progressiste fait figure de favori pour l’élection au poste de maire de la mégalopole, qui aura lieu en novembre, après avoir battu lors d’une primaire l’ancien gouverneur de l’Etat, Andrew Cuomo, incarnation des élites locales modérées."
26,"Le stradivarius des Mendelssohn, volé sous les nazis, sort de l’ombre",https://www.lemonde.fr/culture/article/2025/06/26/le-stradivarius-des-mendelssohn-vole-sous-les-nazis-sort-de-l-ombre_6615983_3246.html,,"Le « Petit Mendelssohn », violon d’exception pris à l’illustre famille pendant la seconde guerre mondiale, et le « Stella », le magnifique instrument avec lequel se produit le virtuose japonais Eijin Nimura ne font-ils qu’un ? C’est ce qu’atteste l’enquête minutieuse d’une universitaire américaine, malgré les dénégations du violoniste."
27,Le point sur la guerre en Ukraine : les dernières informations,https://www.lemonde.fr/international/live/2025/06/26/en-direct-guerre-en-ukraine-la-russie-revendique-la-prise-de-deux-villages-dans-l-oblast-de-donetsk_6615228_3210.html,,
28,Le Parti socialiste a déposé sa motion de censure contre François Bayrou,https://www.lemonde.fr/politique/article/2025/06/26/le-parti-socialiste-a-depose-sa-motion-de-censure-contre-francois-bayrou_6615996_823448.html,Le Monde avec AFP,
29,"Contrôle d’identité « au faciès » : la France condamnée par la CEDH, une décision inédite",https://www.lemonde.fr/societe/article/2025/06/26/controle-d-identite-au-facies-la-france-condamnee-par-la-cedh_6615977_3224.html,Le Monde avec AFP,
30,"Dans les masters de droit à l’université, la concurrence s’intensifie : « On est victimes de notre succès »",https://www.lemonde.fr/campus/article/2025/06/26/dans-les-masters-de-droit-a-l-universite-la-concurrence-s-intensifie-on-est-victimes-de-notre-succes_6615951_4401467.html,  Par Gabrielle Meulle ,
31,Rachida Dati échoue à obtenir l’annulation du réquisitoire du Parquet national financier dans l’affaire Ghosn,https://www.lemonde.fr/societe/article/2025/06/26/rachida-dati-echoue-a-obtenir-l-annulation-du-requisitoire-du-parquet-national-financier-dans-l-affaire-ghosn_6615965_3224.html,Le Monde avec AFP,
32,"Pour Rayan Cherki, des débuts contrastés avec Manchester City à la Coupe du monde des clubs",https://www.lemonde.fr/sport/article/2025/06/26/pour-rayan-cherki-des-debuts-contrastes-avec-manchester-city-a-la-coupe-du-monde-des-clubs_6616001_3242.html,  Par Service Sports ,
33,Intoxications alimentaires dans l’Aisne : le pôle santé publique du parquet de Paris s’est saisi de l’enquête,https://www.lemonde.fr/planete/article/2025/06/26/intoxications-alimentaires-dans-l-aisne-le-pole-sante-publique-du-parquet-de-paris-s-est-saisi-de-l-enquete_6615999_3244.html,Le Monde avec AFP,
34,"En France, cinq restaurants végétariens qui valent le détour sur la route des vacances",https://www.lemonde.fr/m-styles/article/2025/06/26/en-france-cinq-restaurants-vegetariens-qui-valent-le-detour-sur-la-route-des-vacances_6615931_4497319.html,,
35,"Tomates marocaines, crevettes malgaches... Le modèle d’import-export de la France nuit aussi aux agricultures des pays du Sud",https://www.lemonde.fr/planete/article/2025/06/26/tomates-marocaines-crevettes-malgaches-le-modele-d-import-export-de-la-france-nuit-aussi-aux-agricultures-des-pays-du-sud_6615994_3244.html,  Par Mathilde Gérard ,
36,« Motorgate » : Renault visé par une enquête de la direction de la répression des fraudes à propos de ses moteurs défectueux,https://www.lemonde.fr/economie/article/2025/06/26/motorgate-renault-vise-par-une-enquete-de-la-direction-de-la-repression-des-fraudes-a-propos-de-ses-moteurs-defectueux_6615992_3234.html,  Par Eric Béziat ,
37,Deux juges d’instruction saisis après la plainte de Kylian Mbappé accusant le PSG de harcèlement moral,https://www.lemonde.fr/football/article/2025/06/26/apres-la-plainte-de-kylian-mbappe-accusant-le-psg-de-harcelement-moral-deux-juges-d-instruction-saisis_6616000_1616938.html,Le Monde avec AFP,
38,Voyage à l’étranger : où changer des devises ?,https://www.lemonde.fr/argent/article/2025/06/26/voyage-a-l-etranger-ou-changer-des-devises_6615938_1657007.html,  Par Agnès Lambert ,
39,OTAN : les alliés se plient aux exigences de Donald Trump,https://www.lemonde.fr/international/article/2025/06/26/otan-les-allies-plient-face-aux-exigences-de-donald-trump_6615934_3210.html,"  Par Philippe Jacqué (La Haye [Pays-Bas], envoyé spécial) et Elise Vincent (La Haye [Pays-Bas], envoyée spéciale) ","Réunis en sommet à La Haye, les membres de l’Alliance atlantique se sont engagés à consacrer 3,5 % de leur PIB aux dépenses militaires. Si le président américain n’a finalement pas remis en cause l’article 5 sur la solidarité entre alliés, il a obtenu une déclaration finale minimaliste."
40,Comprendre les douze jours d’affrontements entre Israël et l’Iran en dix temps forts,https://www.lemonde.fr/international/article/2025/06/25/comprendre-les-douze-jours-d-affrontements-entre-israel-et-l-iran-en-dix-temps-forts_6615898_3210.html,,"Du lancement de l’offensive israélienne, dans la nuit du 12 au 13 juin, au cessez-le-feu survenu le 24 juin, « Le Monde » revient sur la guerre éclair entre les deux puissances."
41,"Guerre Iran-Israël : devant l’Assemblée nationale, François Bayrou prend acte du « basculement » dans un monde de « la primauté de la force »",https://www.lemonde.fr/politique/article/2025/06/26/guerre-iran-israel-devant-l-assemblee-nationale-francois-bayrou-prend-acte-du-basculement-dans-un-monde-de-la-primaute-de-la-force_6615924_823448.html,  Par Robin Richardot ,"Les députés ont débattu sans vote, mercredi, de la situation au Moyen-Orient, la gauche critiquant le « droit international à géométrie variable » pratiqué par l’exécutif, tandis que l’extrême droite fustigeait l’« inconstance » d’Emmanuel Macron sur la scène mondiale."
42,OTAN : un sommet pour Donald Trump,https://www.lemonde.fr/idees/article/2025/06/26/otan-un-sommet-pour-donald-trump_6615974_3232.html,,
43,Cœur artificiel : « Carmat en appelle aux dons et à l’aide de l’Etat tout en critiquant le modèle de financement de l’innovation en France »,https://www.lemonde.fr/economie/article/2025/06/25/c-ur-artificiel-carmat-en-appelle-aux-dons-et-a-l-aide-de-l-etat-tout-en-critiquant-le-modele-de-financement-de-l-innovation-en-france_6615844_3234.html,,
44,« L’opposition à Trump se trouve face à un autre adversaire : le phénomène de “rassemblement autour du drapeau” »,https://www.lemonde.fr/idees/article/2025/06/24/l-opposition-a-trump-se-trouve-face-a-un-autre-adversaire-le-phenomene-de-rassemblement-autour-du-drapeau_6615640_3232.html,,
